recall_id,clause_id,clause_text
0,1,The police returned the mother and boy home
0,2,in the police cart
0,3,with horses and a bell
0,4,"that went clang, clang, clang."
0,5,All the neighbours came out
0,6,to watch them coming home.
0,7,The mum spoke to them
0,8,and told them she had no money to move anywhere
0,9,so they would be there for the month
0,10,and maybe longer.
0,11,And that she couldn't afford to keep replacing windows
0,12,so they should stop breaking them
0,13,and accept they were there.
0,14,The neighbours were very nice to them
0,15,and when their dad got sick
0,16,were helpful.
1,1,They dropped them off in a police patrol
1,2,which was a horse and cart
1,3,and had steps.
1,4,The mother came down
1,5,and told the people
1,6,"why were they doing this to them,"
1,7,they were different colorwise
1,8,but same otherwise.
1,9,She was just providing for her family
1,10,and she was going to be here for a month.
1,11,The money had been spent on the rent
1,12,which was due in advance.
1,13,They were dropped off at fourth street.
1,14,The dad had been ill.
2,1,The police wagon was driven by horses
2,2,and made a loud clanging sound.
2,3,On arriving home
2,4,the neighbours heard all the clanging
2,5,and came outside to see what was happening.
2,6,The mother and the boy descended the steps at the back of the police wagon.
2,7,The mother confronted the neighbours
2,8,and said that they could not afford new windows.
2,9,Look at what they had done
2,10,and they had paid rent for a month
2,11,and would be staying here for at least a month.
2,12,The mother told the neighbours
2,13,that if they were not welcome here
2,14,and wanted them to move
2,15,then they should collect the money between them
2,16,to raise the rent
2,17,for them to move to a new house.
2,18,The mother and boy entered the house.
2,19,In the near future the father fell ill
2,20,and neighbours were very supportive
2,21,and kind to the family.
3,1,The police returned the mother and the boy home
3,2,in their police patrol car.
3,3,When they arrived
3,4,there were horses and wagons and people still there.
3,5,The mother stated that she wanted to find out who threw the stone through the window
3,6,as it was winter and cold
3,7,"and she could not afford a window,"
3,8,nor her rent.
3,9,She said the person who threw the stone should own up
3,10,or pay for her and her family to move out
3,11,so that they were not there anymore.
3,12,There was a discussion with the policeman regarding colour of skin and race.
3,13,The father came back
3,14,and he was sick.
4,1,A crowd was gathered
4,2,and the mother explained
4,3,that she had paid a month's rent
4,4,and only that.
4,5,She said it was cold
4,6,and she didn't have enough money to pay for the windows
4,7,and indeed may not have enough money for the next month's rent.
4,8,She said if the crowd wanted to pay the rent
4,9,she would move out
4,10,but nobody offered.
4,11,During the month
4,12,the father got sick
4,13,but the neighbours treated him well.
5,1,The mother and boy got out of the police cart.
5,2,the neighbours were all out
5,3,watching.
5,4,Mother said
5,5,"look what your all doing,"
5,6,I won't be leaving
5,7,in the next month
5,8,as can't afford it
5,9,if you want me gone
5,10,you give me the money.
5,11,I'm different in colour
5,12,but nothing else.
5,13,They stayed the month.
5,14,The father got ill
5,15,and the neighbours were helpful.
6,1,The mother described
6,2,"how much she paid in rent for the month,"
6,3,"her desire to simply provide a home for her family,"
6,4,and her lack of certainty
6,5,as to whether she would have the money
6,6,to pay for rent beyond the first month.
6,7,She also described
6,8,that their home lacked a window.
7,1,They returned the mother and boy home.
7,2,"The mother then went on a speech,"
7,3,telling the local crowd that had formed
7,4,all about the reality of their situation.
7,5,"They had no money to move,"
7,6,didn't understand why the locals were treating them so badly
7,7,and if they really wanted them gone
7,8,then they would have to find the money for her to rent elsewhere.
7,9,"Then a little time passes,"
7,10,the father becomes ill
7,11,"but the community is actually supportive,"
7,12,surprisingly after how they were treated.
7,13,"Seems to show that once you aren't treated as an outsider,"
7,14,"you become an insider,"
7,15,regardless of colour/race etc.
8,1,Now the real estate agent should be accountable.
8,2,"""So anyhow, she said to him, well I know one thing you can do."""
8,3,So they put us in the police patrol
8,4,and they took us home.
8,5,We were not far from
8,6,from where it was
8,7,maybe Fifth street.
8,8,"""Clang."""
8,9,"Well, this police patrol that bell they had, it went ""Clang clang clang."""
8,10,And um all the neighbors came running out to see what was happening.
8,11,I can see it right now
8,12,from where he was sitting
8,13,"up in front there where the horses came around,"
8,14,and open the door in the back.
8,15,And they had a long door in the back
8,16,where you had to come down steps to get out the back
8,17,of this police patrol.
8,18,We we got out of that police.
8,19,Before the patrol ever left
8,20,"my mother turned and faced all those people that were standing around,"
8,21,"and she says, ""Why you're doing this to me."""
8,22,"She says, ""I know that I am different from you, color wise,"
8,23,"in every other respect I am just the same as you are,"
8,24,"and all I'm trying to do is provide a home."""
8,25,"She told them that they had rented the house,"
8,26,"she told them how much money she had paid,"
8,27,she had told them that was all the money she had.
8,28,Whether they had have enough money to pay for it next month.
8,29,but she knew they were going to be there for a month.
8,30,"She said, it is winter time."
9,1,The mother said
9,2,"she doesn't have enough money to move,"
9,3,or pay for new windows
9,4,because it is winter.
9,5,And if the locals want her to move so badly
9,6,they should group together
9,7,and provide her with enough money to move somewhere else.
9,8,She told them
9,9,that even though her skin may be a different colour
9,10,she is just trying to provide for her family
9,11,like them.
9,12,The son then finishes
9,13,with that was what happened
9,14,when they moved in
9,15,"and it was ""terrible""."
10,1,"The mother confronted the neighbours,"
10,2,telling them
10,3,that she paid rent for the month.
10,4,That was all she had.
10,5,She was not moving.
10,6,"If they want her to move,"
10,7,then they have to pay her to move.
10,8,That didn't happen.
10,9,The husband was sick.
10,10,The neighbours were nice to them
10,11,after awhile.
11,1,the mother faced the crowd of Irish neighbours
11,2,that had come to see what the noise was about
11,3,"and she addressed them,"
11,4,explaining that she had moved there
11,5,and had given all her money to pay for the first month
11,6,and that if they did not like it
11,7,they could band together
11,8,"and give her enough money to move away,"
11,9,otherwise they would just have to deal with it.
11,10,she also explained
11,11,that the only real difference between them is their skin colour.
11,12,the boy then explains
11,13,that during the time that they lived there
11,14,the father became ill
11,15,and the neighbours were as nice as anyone could be.
12,1,The mother was explaining
12,2,"that although she has different skin colour,"
12,3,"everything else was the same,"
12,4,they were both people.
12,5,Skin colour doesn't define
12,6,or make people different.
13,1,The couple got out of the police car
13,2,and the mother faced the waiting crowd of neighbours.
13,3,She announced that she and her family were going to stay where they were for at least a month
13,4,as they had paid the rent
13,5,and didn't have the money to move again.
13,6,She told them that they were all the same
13,7,except for the colour of their skin.
13,8,She said the only way they would be able to get her family out
13,9,was to raise the cash needed to move.
13,10,In the meantime her husband was taken ill.
14,1,The police took the mother and boy home
14,2,in the police wagon
14,3,as it was easier
14,4,than listening to the mother.
14,5,"When they got back,"
14,6,the mother came out of the wagon
14,7,and saw the neighbors all looking out.
14,8,She told them
14,9,that they would be there for the whole month
14,10,as they had already paid a month's rent
14,11,and that they may as well get used to it
14,12,unless they wanted to give her money to move out.
14,13,The neighbors turned out to be nice people
14,14,and supported the family
14,15,when the father became sick.
15,1,The neighbours came out of the house
15,2,because the bell on the patrol was clanging.
15,3,They got out of the patrol
15,4,and went down some steps.
15,5,The mother confronted all of the neighbours
15,6,and said she was just the same as them in all respects
15,7,except her colour.
15,8,"[She said] that she was just trying to provide for her family,"
15,9,and that she couldn't afford to move
15,10,"so if they wanted her to go,"
15,11,that they would have to give her the money.
15,12,She told them how much she paid
15,13,and that she didn't know who had broken the window
15,14,but that winter was coming
15,15,and she was afraid of the cold.
15,16,The narrator reminds us that the experience was frightening.
16,1,THE WOMAN COMPLAINED
16,2,THAT THE STONES HAD HIT HER HOUSE
16,3,"AND THEY ALL HID IN THE STAIRCASE,"
16,4,"THE WOMAN ASKED THE POLICEMAN,"
16,5,WHO WAS BEING PULLED BY A HORSE
16,6,WHAT SHE SHOULD DO
16,7,AND HE TOLD HER
16,8,HE DIDN'T KNOW.
16,9,SHE QUESTIONED WHY HE COULDN'T HELP
16,10,AND HE SUGGESTED
16,11,"SHE MOVE HOUSE,"
16,12,SHE SAID
16,13,SHE COULDN'T AFFORD IT
16,14,BECAUSE SHE HAD PUT ALL HER MONEY INTO THE HOUSE
16,15,THEY ARE IN NOW.
17,1,The police dropped the mother and son at their home
17,2,in their horse drawn carriage.
17,3,The carriage had a bell
17,4,that went 'clang clang clang'.
17,5,Everyone in the neighbourhood could hear it
17,6,and came out to see what was happening.
17,7,The police opened the back door of the carriage
17,8,to let them out.
17,9,The mother looked around at the people staring
17,10,and told them that she had paid to live there a month
17,11,but was not sure if they would be there longer
17,12,as she did not have enough money for it.
17,13,She told them they would have to give them the money
17,14,if they wanted them to move elsewhere.
17,15,No one replied.
17,16,During that time the father got sick.
17,17,"The neighbours were all nicer after that,"
17,18,as much as they could be
17,19,and that was the introduction to the neighbourhood.
18,1,The neighbours responded in a nice way
18,2,and welcomed them
18,3,even when there was trouble
19,1,The mother and boy got out of the back of the police patrol
19,2,and the mother spoke to the neighbours
19,3,telling them they would be there for the month
19,4,as they could not afford to move.
19,5,She suggested if they wanted them out of the house
19,6,"they should raise the money between them for a move,"
19,7,they did not do this.
19,8,The father then became ill
19,9,and the neighbours were very helpful
19,10,and did whatever they could.
20,1,The mother stood out the front
20,2,after exiting the wagon
20,3,"and said loudly,"
20,4,"'we are here,"
20,5,the house was rented to us
20,6,"and we have paid for the month,"
20,7,so we will be here for the month.
20,8,I don't know if we can afford to pay for another month
20,9,but we will see.
20,10,It's winter
20,11,and it's cold
20,12,and a stone has been put through the window.
20,13,If you did this
20,14,you can make it right
20,15,by fixing it.'
20,16,but no one ever did.
20,17,The father got sick that month
20,18,and the neighbours were as nice as anything
20,19,also seeing off any trouble.
20,20,But to the boy
20,21,it still felt terrible
20,22,from his very first moment in that home.
21,1,The mother was clanging
21,2,"before the boy was returned home,"
21,3,that is all
21,4,I can recall.
22,1,The mother called out all the neighbors
22,2,while being dropped back off at their home
22,3,by the police officer.
22,4,Telling them
22,5,if they want her and her family to go away
22,6,they should pay them
22,7,because they have no money left
22,8,after the brutal robbery
22,9,stoning their window
22,10,after their arrival.
22,11,After a short while
22,12,the father became ill
22,13,and the neighbors actually helped out
22,14,despite the awful racist welcoming
22,15,they had
22,16,from all the others
22,17,because of their skin colour.
23,1,The mother spoke to the neighbors
23,2,and said
23,3,that they will stay there for a month
23,4,as they had already paid in advance
23,5,and cannot afford to move until then.
23,6,She said
23,7,if anyone is unhappy with that
23,8,then they should get together
23,9,and get the money
23,10,"to pay for them to move,"
23,11,but they obviously didn't do that
23,12,as everyone was struggling with money.
23,13,Sometime after it
23,14,the father got sick
23,15,and the neighbors were as nice as anyone could have been.
24,1,This was our welcoming to the neighbourhood.
25,1,The wagon had a bell on it
25,2,"and that clang clanged,"
25,3,so the neighbours came out of their houses
25,4,"to see what was going on,"
25,5,"when they got out of the back of the horse and wagon,"
25,6,the mother told all the people
25,7,how much she had paid to be there
25,8,and that they were paid up for the month
25,9,but she did not know about the month after that.
25,10,She had no more money
25,11,and was not going to move
25,12,"and she did not have new window money,"
25,13,she was there for the month whether they liked it or not.
25,14,If they objected to them being there
25,15,"then they could give her money to move on,"
25,16,but without it she was staying.
25,17,No one gave her any money
25,18,"but did leave them alone,"
25,19,when his father got sick
25,20,they did help out
25,21,just as any other neighbours would.
26,1,"The police patrol had a bell that clanged,"
26,2,and all of the neighbours came out
26,3,to see what was going on.
26,4,They came through the back of the police patrol.
26,5,The mother stood in front of the neighbours
26,6,"and told them that they were going to be there for a month,"
26,7,that they had paid the rent upfront for a month
26,8,and she couldn't afford to move.
26,9,If they wanted her to move
26,10,then they would have to all gather up their money
26,11,and pay for them to move somewhere else.
26,12,They didn't have any money though.
26,13,She said they would have to accept that they would be there for a month.
26,14,And that she couldn't afford new windows.
26,15,"That they were different,"
26,16,but ultimately the same.
26,17,Her husband got sick
26,18,and the neighbours responded as though it was anyone else.
27,1,"When the police returned the mother and the boy home,"
27,2,she informed them of how much money she spent renting the house
27,3,and that she doesn't have any money to fix broken windows
27,4,nor rent another house.
27,5,"So she said,"
27,6,"if they do not want me in that house,"
27,7,they should have at least said it.
27,8,She then asked them
27,9,to give her some of the money she used in paying for the rent
27,10,"so that she can find somewhere else to rent,"
27,11,but they also did not have any money to give to her.
27,12,"From there,"
27,13,the boy and his mother were taken to his father
27,14,who was also sick.
28,1,The mother confronted the neighbours
28,2,and said
28,3,"that although she was not the same skin colour as them,"
28,4,she was similar to them
28,5,and was just trying to feed her family
28,6,just like them.
28,7,It seemed to work
28,8,with the neighbours.
29,1,The police brought the mother and her son home.
29,2,The drawn horse police carriage had a bell that clanged.
29,3,That caused all the neighbors to come out to see what was happening.
29,4,"Once they got home, the mother spoke out to all the neighbors."
29,5,She told them that they are paid up for the month.
29,6,She told them how much it was.
29,7,She told them how much they had.
29,8,They can't afford to move.
29,9,So they are stuck with them for the month.
29,10,They also can't be affording any more broken windows.
29,11,Now they don't know if they will still be there for the next month.
29,12,But if they don't want them there then the neighbors should get a collection going.
29,13,The collection would help pay them to move out.
29,14,"Of course, they didn't."
29,15,She told them that she may look different from them (skin color).
29,16,But she is the same as them.
29,17,They did end up staying.
29,18,The neighbors did become more neighborly.
29,19,"Eventually, the father did get sick."
29,20,The neighbors did help out.
29,21,And this was their welcome into their new neighborhood.
30,1,"They told that they were staying for a month,"
30,2,"they didn't know if they were going to stay more than a month,"
30,3,"but at least a month they were staying,"
30,4,"and she told them if they want them out,"
30,5,"they needed to give them money to move out,"
30,6,and they didn’t do that.
30,7,"In the meantime, the father got sick,"
30,8,"and everyone was nice to them,"
30,9,but the welcoming was terrifying.
31,1,"On arriving back at the house,"
31,2,the mother explained to the mob of people outside
31,3,that she was aware
31,4,that they didn’t want us to be in that house because of our colour
31,5,but that she couldn’t afford to move anywhere else.
31,6,If they wanted us out
31,7,"then they could pay for us to move,"
31,8,but they were probably just as poor as us.
31,9,It was a frightening time
31,10,but it became clear
31,11,that the neighbours were just like us
31,12,and were very helpful when dad became ill.
32,1,"Basically, the police,"
32,2,"when they arrived,"
32,3,they made a noise
32,4,because it was 1925
32,5,and it was a horse-drawn wagon
32,6,"with bells on,"
32,7,"which caused a commotion,"
32,8,and brought out all the neighbours to their doors.
32,9,The mother was a proud and dignified woman
32,10,and told those in the neighborhood
32,11,"(who were mostly Jewish,"
32,12,"even though the officer said they were Irish),"
32,13,that she would not move
32,14,"as she only had a month's rent,"
32,15,which she had paid
32,16,and could not afford to move.
32,17,It appears that she didn't have the money to pay after that either.
32,18,"She told her neighbours,"
32,19,who were being racist
32,20,"by throwing stones at her window,"
32,21,that if they wanted her to move
32,22,"they would have to pay for it themselves,"
32,23,which they didn’t do.
32,24,"They were poor themselves,"
32,25,"perhaps they were a bit ashamed,"
32,26,"but in any case,"
32,27,for the remainder of the time they lived there
32,28,they were good neighbours
32,29,and even checked in when the father fell ill.
32,30,"The narrator,"
32,31,"who was a boy at the time,"
32,32,finishes by saying
32,33,"that this was their introduction to the neighbourhood,"
32,34,which wasn't the best.
33,1,The police said
33,2,"if we wanted anything to change,"
33,3,we would need to move.
33,4,My mother explained
33,5,"that we would need to stay,"
33,6,"as we had no money after the move,"
33,7,given it had just happened.
33,8,We explained to the neighbours
33,9,"that if they wanted us to not live in their neighbourhood,"
33,10,"they would have to pay,"
33,11,however they didn't do so
33,12,"- likely, they had no money of their own."
33,13,"During the time we lived there,"
33,14,"my father became sick,"
33,15,and when this happened
33,16,our neighbours were very kind and supportive.
33,17,It was a scary welcoming to the neighbourhood.
34,1,"When the Police Patrol arrived in the neighborhood,"
34,2,the neighbors came out of the house.
34,3,The boy's mother then told them about what had happened
34,4,when she left her children to go to the grocery store.
34,5,The windows were allegedly broken by neighbors
34,6,who didn't want this family moving into their neighborhood
34,7,because they were black.
34,8,"The mother then pleaded with them to accept her family,"
34,9,her family was poor
34,10,and had used all the money they had to pay for the month's rent.
34,11,They did not have money for repairing the broken windows
34,12,and it was winter.
34,13,The neighbors finally showed their support and acceptance of the family
34,14,when the boy's father became ill.
35,1,The Police took the mother and boy home
35,2,in the Police Patrol horse and cart.
35,3,The bell of the cart clanged loudly
35,4,and the people all came out of their houses
35,5,to see what was occurring.
35,6,The mother and boy came down the steps of the cart
35,7,and the mother spoke loudly to the people that had gathered.
35,8,She said she had no money to move.
35,9,She said they would have to put up with her family
35,10,for at least a month
35,11,as that was when her rent was paid up to.
35,12,She said that if they wanted her gone
35,13,they could pay for her to move
35,14,but she knew they wouldn't do that
35,15,as they didn't have any money either.
35,16,She said she just wanted to live quietly
35,17,and look after her family.
35,18,The people then treated her kindly
35,19,and helped when her husband became sick.
35,20,They rallied around.
35,21,The boy ends by saying their move to this place
35,22,had started by being terrifying and sickening.
36,1,The police returned them home
36,2,and the bells were loud
36,3,and went clang clang clang.
36,4,They then went to the house
36,5,and the lady said to everyone
36,6,I know you don’t want me here
36,7,but I have paid a month’s rent
36,8,and I’m not sure I will have the money next month
36,9,but for this month we will be here
36,10,and I don’t have any money to buy new windows.
36,11,If you don’t want us here
36,12,you can all put together the money for us to rent somewhere else instead.
36,13,The dad was poorly though
36,14,and they actually treated him nicely.
37,1,The police returned them home
37,2,and the mother was saying
37,3,they shouldn't have rented the house to them
37,4,if they didn't want them there.
37,5,And they were worried
37,6,about how cold it was
37,7,with the broken window.
38,1,"When they came home,"
38,2,everybody was out
38,3,and had surrounded the police car
38,4,and the mother asked
38,5,why somebody had done this to her house.
38,6,She said
38,7,she had paid rent for a month
38,8,and was just trying to provide for her family.
38,9,She didn't know
38,10,why this was happening.
38,11,"If they didn't want someone like her to live in the house,"
38,12,they shouldn't have rented it to her
38,13,however she wasn't going to move
38,14,as she didn't have money.
38,15,She didn’t know
38,16,what she was going to do beyond the month
38,17,"however for this month,"
38,18,she wasn't going to move
38,19,as she didn’t have money to.
38,20,She said
38,21,"if the neighbours wanted her out,"
38,22,they should collectively give her money
38,23,to move
38,24,but they didn’t.
38,25,The father became sick
38,26,"during this period,"
38,27,and the neighbour were as nice as could be
38,28,but this was their terrifying welcome
38,29,to Third and Wharton.
39,1,**When the police returned the mother and the boy home** - Adverbial clause indicating the time of the main action.
39,2,"**they went in a carriage** - Main clause describing the action of the police, the mother, and the boy."
39,3,"**that had a bell** - Relative clause modifying ""carriage."""
39,4,"**that went ""clang, clang, clang""** - Relative clause modifying ""bell."""
39,5,**which attracted the attention of the neighbours** - Relative clause modifying the entire preceding clause about the bell sound.
39,6,"**who came out to see what was going on** - Relative clause modifying ""neighbours."""
39,7,**When they got out of the police patrol carriage** - Adverbial clause indicating the time of the subsequent action.
39,8,**the mother turned to the neighbours** - Main clause describing the mother’s action.
39,9,**She told them that** - Main clause indicating the action of speaking.
39,10,"**apart from their skin colour, her family was the same as theirs** - Noun clause acting as the object of ""told."""
39,11,**and explained that** - Coordinating conjunction with a new main clause indicating another action of speaking.
39,12,**even if they have a problem with her being there** - Conditional adverbial clause within the explained matter.
39,13,**she paid all her money in rent that month** - Result clause linked to the condition.
39,14,**so will be staying for at least a month** - Consequence clause related to the payment of rent.
39,15,"**unless they want to raise the money to fund her move** - Conditional clause modifying the consequence of ""will be staying."""
39,16,**She also told them** - Main clause indicating a continued action of speaking.
39,17,"**it was cold,** - Independent clause within the direct speech."
39,18,"**it was winter,** - Coordinated clause within the direct speech."
39,19,**and they could not afford new windows** - Coordinated clause within the direct speech explaining their situation concerning the cold and winter conditions.
40,1,Why would you do this to me.
40,2,We may be a different colour
40,3,but other than that we are the same.
40,4,I am just trying to provide a home for my family.
40,5,I have paid all my money for a month's rent
40,6,so you may as well get that in head.
40,7,It is winter
40,8,and cold
40,9,and I cannot afford to buy new windows.
40,10,"Unless you all want to give me money to move,"
40,11,I will be staying for the month.
40,12,"Of course no one wanted to give money,"
40,13,they probably couldn't afford it themselves.
40,14,During our time in that house
40,15,my father became ill.
40,16,And the neighbours supported us
40,17,like they would anyone else.
41,1,"The mother stood up to the crowd,"
41,2,"telling them she was the same as them,"
41,3,just a different colour.
