recall_id,clause_id,clause_text
79,14,and broken the window.
79,15,She said they'd used all the money they had
79,16,"to pay for one month's rent,"
79,17,"and unless the people gathered wanted to pay for the family to move,"
79,18,they would be staying for the month.
79,19,"After that, she didn't know what would happen."
79,20,She said they were no different than anyone else here.
79,21,"During the following month, the boy's father was ill,"
79,22,"and the neighbours treated the family with kindness,"
79,23,"helping them with food, etc."
79,24,That was the family's experience
79,25,"during the month of living in this place,"
79,26,"a Black family in an Irish neighbourhood,"
79,27,dealing with Irish police.
80,1,And they came down from the long door at the back of the police patrol down the steps.
80,2,"And the mother said ""I may be different from you people colour wise, but I am the same in every other aspect""."
80,3,She claimed what she had paid for the rent
80,4,and that they would be there for at least the next month
80,5,and that it being winter time she didn't have the money to keep buying windows.
80,6,If they wanted her and her family to move they could all come up with the money for her to do so as she did not have it.
80,7,"They didn't do that,"
80,8,they likely didn't have nay money either.
80,9,In that next month the father became sick.
80,10,The neighbours were as nice as anybody.
80,11,That was their welcome to the neighbourhood
80,12,and it was terrible.
81,1,The mother insisted that the police escort her and her son back home
81,2,on Third and Wharton via the police cart and horse.
81,3,The police cart had a bell
81,4,"which was rung,"
81,5,making a loud clanging noise
81,6,"that attracted the neighbourhood,"
81,7,who all came out to see what was going on.
81,8,"As the mother got out of the vehicle,"
81,9,she defiantly addressed the crowd.
81,10,"She stated that although the colour of her skin was different,"
81,11,she was just the same as the people living in the neighbourhood.
81,12,"She simply wanted to provide a home for her family,"
81,13,and that she had given all of her money to pay for the rent for one month.
81,14,"This meant that she would not be going anywhere for the next month,"
81,15,and she was working hard to earn more money
81,16,as she was unsure if she would have enough to continue paying the rent.
81,17,She then referred to the accident
81,18,when there was a group of people
81,19,"who were throwing stones through the window,"
81,20,which scared the boy and the siblings.
81,21,"After the incident,"
81,22,the boy's father got sick
81,23,"and the neighbourhood rallied around the family,"
81,24,"offering to provide help where they could,"
81,25,and to stop any troublemakers causing harm to the family.
81,26,The boy refers to the first time that they moved to the area
81,27,as a terrifying and frightening time.
82,1,"**In this episode**,"
82,2,**a family is taken home**
82,3,**by a police patrol**
82,4,**after a troubling incident**.
82,5,**The narrator vividly describes**
82,6,**the sound of the patrol’s bell—“clang clang clang”**
82,7,**as it approaches**.
82,8,"**Neighbors gather**,"
82,9,**curious about the commotion**.
82,10,"**The mother bravely confronts the crowd**,"
82,11,**expressing her frustration**
82,12,**and asserting her humanity**
82,13,**despite their racial differences**.
82,14,**She explains that she's rented the house**
82,15,"**for a month**,"
82,16,**emphasizing her struggle**
82,17,**to provide for her family**
82,18,"**during the cold winter**,"
82,19,**and challenges the neighbors to help**
82,20,**if they don't want her there**.
82,21,"**Her determination shines through**,"
82,22,**highlighting both vulnerability**
82,23,**and resilience in the face of prejudice**.
83,1,The mother told the people
83,2,that they had no money
83,3,so they could not leave
83,4,as they had paid a month
83,5,and if they wanted them to leave
83,6,they would need to give them money
83,7,which they did not have
83,8,then the father became sick
83,9,and the community rallied around
83,10,and helped
84,1,(I) do not remember
85,1,They climbed out of the police patrol
85,2,and the mother turned to those standing there
85,3,and said she didn't know
85,4,why they were doing what they did.
85,5,She said she knew she was different in color
85,6,"but said besides that,"
85,7,they were actually the same.
85,8,She said the house they lived in was rented out
85,9,and told them the price for & that was all she had
85,10,so the family would stay there.
85,11,"She told them if they did not like it,"
85,12,they could come together
85,13,and give her the money for her to move
85,14,as she did not have any.
85,15,The community did not give her any money
85,16,and they stayed.
85,17,The dad got sick
85,18,and the community members were now nice & friendly to them
85,19,and eventually were treated as part of the Irish community.
86,1,The mother got out of the police vehicle
86,2,and loudly stated to the neighbourhood
86,3,that they were staying put in the house
86,4,"for (at least) the next month,"
86,5,being that was the period of time
86,6,that the rent (paid in advance) would cover.
86,7,The mother then said
86,8,that she did not have the money
86,9,for window replacements
86,10,that were damaged by the stones.
86,11,The mother challenged the neighbours
86,12,"that if they wanted the family out of the house,"
86,13,they would need to pay them to leave
86,14,as they had no money.
86,15,It turned out
86,16,that the neighbours probably also did not have money.
86,17,"Eventually the family settled nicely in the house,"
86,18,"and the neighbours were the ""nicest neighbours ever""."
87,1,The mother said to the police
87,2,that they don't know why
87,3,"they're doing this to her,"
87,4,"all because she's different to them colour-wise,"
87,5,that she just wanted to be able to provide for her family.
87,6,The boy then mentioned
87,7,"that they stayed there for the meantime,"
87,8,and while they were staying there
87,9,"his father got sick,"
87,10,and it was a very sad time for him.
88,1,"They went in a horse drawn carriage,"
88,2,"which had a bell,"
88,3,"which went clang, clang, clang."
88,4,"All the neighbors noticed,"
88,5,and came out.
88,6,This was a black family
88,7,in a neighborhood that didn't seem to want to accept them.
88,8,The mother of the house then addressed the neighbors
88,9,"when they got back,"
88,10,"and told them that they were staying for at least a month,"
88,11,"and if they didn't like that,"
88,12,"then they could pay up to allow them to move elsewhere,"
88,13,"but no one did that,"
88,14,as they didn't have the money.
88,15,"Something changed,"
88,16,"and the neighbors then started to accept them,"
88,17,when the father became ill.
89,1,The woman asked the police
89,2,to take her home
89,3,via a police patrol van
89,4,because she was talking loud.
89,5,The police patrol had a bell
89,6,that clanged
89,7,[and] people came looking.
89,8,[She] got out
89,9,and looked at the people
89,10,and they were looking at her
89,11,because of her colour.
89,12,She didn’t have any money
89,13,to pay rent
89,14,for after a month
89,15,or for fixing the house.
89,16,She asked for enough money
89,17,to leave her house
89,18,so [that] people can help her.
90,1,The police patrol rolled up to the house
90,2,and all the neighbours had come running
90,3,"due to the Clang, Clang, Clang of the bell on the police patrol."
90,4,The boy and his mother stepped down from the back of the patrol
90,5,when it stopped
90,6,and the mother addressed the crowd of people assembled.
90,7,She said that she was different colour wise
90,8,but in all other respects was the same.
90,9,She said that she did not know whom had thrown the stones.
90,10,She explained that she had rented the property for a month
90,11,and that the rent had consumed all the money that she had
90,12,and therefore she could not afford to leave
90,13,and so was going to be there for a month
90,14,unless the people would give her money to allow her to move.
90,15,Of course this did not happen.
90,16,When the father returned home he became sick
90,17,and the neighbours were as nice as pie to them
90,18,but what had happened as their first introduction to the neighbourhood had frightened and traumatised the boy
90,19,so that he would always remember it as an awful and scary time.
91,1,The mother wondered
91,2,why she was allowed to rent
91,3,in the first place
91,4,if they didn't want her there.
91,5,She told them
91,6,the windows would need to be replaced
91,7,since it's cold.
91,8,She told them
91,9,they would have to come up with the money together
91,10,if they wanted her to move
91,11,since she had none.
91,12,They also had none
91,13,so they let her live in peace.
92,1,They stopped
92,2,and it was a long door they opened
92,3,and the mum told them
92,4,she was oh different in color
92,5,but the same otherwise
92,6,and that she only had the money she had paid for the month
92,7,and if people wanted her to move
92,8,they had to give her the money
92,9,so she could get somewhere else.
92,10,"The person's dad became sick in that time,"
92,11,neighbors were very nice.
92,12,But the welcoming had been awful
92,13,and very frightening.
92,14,Ok I’m in max.
93,1,"After the mother and the boy were returned home,"
93,2,the mother saw all the neighbors standing there watching her.
93,3,She told them all how much she had paid in rent for the month
93,4,and told them that they were at least staying there a month.
93,5,She said she didn’t know if they would have enough money to live there next month.
93,6,"If the neighbors didn’t want her living there,"
93,7,"then they could give her enough money to move again,"
93,8,but none of them gave her any money.
93,9,"It was during this time that the father got sick,"
93,10,"however,"
93,11,the neighbors where is nice has anyone else would be.
94,1,When police returned the mother and boy home
94,2,home in convoy
94,3,They talked with the neighbors
94,4,and told them
94,5,that they do not have enough money to move out
94,6,and how much money (was) spent renting this house
94,7,If neighbors want them to move
94,8,then gather some money
94,9,and give it to mother and boy
94,10,so that they can move out
94,11,Eventually everything settled up
94,12,Boy's father became ill
94,13,and neighbors were supporting.
95,1,"When they returned home,"
95,2,the people got out their houses
95,3,"to see what was going on,"
95,4,"and when the mother got off the carriage,"
95,5,she said out loud
95,6,"so they can all hear ""why you're doing this to me I don't know,"
95,7,and I don't have money to move out
95,8,"because I just moved here,"
95,9,"so if you don't want me here,"
95,10,"you can all put money together to help me move to another place,"
95,11,and I don't have the money to buy new windows
95,12,"that you just broke"""
95,13,They didn't give her the money
95,14,because they also did not have the money.
95,15,"They stayed there for a while,"
95,16,"and the father fell ill,"
95,17,and the neighbors were nice.
96,1,The mother berated them
96,2,saying she was the same for them
96,3,trying to provide for her family
96,4,and couldn't afford to move.
96,5,If they wanted her to move
96,6,they would have to give her money
96,7,because she could afford it.
96,8,The neighbours were nice
96,9,when the father became ill.
97,1,"After the police returned the mother and the boy home,"
97,2,as the mother got out the police patrol
97,3,"and everyone came out to see what was happening due to the clang of the bell,"
97,4,she explained that she had paid rent for a month.
97,5,"Therefore, she was going to stay there for that month"
97,6,and did not know if she would have enough money to stay longer.
97,7,She mentioned it was winter
97,8,and could not afford to fix the window
97,9,and would have to let the cold enter her house.
97,10,She asked for whoever broke it to fix it
97,11,but no one did.
97,12,"She also explained that besides her color, she was no different from the people who lived there."
97,13,"She also said if they did not want her there,"
97,14,they should come together and pitch in with money
97,15,so that she could afford to rent another house in a different place
97,16,but that also did not happen.
97,17,The little boy said that the whole situation scared him.
98,1,The neighbours heard the bell
98,2,and [heard] horses of the police
98,3,as they approached the mother’s house.
98,4,The mother addressed the neighbours
98,5,"by saying why have they done this to her,"
98,6,"because apart from her colour they were the same,"
98,7,just trying to provide a home for her family.
98,8,She explained that they paid a month's rent for this house
98,9,and [explained that] if they wanted her to move
98,10,"they would have to pay her some money,"
98,11,so she could do that.
98,12,"She said that she didn't have any money to move,"
98,13,so they would have to stay there.
98,14,Her husband who was a drinker
98,15,became sick
98,16,and the neighbours were nice
98,17,and [neighbours] helped them.
98,18,[I am] Too [sic] be honest rather confused with the timeline
98,19,as to when that happened!
99,1,The police took them home
99,2,and the mother confronted the neighbors.
99,3,She told them
99,4,that they could either raise enough money for them to move
99,5,or leave them alone.
99,6,By standing up to them
99,7,she gained their respect
99,8,and they became supportive of the family.
