recall_id,clause_id,clause_text
41,4,She said that she had paid the rent for a month
41,5,"and that she didn't have anymore money,"
41,6,certainly not to replace broken windows.
41,7,She said that would have to accept her
41,8,as the family was going to be there for a month.
41,9,She didn't know what would be happening after that month.
41,10,"She asked them to put forward some money,"
41,11,"but of course, they didn't."
41,12,When the father came back he was very sick
41,13,and then the people were as nice as they could be.
42,1,she told them
42,2,"they had rented the house,"
42,3,she told them
42,4,"how much money she had paid,"
42,5,she knew
42,6,"she was going to be there for the month,"
42,7,she didn’t know
42,8,"beyond if they could pay thereafter,"
42,9,it was winter
42,10,and cold
42,11,"could not afford buying of windows,"
42,12,she asked them
42,13,to give her enough money
42,14,to move elsewhere
42,15,"if they want her to leave,"
42,16,"because she did not have,"
42,17,her father was sick
42,18,and the neighbours were kind.
43,1,The mother turned to the group of people
43,2,and told them
43,3,"that she has paid all her money for the month to stay,"
43,4,does not know if can afford to stay longer
43,5,but will be there for that month.
43,6,Told them
43,7,she does not know who threw the stones
43,8,but she can't afford to pay for broken windows.
43,9,If they want to give her money to move somewhere else
43,10,they can.
43,11,She told them she is a different colour to them
43,12,but she is no different to them.
43,13,During the time living there after this
43,14,the child's father became sick.
43,15,The neighbours were kind to them.
44,1,The police returned the mother and boy
44,2,in the police patrol
44,3,because the lady was talking loud.
44,4,"They are in fifth street,"
44,5,all the neighbours ran out
44,6,to see what's happening
44,7,when the police clang went off.
44,8,All the people was looking at the mom
44,9,"and the mom asked them why they are looking at her,"
44,10,she knows she looks different color-wise
44,11,but all she wants to do is provide for her family.
44,12,"She rented the house,"
44,13,and paid upfront for 1 month.
44,14,She was unsure if she could afford the rented house for another month.
44,15,It was winter time
44,16,"and it was cold,"
44,17,cannot afford to buy new windows.
44,18,Mom doesn't know who threw the stones
44,19,but she knows for sure that they will live there for at least 1 month.
44,20,The mother told the people if they don't want her here
44,21,then they must give her enough money to pay for another house to rent.
44,22,The mother's dad became sick.
44,23,It was scary for them to live in that neighborhood.
45,1,"When police returned the mother and the boy home,"
45,2,the neighbors came running to see what was happening.
45,3,"And of course, they saw the man came around"
45,4,and back - I can see it right now -
45,5,from where he was sitting up front there
45,6,"where the horses came around,"
45,7,and opened the door in the back.
45,8,And they had a long door in the back
45,9,where you had to come down steps to get out the back of the -
45,10,of this police patrol.
45,11,"Well, we got out of that police patrol."
45,12,"Before the patrol ever left,"
45,13,"my mother turned and faced all those people that were standing around,"
45,14,"and she says, ""why you're doing this to me I don't know."""
45,15,"She says, ""I know that I am different from you, colour wise,"
45,16,"but in every other respect, I'm just the same as you are,"
45,17,"and all I'm trying to do is provide a home for my family."""
46,1,Once the police returned the mother and boy home
46,2,"in the police patrol,"
46,3,the whole neighborhood came out
46,4,to see the loud horses arriving.
46,5,The mother then made a speech
46,6,to all the neighbours
46,7,"about not being sure why they were doing this,"
46,8,and that despite being of a different colour
46,9,"she was the same as everybody else,"
46,10,trying to provide a home for her family.
46,11,She made it clear
46,12,they would at least be there for the month
46,13,"as they paid the rent upfront,"
46,14,and didn't have extra cash to move somewhere else.
46,15,She suggested
46,16,"that if they wanted her gone,"
46,17,they should save up the money
46,18,for her to move elsewhere with her family.
46,19,As time went on
46,20,"and the father fell sick,"
46,21,they found that the neighbours were very kind and generous.
46,22,The problems seemed to subside
46,23,but the entrance into the neighbourhood was traumatising for the boy.
47,1,The police wagon had a bell
47,2,"that made a loud clanging sound,"
47,3,so the neighbors all came out
47,4,to see what was happening
47,5,as they arrived back.
47,6,The mother jumped off the back of the police wagon
47,7,before it had even stopped
47,8,"and said to everyone in the neighborhood who had gathered around,"
47,9,"""Look,"
47,10,we live here now
47,11,so get used to it.
47,12,The only difference between me and you all is the color of my skin.
47,13,"I just moved in,"
47,14,"it cost all my money to pay this month's rent,"
47,15,so for this month we'll be here
47,16,unless you get us the money to move somewhere else!
47,17,"And we can't afford to be replacing windows,"
47,18,"we spent all our money on the rent for this house!"""
47,19,Of course no one gave them money to move somewhere else.
47,20,"But when father got sick that month,"
47,21,the neighbors were very kind and supportive.
48,1,when returning home
48,2,the father was sick
48,3,and the boy was frightened
48,4,to live there
49,1,The mother asked all the neighbors
49,2,why they were doing this to her.
49,3,She told them
49,4,her skin color may be different
49,5,but she's the same as them inside.
49,6,She told them
49,7,she was just trying to provide a home for her family
49,8,and if they wanted her to move out so bad
49,9,they needed to pay for her to move
49,10,as she has not enough money.
49,11,During the ending
49,12,the father had become sick
49,13,and the neighbors were apparently welcoming after that point.
50,1,When the police returned the mother and the boy home
50,2,they were understandably frightened
50,3,and worried about their safety.
50,4,"However, the mother made it clear"
50,5,that she had no money to move anywhere else
50,6,"and if it was such a huge problem for her neighbours,"
50,7,"them being there,"
50,8,then it's probably best
50,9,that they get together
50,10,and try to raise some money
50,11,to help get them out of the area.
50,12,She made it clear
50,13,she would be staying for a month.
51,1,once they returned home
51,2,the mother started talking to the policeman
51,3,about how she wasn't going to move anywhere
51,4,unless the community could give them enough money
51,5,to move
52,1,"They were brought home in the police car,"
52,2,"she spoke up to the neighbors,"
52,3,"explaining her situation of having paid up until the end of the month,"
52,4,and her struggles.
52,5,Her father had gotten sick.
52,6,The neighbors were nice
52,7,and defended her during that period.
53,1,The police returned the lady and the son home
53,2,in the cart
53,3,with a horse.
53,4,The cart made a distinct noise
53,5,"which the neighbourhood recognised,"
53,6,and it also had a bell.
53,7,That led to the neighbours all coming out
53,8,as they heard the cart approach.
53,9,The mother got out
53,10,"and spilled her heart,"
53,11,saying her family had spent all they had on the first month of rent
53,12,"so they would be staying for at least that long,"
53,13,and how they were only different in colour
53,14,but the same in every other respect.
53,15,Given she had no money to be fixing the broken window
53,16,so the neighbours were free to pay for that
53,17,so that she had money to move elsewhere when the month was up.
53,18,This didn't happen
53,19,but the neighbours were far more helpful
53,20,when the father was then sick.
54,1,It was a bad neighbourhood
54,2,don’t like blacks or Jews
54,3,The police couldn’t do anything
54,4,"but said they should move,"
54,5,but they couldn’t
54,6,and they couldn’t afford windows.
55,1,The police patrol arrived at their home
55,2,and all the neighbours were stood around watching.
55,3,The mother told them
55,4,"that she knew they didn't want them there,"
55,5,but that they were going to be there for at least a month
55,6,as they had paid the rent in advance.
55,7,She told them
55,8,"that she didn't have any money to move,"
55,9,so if they wanted them out
55,10,they would have to give the family the money to do so.
55,11,The mother said
55,12,"that she may be a different colour to them,"
55,13,"but that in all other respects she was just the same,"
55,14,and simply trying to provide a home for her family.
55,15,She said
55,16,"she didn't know who had broken the windows,"
55,17,but that she didn't have the money to replace them
55,18,and it was cold.
55,19,The boy recalled
55,20,"that his father became sick while they were living there,"
55,21,"and that the neighbours then could not have been more helpful,"
55,22,but that the family would always remember
55,23,that hostile welcome that was initially given to them.
56,1,"The mother said ""There's one thing that you can do""."
56,2,"The police officer asked ""what's that?"""
56,3,"The mother said ""Take us home""."
56,4,The police officer was confused
56,5,"The mother further explained ""Yes, take us home in your patrol car""."
56,6,The police officer hadn't seen a lady talk loud like that before
56,7,"So to avoid the situation,"
56,8,They put the mother and the boy in the patrol car
56,9,And took them home.
56,10,"On the way home,"
56,11,There were noises of bells from the patrol car
56,12,Which made everybody look outside their homes.
56,13,"Somebody opened the door for the mother and the boy,"
56,14,And there were long steps they had to walk out of.
56,15,"Lots of people were staring at the mother and the boy,"
56,16,"And the mother asked ""why are you all doing this to us?"""
56,17,"I know we are different colors,"
56,18,But I already rented this house.
56,19,"I paid all the money I had for the whole month,"
56,20,So I'm unable to move elsewhere.
56,21,"If you want me to leave,"
56,22,"Then you can all group together and come up with money so I can move somewhere else"""
56,23,"The neighbours didn't do that,"
56,24,They probably didn't have any money either.
56,25,"After this, the father also became sick,"
56,26,However the neighbours were really nice and helped with any problems.
56,27,That was our welcoming
56,28,And it was scary.
57,1,The mother asked the police for money
57,2,to move
57,3,"as she had spent all of it on rent,"
57,4,but the police had no money
57,5,to help.
57,6,The father had fallen ill
57,7,"and the neighbours were very helpful,"
57,8,"as neighbours should be,"
57,9,however this did not stop further aggression
57,10,from the Irish neighbourhood.
58,1,The neighbors came out to see
58,2,and the mother told them
58,3,they were here to stay for a month
58,4,because that was all they could afford.
58,5,After they helped them
58,6,and the father became sick.
59,1,They opened the patrol door
59,2,and it was a long way down
59,3,some steps on a ramp
59,4,and when we got out
59,5,we could see that everyone was gathered round.
59,6,And my mother said to everyone
59,7,that someone there must have thrown the stones at the windows.
59,8,She said that we are different from everyone
59,9,- in colour -
59,10,but that is the only difference
59,11,and we are the same as them in every other way.
59,12,She said that we are there for a month
59,13,and had already paid for the month
59,14,(and she didn't know about being there longer)
59,15,and she told them how much we had paid for the month
59,16,and she said that we aren't able to move
59,17,because we didn't have the money.
59,18,She said that she was just trying to provide for her family
59,19,and that it was going to be winter soon
59,20,and cold
59,21,and didn't have money to be fixing windows.
59,22,She said if they were not happy that we were there
59,23,then someone could give us the money to move
59,24,because we didn't have the money.
59,25,Nobody gave us the money
59,26,because I suppose they didn't have it either.
59,27,Sometime later my father returned
59,28,and he was really sick
59,29,and everyone in the neighbourhood was really nice to us
59,30,just like they'd be to anyone else
59,31,and that was my introduction to the neighbourhood
59,32,which was very frightening.
60,1,"When we arrived back to um fifth street,"
60,2,many people were there
60,3,because of the clanging of the police patrol.
60,4,My mother graduated from high school
60,5,and was well educated.
60,6,"My mother said ""Why are you doing this to us?"""
60,7,And my mother told them
60,8,that she already paid the rent of the house in advance
60,9,and that it was all she had.
60,10,"My mother said that if they want her to leave,"
60,11,then they should give her the money
60,12,that would be able to move us away.
60,13,"They obviously didn't do that,"
60,14,they also probably didn't have the money for that either.
60,15,"After a while,"
60,16,dad got sick to do work
60,17,and the neighbours helped us out.
60,18,This was a terrible welcome to the neighbourhood.
61,1,She went to Fifth Street
61,2,where they were grouped together.
61,3,She said
61,4,"they were just like her,"
61,5,and has the same struggles as her.
61,6,They were no different.
61,7,She said
61,8,that she is there
61,9,for at least a month
61,10,because rent took all her money.
61,11,And to the window breaker
61,12,that it is winter
61,13,and she can’t afford new windows
61,14,cause she is broke
61,15,so please don’t break more windows.
61,16,If they really wanted her gone
61,17,than they can pool enough money
61,18,so she can rent a different place.
61,19,They didn’t react
61,20,but left her alone.
61,21,"Overtime her neighbor was kind to them,"
61,22,and even help them
61,23,when her dad got sick.
62,1,"The mother and the boy were in a police patrol,"
62,2,"going back home,"
62,3,the home was fifth street away from the police station.
62,4,"When they arrived,"
62,5,there was a crowd of the neighbourhood
62,6,"and the mother told them that she had nowhere else to go,"
62,7,they had to deal with her staying there with her family
62,8,because she had already paid rent.
62,9,She would move
62,10,"if they would give her back the money,"
62,11,most of the people who lived there were Irish
62,12,and the mother and her family were black.
62,13,"After she told them that they had to accept her and her family,"
62,14,they became welcoming
62,15,and helped them when the father got sick.
63,1,And we got out the police car
63,2,and all the people were standing there
63,3,"and my mother said ""why you are doing this to me I don't know."
63,4,But we live here now
63,5,and have paid rent for the month
63,6,and don't have no more money left to move
63,7,"so if you want us to move you can give us the money"""
63,8,But of course no one did
63,9,and then when my father got sick
63,10,the neighbours were nice
63,11,and treated us the same as anyone else.
64,1,All the neighbors came out onto the street
64,2,"because they heard police sirens,"
64,3,"they saw it was the black family,"
64,4,before the family went inside
64,5,the mother gave a huge speech
64,6,"on how she has no money to move,"
64,7,how she's there for a month
64,8,then doesn't know if she can afford longer
64,9,she said if they want her and her family to leave
64,10,"to pay the money to help her move,"
64,11,she also explained that she is just the same as them.
64,12,Then her husband got sick
64,13,and all the neighbors helped.
65,1,There was a clang clang clang
65,2,with the bell.
65,3,All the neighbours came out
65,4,to see what was going on.
65,5,"There was a long door on the police patrol then,"
65,6,and the policeman had to come
65,7,and let the mother out.
65,8,"The rent had been paid for a month,"
65,9,so they knew
65,10,they would be able to stay for the month.
65,11,"Whether they would be able to pay the rent for another month,"
65,12,"they didn't know,"
65,13,but they knew
65,14,they would be there for the month.
65,15,"Then during this period,"
65,16,the father got sick
65,17,and all the neighbours helped
65,18,and were friendly as anything.
65,19,And that's how
65,20,the first experience of living there went.
66,1,"When the patrol car stopped,"
66,2,the police officer in the front got out
66,3,and came round the vehicle
66,4,to let the son and mother out.
66,5,"There were neighbours standing around watching,"
66,6,so the mother decided to address them all
66,7,by telling them that she knew one of them threw the rock through her window
66,8,and that she and the family cannot afford to move for the month.
66,9,"She said that if they wanted her and her family to leave,"
66,10,they need to get together the money for her to move.
66,11,They didn't.
66,12,"But after the confrontation/explanation,"
66,13,they did seem to treat the family better
66,14,and were nicer to them overall.
66,15,Though the boy did say
66,16,that the first impression/rock incident did really terrify him at the time.
67,1,"When they returned home,"
67,2,she showed them the damage
67,3,but the police did not care
67,4,and the mother was concerned
67,5,as she would not be able to pay for the window
67,6,and it was coming into winter.
67,7,The neighbours took pity on them
67,8,after their father died
67,9,"and became more helpful towards the family,"
67,10,taking pity on them.
67,11,They moved into a communal place with neighbours
67,12,and although they were unfriendly at first
67,13,they took pity
67,14,once the father of the young people died.
68,1,The mother and the boy returned home
68,2,and the mother was talking with the police
68,3,about who the likely troublemakers were.
68,4,The Police said
68,5,they could not help find
68,6,who was victimizing the boy's family.
68,7,They suspected
68,8,it was Irish gangs.
69,1,"After the police returned the mother and the boy home in the police wagon,"
69,2,a crowd of neighbors gathered to watch.
69,3,"The mother confronted them,"
69,4,saying she didn't understand
69,5,why they were hostile.
69,6,She acknowledged their differences in skin color
69,7,but emphasized that she was just trying to provide for her family.
69,8,"She explained that they had rented the house,"
69,9,"paid a month's rent,"
69,10,and had no money to move.
69,11,"She told the crowd that if they wanted her to leave,"
69,12,"they would need to raise the money for her to relocate,"
69,13,as she couldn't afford to replace broken windows or move.
69,14,"The neighbours did not offer any money,"
69,15,and the family stayed.
69,16,"Although their initial reception was hostile and frightening,"
69,17,"with time,"
69,18,"the neighbours became kinder,"
69,19,especially when the father fell ill.
69,20,"Despite this eventual goodwill,"
69,21,the speaker recalls the fear and tension
69,22,of their difficult introduction to the neighbourhood.
70,1,The police took them home
70,2,in the police car.
70,3,The mother got out
70,4,and told the crowd
70,5,who would have included the person who threw the stones
70,6,"that broke the windows,"
70,7,that she couldn't afford to move.
70,8,She told them
70,9,that she would be here for the month
70,10,"and if they wanted her to go,"
70,11,then they would need to give her the money to leave
70,12,as she didn't have any.
70,13,She said she had a family
70,14,"and couldn't afford to keep paying for windows to be fixed,"
70,15,so they needed to stop breaking them.
70,16,It seemed like the people were then ok with the family
70,17,"as when the husband got ill,"
70,18,they were nice to the family.
71,1,The police were returning the mother and the boy back to their home
71,2,in a horse drawn wagon.
71,3,The cart had a large bell on it
71,4,that let off a loud 'clang' sound as they went.
71,5,The noise from the bell caused a lot of people from the neighbourhood to come out
71,6,into the street
71,7,to see what was going on.
71,8,When they got home
71,9,the mother addressed the crowd of neighbours
71,10,before the police wagon had the opportunity to leave.
71,11,She told them
71,12,"that aside from the colour of their skin,"
71,13,her family was just the same as theirs.
71,14,"She said that she had rented the house,"
71,15,"that she had paid for a month up front,"
71,16,and that she had no more money
71,17,to move.
71,18,"She said that even though it was cold,"
71,19,"she had no more money to fix the windows,"
71,20,"and that if they truly didn't want her and her family to live there,"
71,21,they could give her enough money
71,22,"to move somewhere else,"
71,23,because otherwise
71,24,they would be there at least for the month.
71,25,The boy recounted
71,26,"that after that day,"
71,27,"for the duration of their tenancy,"
71,28,"the neighbours were nice to their family,"
71,29,including when his father got sick.
72,1,The mother said
72,2,that her and her family was staying for a month
72,3,and if the people in the neighborhood didn't like her and her family moving to the town
72,4,the people who don’t want them there should give them money to move away
72,5,but that was said with the knowledge
72,6,that the people who threw the rocks in the first place don't have money themselves.
72,7,It is going into winter
72,8,and the family cannot afford new windows
72,9,and it will be cold.
72,10,It was a frightening time for the boy
72,11,to be introduced to the neighborhood.
74,1,The mother was really upset
74,2,and distressed
74,3,as it's winter
74,4,and she can't afford new windows
74,5,"as someone stoned them,"
74,6,police could not do anything
74,7,as the woman didn't know any names
74,8,of the people who stoned their windows.
75,1,i was 10 years old
75,2,and lived on 4th street
75,3,they got out of the police wagons
75,4,& the neighbours all came out to see what was going on
75,5,the clanging bell of the wagon had alerted them
75,6,she asked the neighbours why are you doing this to me
75,7,if you want us to move
75,8,you can give me money
75,9,because i have paid 1 month in advance
75,10,& have no other money
75,11,it was winter
75,12,& we could not afford new windows
75,13,dad got ill
75,14,& the neighbours rallied round
75,15,& helped us out
76,1,They were driven home
76,2,in a patrol cart
76,3,with a door at the back.
76,4,"As they emerged from the cart,"
76,5,"the neighbours were gathering round,"
76,6,having been alerted by the noise.
76,7,The mother took the opportunity
76,8,"to address the gathering,"
76,9,saying that she knew
76,10,that the stoning incident had occurred
76,11,because she and her family were black.
76,12,She said she felt
76,13,that the landlord shouldn't have rented the house to her
76,14,in the first place
76,15,if this was the reaction they were going to get.
76,16,But they were here now
76,17,"for at least the next month,"
76,18,and they couldn't afford to move
76,19,because the move had used up all their savings.
76,20,She suggested
76,21,"that if the neighbours really wanted them out,"
76,22,they should club together
76,23,and pay for a move somewhere else.
76,24,She also said
76,25,that the only difference between them was skin colour
76,26,"- in all other respects,"
76,27,they were basically the same.
76,28,"After this,"
76,29,the neighbours treated them well
76,30,and were very helpful.
77,1,They pulled up outside the house
77,2,and the waggon was clanging
77,3,so the neighbours came out to look.
77,4,Mum and son went down steps
77,5,out of the tall door
77,6,at the back of the waggon
77,7,and mum addressed the onlookers
77,8,and said
77,9,that like it or not
77,10,she and her family are staying here for another month
77,11,so if the neighbours don't like it
77,12,"they can all pay toward finding the family somewhere else to live,"
77,13,but no-one responded
77,14,and no one wanted to pay for the windows.
77,15,It seems like the family stayed
77,16,because some time later the dad of the family got ill
77,17,and the neighbours were nice about it.
78,1,"When the police returned the mother and the boy home,"
78,2,"somewhere on Fifth Street,"
78,3,"the clang clang clang sound from the Police patrol alarmed everybody in the neighborhood,"
78,4,which made them come around.
78,5,The man in the police patrol came out
78,6,and also opened the door for the boy and his mother
78,7,to make their way out of the Police Patrol.
78,8,The mother then questioned the neighbors
78,9,"why they behaved in that manner towards her,"
78,10,asking them if they behaved liked that because she was black.
78,11,"She said if they did not want her in the neighborhood,"
78,12,then the house shouldn't have been rented to her in the first place
78,13,and that it was the fault of the Real Estate Agency.
78,14,So then she asked the people to gather some money
78,15,"and give to her,"
78,16,so that she can go rent another house somewhere else
78,17,"because it was winter,"
78,18,and she couldn't afford to fix windows and rent another place.
78,19,This is because she had used all the money she had to rent the house.
78,20,The people in the neighborhood clearly did not have any money to give to her.
78,21,"During that time, the boy's dad was sick."
78,22,"They couldn't go back to the place,"
78,23,and that was how they were welcomed into the new neighborhood on Fifth Street.
78,24,It was a very frightening experience for the boy.
79,1,The police took the mom and boy home
79,2,"in the police patrol,"
79,3,"which made a clang, clang, clang sound,"
79,4,similar to the clang of a trolley.
79,5,"The patrol was long,"
79,6,with a door at the back.
79,7,"When they reached home,"
79,8,a crowd was gathered.
79,9,"The man, the police officer, climbed off his horse,"
79,10,"went to the back of the patrol,"
79,11,and opened the door for us.
79,12,"My mother addressed the crowd,"
79,13,saying she didn't know why they'd stoned the house
