recall_id,recall_text,recall_len,max_clause_id,mbits_original_narrative,mbits_rephrased_narrative
0,"My daughter died, twenty-eight years ago. I remember when she was at the hospital, they were moving everyone out of their beds. They tried to move her. I told them not to move her from her bed because she was under ether. I told them that Marie was under ether and not to move her. They tried to move her anyway, and when they did, she collapsed. She probably got a blood clot from it because they were talking about what could've caused it. I still remember that day, I was at home and they called me to say that Marie was being discharged from the hospital. I had all the clothes laid out on the table. My husband was at work. I went there and I was praying for this woman who had a gall bladder operation. I was praying to God to not take away this mother from her daughters. I saw a nurse running and she came and asked me something. I asked her if she was running for my daughter, and she said yes, come in. I went in and saw my daughter sweating. The beads of sweat were huge. I started screaming ""You killed her, You killed my daughter!"" A lady doctor Ms. Montique who was an assistant to the doctor who performed the surgery came to speak to me. I screamed very loudly, they wanted to inject me with something. I told them ""You killed my daughter and now you want to kill me."" The receptionist kept calling my home to tell us to come and pick up Marie since she was discharged. My daughter told them that I had already left for the hospital. They all came quickly because they were worried about me. They took me back home. I started screaming when we reached home, I was still in the car. People were coming out of their homes to check what was going on. I kept screaming ""They killed her!"". My husband was sitting on the porch, and he asked me what was going on. I told him ""Marie is dead, they killed her."" I showed them pictures of my daughter, she was only eighteen. When her sister and my husband found out, they collapsed. I told my youngest son to go and tell my sisters Auntie Jenny and Auntie Millie what had happened. When he went to tell them what had happened, they thought he was coming to tell them that Marie had come back home but when they found out, they were shocked. My sister brought an orange earlier, a big orange, nothing like I had ever seen before. The local store owner praised Marie a lot, she said that Marie would always come to the store and stand there, pointing at the steps. ""She would always stand there and look over"", She was a quiet girl, not much to talk. She was a good girl, Marie. - So that's what happened.",2558,72,229.75,240.47046905961133
1,"The story was about a mother's reaction to the unexpected death of her daughter Marie. She passed suddenly from a blood clot in her leg. The mother had a breakdown in the hospital, when she got home she told her husband and son about the sudden passing and they both suffered heart attacks. The story continues with her family making preparations for her daughter's funeral...",376,15,-1.2999999999999998,-23.73489306135891
3,"My daughter died twenty-eight years ago. It was the thirteenth of the month. She was operated on for appendicitis. The next morning, her older sister went to see her in the hospital. She was still under ether. They used a lot of ether for the operation. There was a chair in the room. They just started getting people out of bed. She asked the nurses. It was the doctor's order, they replied. They got her out of bed. She suffered a blood clot. She was put back to bed again. They called us from the hospital. They called on a phone in a nearby store. We were informed about her discharge. Rita was cooking. She will finish the cooking. Her dad is preparing upstairs. He said to prepare coffee for her. He said to get a cake. I went to the hospital with her clothes. She saw me coming into the hospital through her window. She was walking. She fainted again. The nurses were running. I asked if they were running for my daughter. I saw her on the bed. She was in her dress. She had her slippers on.",998,30,133.72,131.15662445728492
4,"A girl called Marie died 28 years ago at aged 22 on the 30th of April. It was a late Saturday afternoon. Her mother Mrs Costa had gone to collect her from hospital, but had found her soaking in beads of sweat and unwell and she passed away. The doctor had given her too much ether and she had pain in her leg and could not see and this was the blood clot. Mrs Costa had been offered a jab to calm her upon declaring the hospital had killed her daughter and exclaimed the shot would be them trying to kill her also. The shocking news spread through the family to Mr Costa and her sister first then extended family.",613,16,16.98,7.601867315301051
5,"It has been 28 years now since Marie died. She had gone to the hospital for surgery for the appendix. Her sister went to visit her and found a chair in the room and asked the nurse what the chair was for and told her that they had to get Marie out of bed, she told her that they can't do that cause Marie is too sick. But the nurse told her that it was the Doctor's orders. She pulled Marie out of bed but she collapsed. The mother did not have a phone so the hospital called the lady at the store to tell Mrs. Costa that she needs to pick up Marie because she is discharged. That morning she asked her daughter to put on some coffee for Marie because she likes coffee in the morning. She laid out Marie's clothes and put her coat on her arm and headed to the hospital. Marie was up and busy saying goodbye to the girls at the hospital when her mother got there. Then the nurse came and asked Mrs. Costa if her daughter had had fainting spells before, she asked if she was going to her daughter, when she saw her daughter she realized that she was sweating. It was a lot of sweat. She was still in her house slippers. Marie died and Mrs. Costa started screaming at the nurse that they had killed her daughter. The female Dr., Dr. Schwartz, had assisted the doctor who did the surgery. She came into the room and Mrs. Costa shouted at her too. The hospital kept calling asking for the mother to come pick up Marie. Marie's sister figured something was wrong and also headed to the hospital. She found her mother in the office undone and that's when she found out about Marie's. She fell and broke her leg. They eventually figured that a blot clot was what had killed Marie. Back at the house the neighbors were out of their houses due to Mrs. Costa's screams from inside the car. The husband had been waiting by the step for his daughter's return. When he heard the news he instantly had a heart attack. Their son Michael also had a heart attack the same day after finding out. The youngest son was then sent to inform his aunties about the death of his sister Marie.",2066,47,180.27,184.42600506128312
6,"A story of a girl named Marie Mrs. Costa, Marie's mom, went to pick up Marie from the hospital because she was being discharged When Mrs. Costa reached the hospital a nurse approached her and asked her to sit down While she was sitting Mrs. Costa was praying for a lady that she knew was having an operation The nurse gave Mrs. Costa a blanket because she was getting chills Mrs. Costa was asked by a nurse if her daughter ever fainted and the nurse asked her to come inside the room Mrs. Costa saw her daughter in the bed with slippers and coats on As soon as she sees her daughter she starts to scream what you did do to my daughter you killed her don't touch my daughter or see I will set this hospital on fire Mrs. Costa went home and let everyone know what happened Everyone’s family member was in shock including the neighbours",833,24,70.86,84.48069595567698
7,"The story was honestly somewhat jumbled in its retelling. However, the core of the story was that the woman's daughter, Marie, died. She was in the hospital receiving treatment. She died. The woman telling the story was livid at the experience. She blamed not the doctor, but the doctor's female assistant. She thinks that the doctor's female assistant killed her daughter. She was completely shocked and angry about it.",420,8,-39.87,-40.78717529285981
8,"My daughter died, it was either March or April 28 years ago, the daughter was called Marie, she went into hospital for something and was due to be discharged. The hospital rang the mother, Mrs. Costa to go and collect her. She told her other daughter to wait for the Dad coming back from work and put some coffee on. Marie liked a pot of coffee every morning that's what Mrs. Costa remembered. At the hospital someone was taking blankets and she realized they were for her daughter she was told to talk to her and said she was dying what was she supposed to say and when she died she was screaming and kicking and pulled out her hair and asked what was wrong her daughter has just been saying goodbye to Arlene. Also, she had taken her dress and her corsets. She asked what had happened and they said a blood clot. She was screaming so they said they'd give her a shot and she said they'd killed her daughter and they weren't killing her as well. She went home and the son James was there he was only little and when she told the Dad he had a heart attack and died and then someone else had a heart attack and died and two Aunties came.",1136,35,82.88,73.21886051711672
9,"Marie was in hospital 28 years ago for appendicitis, the nurse tried to get her out of bed too soon and she collapsed with a blood clot in her leg, her sister Victoria was there, the nurse rang Mrs. Costa, Marie's mother, once she reached the hospital she was told her daughter had died, she was hysterical, pulling her hair screaming at the doctors to leave her daughter alone, saying she would kill them and burn down the hospital. Going home she told her husband, who had a heart attack and her son Michael had a heart attack as well. She told her son Jamie to tell her two sisters, Marie's aunties, that she had died.",621,21,68.18,44.48482712747146
10,"Mrs. Costa (mom) recalled her experience of losing her daughter, Marie. Marie had surgery for appendicitis which eventually led to a blood clot and then her death. Mrs. Costa was remembering the experience which occurred 28 years earlier, in the month of April. She was called to come and pick up her daughter from the hospital after she was being discharged, but when she got there, she was told by the nurses to sit and wait. Eventually, they told the mom that Marie had broken out into cold sweats and was waiting to be seen by the doctor. Marie eventually died in the hospital. Mrs. Costa went hysterical, as any mother would, trying to figure out what had happened while emotions were incredibly high. Eventually, Mrs. Costa had to break the news to her family once she was able to get home. The news of Marie's death caused Mr. Costa and Marie's brother to both have heart attacks.",887,22,28.61,22.962940093158643
11,"It is 28 years since the death of Mrs. Costa's daughter, Marie, who died on the 30th of April - 10 days after an operation for appendicitis. Mrs. Costa's other daughter Veronica had gone to the Methodist Hospital to see how Marie was. They were getting her out of bed. The surgeon was Dr. Schwarz, and his assistant was a female doctor, Dr. Montique. It was time for Marie to come home, and so Mrs. Costa had gone to the hospital, carrying her coat and after her husband had made a coffee. While there, waiting for Marie, she said a prayer for a woman she knew, praying that she would survive and that her daughter wouldn't be left without a mother. At that time, there was a commotion as something had happened to Marie. Mrs. Costa went into her room to see her daughter lying there, covered in beads of sweat. ""You've killed her,"" Mrs. Costa yelled. ""Don't you touch her, or I'll burn this whole hospital down and everyone in it. I know you want to find out why she died, but don't touch her."" It turned out that Mrs. Costa's other daughter Rita had been with her, and Marie had complained that she had a pain in her leg and couldn't see before collapsing. It turned out she had died from a blood clot. When Rita learned that Marie had died she collapsed to the floor, badly injuring her leg which became rigid. 28 years later and she still suffers extended periods of serious pain in that leg, like phlebitis. Mrs. Costa went home and informed her husband. He had shaved, and had been sitting on the porch immediately suffered a heart attack. When her son Michael found out, he also had a heart attack. It was her other son Jamie who went to Mrs. Costa's two sisters and her mother, still alive at the time, arriving with red eyes to report that Marie had died.",1764,52,229.63,228.24436993323974
13,"The story was about a girl named Marie who was 18 years old when she passed away. Her mother Mrs. Costa was recalling the story of her passing away 28 years after her death on 30th April. The mother seemed to be confused with the dates, so it could either be the 20th of April or the 30th. Marie was admitted to the Methodist Hospital for some complications. Her sister Rita came over to check up on her and saw that the hospital was getting ready to put her into a chair however she passed away when they tried to shift her so they had to put her back to bed. After which they sent everyone back home and the doctors checked up on her. Then Mrs Costa was at home waiting for a call from the hospital and since she didn't have a phone, she was waiting for a shopkeeper around her home to tell her whenever she got a call from the hospital. Then one day she got a call from the hospital that she had been discharged and she could come pick her up and extra fees were needed for her boarding charges, which were 10$. The mother reached the hospital and was praying for another patient while waiting in the hospital. Then a nurse comes and asks her if her daughter was prone to fainting spells and lead her to a room where her daughter was sweating a lot and was unconscious. The mother broke out in a hysterical fit and started crying that the hospital killed her and she had an unchecked blood clot. The doctor came rushing in and they had to restrain the mother because she tried to harm herself and was not able to calm down. Her daughter comes in a car with her husband and the mother delivers her the news and she collapses in the hospital. The mother then narrated her story of how things went down after her death was announced how her husband and son both got heart attacks after listening to the news and how everyone else was shocked.",1842,58,149.88,119.16026051212161
14,"Her daughter died in the hospital, she died at a Methodist hospital, she had an operation for appendicitis on a Saturday. On Sunday his oldest daughter Victoria went to the hospital to check up on her, she was still under ether. She saw a chair and asked the nurse what the chair was for, the nurse explained that they had to get her out of bed, the older daughter was furious because her sister was still under ether, but the nurse reiterated that it was the doctor's orders, they went to get her out of bed, but she was passed out. She believed the blood clot she had was their fault for taking her out of bed, later the hospital called for her to go pick up Marie, that she had been discharged. He told Rita she was going to pick Marie from the hospital. When she got there the nurse told her to sit down, she started praying for another patient that had an operation because she was a mother of ten. The nurse asked her if her daughter had ever gotten a fainting spell, when she stepped in she yelled, you killed my daughter a couple times, the doctor who was a lady rushed in and said we don't know what happened, her daughter passed away in front of her eyes. Rita was bothered, so she came over with her son-in-law, but due to her acting hysterical she was held down, she then broke the news of Marie's passing to Rita, she was taken home. Mike had a heart attack once the news was broken to him. Her younger sister had brought an orange for Marie earlier. James was sent to break the news to Aunt Jennie.",1512,29,242.59,226.2549730558876
15,"A woman recounts the passing of her daughter, Marie. She talks about how it happened 28 years ago. It happened on April the 20th. Marie was in hospital. She was having an operation to treat appendicitis. A nurse tried to move her out of a bed into a chair. However, she was heavily sedated on Ether. She passed out whilst they were attempting to move her. They were forced to put her back into bed. The narrator believes this may have been the cause of the blood clot. The blood clot resulted in her death. The narrator recounts the day in which she was supposed to pick up Marie from the hospital. She gathered several of her clothes. She gathered a coat. She speaks about how they lacked a telephone. The local store had agreed to call ahead. The store was to let the rest of the family know when Marie had been discharged. She arrived at the hospital. She sat in a chair. She prayed for an elderly woman. The elderly woman was also undergoing an operation. She noticed several nurses grabbing cold towels. She inquired as to where her daughter was. She was then asked whether her daughter had a history of fainting. Worry began to set in. ""What have you done to my daughter?"", she asked. She was told to come with the nurse. The mother states that the beads of sweat appearing on her daughter's face were very large. Seeing this made the narrator lose herself with anguish. She shouted at the nurses. She shouted at the doctors. She said that they had 'killed her daughter'. Shortly after, as she turned her back, Marie died. The narrator had torn her own hair out. She was still shouting. She was moved to a waiting area. She had refused 'a shot' from a doctor. She believed they were going to kill her too. A short time later, another daughter arrived at the hospital. The other daughter wanted to see what had held them up. The other daughter believed that they should have been home by now. When the narrator told her that Marie had died. She collapsed to the floor 'like lightning'. Later, the mother describes how she returned home. She was screaming from the grief. This caused many people to investigate what happened. She states that when she told her husband and her son. They both had heart attacks. Later, she recounts visiting a store. The employee would always remind her of how Marie would use to stand on the step outside. Marie was a quiet girl. Marie was always kind and good.",2397,52,201.3,178.6286812870615
16,"There was a lady who had a daughter who died of a blood clot. She recalled the story in some detail, detailing the day she died. Her daughter had an operation which appeared to be successful. The mother was called to collect her and whilst on route the daughter had a pain in her leg and some blindness then collapsed. When the mother arrived, the daughter had beads of sweat on her and she had died on a hospital bed. The father was called and tragically, he too had a heart attack but did not die. The sibling also fell ill and continues to be ill, every few years. The girl who died was well liked amongst family and friends but sadly died.",643,24,-0.5100000000000009,-6.035973335318988
18,"A woman's daughter passed away twenty-eight years ago. Her daughter's name was Marie. She (Marie) was in the hospital for appendicitis. The doctors made her (Marie) get up. She (Marie) eventually just died. The mother went alone to go pick up Marie from the hospital. Marie was supposed to be discharged the day she died. The mother brought clothes and Marie's girdle. She (the mother) had a coat on her arm. She (the mother) had everything. Before leaving her house to get her daughter, she (the mother) told her other daughter, Rita, to keep cooking. She (the mother) told (Rita) that her father would be home soon. He (the father) was outside in the yard. The mother goes to the hospital. The nurses tell her (the mother) to have a seat. They (the nurses) say, ""Mrs. Costa, Marie has died"". The mother then becomes completely hysterical. She (the mother) starts ripping her hair out. She (the mother) keeps claiming that the hospital staff killed her daughter. They (hospital staff) are all trying to console her. She (the mother) threatens to kill them. She (the mother) threatens to burn the hospital down. She (the mother) did not care who was in it. On the way home, she (the mother) is obnoxiously crying and screaming. Everyone comes out. Her husband is in shock of Marie's death. He (the father) has a heart attack. Her son has a heart attack. They both have heart attacks. Mrs. Costa's sisters are there as well. They wanted to see Marie when she came home. The younger sister of Mrs. Costa had brought a big orange for Marie. The shopkeeper, Annie, recalls seeing Marie on the steps. She (Annie) claims she (Marie) was a quiet girl.",1644,34,148.04,159.89290365742443
19,"The story was about the death of a woman's daughter, Marie. The woman was Mrs. Costa. She had a daughter named Marie, son called James, and daughters called Rita and Victoria. She had two sisters called Millie and Jenny. The daughter that died had been in the hospital for appendicitis. She was ready to come home. She had passed out when saying goodbye to people. There was a blood clot when she got out of bed. The mum had asked everyone at home to get ready for her coming home (before they knew she had died). Her husband was going to be waiting for them. Cake and coffee would be waiting. The operation was in April, April 20th. The mum went to go pick her up, coat over her arm. Gets to the hospital. The nurse tells her to sit down. The nurse asks if her daughter ever fainted before. She runs to find daughter. But she was dead. The mum said the doctors killed her daughter. Marie said she had a pain in her leg. Marie said she couldn't see before she died. It was a blood clot. The mum was very distressed, hysterical, pulling hair out. Doctors tried to calm her down with a shot. She refused. When Rita found out, she collapsed. The dad had a heart attack. Marie's aunt had brought an orange for Marie, a big one.",1223,28,95.24,127.71339933615019
20,"A lady's daughter was in the hospital but [she] died of a blood clot, [she] was furious at the doctors and [she was furious] at the hospital. She recalled the event that happened in April years ago. Her husband and son had heart attacks when they found out about the death of their daughter/sister.",298,9,-19.77,-41.958412015539636
21,Woman had her daughter die from a blood clot. She went to the hospital for an appendectomy for appendicitis. The assistant doctor had her stand up while under anesthesia and it caused a blood clot to form.,205,8,-18.669999999999998,-0.07547581230164169
22,"My daughter Marie died. She was admitted to the Methodist Hospital 28 years ago this month. She passed away after they had tried to stand up. She was being released. She got a blood clot on her leg. I was going to pick her up. I found out when I got to the hospital. When I got home, my husband was waiting. He had a heart attack when he found out. My eldest son had a heart attack as well. My other son had to go round. He had to tell his aunties. Marie had passed away.",471,13,35.46,42.01532557138964
23,The daughter died on the 28th day 13 months ago. Her mother was Mrs. Costa and (she) held the hospital and Dr. Schwartz directly responsible for her death. She collapsed after experiencing difficulty and pain in her leg. She was 18 when she died. Mrs. Costa enjoyed being greeted by a cup of coffee first thing in the morning.,326,7,0.6200000000000001,-8.674280934544605
24,"It was being told by Mrs Costa. 28 years ago her daughter Maria went to hospital and needed to have her appendix out. After 10 days the hospital called a neighbour to say she was ready to be collected (as Mrs Costa did not have a phone). Mrs Costa went to hospital to collect Maria with a change of clothes (a dress). When she arrived she was asked by a nurse if Maria ever fainted. When Mrs Costa saw her daughter she saw she was sweating, they called a female doctor but Maria died. Mrs Costa was hysterical - Maria was wearing her house coat and slipper. Mrs Costa was taken home where she met Mr Costa who was waiting on the front step. When she told him what had happened he had a heart attack. She then sent her youngest son to her sister's (his Aunts) to tell them the news. Maria died of a blood clot.",809,24,62.45,69.65876066067212
26,"Marie died of a blood clot when the nurses got her to walk and she collapsed. Mrs. Costa, her mother, was called to the hospital to pick Marie up because she had been discharged but Marie had died. Mrs. Costa was hysterical. Her daughter picked her up and she went home and she told her husband, Mike, who had a heart attack. Their son, Michael, also had a heart attack. Their son, Jamie, who was young at the time went next door to tell his Aunt Millie and Aunt Jennie that his sister had died. This happened 28 years ago on April 30th.",537,18,60.04,23.713273304025385
28,28 years ago My daughter died She had appendicitis The nurse made her get up to walk and she collapsed My husband had a heart attack My son had a heart attack I will burn the hospital down That's all That's what happened,220,10,44.05,34.72343955888266
