recall_id,recall_text,recall_len,max_clause_id,mbits_original_narrative,mbits_rephrased_narrative
29,"Mr's Costa's daughter died at Methodist hospital, 30 years later, she was in for appendicitis. There was a chair in the hospital room, she asked them what it was for, they said it was good for her daughter to get up, they tried getting her up, then she fainted, and they think it caused a blood clot. Mrs. Costa was called to collect her daughter from the hospital, Rita (her other daughter) took over the cooking, and waited for their dad to get home. When Mrs. Costa was at the hospital, the nurses were called for a painting that was falling, it was her daughter. Mrs. Costa screamed at them that they had killed her daughter, they wanted to give her a shot, but she screamed that they wanted to kill her too. Rita, her other daughter, is still affected by her sister's death 30 years on, and has pains in her legs for weeks at a time, and people have fond memories of her daughter even after her death, such as the shop keeper, who remembers her standing in her shop.",971,24,94.59,85.8827423668617
30,"A woman's daughter died in the hospital, she got upset about it, her husband and son had heart attacks when they found out.",123,4,-5.09,-31.281088796674634
31,"Marie was in hospital having an operation. It was the 20th of April. Marie was recovering in hospital and was getting ready to be discharged, when she fainted. Mrs. Costa got to the hospital ready to collect Marie when a nurse wanted to speak to her. She thought it was about her friend who had a gall bladder operation but no, it was about Marie who had died. Mrs. Costa was hysterical and didn't want to be with the doctors or nurses who she believed killed her daughter. She was going crazy banging her head against the wall. It turned out she died from a blood clot in her leg. Mrs. Costa got taken home but she felt trapped in the car and just wanted to get out. When she got home she told her husband and he had a heart attack. Her uncle was an undertaker. She got James her son to go and tell his two aunties. When he arrived Marie was in hospital having an operation. It was the 20th of April.",901,30,19.71,13.549847181826536
32,Mrs Costa’s daughter had died. 28 years ago. At the Methodist hospital. The eldest daughter Victoria had gone to the hospital. Marie was under ether. There was a chair there. Nurse was going to get Marie to sit on it. Victoria was startled. As to why they would try and get her on the chair. Mrs Costa was at home. Her other daughter Rita was cooking. They never had a phone. So a store owner they knew was able to call the hospital. So they could go and get Marie. Rita was sent away to get some cake. While Mrs Costa would go to the hospital. It had been 10 days. Before the 28 April. And would have cost $10 more for board. When Mrs Costa arrived at the hospital. She was praying for the recovery of another woman she knew. Who had 10 children. When they tried to bring out Marie. She went into a cold sweat. And fell on the hard marble floor. The nurse and doctors tried to save her. And asked Mrs Costa to talk to her. But she died. She was only 18 years old. Her husband Mike had also now come to the hospital. And he suffered a heart attack. At the news Marie had died. When Mrs Costa had come out of the hospital. The brother Michael also collapsed. At the shocking news. Sister brought an orange for Marie.,1215,36,193.04,151.36374360898742
33,"A woman named Mary has a daughter named Marie who was a very good and quiet child who went into the hospital for appendicitis. During recovery, she was made to get up from the bed and sit in a chair where she fainted that caused a blood clot that led to her death 28 years ago on the 30th of April when she was only 18 years old. Mary did not have a phone at home so the woman from the store received the call when it was time to retrieve Marie from the hospital. But she died shortly after she arrived after saying goodbye to Arlene and other women at the hospital. Mary became very distraught, screaming and pulling at her hair and threatening to kick and kill people and burn the hospital to the ground with everyone in it. They tried to give her a shot and she wondered if they wanted to kill her, too, after killing her daughter. Mary had three surgeries over a short period of time at the hospital so all of the nurses knew her. She was taken home by hospital staff and screamed the entire way. People came out of their houses to see what the matter was. Her husband had come home from work to wash and shave and wait for her and Marie to arrive from the hospital, then had a heart attack upon hearing the news. Her older son (Michael?) also had a heart attack. Her sisters, Jenny and Millie, were to be there to greet Marie. One had brought her a big orange. The youngest son, James, was sent to tell them the news, and arrived with reddened eyes.",1454,38,180.9,170.81797807121893
34,"Daughter Marie went to hospital for an operation for appendicitis. She had the operation on Saturday afternoon. Her sister visited her and she was still under ether. They tried to get her out of bed and mother felt it was too soon but it was the doctors' order. She fainted so they put her back to bed. Mrs. Costa, the mother, was called to go to the hospital to pick up her daughter as she was being discharged. She felt this was too early to be discharged. Mrs. Costa went to the hospital but when she got there [she found out] that her daughter died. Mrs. Costa went home and told her husband who then had a heart attack. Son Michael also had a heart attack at the news.",673,29,65.8,47.57742453435136
35,"My daughter died twenty eight years ago, on the 13th of April on a chilly day. She had gone in for surgery on her appendix at a hospital I had 3 surgeries at in the past. Her sister, Victoria, often went to visit her. I was at the store with Rita when the hospital called me to come and pick her up. She had been in hospital for 10 days and the nurses took her out of bed to ensure she wouldn't get clots. Marie had been excited to come home. I took her coat with me. While I was on my way my husband was shaving and getting ready to welcome her home, waiting on the step outside our house for her. When I got to the hospital there were doctors and nurses running, a nurse came up to me and asked if I was Marie's mother. I asked her if all the running was for my daughter and they said yes. They took me into her room and told me to talk to her, I said 'what am I meant to say, my daughter is dying.' She passed away soon afterwards from a blood clot. I was pulling my hair out and hitting my head on the wall outside the office. They drove me home and when I told my husband what had happened he had a heart attack. My son Michael also came out and when I told him he had a heart attack too. My nephew, Jamie, was there too and went to tell my sisters and my mother. My sister's brother has since passed away. Marie was only 18 when she died.",1344,42,101.12,99.06449643395847
36,"OK. A mother showed up at the hospital to take who I believe to be her daughter (Marie) home from a hospital stay. Just before she was to take Marie home, Marie died. Then the mother went insane threatening to kill people, even threatening to burn the hospital down. She then proceeded to inform the immediate family. That's the general idea as near as I could discern from this poorly written hodgepodge of a story.",416,13,-30.48,-14.850817474941792
37,"The woman from the store called us because we didn't have a phone. She told us that the hospital called — they wanted us to pick Marie up. I told my daughter to put a pot of coffee on, dad would be finished in the yard soon. I always gave Marie the first cup in the morning, I always remember that. Anyway, I went to the hospital. I saw a chair by her bed. ""What's that for?"" The nurse told me they were going to sit Marie. ""What? No."" She said it was the doctor's orders. Well, they tried but she passed out, so they put her back in bed. Marie saw me from the window. The nurse told me to wait. Next thing, she was rushing around. ""Don't tell me it's my daughter you're rushing for?"" It was. We ran to her room where we found her in a cold sweat. Drenched. I went berserk. ""Oh my god, you've killed my daughter!"" The doctor, a female doctor, came in. She told me to be with Marie. ""What can I possibly say to her?"" I was out of my mind. As soon as I turned my back, she passed away. I kept screaming ""You've killed my daughter."" The doctor couldn't tell me why she died. Eventually they escorted me out of the hospital and put me in a car. I screamed all the way home, pulling my hair out. By the time I got home, I didn't realise what a mess I looked. All the neighbors came out to see who was screaming. My husband came out and asked what was wrong. ""It's Marie, she's dead."" He had a heart attack. My other daughter has been chronically ill for the twenty-eight years since. Her leg goes stiff for weeks at a time. I sent my son to tell his aunts the news. Seeing his red eyes, they asked him why he was crying. He told them the news. My other daughter got a phone call from the hospital. They wanted her to pick me up. They were trying to sedate me but I told them ""Don't come near me!"". I knew all the nurses because I'd already been in three times that year for operations.",1880,49,150.72,175.0540471466338
38,"A mother (Mary) lost her daughter (Marie). She had taken her for an operation, when they visited the hospital staff tried to get her out of bed and she collapsed, because she clearly wasn’t ready to do that. Later, on the 18th of April she took her for another surgery performed by a female doctor, and ten days later she died. Mary went to collect her from the hospital carrying her coat and Marie's clothes on her arm, and when Mary arrived Marie had collapsed and died. Mary accused the doctors of killing her daughter. She didn’t want the doctors to operate and find the cause of death. She had to go home and tell everyone. The news shocked her husband and son so much they both collapsed of a heart attack. Her other daughter has suffered with pain for 28 years because of this. Even the shop lady nearby felt the pain of her death, and recalled how nice, quiet, and kind Marie was. Mary sent Jamie, her other son, to tell their other family members.",956,23,72.83,61.08414331890701
39,"Daughter went in for surgery for appendicitis at the local hospital and it was on the 20th of the month. The mother did not have a phone at the house so had someone else that would take calls when the daughter was ready to be picked up. The mother prepared to pick up the daughter by getting clothes and other items ready for when he picked her up. The mother then received a message that her daughter was ready to be picked up by the lady at the store with the phone. When the mother got to the hospital the nurses had her sit down for a bit while she waited. They then asked her if her daughter had a history of fainting and then was taken to the room her daughter was in. She seen her daughter in a poor state with beads of sweat dripping and suddenly came to the realization that something is seriously wrong and started yelling ""you killed my daughter"". The nurses and doctors did try to calm her down but she would not. The mother's other daughter arrived at the hospital soon and found out what was happening and collapsed to the floor and died at the hospital also. The mother was even more distraught and threatened to burn the hospital down. When the mother told the husband and brother they both suffered heart attacks and died. It was a tragic story overall.",1270,33,38.29,37.77465929247049
41,"Mrs Costa lost a daughter named Marie who had died from an appendicitis operation. She had told everyone and the entire neighbourhood her daughter would be coming back the same day, but instead the daughter passed away. She was devastated and the doctors asked to give her something and she declined. She went home and told her husband who end up having a heart attack and her son Micheal who also had a heart attack. She sent her little son Jamie to go tell his two aunts about the death. The operation happened 20th of April and a male doctor performed the operation with the help of a female doctor. Mrs Costa had her hair pulled and she kept screaming until everybody came out and stood at their door.",705,23,34.64,-0.5592592506633469
42,"Marie had a appendectomy done, The next day she was in a lot of pain, when nurses tried to move her from bed to chair. But she had to be taken back to the bed. This might have caused a blood clot, the surgery was done in April. When her mother came to take her home, after she was discharged, Marie was very happy to see her, but sadly she passed away soon after. Her mother was very upset, and cried a lot, when she got home, her husband passed out from a heart attack. The community was also saddened, by Marie's death, as everyone was waiting to welcome her back.",566,17,13.77,3.841154140660173
43,Mrs Costa's daughter Marie died from a blood clot after an operation for appendicitis. She was 18 and it happened 28 years ago. Her father and brother had heart attacks.,169,7,18.02,3.504414809316371
44,"A woman recalls the death of her daughter which occurred 28 years ago following an operation for appendicitis at Methodist Hospital. After the surgery, her daughter was still under ether anesthesia. Despite this, a nurse followed the doctor’s orders to get her out of bed, though she was too weak. The woman believes this action led to her daughter developing a blood clot, which she holds the hospital staff responsible for. The woman recounts her reaction to her daughter's sudden decline after surgery, accusing the doctors of killing her. She recalls screaming at the doctors, particularly Dr. Montique, the assistant to Dr. Schwartz, who performed the operation. Despite being told to talk to her daughter, the woman was too distraught, as her daughter was dying. Overcome with hysteria, she describes her daughter, only 18 and ready to come home, passing away while she briefly turned away. Her husband was waiting for their daughter at home, unaware of the tragedy unfolding at the hospital. The woman recalls confronting Dr. Montique, the assistant to Dr. Schwartz who performed the operation, accusing her of killing her daughter. Dr. Montique admitted they didn’t know what went wrong. The nurse urged her to speak to her dying daughter, but the woman was too hysterical. Overwhelmed with grief, she describes her daughter, only 18 and beautiful, passing away the moment she turned her back.",1401,42,97.78,109.33772652114547
45,"Marie, the daughter of Mrs Costa, died in hospital after suffering from a suspected blood clot in her leg. Mrs Costa recalls telling her other children Rita & James that their sister had died. Rita reacted in a bad way to the news, whilst James was then given the task of passing on the news to his two aunties Millie & Jenny.",326,7,2.600000000000002,-24.423184605147863
46,"Ms Costa tells the story of how her daughter Marie died at the hospital ten days after an operation she had, from a blood clot. The daughter was in the hospital and the nurses tried to pick her up from the bed and have her sit on a chair, under the doctor's orders. When they got her out of the bed, she passed out so they had to put her back to bed. After ten days, they called Ms Costa from the hospital to come and pick her daughter up and return her home. A lady from a store called her and told her that her daughter was discharged. Mr Costa told her daughter Rita to put a pot of coffee on and buy some cake from the bakery. She went then to the hospital where she saw her daughter collapsed with heavy beads of sweat on her forehead. She started screaming the doctor came but they couldn't save her daughter. She went home and first she told her husband and the rest of the family. Unfortunately, the husband had a heart attack due to the terrible news and so did her son. She also called her brother-in-law who worked as an undertaker.",1043,33,141.29,99.22751510982596
47,"Mrs. Costa's daughter Marie passed away, and she's recalling the story. She mentions how she was in hospital, only 18 years old at the time. She was there for 10 days, and there was an issue with getting Marie out of bed and the usage of ether, and another daughter, Victoria, helped a nurse get Marie out of bed when they shouldn't have. Marie got a blood clot, and passed away because of that. The family was waiting to bring her home, and Mrs. Costa went to the hospital, getting Marie's clothes all lined up. Meanwhile, the father shaved and got ready for her return. At the hospital, a nurse's aide came to Mrs. Costa and explained that Marie had collapsed, and that they weren't sure exactly what happened. When Mrs. Costa got upset, they offered her a shot and she refused, saying they had killed her daughter and were trying to kill her, and she would trust the female Dr. Schwartz. The rest of the family had to be informed as well, and they sent a small male to tell her sisters and mother, and they all thought the boy was coming to tell them the good news, that Marie had returned safely, when it was actually bad news. This all happened around April 20th or so. Now, even when Mrs Costa goes to the store, the cashier there mentions how she used to see Marie sitting out on the step looking at the store.",1317,32,69.85,82.96789085375937
48,"My daughter Marie was sick, and I went to the hospital to see how she was, she was still under, back then, they used a lot of ether. There was a chair there. They were just starting to get people out of the bed, you know. Victoria saw the chair and she said to the nurse, ""What's this chair doing here?"" And the nurse said, ""Well, we've got to get her out of bed."" She said, ""What are you talking about? She's still under ether and too sick."" But the nurse insisted that was the doctor's orders. So they went to get her out of bed and she passed out back in bed. Dr. Monique, she was a lady doctor, so she came in and said ""You killed my daughter, what did you do to her?"" She said, ""Calm down, Mrs. Costa,"" She took me away from the bed, and the nurse said to her, ""Talk to her,"" My daughter Marie is dying, what am I supposed to tell her? And Costa was screaming, with her hair all pulled out. I was hysterical, you know. I walked into the room, my daughter collapsed on the hard floor when I told her about Marie and I told the doctors not to touch her, I kept screaming and hitting my head on the wall, I was hysterical, they took me home, I was screaming and neighbors were coming out and my husband was sitting on the stairs, he asked, ""What is wrong with you?"" I told him Marie died, My sisters were with us till 4 a.m. waiting for Marie to come home. My daughter Marie was sick,",1386,30,250.03,190.7412694931322
49,"Mrs. Costa's daughter Marie died, in Methodist Hospital, of a blood clot, at age 18. Her daughter and nurse tried to move her, whilst she was on Ether. She had an operation for Appendicitis, on a Saturday afternoon. They used a lot of Ether back then. She passed out, when trying to be moved. Her sister said that she was too sick to move, despite her sister saying that. The parents worked at a store, and the mother got a call, to pick Marie up. There was some confusion at the hospital, about whether Mrs. Costa was there. Rita, her daughter, finished the dinner, and her dad would be home soon. Mrs. Costa was chilly in the hospital, in just a dress, so they gave her a blanket. The nurse noticed she was in a cold sweat. Her mother bought her a girdle, to put on. Another lady had an operation, for her gallbladder. Mrs. Costa went into the room, and Marie was sweating, on the bed, with slippers and a housecoat. Mrs. Costa told the lady doctor that she killed her daughter, and was screaming. There was some confusion, about whether Mrs Costa was still at the store, and the hospital kept ringing the store. Rita then came to the hospital, and fell to her knees, when she was told Marie was dead. Mrs. Costa was well known at the hospital, for having 3 operations. Her brother in law (now dead) was an undertaker.",1320,43,148.32,95.66947147783918
50,"No idea a lot of people died something about the doctor There was a funeral director, a Marie.",94,6,-18.41,-27.41991246601388
51,"Mrs Costa's daughter, Marie, was in the hospital getting treated for an illness. During the end of her stay, the day she was supposed to be discharged, the nurses had Marie try to walk around her hospital room. Mrs Costa believes that this caused a blood clot in her leg, which led to her death at the time of discharge. On the day of her discharge, the family was looking forward to her coming home. They received a call through a local store that she was ready to be discharged do they not have a phone? They got everything ready for Marie. They had coffee and breakfast prepared and Mrs Costa went by herself to pick Mary up. Her husband and other daughter stayed at their house to continue preparing. At this time, other family members were notified that Marie was being released on that day. Costa states that she had clothes and other things laid out and brought jackets and clothes to the hospital with her. At the hospital, Costa was told to sit and wait. She sat with another patient who'd had gallbladder surgery and prayed for her recovery because she had way too many children. While waiting, she saw some medical staff running to a patient. Costa quickly learned that they were running to treat a medical emergency for Marie, who had developed a clot in her leg. She was taken to Marie's room. Marie was visibly unwell, sweating heavily and with an unnaturally stiff leg Costa started to panic and become belligerent while the doctors rushed around trying to mitigate the situation. During that mess, Marie succumbed to the blood clot. Costa became understandably enraged and started shouting about how the hospital had killed her daughter and complained that they wanted to kill her as well when offerings some sort of calming injection. After some more time the husband and other daughter arrived at the hospital, as they'd become concerned about the lack of updates. They learned at that point that Marie had died. However, Costa's story has an inconsistency from how I recall it here because she then goes on to say that her husband was waiting on the porch and asked what was wrong when she arrived and only sat in the car screaming. They sent one of their other children or grandchildren to notify other relatives. He seems to have been a child and was crying by the time he arrived, leading them to ask what was wrong before he broke the news. Costa then rambles a bit more about unnecessary details but I don't remember them because they weren't key to the story.",2484,43,49.96,63.34374087699793
52,"Mrs Mary Costas tells the story of when she was younger and her daughter, Marie died. She died post surgery from a blood clot. She was supposed to be discharged that day when Mrs Costas went to pick up her daughter, she got sick and then fainted, but she actually died. Mrs Costas had a bad breakdown, was hysterical, hurting herself and threatening others. When she got home, Mike, the father, had a heart attack. Then Michael, the son, had a heart attack. Rita was Marie's sister. There was also a younger son, who told the two aunts that Marie had died. Mrs Costas had 3 surgeries within a year so she knew all the nurses.",625,22,52.75,37.81016911297444
53,"The story was told by a woman who's daughter died. The daughter, named Marie, died of a blood clot after surgery. It was on the thirtieth or maybe the 28th of the month that she died. The hospital had called the store down the road from them to speak with Rita to let the mother know that Marie was ready to be picked up. Marie died while saying goodbye to another woman in the hospital, she said she had a pain in her leg and couldn't see right before she dropped to the ground. The woman telling the story went to the hospital and said they needed to find out what happened. The woman doctor who was the assistant of the doctor who performed the surgery told her she didn't know what happened. The mother said she was going to burn the hospital down despite who was inside if they didn't find out what happened to her daughter. She also said they better not touch her. When the woman who told the story (the mother) went home she told the father and he had a heart attack on the spot while sitting on the front step waiting to see Marie. The brother also had a heart attack upon hearing the news. The older sister watched Marie die in the hospital. The mother had a bad heart herself and had known the nurses because she had three surgeries all within one year. The doctors wanted to give the mother a shot because of how upset she was but she turned it away.",1361,35,103.52,134.39597312736637
54,"Mrs Costa's daughter Marie was in the hospital for an Appendicitis and when Mrs. Costa went to pick her up, as Marie was saying goodbye to the nurses, she passed out after claiming her leg hurt and she lost her vision. Mrs Costa was on her way to the hospital with Marie's clothes she would wear home. When Mrs. Costa arrived at the hospital, as she was praying for another patient, she was informed that something was wrong with Marie. Mrs Costa had a nervous breakdown and screamed that they killed her daughter, as Marie laid in her bed covered in sweat. She pulled her hair out and screamed. She went home where many family members were waiting for Marie to return home but when she told her husband and son about Marie dying, they both had heart attacks. Everyone was shocked and saddened. The neighbor recalled Marie standing at the steps of their store and how quiet she was.",882,23,106.12,72.35436791145668
