segment_id,segment_text,p-rec,p-caught
1,My daughter died.,95.92%,82.80%
2,It’ll be twenty-eight years this month.,45.92%,62.37%
3,"The thirtieth of this month, yeah.",14.29%,54.84%
4,She died at Methodist Hospital.,55.10%,61.29%
5,She had an operation for appendicitis.,65.31%,77.42%
6,"It was late Saturday afternoon when they operated, very late.",7.14%,30.11%
7,"Sunday morning, my oldest daughter, Victoria, went to the hospital to see how she was.",25.51%,47.31%
8,She was still under ether.,22.45%,41.94%
9,"Back then, they used a lot of ether.",11.22%,34.41%
10,There was a chair there.,19.39%,32.26%
11,"They were just starting to get people out of bed, you know.",6.12%,46.24%
12,"So, Victoria saw the chair,",8.16%,23.66%
13,"and she said to the nurse, “What’s this chair doing here?”",12.24%,40.86%
14,"The nurse said, “Well, we’ve got to get her out of bed.”",16.33%,56.99%
15,"She said, “What are you talking about? She’s still under ether.”",10.20%,29.03%
16,“She’s too sick.”,6.12%,33.33%
17,"But the nurse said, “Well, that’s the doctor’s orders.”",10.20%,47.31%
18,"So, they went to get her out of bed,",12.24%,46.24%
19,"and she passed out,",23.47%,62.37%
20,and they had to put her back in bed.,11.22%,32.26%
21,"See, here, she never – I don’t know if they knew or what,",0.00%,31.18%
22,"but I blame them for the blood clot she got, taking her out of bed.",34.69%,67.74%
23,"So, when she was walking around to come home after ten days,",8.16%,49.46%
24,I was waiting for the call from the hospital.,23.47%,69.89%
25,I didn’t have a phone then.,15.31%,35.48%
26,"The lady from the store who had a phone called me, “Mrs. Costa,” at aquarter to five at night.",12.24%,76.34%
27,"“Mrs. Costa, they just called you from the hospital.",10.20%,66.67%
28,Go Pick Marie up.,11.22%,82.80%
29,She’s discharged.”,13.27%,32.26%
30,I had all the clothes laid out on the table.,5.10%,47.31%
31,"And Rita was – I was cooking,",11.22%,50.54%
32,"I said, “Rita, finish the cooking.”",9.18%,46.24%
33,Daddy will be home soon.”,6.12%,46.24%
34,He was working down in the yard.,8.16%,39.78%
35,"I said, “And put a big pot of coffee on,” because she had been wishing for coffee.",16.33%,43.01%
36,"And you know, every morning, that first cup of coffee, I offered it to her.",4.08%,38.71%
37,"When I get up in the morning, the first cup is hers.",5.10%,35.48%
38,"Since she’s gone, I never forget that.",0.00%,33.33%
39,"So I said, “Put a pot of coffee on,",2.04%,37.63%
40,and send for some cake from the bakery.”,5.10%,37.63%
41,I’m going to get Marie; they called me.”,0.00%,52.69%
42,"“All right, mother, go ahead,” she said, “I’ll finish up.”",0.00%,26.88%
43,"And I went myself. You know, I had the coat on my arm.",5.10%,48.39%
44,She was operated on in March –,2.04%,35.48%
45,"No, April! So that was the thirtieth.",0.00%,53.76%
46,"She was operated – ten days before, so that would be the twentieth.",10.20%,49.46%
47,"The twentieth of April, right? It was kind of chilly.",5.10%,22.58%
48,"Oh, and I had everything in a bag,",1.02%,41.94%
49,and I had the coat on my arm and her dress hanging on my arm.,12.24%,46.24%
50,"She saw me from the windows, from Wolf Street.",10.20%,39.78%
51,"She said, “My mother’s just coming.”",0.00%,27.96%
52,"She was with the girls, saying goodbye to everyone – you know how it is.",3.06%,34.41%
53,"They told me on the phone, it would be ten dollars more for her board.",2.04%,25.81%
54,And to make sure I brought her girdle to put on.,2.04%,25.81%
55,"I said, “All right, I’ll be right over.”",0.00%,23.66%
56,And I went.,0.00%,52.69%
57,"But when I got there, the nurse said to me, “Sit down, Mrs. Costa, sit here for a while.”",15.31%,70.97%
58,"So I sat down, and I was praying for another lady in the hospital that had an operation for her gall bladder.",22.45%,45.16%
59,"She lived near my sister, and she had ten children.",12.24%,37.63%
60,They had said she was in very bad shape.,1.02%,35.48%
61,"I prayed, “Oh dear God, don’t take that mother away from her children.”",6.12%,39.78%
62,"I was praying for her, you know.",1.02%,23.66%
63,Then a little nurse’s aide went to the closet and got some blankets.,2.04%,32.26%
64,"I started getting the chills,",6.12%,30.11%
65,"and I was thinking about it,",0.00%,22.58%
66,"when the aide said to the nurse, “Oh, she’s going into a cold sweat now.”",3.06%,34.41%
67,"The nurse hung up the phone and came to me. She said, “Mrs. Costa, has your daughter ever had a fainting spell?”",13.27%,55.91%
68,"“Oh my God!” I said, “Don’t tell me you’re running for my daughter!”",3.06%,54.84%
69,"“Yes,” she said, “come on in.”",3.06%,49.46%
70,"So, I went into the room.",3.06%,54.84%
71,And my daughter was on the bed with her bedroom slippers and her housecoat on.,12.24%,55.91%
72,"And the beads of sweat – honest to God, not to exaggerate, they were that big.",6.12%,50.54%
73,It came – just poured from her –,0.00%,38.71%
74,"I said, “What did you do, kill my daughter?",23.47%,77.42%
75,You killed her! You killed her!”,20.41%,62.37%
76,That’s what I kept yelling.,3.06%,56.99%
77,"And the doctor rushed in,",2.04%,41.94%
78,"see, they were trying to get the doctor, you know.",0.00%,34.41%
79,She was a lady doctor.,2.04%,45.16%
80,"Dr. Schwartz actually did the operation, but she was his assistant, Dr. Montique.",8.16%,40.86%
81,She was a lady doctor.,11.22%,41.94%
82,"So, she came in and she said –",0.00%,27.96%
83,"I said, “You killed my daughter – what did you do to her?”",4.08%,70.97%
84,"She said, “We don’t know what happened, Mrs. Costa.”",8.16%,53.76%
85,She took me away from the bed.,1.02%,31.18%
86,"The nurse said to me, “Talk to her.”",3.06%,40.86%
87,"I said, “Talk to her? My daughter’s dying, what am I supposed to tell her?”",2.04%,38.71%
88,And I was screaming.,7.14%,68.82%
89,My hair was all pulled out.,4.08%,56.99%
90,"I went hysterical, you know what I mean? She was only eighteen years old.",10.20%,67.74%
91,"Beautiful girl, you can see from her picture.",2.04%,34.41%
92,"And just as I turned my back, my daughter passed away.",7.14%,64.52%
93,She was getting ready to go home.,1.02%,49.46%
94,I had the clothes and everything ready.,1.02%,40.86%
95,My husband was waiting for her.,4.08%,53.76%
96,"He came home, went upstairs to shave and wash, then sat on the step, waiting.",7.14%,53.76%
97,“When is the mother coming?”,0.00%,48.39%
98,The hospital kept calling.,3.06%,46.24%
99,The people in the office didn’t know what had happened yet.,1.02%,49.46%
100,"They kept calling the store, trying to reach us.",0.00%,50.54%
101,"They asked, “When is the mother coming to pick up Marie?",3.06%,53.76%
102,She’s discharged.”,2.04%,50.54%
103,"And Rita said “That’s strange, the mother went to the hospital. She should be there.”",5.10%,53.76%
104,So they came back to the hospital to look for us.,1.02%,46.24%
105,"Rita said, “Gee, that’s strange,”",0.00%,44.09%
106,"she said, “Mother must’ve gotten really worked up about Marie.”",0.00%,43.01%
107,"You know, I’ve always had a bad heart.",1.02%,38.71%
108,"“Mother must’ve gotten so upset about Marie, she probably made herself sick,” Rita thought.",0.00%,41.94%
109,"So she came over with my son-in-law, in the car.",3.06%,45.16%
110,"And I was in the main hallway, at the office.",0.00%,47.31%
111,I was all pulled apart.,0.00%,45.16%
112,One doctor wanted to give me a shot.,2.04%,52.69%
113,"I said, “Get out of here,",1.02%,49.46%
114,"I’ll kick you,” I said.",1.02%,52.69%
115,"“You killed my daughter, now you want to kill me?”",8.16%,56.99%
116,Another nurse came over.,1.02%,46.24%
117,"See, they all knew me.",3.06%,45.16%
118,"I had three operations in no time, not even a year.",6.12%,44.09%
119,And I knew all the nurses.,4.08%,41.94%
120,"“Mrs. Costa, please, take –”",0.00%,50.54%
121,"“Get out!” I said, “Don’t you dare come near me.”",2.04%,51.61%
122,I was so hysterical.,2.04%,56.99%
123,I was banging my head against the wall and everything.,1.02%,62.37%
124,They had to grab me.,0.00%,48.39%
125,"Then they brought me to the office, see.",0.00%,40.86%
126,"When Rita came in and saw me like that, she asked, “Mother, what happened?”",2.04%,49.46%
127,"I said, “We lost Marie.",5.10%,51.61%
128,Marie died.”,15.31%,55.91%
129,"Well, that’s this one. This is a picture of Rita.",0.00%,34.41%
130,She went down like lightning.,7.14%,50.54%
131,"Dropped to the floor, and that’s a marble floor.",5.10%,46.24%
132,She went down like lightning.,1.02%,41.94%
133,"And the back of her leg, it felt just like a pole.",1.02%,44.09%
134,"Hard like a pole, the back of her leg.",1.02%,41.94%
135,And that girl is suffering.,0.00%,44.09%
136,"Thirty – no, twenty-eight years since her sister died?",1.02%,50.54%
137,"When she gets that pain, it’s like she has phlebitis from it.",5.10%,49.46%
138,"She suffers – seven, eight, nine weeks at a time.",2.04%,51.61%
139,"She can’t walk, she goes through such pain since then.",2.04%,43.01%
140,And how did they figure how Marie died?,4.08%,35.48%
141,"The girl who was walking with Marie,",1.02%,34.41%
142,told the doctor that Marie was saying goodbye to Arlene.,2.04%,37.63%
143,"And all Marie said to that girl was, “Oh, I’ve got a pain in my leg and I can’t see.”",12.24%,44.09%
144,And then Marie collapsed.,7.14%,47.31%
145,"Later, they said it was a blood clot.",31.63%,75.27%
146,"I said, “Don’t you dare touch my daughter.",7.14%,51.61%
147,I’ll burn this hospital down!,6.12%,53.76%
148,I don’t care who’s in it.”,0.00%,47.31%
149,"I said, “Don’t you dare touch my daughter.",4.08%,50.54%
150,You want to find out what she died from.”,0.00%,50.54%
151,"But if you touch my daughter, I’ll kill you.”",4.08%,49.46%
152,I wouldn’t let them touch her.,0.00%,37.63%
153,So when I got home – they took me home.,5.10%,67.74%
154,I was screaming in the car.,6.12%,46.24%
155,"I couldn’t get out, you know, I couldn’t –",0.00%,41.94%
156,I was screaming!,6.12%,46.24%
157,"Everybody came out, coming out of their doors because they could hear the screams.",4.08%,48.39%
158,My husband was sitting on the step.,11.22%,50.54%
159,"He asked, “What’s the matter? What happened to you?”",11.22%,45.16%
160,"Well, my hair was all pulled, and my face – I was a mess.",1.02%,40.86%
161,I didn’t know what I had done to myself.,0.00%,38.71%
162,"I said, “Mike, we lost Marie. Marie died.” It was just a shock.",24.49%,69.89%
163,My husband had a heart attack.,52.04%,80.65%
164,"Yes, he had a heart attack.",31.63%,64.52%
165,"Then my son, Michael, yeah. That night.",16.33%,53.76%
166,"Right there, my Michael came, and my Michael collapsed.",21.43%,73.12%
167,"He had a heart attack too, no kidding.",29.59%,54.84%
168,"It was all – my two sisters were here, waiting until about half-past four.",0.00%,41.94%
169,"They waited because they knew she was coming home that day, waiting for the call.",0.00%,41.94%
170,"My younger sister had brought an orange for Marie, and I had never seen an orange like it. It was a big orange, like that.",13.27%,49.46%
171,"She said, “Mary, look, when they call you, when you pick Marie up, let us know, and we’ll come over.”",0.00%,39.78%
172,"I said, “All right.”",0.00%,36.56%
173,"So, I got home and called everybody, told them what happened.",4.08%,64.52%
174,I called my brother-in-law.,7.14%,52.69%
175,He was an undertaker.,4.08%,50.54%
176,My sister’s husband – he’s passed away now too. God rest his soul.,3.06%,49.46%
177,Maybe you know him...,0.00%,45.16%
178,"So they were waiting for my call, you know,",0.00%,49.46%
179,"but instead, I sent my son James, he was little then.",7.14%,63.44%
180,"I said, “Go tell Aunt Millie and Aunt Jenny.”",15.31%,66.67%
181,"They had cleaned the pavement,",0.00%,53.76%
182,"and done the cement work, and they were cleaning the pavement.",0.00%,53.76%
183,"They said, “Here comes little Jamie,” and now they said,",0.00%,53.76%
184,“Maybe he’s come to tell us Marie’s home.”,0.00%,55.91%
185,"But when he got there, the poor kid’s eyes were all red.",6.12%,55.91%
186,"They said, “James, what’s the matter, honey?",1.02%,55.91%
187,Why are you crying?”,1.02%,54.84%
188,"“Aunt Jenny, Aunt Millie, Marie died,” he said.",19.39%,62.37%
189,"Well, my sisters and my mother, you know, they were all alive.",0.00%,40.86%
190,It was a shock to everybody. That was a shock that –,3.06%,45.16%
191,"The neighborhood – Annie at the store always says, “Mrs. Costa,” every time I go in there, she reminds me, “I just picture Marie standing at that step, looking over here.” She used to stand at that step.",14.29%,46.24%
192,"She was a real quiet girl, pleasant, didn’t talk much,",14.29%,45.16%
193,"but she was so good, I can’t even tell you.",8.16%,47.31%
194,That’s all. So that’s what happened.,4.08%,36.56%
