recall_id,clause_id,clause_text
5d667a1a3741ea0001c719b9,3,"But he did not return her interest, mostly because she talked too much (she was a 'chatterbox')."
5d667a1a3741ea0001c719b9,4,"He tells of the time the chief showed up at his house, saying the daughter had run away because the chief always gave her a hard time over talking about the author so much."
5d667a1a3741ea0001c719b9,5,"The author said he knew nothing about, was not involved, but would help find her so the chief could see the truth and act as he thought was appropriate."
5d667a1a3741ea0001c719b9,6,"They found the girl's scarf in the park, but no other clues."
5d667a1a3741ea0001c719b9,7,"When they went back to the police station they found the girl there, sitting reading a book."
5d667a1a3741ea0001c719b9,8,"The author was advised to transfer out, because even though he did nothing wrong, the chief would still remember the incident."
5d667a1a3741ea0001c719b9,9,The author took his advice and transferred out.
60abb40fe8824c6f9007faeb,1,"When I was a rookie in the police force,"
60abb40fe8824c6f9007faeb,2,the chief was a veteran.
60abb40fe8824c6f9007faeb,3,He caught a criminal
60abb40fe8824c6f9007faeb,4,and he was rewarded.
60abb40fe8824c6f9007faeb,5,He had a young daughter
60abb40fe8824c6f9007faeb,6,who was very beautiful
60abb40fe8824c6f9007faeb,7,and she was trying to impress me.
60abb40fe8824c6f9007faeb,8,I was charmed by her
60abb40fe8824c6f9007faeb,9,but she was a chatterbox.
60abb40fe8824c6f9007faeb,10,One day she left me a message
60abb40fe8824c6f9007faeb,11,saying she was going to run away
60abb40fe8824c6f9007faeb,12,because her dad was always scolding her.
60abb40fe8824c6f9007faeb,13,Me and her father went to search for her.
60abb40fe8824c6f9007faeb,14,We found her at the police station
60abb40fe8824c6f9007faeb,15,reading a book
60abb40fe8824c6f9007faeb,16,which meant she didn't run away.
5d66c1382d1a18000170759b,1,A rookie police man joined in his first year.
5d66c1382d1a18000170759b,2,The chief's daughter took a liking to the rookie.
5d66c1382d1a18000170759b,3,She argued with her father unbeknown to the rookie.
5d66c1382d1a18000170759b,4,The daughter ran away.
5d66c1382d1a18000170759b,5,The police chief assumed the rookie had something to do with it.
5d66c1382d1a18000170759b,6,He went to the rookies house.
5d66c1382d1a18000170759b,7,The rookie needed the chief to calm down.
5d66c1382d1a18000170759b,8,He offered to help search for the missing daughter.
5d66c1382d1a18000170759b,9,They found her at a police station unharmed.
5d66c1382d1a18000170759b,10,Someone recommended the rookie transfer following the incident.
5d66c1382d1a18000170759b,11,The chief would hold it against him.
5d66c1382d1a18000170759b,12,It could impact the rookies career.
5d66c1382d1a18000170759b,13,The rookie transferred.
5d66c1382d1a18000170759b,14,He left.
60a65fa78c5f119da5e887e6,1,"Back then when I was a rookie,"
60a65fa78c5f119da5e887e6,2,we had a veteran in our department who had caught a notorious criminal.
60a65fa78c5f119da5e887e6,3,I was a fitness enthusiast
60a65fa78c5f119da5e887e6,4,and this veteran had a daughter who took a liking to me.
60a65fa78c5f119da5e887e6,5,She was charming
60a65fa78c5f119da5e887e6,6,but the moment she opened her mouth she was a chatterbox
60a65fa78c5f119da5e887e6,7,boy she could talk.
60a65fa78c5f119da5e887e6,8,I could not handle her talking.
60a65fa78c5f119da5e887e6,9,One day the veteran came to look for me
60a65fa78c5f119da5e887e6,10,and said she was missing because he had scolded her about me.
60a65fa78c5f119da5e887e6,11,I suggest we go look for her
60a65fa78c5f119da5e887e6,12,and if we didn't find her he could do whatever he saw fit.
60a65fa78c5f119da5e887e6,13,I was strategizing.
60a65fa78c5f119da5e887e6,14,We went to the park where her scarf was found
60a65fa78c5f119da5e887e6,15,but she was not there.
60a65fa78c5f119da5e887e6,16,We found her at the police station where she was reading a book.
60a65fa78c5f119da5e887e6,17,I went home
60a65fa78c5f119da5e887e6,18,and deputy Frank Miller came to see me
60a65fa78c5f119da5e887e6,19,and said I better move because the old man never forgets.
60a65fa78c5f119da5e887e6,20,So I moved.
60a65fa78c5f119da5e887e6,21,Those were my rookie days.
60ff2de87f8a6665bcff2144,1,"Back in the days when I was a rookie in the police force,"
60ff2de87f8a6665bcff2144,2,the Chief was a veteran.
60ff2de87f8a6665bcff2144,3,He had caught a notorious criminal –
60ff2de87f8a6665bcff2144,4,or had been awarded for bravery.
60ff2de87f8a6665bcff2144,5,But he had – a young daughter.
60ff2de87f8a6665bcff2144,6,And in those days I was a fitness enthusiast.
60ff2de87f8a6665bcff2144,7,And it seemed she was trying to impress me.
60ff2de87f8a6665bcff2144,8,I never observed it.
60ff2de87f8a6665bcff2144,9,Truth is I wasn't very fond of her because she was –
60ff2de87f8a6665bcff2144,10,She was a charming girl until she opened her mouth.
60ff2de87f8a6665bcff2144,11,She was a chatterbox.
60ff2de87f8a6665bcff2144,12,"Goodness, she could talk."
60ff2de87f8a6665bcff2144,13,Then she left a message one day saying she was going to run away because he was always scolding her about me.
60ff2de87f8a6665bcff2144,14,He arrived at my apartment.
60ff2de87f8a6665bcff2144,15,Big intimidating look on his face.
60ff2de87f8a6665bcff2144,16,I managed to calm him down.
60ff2de87f8a6665bcff2144,17,and proposed “Well we'll search for her and if we can't locate her well you can – do whatever you think is right.”
60ff2de87f8a6665bcff2144,18,I was strategizing.
60ff2de87f8a6665bcff2144,19,So he accepted my offer.
60ff2de87f8a6665bcff2144,20,And we went to where they found her scarf – near a park.
60ff2de87f8a6665bcff2144,21,and we traced down a little more and we couldn't locate her.
60ff2de87f8a6665bcff2144,22,And returned – it was a police station –
60ff2de87f8a6665bcff2144,23,she was sitting on a chair with a book in her hands.
60ff2de87f8a6665bcff2144,24,She hadn't run away.
60ff2de87f8a6665bcff2144,25,But – nevertheless – that resolved the issue for that day.
60ff2de87f8a6665bcff2144,26,"But that evening the deputy, Frank Mitchell, said “You better transfer and leave because that old man never forgets anything once he gets it into his mind.”"
60ff2de87f8a6665bcff2144,27,And I did.
60ff2de87f8a6665bcff2144,28,I transferred.
60ff2de87f8a6665bcff2144,29,and left.
60ff2de87f8a6665bcff2144,30,That was the end of my rookie year.
642ea9a95d8d96e72339424e,1,A rookie policeman went looking for a girl
642ea9a95d8d96e72339424e,2,and couldn't find her.
642ea9a95d8d96e72339424e,3,She later turned up in the police station
642ea9a95d8d96e72339424e,4,"and the rookie policeman was encouraged to transfer,"
642ea9a95d8d96e72339424e,5,and he did.
609101a8a29bc713a6bcdbba,1,The was a rookie police officer
609101a8a29bc713a6bcdbba,2,The chief was veteran.
609101a8a29bc713a6bcdbba,3,He had a daughter
609101a8a29bc713a6bcdbba,4,Who liked me
609101a8a29bc713a6bcdbba,5,But I did not really like her
609101a8a29bc713a6bcdbba,6,Because she is a chatterbox
609101a8a29bc713a6bcdbba,7,She talks too much.
609101a8a29bc713a6bcdbba,8,She was angry with her father
609101a8a29bc713a6bcdbba,9,Because he was always complaining about me.
609101a8a29bc713a6bcdbba,10,She said she will run away.
609101a8a29bc713a6bcdbba,11,The father came to my place
609101a8a29bc713a6bcdbba,12,Looking for her
609101a8a29bc713a6bcdbba,13,But she was not there
609101a8a29bc713a6bcdbba,14,So we agreed to go look for her
609101a8a29bc713a6bcdbba,15,We found her scarf in the park
609101a8a29bc713a6bcdbba,16,"But she was not there,"
609101a8a29bc713a6bcdbba,17,When we went back to the police station
609101a8a29bc713a6bcdbba,18,We found her sitting on a chair
609101a8a29bc713a6bcdbba,19,Holding a book
609101a8a29bc713a6bcdbba,20,She did not run away.
609101a8a29bc713a6bcdbba,21,I was told to transfer
609101a8a29bc713a6bcdbba,22,Because the old man will not forget what happened
609101a8a29bc713a6bcdbba,23,It was best for me to leave
609101a8a29bc713a6bcdbba,24,And that is what I did.
5f413867991f880a34f5b28d,1,"Back in the day when I was a rookie in the police force,"
5f413867991f880a34f5b28d,2,the Chief was a veteran.
5f413867991f880a34f5b28d,3,"He had a daughter,"
5f413867991f880a34f5b28d,4,"athletic one,"
5f413867991f880a34f5b28d,5,but she never impressed me.
5f413867991f880a34f5b28d,6,She was really cute until she opened her mouth.
5f413867991f880a34f5b28d,7,She was a chatterbox.
5f413867991f880a34f5b28d,8,She got mad and chief thought she run away.
5f413867991f880a34f5b28d,9,"We searched for her at the park where they found her scarf,"
5f413867991f880a34f5b28d,10,but she wasn't there.
5f413867991f880a34f5b28d,11,"She was at the police station,"
5f413867991f880a34f5b28d,12,with a book in her hands.
5f413867991f880a34f5b28d,13,She didn't run away after all.
5f413867991f880a34f5b28d,14,"Someone told me to transfer,"
5f413867991f880a34f5b28d,15,because the old man never forgets.
5f413867991f880a34f5b28d,16,I listened to him and transferred.
5f413867991f880a34f5b28d,17,That was the end of my rookie year.
5d5c250a0274020016e2333a,1,"When I was a rookie at the police station,"
5d5c250a0274020016e2333a,2,"the chief, who was then a veteran won an award for bravery."
5d5c250a0274020016e2333a,3,The chief had a daughter
5d5c250a0274020016e2333a,4,who was attracted to me because of my love of fitness.
5d5c250a0274020016e2333a,5,However the chief's daughter was a chatterbox
5d5c250a0274020016e2333a,6,and I therefore did not return her feelings.
5d5c250a0274020016e2333a,7,One day she left a note
5d5c250a0274020016e2333a,8,saying she was running away
5d5c250a0274020016e2333a,9,after her father had been scolding her about me.
5d5c250a0274020016e2333a,10,"We went to look for her,"
5d5c250a0274020016e2333a,11,going to where he had found her scarf.
5d5c250a0274020016e2333a,12,"In the end she was found sitting in the police station reading,"
5d5c250a0274020016e2333a,13,so she had not run away.
5d5c250a0274020016e2333a,14,"A senior police officer, Mitchell, advised me to transfer"
5d5c250a0274020016e2333a,15,and so I did.
5c8808098d2bbf0017e4b527,1,I was a rookie cop.
5c8808098d2bbf0017e4b527,2,My boss was very experienced.
5c8808098d2bbf0017e4b527,3,A young person was reported missing.
5c8808098d2bbf0017e4b527,4,"Turns out she didn't run away,"
5c8808098d2bbf0017e4b527,5,but turned herself in to the police station.
5c8808098d2bbf0017e4b527,6,Someone told me to leave the force
5c8808098d2bbf0017e4b527,7,since my boss never forgets anything.
5c8808098d2bbf0017e4b527,8,"I did,"
5c8808098d2bbf0017e4b527,9,I quit.
5f7ca372a8afc510abbbe99b,1,A girl ran away.
5f7ca372a8afc510abbbe99b,2,A man was angry with the narrator about it.
5f7ca372a8afc510abbbe99b,3,"The narrator offered to look for her with him,"
5f7ca372a8afc510abbbe99b,4,they only found her scarf near a park.
5f7ca372a8afc510abbbe99b,5,They went to the police station
5f7ca372a8afc510abbbe99b,6,and she was there.
5f7ca372a8afc510abbbe99b,7,The policeman there told him to transfer
5f7ca372a8afc510abbbe99b,8,because the man 'never forgets something once he gets it in his head'
5f7ca372a8afc510abbbe99b,9,so he did transfer
5f7ca372a8afc510abbbe99b,10,and that was the end of his rookie year.
5a5e03dd8e62590001762542,1,Back in the day I was a rookie
5a5e03dd8e62590001762542,2,and my chief was a veteran
5a5e03dd8e62590001762542,3,he had a daughter who liked me.
5a5e03dd8e62590001762542,4,She was nice
5a5e03dd8e62590001762542,5,until she opened her mouth
5a5e03dd8e62590001762542,6,she was a chatterbox.
5a5e03dd8e62590001762542,7,One day she ran away
5a5e03dd8e62590001762542,8,because her father kept scolding her about me
5a5e03dd8e62590001762542,9,"he was angry with me,"
5a5e03dd8e62590001762542,10,so I suggested we look for her.
5a5e03dd8e62590001762542,11,We found her scarf in a park
5a5e03dd8e62590001762542,12,but not her.
5a5e03dd8e62590001762542,13,She hadn't run away
5a5e03dd8e62590001762542,14,she was back at the police station reading a book.
5a5e03dd8e62590001762542,15,The deputy suggested I should transfer
5a5e03dd8e62590001762542,16,as the old man had a long memory.
5a5e03dd8e62590001762542,17,I did
5a5e03dd8e62590001762542,18,and that was the end of my rookie year.
5c71ca9bf6c9fe00013ef0b5,1,It was my rookie year at a Police Station.
5c71ca9bf6c9fe00013ef0b5,2,The captain there was a veteran and had received commendations for bravery and for capturing a criminal.
5c71ca9bf6c9fe00013ef0b5,3,His daughter liked me.
5c71ca9bf6c9fe00013ef0b5,4,I was a fitness fanatic.
5c71ca9bf6c9fe00013ef0b5,5,But I didn't like her.
5c71ca9bf6c9fe00013ef0b5,6,She talked far too much.
5c71ca9bf6c9fe00013ef0b5,7,One day she left me a message saying that she was going to run away.
5c71ca9bf6c9fe00013ef0b5,8,As her father (my boss) was always telling her off about her infatuation with me.
5c71ca9bf6c9fe00013ef0b5,9,Her father came to my apartment that evening.
5c71ca9bf6c9fe00013ef0b5,10,And was very intimidating.
5c71ca9bf6c9fe00013ef0b5,11,But I was able to calm him down.
5c71ca9bf6c9fe00013ef0b5,12,And suggested that we team up and look for her.
5c71ca9bf6c9fe00013ef0b5,13,He agreed with this.
5c71ca9bf6c9fe00013ef0b5,14,And we started searching at a point where her scarf had been discovered.
5c71ca9bf6c9fe00013ef0b5,15,We were unsuccessful.
5c71ca9bf6c9fe00013ef0b5,16,I encouraged him to keep looking.
5c71ca9bf6c9fe00013ef0b5,17,And we headed back to the Police Station.
5c71ca9bf6c9fe00013ef0b5,18,"His daughter was in there, sitting in a chair, with a book in her hand."
5c71ca9bf6c9fe00013ef0b5,19,Although that situation was resolved.
5c71ca9bf6c9fe00013ef0b5,20,I was soon warned by her father's Deputy that my boss wouldn't forget this.
5c71ca9bf6c9fe00013ef0b5,21,And would likely blame me for the situation.
5c71ca9bf6c9fe00013ef0b5,22,He (the deputy) suggested that I transfer away from that Station.
5c71ca9bf6c9fe00013ef0b5,23,I took his advice.
5c71ca9bf6c9fe00013ef0b5,24,And did so.
5c71ca9bf6c9fe00013ef0b5,25,And concluded my rookie year at another Station.
5a27eee353fc4b0001414fe8,1,The narrator is a rookie police officer with a Chief.
5a27eee353fc4b0001414fe8,2,The chief has a daughter
5a27eee353fc4b0001414fe8,3,but rookie is not keen on her
5a27eee353fc4b0001414fe8,4,as she talks too much.
5a27eee353fc4b0001414fe8,5,She told the chief she was running away.
5a27eee353fc4b0001414fe8,6,They go and look for her
5a27eee353fc4b0001414fe8,7,and find her scarf
5a27eee353fc4b0001414fe8,8,but not her.
5a27eee353fc4b0001414fe8,9,On returning she is at the police station.
5a27eee353fc4b0001414fe8,10,Another officer tells the rookie that the Chief will be out to get him now
5a27eee353fc4b0001414fe8,11,"and he should leave,"
5a27eee353fc4b0001414fe8,12,so he does.
6054ce9cd4e5c96ab84e9113,1,ONE DAY
6054ce9cd4e5c96ab84e9113,2,i WAS IN A POLICE FORCE
6054ce9cd4e5c96ab84e9113,3,AND A ROOKIE
6054ce9cd4e5c96ab84e9113,4,AND SAW A DAUGHTER
6054ce9cd4e5c96ab84e9113,5,WHO WAS A CHATTERBOX
5eaeddb6a7e04f5af6b3e879,1,A rookie was working for a chief at the police station
5eaeddb6a7e04f5af6b3e879,2,who had been a veteran.
5eaeddb6a7e04f5af6b3e879,3,The chief had a daughter
5eaeddb6a7e04f5af6b3e879,4,who was quite keen on the rookie
5eaeddb6a7e04f5af6b3e879,5,and he thought she was quite nice
5eaeddb6a7e04f5af6b3e879,6,until she opened her voice.
5eaeddb6a7e04f5af6b3e879,7,He thought her a chatterbox.
5eaeddb6a7e04f5af6b3e879,8,The chief argued with the daughter over the rookie
5eaeddb6a7e04f5af6b3e879,9,and one day she disappeared.
5eaeddb6a7e04f5af6b3e879,10,They tried to locate her
5eaeddb6a7e04f5af6b3e879,11,but eventually found her sitting quietly in the police station reading a book.
5eaeddb6a7e04f5af6b3e879,12,She had not run away at all.
5eaeddb6a7e04f5af6b3e879,13,The deputy warned the rookie
5eaeddb6a7e04f5af6b3e879,14,that maybe he should move to a different station
5eaeddb6a7e04f5af6b3e879,15,as the old man would never forget this incidence.
5df252f758a5c71603afc39a,1,The narrator worked in a police station.
5df252f758a5c71603afc39a,2,His Chief was a veteran
5df252f758a5c71603afc39a,3,and was awarded commendation for his bravery.
5df252f758a5c71603afc39a,4,Chief had a daughter
5df252f758a5c71603afc39a,5,that liked the main character
5df252f758a5c71603afc39a,6,but he didn't like her so much
5df252f758a5c71603afc39a,7,because she was a chatterbox.
5df252f758a5c71603afc39a,8,The Chief didn't like his daughter seeing the narrator
5df252f758a5c71603afc39a,9,and he would scold her for talking to him.
5df252f758a5c71603afc39a,10,She ran away because of this
5df252f758a5c71603afc39a,11,and the Chief came to the narrators house
5df252f758a5c71603afc39a,12,so they could look for her.
5df252f758a5c71603afc39a,13,They went to a park
5df252f758a5c71603afc39a,14,and found her scarf.
5df252f758a5c71603afc39a,15,She was actually in the police station
5df252f758a5c71603afc39a,16,sitting on a chair
5df252f758a5c71603afc39a,17,reading a book
5df252f758a5c71603afc39a,18,when they found her.
5df252f758a5c71603afc39a,19,"The Deputy, Frank, advised the narrator to transfer to a different station"
5df252f758a5c71603afc39a,20,because even though she wasn't lost
5df252f758a5c71603afc39a,21,the Chief doesn't forget things
5df252f758a5c71603afc39a,22,and would make it difficult for the narrator to stay.
5df252f758a5c71603afc39a,23,He ended up transferring
5df252f758a5c71603afc39a,24,and that was his experience of his first year as a rookie.
60f09743e03e0ef8f6f4842a,1,Rookie year
60f09743e03e0ef8f6f4842a,2,i helped
60f09743e03e0ef8f6f4842a,3,find the daughter
60f09743e03e0ef8f6f4842a,4,of my captain.
