recall_id,clause_id,clause_text
5e652bffbe3f4d000c66a42a,9,They search and find her scarf.
5e652bffbe3f4d000c66a42a,10,They go to the police station.
5e652bffbe3f4d000c66a42a,11,"She is there, reading a book."
5e652bffbe3f4d000c66a42a,12,She is not missing at all.
5e652bffbe3f4d000c66a42a,13,"The rookie is told, by another officer, to transfer."
5e652bffbe3f4d000c66a42a,14,This is because the father seems to blame him for the event.
5e652bffbe3f4d000c66a42a,15,The father will not forgive.
5e652bffbe3f4d000c66a42a,16,So he transfers.
608030a41cd2a2d7cabbba49,1,"In my first year,"
608030a41cd2a2d7cabbba49,2,I was a rookie.
608030a41cd2a2d7cabbba49,3,The detective was a veteran.
608030a41cd2a2d7cabbba49,4,He had caught a notorious criminal-
608030a41cd2a2d7cabbba49,5,or he was awarded for bravery.
608030a41cd2a2d7cabbba49,6,He had a daughter.
608030a41cd2a2d7cabbba49,7,She was a fitness instructor.
608030a41cd2a2d7cabbba49,8,She seemed to have liked me -
608030a41cd2a2d7cabbba49,9,I never observed it.
608030a41cd2a2d7cabbba49,10,I did not like for because she was -
608030a41cd2a2d7cabbba49,11,She was charming until she opened her mouth.
608030a41cd2a2d7cabbba49,12,She was a chatterbox.
608030a41cd2a2d7cabbba49,13,one day she left me a note saying she was running away because he was always scolding at her about me.
608030a41cd2a2d7cabbba49,14,He came furious to my apartment -
608030a41cd2a2d7cabbba49,15,with an intimidating look.
608030a41cd2a2d7cabbba49,16,I managed to calm him down.
608030a41cd2a2d7cabbba49,17,"I said ""Well we'll go look for her and if we can't find her -"
608030a41cd2a2d7cabbba49,18,"You can do whatever you think is right""."
608030a41cd2a2d7cabbba49,19,I was strategizing.
608030a41cd2a2d7cabbba49,20,We followed a trail of her scarf they found -
608030a41cd2a2d7cabbba49,21,near a park.
608030a41cd2a2d7cabbba49,22,She was not there -
608030a41cd2a2d7cabbba49,23,We searched a bit further but didn't find her.
608030a41cd2a2d7cabbba49,24,It was at the police station -
608030a41cd2a2d7cabbba49,25,She was sitting on a chair with a book in her hand.
608030a41cd2a2d7cabbba49,26,She didnt ran away.
608030a41cd2a2d7cabbba49,27,"the Deputy officer, Fischer said "" You should resign and leave, that man never forgets anything once he has it in his mind""."
608030a41cd2a2d7cabbba49,28,So i resigned.
608030a41cd2a2d7cabbba49,29,and left.
608030a41cd2a2d7cabbba49,30,and that was the end of my year as a rookie.
5f2b3b2b4cc04057806945da,1,"There was a rookie at a police station,"
5f2b3b2b4cc04057806945da,2,and he had a chief you enjoyed going to the gym.
5f2b3b2b4cc04057806945da,3,This chief also had a daughter
5f2b3b2b4cc04057806945da,4,"that the rookie was quite fond of,"
5f2b3b2b4cc04057806945da,5,however she was a bit of a chatterbox.
5f2b3b2b4cc04057806945da,6,"He was going to propose to her,"
5f2b3b2b4cc04057806945da,7,however it looked like she had run away.
5f2b3b2b4cc04057806945da,8,"The rookie and the chief went around looking for her,"
5f2b3b2b4cc04057806945da,9,but they couldn't find her.
5f2b3b2b4cc04057806945da,10,So they went back to the station.
5f2b3b2b4cc04057806945da,11,"However, when they got there the daughter was sat there with a book in her hands."
5f2b3b2b4cc04057806945da,12,After that the rookie left that particular station -
5f2b3b2b4cc04057806945da,13,and that was the end of his rookie year.
63b5888bd907777799271d04,1,I was a rookie to a veteran copy.
63b5888bd907777799271d04,2,There was a young person (related to the veteran) who was nice enough but annoying when they opened their mouth.
63b5888bd907777799271d04,3,They talked too much.
63b5888bd907777799271d04,4,I avoided them.
63b5888bd907777799271d04,5,They were offended by this and went missing.
63b5888bd907777799271d04,6,The Vet was annoyed and came to my apartment.
63b5888bd907777799271d04,7,I got a strategy to search for the missing person.
63b5888bd907777799271d04,8,We followed it.
63b5888bd907777799271d04,9,They turned up in the police station.
63b5888bd907777799271d04,10,They had not run away just chose not to be where they should be.
63b5888bd907777799271d04,11,"I was advised that the Vet would never forget by a colleague, Frank."
63b5888bd907777799271d04,12,I left.
63b5888bd907777799271d04,13,That was the end of my rookie year!
60c9fcbb6090f57f63cdbebf,1,It was the guys rookie year in the police
60c9fcbb6090f57f63cdbebf,2,and his Chief had a daughter
60c9fcbb6090f57f63cdbebf,3,who took a shine to him.
60c9fcbb6090f57f63cdbebf,4,He didn't realize it.
60c9fcbb6090f57f63cdbebf,5,One day she sent him a note
60c9fcbb6090f57f63cdbebf,6,but he didn't like her much
60c9fcbb6090f57f63cdbebf,7,because she was a chatterbox.
60c9fcbb6090f57f63cdbebf,8,The girl told him he was always scolding her
60c9fcbb6090f57f63cdbebf,9,because of him.
60c9fcbb6090f57f63cdbebf,10,One day she ran away.
60c9fcbb6090f57f63cdbebf,11,The Chief came to him
60c9fcbb6090f57f63cdbebf,12,and said she had run away.
60c9fcbb6090f57f63cdbebf,13,The rookie suggested they go look for her
60c9fcbb6090f57f63cdbebf,14,and then he could decide what to do as necessary.
60c9fcbb6090f57f63cdbebf,15,They went to where they found her scarf in the park.
60c9fcbb6090f57f63cdbebf,16,Found a few more things
60c9fcbb6090f57f63cdbebf,17,but couldn't find her.
60c9fcbb6090f57f63cdbebf,18,When they went back to the police station
60c9fcbb6090f57f63cdbebf,19,she was there reading a book.
60c9fcbb6090f57f63cdbebf,20,"The Deputy, Frank, told the rookie to transfer"
60c9fcbb6090f57f63cdbebf,21,because once the Chief got something in his mind
60c9fcbb6090f57f63cdbebf,22,he would never let it go.
60c9fcbb6090f57f63cdbebf,23,The rookie transferred
60c9fcbb6090f57f63cdbebf,24,and that was the end of his rookie year.
5e54309f0a98c705f68ae8a8,1,"The storyteller is a policeman,"
5e54309f0a98c705f68ae8a8,2,"and back when he was in his first year on the force,"
5e54309f0a98c705f68ae8a8,3,the police chief's daughter ran away.
5e54309f0a98c705f68ae8a8,4,"They looked for her together in the park,"
5e54309f0a98c705f68ae8a8,5,but ended up finding her in the police station.
603f82cb2fafec01e1d6470a,1,A man joined the police force.
603f82cb2fafec01e1d6470a,2,"While he was starting out,"
603f82cb2fafec01e1d6470a,3,the chief's daughter showed an interest.
603f82cb2fafec01e1d6470a,4,She flirted
603f82cb2fafec01e1d6470a,5,and one day told him she was leaving home
603f82cb2fafec01e1d6470a,6,because the chief was scolding her too much.
603f82cb2fafec01e1d6470a,7,She ran away
603f82cb2fafec01e1d6470a,8,and they looked everywhere for her.
603f82cb2fafec01e1d6470a,9,"When they found her,"
603f82cb2fafec01e1d6470a,10,it was in the police station
603f82cb2fafec01e1d6470a,11,and she was reading a book.
603f82cb2fafec01e1d6470a,12,Someone told the rookie to quit or transfer
603f82cb2fafec01e1d6470a,13,as her father would never forgive him.
5e99beb72892a5016ac5c6a7,1,He was a rookie cop
5e99beb72892a5016ac5c6a7,2,who worked for a highly thought of boss
5e99beb72892a5016ac5c6a7,3,who had been rewarded for service.
5e99beb72892a5016ac5c6a7,4,He did't really rate his boss.
5e99beb72892a5016ac5c6a7,5,She had a daughter.
5e99beb72892a5016ac5c6a7,6,she went missing
5e99beb72892a5016ac5c6a7,7,and a man turned up at his home
5e99beb72892a5016ac5c6a7,8,and he strategised to help find her.
5e99beb72892a5016ac5c6a7,9,They went to where her scarf had been found
5e99beb72892a5016ac5c6a7,10,and traced further
5e99beb72892a5016ac5c6a7,11,but to no avail.
5e99beb72892a5016ac5c6a7,12,She was at the police station
5e99beb72892a5016ac5c6a7,13,with a book.
5e99beb72892a5016ac5c6a7,14,He was advised to transfer
5e99beb72892a5016ac5c6a7,15,as the old man never forgot
5e99beb72892a5016ac5c6a7,16,He did
5e99beb72892a5016ac5c6a7,17,That was the end of his rookie years.
60f6f802c0ede08f7cf69720,1,The rookie policeman's boss was a veteran police officer.
60f6f802c0ede08f7cf69720,2,He had a daughter who fancied the rookie.
60f6f802c0ede08f7cf69720,3,The veteran police officer gave the daughter a hard time because she liked the rookie officer.
60f6f802c0ede08f7cf69720,4,The rookie officer did not like the daughter because she talked too much.
60f6f802c0ede08f7cf69720,5,It was said one day that she ran away.
60f6f802c0ede08f7cf69720,6,"The veteran police officer thought the rookie officer had something to do with the ""disappearance""."
60f6f802c0ede08f7cf69720,7,The rookie officer said they would look for her.
60f6f802c0ede08f7cf69720,8,If they did not find her the veteran police officer could do what he thought was right.
60f6f802c0ede08f7cf69720,9,They found her scarf.
60f6f802c0ede08f7cf69720,10,They eventually found her in the police station.
60f6f802c0ede08f7cf69720,11,The rookie officer was advised to leave the station.
60f6f802c0ede08f7cf69720,12,The veteran police officer would always have it in for him.
60f6f802c0ede08f7cf69720,13,He left.
5f9e93bb62e24043c32378d7,1,"Back in the days when I was a rookie in the police force,"
5f9e93bb62e24043c32378d7,2,the Chief was a veteran.
5f9e93bb62e24043c32378d7,3,He had caught a notorious criminal or had been awarded for bravery.
5f9e93bb62e24043c32378d7,4,But he had a young daughter.
5f9e93bb62e24043c32378d7,5,And in those days I was a fitness enthusiast
5f9e93bb62e24043c32378d7,6,"and it seemed she was trying to impress me,"
5f9e93bb62e24043c32378d7,7,I had never observed it.
5f9e93bb62e24043c32378d7,8,Truth is I wasn't very fond of them because they were.
5f9e93bb62e24043c32378d7,9,She was a charming girl until she started to speak.
5f9e93bb62e24043c32378d7,10,She was a chatterbox.
5f9e93bb62e24043c32378d7,11,And could she talk.
5f9e93bb62e24043c32378d7,12,"Then she left a message one day saying that she was going to run away,"
5f9e93bb62e24043c32378d7,13,because she was unhappy about me.
5f9e93bb62e24043c32378d7,14,He arrived at my apartment.
5f9e93bb62e24043c32378d7,15,A big intimidating look on his face.
5f9e93bb62e24043c32378d7,16,I managed to calm him down
5f9e93bb62e24043c32378d7,17,"and suggested that ""we'll search for her and if we can't locate her well you can do whatever you think is needed"""
5f9e93bb62e24043c32378d7,18,I was strategizing.
5f9e93bb62e24043c32378d7,19,So he accepted my offer.
5f9e93bb62e24043c32378d7,20,And we went to where they found her scarf near a park
5f9e93bb62e24043c32378d7,21,and we traced it down a little more
5f9e93bb62e24043c32378d7,22,and we couldn't locate her.
5f9e93bb62e24043c32378d7,23,"And returned it was a police station,"
5f9e93bb62e24043c32378d7,24,she was sitting on a chair with a book in her hands.
5f9e93bb62e24043c32378d7,25,"She hadn't run away,"
5f9e93bb62e24043c32378d7,26,nevertheless that resolved the issue that day.
5f9e93bb62e24043c32378d7,27,"That evening the deputy Mitchell said "" you better transfer and leave because that old man never forgets anything once gets it in his mind"""
5f9e93bb62e24043c32378d7,28,"And so I did, I transferred and left."
5f9e93bb62e24043c32378d7,29,That was the end of my rookie year.
59d54322c732930001d88b0f,1,"A police veteran had a daughter,"
59d54322c732930001d88b0f,2,she was trying to impress a man with fitness
59d54322c732930001d88b0f,3,but he wasn’t interested.
59d54322c732930001d88b0f,4,She went missing
59d54322c732930001d88b0f,5,"and they worked together to find her,"
59d54322c732930001d88b0f,6,they found her scarf
59d54322c732930001d88b0f,7,and she was at the police station reading a book.
5cb1fdb11a4c6a0015fdcdf7,1,I was a rookie policeman
5cb1fdb11a4c6a0015fdcdf7,2,and my senior was boss
5cb1fdb11a4c6a0015fdcdf7,3,his daughter went missing
5cb1fdb11a4c6a0015fdcdf7,4,she had a crush on me
5cb1fdb11a4c6a0015fdcdf7,5,she read a book
5cb1fdb11a4c6a0015fdcdf7,6,she lost her scarf
5cb1fdb11a4c6a0015fdcdf7,7,then the chief came to my house
5cb1fdb11a4c6a0015fdcdf7,8,we went to the place her scarf was found
5cb1fdb11a4c6a0015fdcdf7,9,but she turned up in the police station
5cb1fdb11a4c6a0015fdcdf7,10,sat on a chair
5cb1fdb11a4c6a0015fdcdf7,11,that was the end of my rookie days
5d2d5401d2f71900159663c1,1,"Back in my days,"
5d2d5401d2f71900159663c1,2,I was a rookie officer.
5d2d5401d2f71900159663c1,3,I had a boss
5d2d5401d2f71900159663c1,4,who had a daughter
5d2d5401d2f71900159663c1,5,that was a chatterbox.
5d2d5401d2f71900159663c1,6,One day he shows up at my door
5d2d5401d2f71900159663c1,7,"and I strategize a way to find her,"
5d2d5401d2f71900159663c1,8,from her scarf.
5d2d5401d2f71900159663c1,9,Eventually we find her
5d2d5401d2f71900159663c1,10,but she was not in trouble.
5d2d5401d2f71900159663c1,11,My boss Eric gives me an ultimatum
5d2d5401d2f71900159663c1,12,to transfer to a different department
5d2d5401d2f71900159663c1,13,which I take.
5d2d5401d2f71900159663c1,14,That is the end of my rookie year.
5422cca4fdf99b328c91b21b,1,"I was a rookie at the police station,"
5422cca4fdf99b328c91b21b,2,and my chief inspector there was a powerful man.
5422cca4fdf99b328c91b21b,3,He had a daughter
5422cca4fdf99b328c91b21b,4,who was always trying to get my attention
5422cca4fdf99b328c91b21b,5,"and to tell the truth,"
5422cca4fdf99b328c91b21b,6,I was not interested.
5422cca4fdf99b328c91b21b,7,"However she sent me a message,"
5422cca4fdf99b328c91b21b,8,"and then seemed to run away,"
5422cca4fdf99b328c91b21b,9,so her dad came to me to find out where she was.
5422cca4fdf99b328c91b21b,10,I said we should go and look for her
5422cca4fdf99b328c91b21b,11,and if we cannot find her
5422cca4fdf99b328c91b21b,12,then she should do whatever he feels is necessary.
5422cca4fdf99b328c91b21b,13,We went to where her scarf was
5422cca4fdf99b328c91b21b,14,"and she wasn't there,"
5422cca4fdf99b328c91b21b,15,but after looking a while we found her at the police station reading a book -
5422cca4fdf99b328c91b21b,16,she hadn't run away.
5422cca4fdf99b328c91b21b,17,I was warned afterwards by a police officer
5422cca4fdf99b328c91b21b,18,that I should redeploy
5422cca4fdf99b328c91b21b,19,"as the chief never forgets,"
5422cca4fdf99b328c91b21b,20,so that's what I did.
5422cca4fdf99b328c91b21b,21,And that was the end of my rookie year.
5cbf5803d2051000017d02fa,1,Back in the day in my time in the police force my manager/chief had a daughter.
5cbf5803d2051000017d02fa,2,I was in my rookie era.
5cbf5803d2051000017d02fa,3,I was a fitness enthusiast and his daughter was after me.
5cbf5803d2051000017d02fa,4,"She was a chatterbox,"
5cbf5803d2051000017d02fa,5,she never stopped talking.
5cbf5803d2051000017d02fa,6,"One day he turned up at my house and said she had gone missing,"
5cbf5803d2051000017d02fa,7,I said we best go and look.
5cbf5803d2051000017d02fa,8,We found a scarf and carried on looking
5cbf5803d2051000017d02fa,9,but it turns out she was at the police station.
5cbf5803d2051000017d02fa,10,After this I was told to relocate and transfer
5cbf5803d2051000017d02fa,11,"and the chief never forgets,"
5cbf5803d2051000017d02fa,12,so that’s it I transferred and left.
5fea352050a7199cfafc3fcb,1,My understanding is that the guy is talking about his experience as a rookie in the police force.
5fea352050a7199cfafc3fcb,2,He talks about his boss who is very experienced.
5fea352050a7199cfafc3fcb,3,He has some issues with a girl (fitness instructor or something) who he knows vaguely as he is interested in fitness too.
5fea352050a7199cfafc3fcb,4,This girl takes a liking to him but he does not feel the same.
5fea352050a7199cfafc3fcb,5,The girl leaves him a note of some sort and says she is going to run away.
5fea352050a7199cfafc3fcb,6,They attempt to locate her (find a red scarf?) and track her to the police station where they find her.
5fea352050a7199cfafc3fcb,7,"The chief, after this incident, suggests the rookie transfers to another police station."
6310d138e026879254c14bd1,1,A police chief's daughter
6310d138e026879254c14bd1,2,who was trying to impress me
6310d138e026879254c14bd1,3,ran away from home
6310d138e026879254c14bd1,4,because her dad always scolded her about me.
6310d138e026879254c14bd1,5,It turns out
6310d138e026879254c14bd1,6,she didn't run away
6310d138e026879254c14bd1,7,and was sat at a police station
6310d138e026879254c14bd1,8,with a book in her hands.
6310d138e026879254c14bd1,9,Frank Mitchell
6310d138e026879254c14bd1,10,a coworker
6310d138e026879254c14bd1,11,said
6310d138e026879254c14bd1,12,I need to leave anyway
6310d138e026879254c14bd1,13,because the old man won't get it out of his head
6310d138e026879254c14bd1,14,so I did.
6023cb37c452c802d4092a35,1,The policeman speaks about when he was a rookie and a fitness enthusiast.
6023cb37c452c802d4092a35,2,The Chief's daughter was fond of him
6023cb37c452c802d4092a35,3,but he wasn't
6023cb37c452c802d4092a35,4,because she was a chatterbox.
6023cb37c452c802d4092a35,5,She always tried to impress him.
6023cb37c452c802d4092a35,6,One day she threatened to runaway
6023cb37c452c802d4092a35,7,because her dad scolded her a lot.
6023cb37c452c802d4092a35,8,She disappeared
6023cb37c452c802d4092a35,9,"and the Chief came to his apartment looking for her,"
6023cb37c452c802d4092a35,10,she wasn't there
6023cb37c452c802d4092a35,11,and he suggested to help look for her.
6023cb37c452c802d4092a35,12,They went to where her scarf was found
6023cb37c452c802d4092a35,13,which was a park.
6023cb37c452c802d4092a35,14,They couldn't find her
6023cb37c452c802d4092a35,15,and eventually found her sitting at the police station bench.
6023cb37c452c802d4092a35,16,"That day the deputy Chief, Frank Mitchell suggested that he transfers"
6023cb37c452c802d4092a35,17,because the Chief never forgets
6023cb37c452c802d4092a35,18,and hold things.
627966f3451caac7a46ca880,1,Very hard to follow
627966f3451caac7a46ca880,2,but something about a police chief
627966f3451caac7a46ca880,3,with a rude daughter
627966f3451caac7a46ca880,4,and the trainee policeman
627966f3451caac7a46ca880,5,had to move away
627966f3451caac7a46ca880,6,because he didn't like him.
60603496c9a3d83273a11297,1,Back in the day when I was a rookie in the police force.
60603496c9a3d83273a11297,2,The chief was a veteran.
60603496c9a3d83273a11297,3,He had caught a notorious criminal.
60603496c9a3d83273a11297,4,But he had a younger daughter.
60603496c9a3d83273a11297,5,"In the early days, I was a fitness enthusiast."
60603496c9a3d83273a11297,6,I wasn't fond of her because she was a charming girl until she opened her mouth.
60603496c9a3d83273a11297,7,She could talk.
60603496c9a3d83273a11297,8,One day she left a note saying she was running away because he was always scolding her about me.
60603496c9a3d83273a11297,9,He came to my apartment intimidating look on his face.
60603496c9a3d83273a11297,10,I propose we look for her.
60603496c9a3d83273a11297,11,He accepted my offer.
60603496c9a3d83273a11297,12,They found her scarf near a park.
60603496c9a3d83273a11297,13,"At the police station, she was sitting on the chair."
60603496c9a3d83273a11297,14,She didn't run away.
60603496c9a3d83273a11297,15,He said I better transfer and leave.
60603496c9a3d83273a11297,16,I did transfer and leave.
60205f5ba5fe0165fa0e5e01,1,back in the day
60205f5ba5fe0165fa0e5e01,2,there was a a rookie cop
60205f5ba5fe0165fa0e5e01,3,who fell in love with his boss’s daughter.
60205f5ba5fe0165fa0e5e01,4,The boss found out
60205f5ba5fe0165fa0e5e01,5,and became upset
60205f5ba5fe0165fa0e5e01,6,forcing the daughter to run away from him.
60205f5ba5fe0165fa0e5e01,7,They went looking for her at a park
60205f5ba5fe0165fa0e5e01,8,"but couldn’t locate her,"
60205f5ba5fe0165fa0e5e01,9,when they went back to the station
60205f5ba5fe0165fa0e5e01,10,they found her sitting on a chair reading a book.
60205f5ba5fe0165fa0e5e01,11,the rookie later transferred jobs
60205f5ba5fe0165fa0e5e01,12,because of this whole ordeal
5e3752a476397a6e638bfc5e,1,A guy talks
5e3752a476397a6e638bfc5e,2,about the first year
5e3752a476397a6e638bfc5e,3,as a police officer.
5e3752a476397a6e638bfc5e,4,There's a girl
5e3752a476397a6e638bfc5e,5,that fancied him
5e3752a476397a6e638bfc5e,6,and they thought
5e3752a476397a6e638bfc5e,7,she ran away
5e3752a476397a6e638bfc5e,8,but she didn't
5e3752a476397a6e638bfc5e,9,but the guy was still asked to leave
5e3752a476397a6e638bfc5e,10,because the veteran officer
5e3752a476397a6e638bfc5e,11,wouldn't be able to forget
5e3752a476397a6e638bfc5e,12,what happened.
60ba46327fecef005d8eeb87,1,The author is talking about his rookie year
60ba46327fecef005d8eeb87,2,in which the senior officer's daughter became interested in him.
60ba46327fecef005d8eeb87,3,He was so interested in fitness activities.
60ba46327fecef005d8eeb87,4,The girl decided to run away from home
60ba46327fecef005d8eeb87,5,after mentioning that her father was bothering her
60ba46327fecef005d8eeb87,6,because of the author.
60ba46327fecef005d8eeb87,7,They began searching for her
60ba46327fecef005d8eeb87,8,and firstly they found her scarf
60ba46327fecef005d8eeb87,9,before finally finding her.
609252692568228b9e5399b0,1,I was a rookie in the police.
609252692568228b9e5399b0,2,My boss was a veteran with awards or something like that.
609252692568228b9e5399b0,3,He had a charming daughter who like me.
609252692568228b9e5399b0,4,I did not like her that much.
609252692568228b9e5399b0,5,"She was beautiful until she opened her mouth,"
609252692568228b9e5399b0,6,That girl could talk and talk.
609252692568228b9e5399b0,7,"She was always fighting with her father, my boss over me."
609252692568228b9e5399b0,8,One day she packed up and ran away.
609252692568228b9e5399b0,9,My boss came to my apartment with a threatening look
609252692568228b9e5399b0,10,And I promised to help him look for his daughter
609252692568228b9e5399b0,11,"And if we could not find her, he was free to do what he liked."
609252692568228b9e5399b0,12,We went to look to look for her at the park where her scarf had been found
609252692568228b9e5399b0,13,And we did not find her.
609252692568228b9e5399b0,14,"We later found her sitting in a corner at the police station,"
609252692568228b9e5399b0,15,She had not been lost after all.
609252692568228b9e5399b0,16,My friend Frank Mitchell told me to ask to be transferred
609252692568228b9e5399b0,17,Or else I would get in trouble with my boss.
609252692568228b9e5399b0,18,I asked to be transferred
609252692568228b9e5399b0,19,And that was it.
60ed995abcc068230f3c604d,1,He was a rookie in the police force.
60ed995abcc068230f3c604d,2,His superior had a daughter.
60ed995abcc068230f3c604d,3,Who was very fond of him.
60ed995abcc068230f3c604d,4,But he didn't like her.
60ed995abcc068230f3c604d,5,As she was a chatterbox.
60ed995abcc068230f3c604d,6,One day she went missing.
60ed995abcc068230f3c604d,7,And the superior arrived at the rookies apartment.
60ed995abcc068230f3c604d,8,Looking for her.
60ed995abcc068230f3c604d,9,He was very angry.
60ed995abcc068230f3c604d,10,She wasn't there.
60ed995abcc068230f3c604d,11,They looked.
60ed995abcc068230f3c604d,12,But couldn't find her.
60ed995abcc068230f3c604d,13,They resolved to contact the police.
60ed995abcc068230f3c604d,14,But she was at the station.
60ed995abcc068230f3c604d,15,When they got back.
60ed995abcc068230f3c604d,16,Frank Mitchell told the rookie to transfer from the station.
60ed995abcc068230f3c604d,17,And he did.
60b2827157e043215e6f997e,1,i had a rookie year.
60b2827157e043215e6f997e,2,when the captain the station commander had a daughter
60b2827157e043215e6f997e,3,whom was in love with me
60b2827157e043215e6f997e,4,she was a charming lady
60b2827157e043215e6f997e,5,who was a chatterbox
60b2827157e043215e6f997e,6,which made me uninterested in her
60b2827157e043215e6f997e,7,she decided to run away
60b2827157e043215e6f997e,8,because her dad used to scold her a lot.
60b2827157e043215e6f997e,9,the chief instructed me to look for her.
5f67ae1b22c41c0e44275dc2,1,"Back in my rookie year on the police force,"
5f67ae1b22c41c0e44275dc2,2,my Chief had a daughter who was quite fond of me.
5f67ae1b22c41c0e44275dc2,3,I was young and a fitness enthusiast.
5f67ae1b22c41c0e44275dc2,4,She liked me.
5f67ae1b22c41c0e44275dc2,5,But I didn't like her.
5f67ae1b22c41c0e44275dc2,6,And I though she was cute.
5f67ae1b22c41c0e44275dc2,7,But when she opened her mouth it was ruined.
5f67ae1b22c41c0e44275dc2,8,She was a chatterbox.
5f67ae1b22c41c0e44275dc2,9,I told her I was not interested.
5f67ae1b22c41c0e44275dc2,10,One day my Chief Mitchell came to me
5f67ae1b22c41c0e44275dc2,11,and said his daughter had run away.
5f67ae1b22c41c0e44275dc2,12,"I told him ""we will go look for her"
5f67ae1b22c41c0e44275dc2,13,"and then we will decide what to do."""
5f67ae1b22c41c0e44275dc2,14,I was bargaining.
5f67ae1b22c41c0e44275dc2,15,We went to the park where they had found her scarf.
5f67ae1b22c41c0e44275dc2,16,We looked all around but could not find her.
5f67ae1b22c41c0e44275dc2,17,Then we went to the police station
5f67ae1b22c41c0e44275dc2,18,and there she was reading a book.
5f67ae1b22c41c0e44275dc2,19,She hadn't run away at all.
5f67ae1b22c41c0e44275dc2,20,But - nevertheless- i was told to transfer to a new job
5f67ae1b22c41c0e44275dc2,21,because that old man never forgets anything.
60607afaf710537516a69546,1,Back in the day when I was a rookie…
60607afaf710537516a69546,2,there was a man with a daughter.
60607afaf710537516a69546,3,she was a charming girl until she opened her mouth.
60607afaf710537516a69546,4,"Goodness, she could talk."
60607afaf710537516a69546,5,She left a message saying she was going to run away.
60607afaf710537516a69546,6,He was intimidating.
60607afaf710537516a69546,7,I searched for her.
60607afaf710537516a69546,8,We went to a park.
60607afaf710537516a69546,9,Back at the station she was there.
60607afaf710537516a69546,10,I was told to transfer and leave which is what I did.
60607afaf710537516a69546,11,That is what I recall from my rookie year.
5d667a1a3741ea0001c719b9,1,A man describes his rookie year as a policeman.
5d667a1a3741ea0001c719b9,2,"His chief, named Frank Mitchell, had a daughter who was very taken with the author."
