recall_id,clause_id,clause_text,rephrased_text
5eab1e2cc8c0ac0d8262feaf,10,and that was the rest of my rookie days.,marking the conclusion of my initial period as a rookie.
5eaeddb6a7e04f5af6b3e879,1,A rookie was working for a chief at the police station,A novice officer was under the employment of a station chief
5eaeddb6a7e04f5af6b3e879,2,who had been a veteran.,who was an experienced veteran.
5eaeddb6a7e04f5af6b3e879,3,The chief had a daughter,This chief had a daughter
5eaeddb6a7e04f5af6b3e879,4,who was quite keen on the rookie,who took a strong liking to the new officer
5eaeddb6a7e04f5af6b3e879,5,and he thought she was quite nice,and he found her to be quite pleasant
5eaeddb6a7e04f5af6b3e879,6,until she opened her voice.,until she began to speak.
5eaeddb6a7e04f5af6b3e879,7,He thought her a chatterbox.,He considered her to be excessively talkative.
5eaeddb6a7e04f5af6b3e879,8,The chief argued with the daughter over the rookie,The chief had disputes with his daughter concerning the novice officer
5eaeddb6a7e04f5af6b3e879,9,and one day she disappeared.,and then one day she vanished.
5eaeddb6a7e04f5af6b3e879,10,They tried to locate her,Efforts were made to find her
5eaeddb6a7e04f5af6b3e879,11,but eventually found her sitting quietly in the police station reading a book.,"but she was eventually discovered in the station, engrossed in a book."
5eaeddb6a7e04f5af6b3e879,12,She had not run away at all.,She hadn't actually fled.
5eaeddb6a7e04f5af6b3e879,13,The deputy warned the rookie,The assistant chief cautioned the novice
5eaeddb6a7e04f5af6b3e879,14,that maybe he should move to a different station,that it might be wise to transfer to another precinct
5eaeddb6a7e04f5af6b3e879,15,as the old man would never forget this incidence.,since the chief would likely hold onto the memory of this event.
5ec848e98af2e014101df8e5,1,When I was a rookie police officer,During my initial days as a law enforcement officer
5ec848e98af2e014101df8e5,2,my chief was a big deal.,my superior was quite influential.
5ec848e98af2e014101df8e5,3,He had been awarded for catching a big criminal.,He had received recognition for apprehending a notorious felon.
5ec848e98af2e014101df8e5,4,I was a big fitness enthusiast back in those days.,"At that time, I was very passionate about physical fitness."
5ec848e98af2e014101df8e5,5,His daughter had her eye on me.,His daughter took a liking to me.
5ec848e98af2e014101df8e5,6,I wasn’t interested,"However, I was not interested"
5ec848e98af2e014101df8e5,7,because as charming as she was,despite her allure
5ec848e98af2e014101df8e5,8,she was a chatterbox.,because she talked incessantly.
5ec848e98af2e014101df8e5,9,She told me she would run away,She threatened to elope
5ec848e98af2e014101df8e5,10,as her father wanted her to date me,since her father was pressuring her to pursue a relationship with me
5ec848e98af2e014101df8e5,11,and I wouldn’t.,and I was not willing.
5ec848e98af2e014101df8e5,12,Her father came to me saying she had run away.,"Her father approached me, reporting her disappearance."
5ec848e98af2e014101df8e5,13,I said I would help look for her,I volunteered to assist in the search for her
5ec848e98af2e014101df8e5,14,and if we couldn’t find her,and mentioned that if she remained missing
5ec848e98af2e014101df8e5,15,he could do whatever he needed too.,he was free to take any necessary actions.
5ec848e98af2e014101df8e5,16,We looked at the park where her scarf was found.,Our search led us to a park where we discovered her scarf.
5ec848e98af2e014101df8e5,17,We looked all around but couldn’t find her.,"Despite our extensive search, she was nowhere to be found."
5ec848e98af2e014101df8e5,18,When we got back to the station,Upon our return to the precinct
5ec848e98af2e014101df8e5,19,she was there sitting in a car reading a book.,"we found her in a vehicle, engrossed in a novel."
5ec848e98af2e014101df8e5,20,The deputy told me I should transfer,An associate advised me to consider a transfer
5ec848e98af2e014101df8e5,21,as once the chief had something in his mind,pointing out that once the chief fixated on an idea
5ec848e98af2e014101df8e5,22,he wouldn’t forget it.,he would not easily let it go.
5ec848e98af2e014101df8e5,23,I transferred,I decided to transfer
5ec848e98af2e014101df8e5,24,and that was the end of my rookie year.,marking the conclusion of my first year on the force.
5ef4ceca768a610b600ee1fb,1,"Back in the days when I as a rookie on the police force,","During my early years as a novice in the police department,"
5ef4ceca768a610b600ee1fb,2,I had a commander.,there was a superior officer I reported to.
5ef4ceca768a610b600ee1fb,3,He was a veteran.,This officer was seasoned with experience.
5ef4ceca768a610b600ee1fb,4,He had caught a notorious criminal.,He had apprehended a well-known felon.
5ef4ceca768a610b600ee1fb,5,He had a daughter.,He was the father of a young woman.
5ef4ceca768a610b600ee1fb,6,I thought she was into me because I was into fitness.,I assumed she was attracted to me because of my interest in physical fitness.
5ef4ceca768a610b600ee1fb,7,I never observed it.,"However, I never actually noticed any signs."
5ef4ceca768a610b600ee1fb,8,I wasn't much fond of her because she was a chatterbox.,I wasn't particularly keen on her since she talked excessively.
5ef4ceca768a610b600ee1fb,9,She wanted to run away because her dad always scolded her.,She desired to escape due to her father's constant reprimands.
5ef4ceca768a610b600ee1fb,10,Then she did.,"Eventually, she vanished."
5ef4ceca768a610b600ee1fb,11,The commander came to my house with a cold look in his eyes.,"The commander showed up at my residence, his gaze icy and stern."
5ef4ceca768a610b600ee1fb,12,He wanted to know what happened to his daughter.,He demanded information regarding his missing daughter.
5ef4ceca768a610b600ee1fb,13,"""Lets go look for her"", I said.","""Let's search for her,"" I proposed."
5ef4ceca768a610b600ee1fb,14,I was strategizing.,I was formulating a plan.
5ef4ceca768a610b600ee1fb,15,"So, we went to the park where her scarf was found.","Thus, we headed to the park where her scarf had been discovered."
5ef4ceca768a610b600ee1fb,16,"Then, it led back to a police station, where she was sitting with a book.","Our search concluded at a police station, where she was found engrossed in a book."
5ef4ceca768a610b600ee1fb,17,"She had never run away, and that solved the problem for that day.","It turned out she hadn't actually fled, resolving the day's issue."
5ef4ceca768a610b600ee1fb,18,"That evening, a supervisor on the force, Frank Mitchell, said to me, ""You need to transfer, once that old man gets something in his head it never leaves"".","That night, Frank Mitchell, a supervising officer, advised me, ""You should consider a transfer; once that old man fixates on something, it's permanent."""
5ef4ceca768a610b600ee1fb,19,So I did it.,"Taking his advice,"
5ef4ceca768a610b600ee1fb,20,I transferred.,I requested a transfer.
5ef4ceca768a610b600ee1fb,21,And that was the end of the story from my days as a rookie on the force.,"And with that, my tale from the rookie years on the squad comes to a close."
5f0a1d89eb65250d7d9eedb4,1,The chief of police is well respected in the community,The town's police head is highly esteemed by the locals
5f0a1d89eb65250d7d9eedb4,2,and has a stunning daughter.,who has a remarkably beautiful daughter.
5f0a1d89eb65250d7d9eedb4,3,She is lovely,She is quite charming
5f0a1d89eb65250d7d9eedb4,4,and pretty.,and attractive.
5f0a1d89eb65250d7d9eedb4,5,But when she opens her mouth,"However, the moment she begins to speak"
5f0a1d89eb65250d7d9eedb4,6,"she becomes unattractive,","her appeal diminishes,"
5f0a1d89eb65250d7d9eedb4,7,she talks too much.,as she speaks excessively.
5f0a1d89eb65250d7d9eedb4,8,"Goodness,","My goodness,"
5f0a1d89eb65250d7d9eedb4,9,she is a chatter box.,she never stops talking.
5f0a1d89eb65250d7d9eedb4,10,"One day she decided to run away,","One day, she made up her mind to leave home,"
5f0a1d89eb65250d7d9eedb4,11,because of her chief police father scolding her all the time.,"due to the constant reprimands from her father, the police chief."
5f0a1d89eb65250d7d9eedb4,12,He came to me after she left,"After her departure, he approached me"
5f0a1d89eb65250d7d9eedb4,13,and demanded I search for her.,and insisted that I help locate her.
5f0a1d89eb65250d7d9eedb4,14,I said I'll do what I can,I agreed to assist as best as I could
5f0a1d89eb65250d7d9eedb4,15,and then if we can't find her,"and mentioned that if she remained missing,"
5f0a1d89eb65250d7d9eedb4,16,you can do whatever you feel is right.,he should do as he sees fit.
5f0a1d89eb65250d7d9eedb4,17,We looked in a park where we last found her scarf,We searched a park where her scarf was previously found
5f0a1d89eb65250d7d9eedb4,18,and then nothing.,but to no avail.
5f0a1d89eb65250d7d9eedb4,19,"We returned to a police station,","We made our way back to the station,"
5f0a1d89eb65250d7d9eedb4,20,"and there she was, holding a book in her hand.","only to find her there, with a book in her grasp."
5f0a1d89eb65250d7d9eedb4,21,The officer there told me I better transfer,The officer on duty advised me to consider a transfer
5f0a1d89eb65250d7d9eedb4,22,because that old man never forgets a thing.,since the chief has a long memory.
5f0a1d89eb65250d7d9eedb4,23,I already transferred,I had already moved on
5f0a1d89eb65250d7d9eedb4,24,and that was the end of my rookie year.,marking the conclusion of my first year on the job.
5f2b3b2b4cc04057806945da,1,"There was a rookie at a police station,","A novice officer was present at a precinct,"
5f2b3b2b4cc04057806945da,2,and he had a chief you enjoyed going to the gym.,with a superior who took pleasure in frequenting the gym.
5f2b3b2b4cc04057806945da,3,This chief also had a daughter,The superior officer had a daughter
5f2b3b2b4cc04057806945da,4,"that the rookie was quite fond of,","whom the novice officer was quite smitten with,"
5f2b3b2b4cc04057806945da,5,however she was a bit of a chatterbox.,although she tended to talk excessively.
5f2b3b2b4cc04057806945da,6,"He was going to propose to her,","He intended to ask for her hand in marriage,"
5f2b3b2b4cc04057806945da,7,however it looked like she had run away.,but it appeared as though she had vanished.
5f2b3b2b4cc04057806945da,8,"The rookie and the chief went around looking for her,","The novice and the superior scoured the area for her,"
5f2b3b2b4cc04057806945da,9,but they couldn't find her.,yet they were unable to locate her.
5f2b3b2b4cc04057806945da,10,So they went back to the station.,"Thus, they returned to the precinct."
5f2b3b2b4cc04057806945da,11,"However, when they got there the daughter was sat there with a book in her hands.","Surprisingly, upon their arrival, they found the daughter sitting there with a tome in her grasp."
5f2b3b2b4cc04057806945da,12,After that the rookie left that particular station -,"Subsequently, the novice departed from that particular precinct -"
5f2b3b2b4cc04057806945da,13,and that was the end of his rookie year.,marking the conclusion of his inaugural year as an officer.
5f411693e388cd26c8000e90,1,A young rookie cop,An inexperienced police officer
5f411693e388cd26c8000e90,2,had trouble,encountered difficulties
5f411693e388cd26c8000e90,3,with a chief’s daughter,involving the precinct chief's daughter
5f411693e388cd26c8000e90,4,who followed him.,who persistently shadowed him.
5f411693e388cd26c8000e90,5,She was angry,She harbored resentment
5f411693e388cd26c8000e90,6,with her father,towards her father
5f411693e388cd26c8000e90,7,who was always scolding her.,who constantly reprimanded her.
5f411693e388cd26c8000e90,8,She said,She declared
5f411693e388cd26c8000e90,9,she was going to run away.,her intentions to elope.
5f411693e388cd26c8000e90,10,The rookie and father,The novice officer and her father
5f411693e388cd26c8000e90,11,went in search,set out to look for her
5f411693e388cd26c8000e90,12,and found her scarf.,and stumbled upon her shawl.
5f411693e388cd26c8000e90,13,Eventually they went back,"Ultimately, they returned"
5f411693e388cd26c8000e90,14,to the police station,to the headquarters
5f411693e388cd26c8000e90,15,where the girl was,where the young woman was found
5f411693e388cd26c8000e90,16,and was reading a book.,engrossed in reading a tome.
5f411693e388cd26c8000e90,17,Another officer told the rookie,A fellow officer informed the novice
5f411693e388cd26c8000e90,18,the chief would never forget,that the chief would always remember this
5f411693e388cd26c8000e90,19,so he had better move on.,thus he should consider moving forward.
5f411693e388cd26c8000e90,20,He did move,He proceeded to do so
5f411693e388cd26c8000e90,21,and that was the end,which marked the conclusion
5f411693e388cd26c8000e90,22,of his rookie year.,of his initial year on the force.
5f413867991f880a34f5b28d,1,"Back in the day when I was a rookie in the police force,","In my early days as a novice officer,"
5f413867991f880a34f5b28d,2,the Chief was a veteran.,our Chief was an experienced leader.
5f413867991f880a34f5b28d,3,"He had a daughter,","His offspring was a girl,"
5f413867991f880a34f5b28d,4,"athletic one,","quite the sporty type,"
5f413867991f880a34f5b28d,5,but she never impressed me.,though she never managed to impress me.
5f413867991f880a34f5b28d,6,She was really cute until she opened her mouth.,She seemed adorable until she began to speak.
5f413867991f880a34f5b28d,7,She was a chatterbox.,She talked incessantly.
5f413867991f880a34f5b28d,8,She got mad and chief thought she run away.,She became upset and the chief suspected she had taken off.
5f413867991f880a34f5b28d,9,"We searched for her at the park where they found her scarf,","Our search led us to the park where her scarf was discovered,"
5f413867991f880a34f5b28d,10,but she wasn't there.,yet she was nowhere to be found there.
5f413867991f880a34f5b28d,11,"She was at the police station,","Turns out, she was at the precinct,"
5f413867991f880a34f5b28d,12,with a book in her hands.,engrossed in a book.
5f413867991f880a34f5b28d,13,She didn't run away after all.,It turns out she hadn't eloped.
5f413867991f880a34f5b28d,14,"Someone told me to transfer,","Someone advised me to request a transfer,"
5f413867991f880a34f5b28d,15,because the old man never forgets.,reminding me that the chief holds a long memory.
5f413867991f880a34f5b28d,16,I listened to him and transferred.,"Heeding that advice, I made the move."
5f413867991f880a34f5b28d,17,That was the end of my rookie year.,Thus concluded my inaugural year on the force.
5f4560c565e28d13e5dd5d56,1,The narrator was a police officer,The storyteller served as a law enforcement agent
5f4560c565e28d13e5dd5d56,2,and his chief had a daughter.,whose superior had a young female offspring.
5f4560c565e28d13e5dd5d56,3,The chief's daughter wanted to get close to the narrator,This offspring of the superior sought to form a bond with the storyteller
5f4560c565e28d13e5dd5d56,4,but her father was against it.,yet her progenitor disapproved of the idea.
5f4560c565e28d13e5dd5d56,5,The daughter ran away from home.,"Subsequently, the superior's daughter absconded from her residence."
5f4560c565e28d13e5dd5d56,6,The chief officer scolded the police,The head officer admonished the constabulary
5f4560c565e28d13e5dd5d56,7,and they started searching for the girl at the park.,prompting them to initiate a search for the young woman in the recreational area.
5f4560c565e28d13e5dd5d56,8,They found her scarf only.,All they discovered was her neckwear.
5f4560c565e28d13e5dd5d56,9,They found the girl at the police station,"Ultimately, the young woman was located at the precinct"
5f4560c565e28d13e5dd5d56,10,busy reading a book.,engrossed in perusing a tome.
5f4560c565e28d13e5dd5d56,11,The deputy officer told the rookie to stay away,The second-in-command warned the novice officer to maintain distance
5f4560c565e28d13e5dd5d56,12,from the daughter of the chief officer.,from the superior's offspring.
5f588f227723ca000cc5e08f,1,The story is about a Rockie officer,"This tale centers on a rookie officer,"
5f588f227723ca000cc5e08f,2,"whose chief was a veteran,","under the command of an experienced leader,"
5f588f227723ca000cc5e08f,3,The chief was popular,"The leader enjoyed widespread popularity,"
5f588f227723ca000cc5e08f,4,and a notorious criminal.,and was known as a formidable outlaw.
5f588f227723ca000cc5e08f,5,The chief had a daughter,"This leader had a daughter,"
5f588f227723ca000cc5e08f,6,who was a gym enthusiast,"who was an avid fitness aficionado,"
5f588f227723ca000cc5e08f,7,and the boyfriend referred to her as a chatterbox.,and her boyfriend affectionately called her a gabfest.
5f588f227723ca000cc5e08f,8,The girl wrote a note,"The young woman penned a message,"
5f588f227723ca000cc5e08f,9,saying she was leaving,"declaring her intention to depart,"
5f588f227723ca000cc5e08f,10,because she was tired of her father scowling about her boyfriend Rockie.,owing to her weariness of her father's constant grimaces regarding her rookie beau.
5f588f227723ca000cc5e08f,11,The Rockie took a transfer,"The rookie opted for reassignment,"
5f588f227723ca000cc5e08f,12,because he was scared of the chief.,fearing the wrath of the seasoned chief.
5f588f227723ca000cc5e08f,13,That was the end of his Rockie years.,Thus concluded his tenure as a rookie.
5f58ad6414fd6902d237d3f3,1,Guy worked as a rookie in the police force.,Guy served as a novice officer in the law enforcement agency.
5f58ad6414fd6902d237d3f3,2,The relationship with my boss was challenging.,My rapport with the supervisor was quite difficult.
5f58ad6414fd6902d237d3f3,3,He had a daughter.,He was the father of a girl.
5f58ad6414fd6902d237d3f3,4,I think she had a crush on me.,I believe she developed a fondness for me.
5f58ad6414fd6902d237d3f3,5,She wanted us to run away together.,She desired for us to elope.
5f58ad6414fd6902d237d3f3,6,She was not my type at all.,She absolutely wasn't my preferred choice.
5f58ad6414fd6902d237d3f3,7,One day the boss found out.,"Eventually, her father became aware."
5f58ad6414fd6902d237d3f3,8,He scolded her.,He reprimanded her.
5f58ad6414fd6902d237d3f3,9,She said he always did this.,She claimed it was his usual behavior.
5f58ad6414fd6902d237d3f3,10,She then ran away.,"Afterward, she took off."
5f58ad6414fd6902d237d3f3,11,The boss was frantic.,Her father was in a state of panic.
5f58ad6414fd6902d237d3f3,12,We looked for her.,We embarked on a search for her.
5f58ad6414fd6902d237d3f3,13,We could not find her.,Our efforts to locate her were in vain.
5f58ad6414fd6902d237d3f3,14,"When we got back to the police station, she was sitting in a chair.","Upon our return to the precinct, we found her seated in a chair."
5f58ad6414fd6902d237d3f3,15,She was unharmed.,She had not been harmed.
5f58ad6414fd6902d237d3f3,16,I was told by a colleague that I should ask for a transfer.,A workmate suggested I request a departmental transfer.
5f58ad6414fd6902d237d3f3,17,"The ""boss never forgets"".",The phrase 'the boss never forgets' was mentioned.
5f58ad6414fd6902d237d3f3,18,He did this.,He was responsible for it.
5f58ad6414fd6902d237d3f3,19,He was transferred.,A transfer was his fate.
5f58ad6414fd6902d237d3f3,20,That was his rookie year.,That marked the end of his inaugural year on the force.
5f58c945b5424a055aad846b,1,Rookie in police force.,Newcomer to the police department.
5f58c945b5424a055aad846b,2,Leader was a veteran,The chief was experienced
5f58c945b5424a055aad846b,3,and had been awarded for bravery.,and had received recognition for his courage.
5f58c945b5424a055aad846b,4,He has a daughter,He is a father to a girl
5f58c945b5424a055aad846b,5,who was impressed by my fitness.,who took notice of my physical condition.
5f58c945b5424a055aad846b,6,She went missing,She disappeared
5f58c945b5424a055aad846b,7,I was strategizing.,While I was devising a plan.
5f58c945b5424a055aad846b,8,Looked everywhere,Searched high and low
5f58c945b5424a055aad846b,9,and where her scarf was.,including the location of her lost scarf.
5f58c945b5424a055aad846b,10,Going to call the police,Was about to contact law enforcement
5f58c945b5424a055aad846b,11,but found her back at the police station reading a book.,only to discover her at the station engrossed in a novel.
5f58c945b5424a055aad846b,12,Other police officer advised me to leave,A fellow officer suggested I depart
5f58c945b5424a055aad846b,13,as the old man never forgot anything.,since the senior officer had a flawless memory.
5f58c945b5424a055aad846b,14,She that's what I did - leave,So that's precisely what I did - departed
5f58c945b5424a055aad846b,15,and it was the end of my rookie year.,marking the conclusion of my initial year on the force.
5f67ae1b22c41c0e44275dc2,1,"Back in my rookie year on the police force,","During my initial year with the law enforcement team,"
5f67ae1b22c41c0e44275dc2,2,my Chief had a daughter who was quite fond of me.,the Chief's daughter took quite a liking to me.
5f67ae1b22c41c0e44275dc2,3,I was young and a fitness enthusiast.,"Back then, I was youthful and passionate about staying fit."
5f67ae1b22c41c0e44275dc2,4,She liked me.,She was attracted to me.
5f67ae1b22c41c0e44275dc2,5,But I didn't like her.,"However, I wasn't attracted to her."
5f67ae1b22c41c0e44275dc2,6,And I though she was cute.,And I thought she was attractive.
5f67ae1b22c41c0e44275dc2,7,But when she opened her mouth it was ruined.,"Yet, her charm vanished the moment she spoke."
5f67ae1b22c41c0e44275dc2,8,She was a chatterbox.,She wouldn't stop talking.
5f67ae1b22c41c0e44275dc2,9,I told her I was not interested.,I made it clear that I wasn't interested.
5f67ae1b22c41c0e44275dc2,10,One day my Chief Mitchell came to me,"One time, Chief Mitchell approached me"
5f67ae1b22c41c0e44275dc2,11,and said his daughter had run away.,and informed me his daughter had disappeared.
5f67ae1b22c41c0e44275dc2,12,"I told him ""we will go look for her","I assured him, ""Let's search for her"
5f67ae1b22c41c0e44275dc2,13,"and then we will decide what to do.""","and then we'll figure out our next steps."""
5f67ae1b22c41c0e44275dc2,14,I was bargaining.,I was negotiating.
5f67ae1b22c41c0e44275dc2,15,We went to the park where they had found her scarf.,We headed to the park where her scarf had been discovered.
5f67ae1b22c41c0e44275dc2,16,We looked all around but could not find her.,"Despite searching high and low, she was nowhere to be found."
5f67ae1b22c41c0e44275dc2,17,Then we went to the police station,"Next, we proceeded to the police department"
5f67ae1b22c41c0e44275dc2,18,and there she was reading a book.,"and found her there, engrossed in a book."
5f67ae1b22c41c0e44275dc2,19,She hadn't run away at all.,"Turns out, she hadn't actually gone missing."
5f67ae1b22c41c0e44275dc2,20,But - nevertheless- i was told to transfer to a new job,"Yet, in the end, I was instructed to switch to another position"
5f67ae1b22c41c0e44275dc2,21,because that old man never forgets anything.,since the old man held onto every memory.
5f702dfd68dfbf000da79ada,1,"Back in the day when he was in the police force,","In the times when he served as a police officer,"
5f702dfd68dfbf000da79ada,2,"during his rookie year,","in his initial year on the job,"
5f702dfd68dfbf000da79ada,3,he tried to explain an incident,he attempted to describe a situation
5f702dfd68dfbf000da79ada,4,about locating a charming and missing lady,"regarding the search for an enchanting woman who had disappeared,"
5f702dfd68dfbf000da79ada,5,through a scarf,"using a scarf as a clue,"
5f702dfd68dfbf000da79ada,6,that was probably by the river.,which was likely found near the river.
5f7ca372a8afc510abbbe99b,1,A girl ran away.,A young girl fled.
5f7ca372a8afc510abbbe99b,2,A man was angry with the narrator about it.,A man harbored anger towards the storyteller over this incident.
5f7ca372a8afc510abbbe99b,3,"The narrator offered to look for her with him,","The storyteller proposed searching for her together with the man,"
5f7ca372a8afc510abbbe99b,4,they only found her scarf near a park.,but they only stumbled upon her scarf adjacent to a park.
5f7ca372a8afc510abbbe99b,5,They went to the police station,They proceeded to the police precinct
5f7ca372a8afc510abbbe99b,6,and she was there.,where she was already present.
5f7ca372a8afc510abbbe99b,7,The policeman there told him to transfer,An officer there advised him to request a transfer
5f7ca372a8afc510abbbe99b,8,because the man 'never forgets something once he gets it in his head',"on the grounds that 'once the man fixates on something, he never lets it go'"
5f7ca372a8afc510abbbe99b,9,so he did transfer,"thus, he requested a transfer"
5f7ca372a8afc510abbbe99b,10,and that was the end of his rookie year.,marking the conclusion of his initial year on the job.
5f86ebc47c32d005ad582abd,1,"There was a Policeman,","A member of the police force existed,"
5f86ebc47c32d005ad582abd,2,a good one,"who was commendable in his duties,"
5f86ebc47c32d005ad582abd,3,but he hadn't won a medal or award for bravery.,yet he had never received a decoration or commendation for valor.
5f86ebc47c32d005ad582abd,4,HE had a daughter,"This officer had a progeny,"
5f86ebc47c32d005ad582abd,5,whom the writer really liked.,a young woman the author held in high esteem.
5f86ebc47c32d005ad582abd,6,"She was witty, intelligent and beautiful (or words to that effect).","She possessed a sharp wit, high intelligence, and striking beauty (to use similar expressions)."
5f86ebc47c32d005ad582abd,7,The Policeman didn't want the writer to be friends,The lawman was opposed to the idea of the author befriending
5f86ebc47c32d005ad582abd,8,or have a relationship with the daughter.,or entering into a romantic involvement with his offspring.
5f86ebc47c32d005ad582abd,9,She went missing one day.,"One day, she became unaccounted for."
5f86ebc47c32d005ad582abd,10,The writer proposed he would look for her.,The author offered to embark on a search for her.
5f86ebc47c32d005ad582abd,11,Maybe the Policeman went too.,Perhaps the officer joined the search as well.
