segment_id,segment_text,real_rec,real_caught,emulated_rec,emulated_caught,rec_difference,caught_difference
1,We moved down to Third and Wharton.,52.38,78.35,0.0,10.0,-52.38,-68.35
2,We had gotten moved,7.14,29.9,0.0,0.0,-7.14,-29.9
3,"but it was like – you remember I told you my father drank,",42.86,42.27,10.0,30.0,-32.86,-12.27
4,"but it was still day,",3.57,6.19,0.0,0.0,-3.57,-6.19
5,"and after he had gotten in and put the furniture where it was supposed to go, my mother left, to go to market to get some food to bring into the house.",44.05,68.04,0.0,20.0,-44.05,-48.04
6,And my father went to take the horses – take the team of horses back.,42.86,55.67,0.0,0.0,-42.86,-55.67
7,But he didn't come home.,10.71,25.77,0.0,40.0,-10.71,14.23
8,"He – stopped somewhere on – I dunno,",0.0,17.53,0.0,10.0,0.0,-7.53
9,but he – how he – why he wasn't in the house.,0.0,15.46,0.0,0.0,0.0,-15.46
10,And of course I was left there with the kids.,34.52,55.67,0.0,0.0,-34.52,-55.67
11,Well no sooner did my mother get out of the house – my father went first – then – oh it was such an awful crash came through the window.,63.1,96.91,0.0,80.0,-63.1,-16.91
12,And I – and I looked and it was a big stone.,29.76,80.41,0.0,20.0,-29.76,-60.41
13,And then of course they – they – well they stoned the house.,39.29,90.72,0.0,80.0,-39.29,-10.72
14,And I had sense enough to get the kids into the stairway so that they wouldn't get hurt by flyin' glass.,57.14,73.2,0.0,40.0,-57.14,-33.2
15,"And I said to them, “Now you stay there.",2.38,52.58,0.0,10.0,-2.38,-42.58
16,Don't move 'cause nothing will reach you here.,4.76,48.45,0.0,10.0,-4.76,-38.45
17,And I'm gonna go and see if I can find mom” –,34.52,67.01,0.0,10.0,-34.52,-57.01
18,(We call our mother mom.),4.76,6.19,0.0,0.0,-4.76,-6.19
19,And they were crying,7.14,20.62,0.0,30.0,-7.14,9.38
20,and carryin' on.,5.95,13.4,0.0,20.0,-5.95,6.6
21,"I was scared to death,",14.29,45.36,0.0,50.0,-14.29,4.64
22,I really was frightened out of my wits.,10.71,41.24,0.0,60.0,-10.71,18.76
23,"And I didn't know what to do,",2.38,16.49,0.0,60.0,-2.38,43.51
24,but I remember saying a prayer as I went out the front door because I didn't know what was gonna hit me when I went out that door.,8.33,47.42,0.0,50.0,-8.33,2.58
25,And I ran –,7.14,53.61,0.0,30.0,-7.14,-23.61
26,I was ten years old at the time this happened –,44.05,47.42,0.0,30.0,-44.05,-17.42
27,"I ran to Fourth street, because I knew my mother wa-",26.19,58.76,0.0,20.0,-26.19,-38.76
28,"They had push carts in those days, on Fourth street.",15.48,19.59,0.0,20.0,-15.48,0.41
29,And it was a Jewish neighborhood,34.52,45.36,0.0,30.0,-34.52,-15.36
30,and they – they stayed open until – until all hours.,19.05,24.74,0.0,20.0,-19.05,-4.74
31,"Because they would, you know, however much money they could get they wanted.",7.14,16.49,0.0,20.0,-7.14,3.51
32,So uh that's where she was going to do her shopping.,5.95,28.87,0.0,20.0,-5.95,-8.87
33,And I finally found my mother.,28.57,79.38,0.0,40.0,-28.57,-39.38
34,I did find her.,5.95,43.3,0.0,20.0,-5.95,-23.3
35,And while I was trying to tell her what had happened,15.48,50.52,0.0,30.0,-15.48,-20.52
36,a policeman went by.,57.14,74.23,0.0,30.0,-57.14,-44.23
37,And my voice was such that you could hardly make out what I was saying.,11.9,36.08,0.0,40.0,-11.9,3.92
38,"I was so nervous and – and – my voice was shaking so,",5.95,38.14,0.0,30.0,-5.95,-8.14
39,and he wanted to find out what ha- what was wrong with me.,7.14,56.7,0.0,30.0,-7.14,-26.7
40,And then when he understood what the situation was he turned to my mother,1.19,53.61,0.0,30.0,-1.19,-23.61
41,"and says, “This is a bad neighborhood.",25.0,80.41,0.0,80.0,-25.0,-0.41
42,It's Irish.”,41.67,73.2,0.0,40.0,-41.67,-33.2
43,"And he said, “They're known to do things like that,",4.76,56.7,0.0,80.0,-4.76,23.3
44,Better move out of there.”,29.76,57.73,0.0,50.0,-29.76,-7.73
45,"My mother said, “I just moved in, how am I gonna move out?”",19.05,37.11,0.0,60.0,-19.05,22.89
46,"He says, “I dunno.”",0.0,15.46,0.0,30.0,0.0,14.54
47,"He says, “But they don't want any black people in there.”",32.14,83.51,0.0,80.0,-32.14,-3.51
48,An' he didn't say black 'cause they didn't use black then.,9.52,40.21,0.0,40.0,-9.52,-0.21
49,But “they don't want anybody in there.”,5.95,26.8,0.0,40.0,-5.95,13.2
50,"So uh, she said, “Well you're the law.",1.19,34.02,0.0,70.0,-1.19,35.98
51,You're supposed to protect us.”,4.76,22.68,0.0,50.0,-4.76,27.32
52,"He says, “I can't do anything with it.”",7.14,74.23,0.0,40.0,-7.14,-34.23
53,He was Irish himself.,15.48,59.79,0.0,40.0,-15.48,-19.79
54,“I can't do anything about it.”,2.38,45.36,0.0,40.0,-2.38,-5.36
55,"So my mother said um, “Where is the uh precinct you work from?”",14.29,42.27,0.0,50.0,-14.29,7.73
56,And he told her.,5.95,14.43,0.0,30.0,-5.95,15.57
57,I forgot now.,1.19,10.31,0.0,30.0,-1.19,19.69
58,I was right there with her,0.0,11.34,0.0,30.0,0.0,18.66
59,but I've forgotten where he told her.,1.19,11.34,0.0,30.0,-1.19,18.66
60,"So uh she said, “Well if you can't do anything to help me, I'll go see who – if I can't find someone else to help me.”",5.95,46.39,0.0,60.0,-5.95,13.61
61,"Well in those days black people were so cowed by circumstances an' uniforms and white people, you know, they uh many times didn't assert themselves.",5.95,22.68,0.0,50.0,-5.95,27.32
62,But thankfully my mother was not one of those kind.,9.52,25.77,0.0,40.0,-9.52,14.23
63,And she – well I always thought of her as an educated person which she was because she was the only one I knew who had completed high school.,17.86,35.05,0.0,60.0,-17.86,24.95
64,She went to Lackawanna high school.,4.76,17.53,0.0,40.0,-4.76,22.47
65,"And this was – let me see what year was this happening – well it must have been nineteen twenty-five, so you can see what – what the times were.",26.19,37.11,10.0,80.0,-16.19,42.89
66,"And we went – she took me, and we went to the police station.",29.76,81.44,0.0,30.0,-29.76,-51.44
67,And they also had police wagons with horses attached to them. Believe it or not in those days.,5.95,24.74,0.0,20.0,-5.95,-4.74
68,"So my mother said, to the captain, “What are you going to do about it?”",4.76,44.33,0.0,70.0,-4.76,25.67
69,"And he says, “Well lady there's nothing we can do about it.”",7.14,67.01,0.0,40.0,-7.14,-27.01
70,"And she says, “You mean to tell me that I have to live under those circumstances and there's nothing that you can do about it?”",2.38,44.33,0.0,80.0,-2.38,35.67
71,"She says – he says, “Well uh the only thing I can tell you to do is to move.”",11.9,67.01,0.0,50.0,-11.9,-17.01
72,"He says, “Because” – he said to me, “Did you see anyone?”",1.19,30.93,0.0,40.0,-1.19,9.07
73,"And I said, “No.”",2.38,28.87,0.0,40.0,-2.38,11.13
74,"He says, “Well how can – how can you” – to my mother – “how can you do anything if you don't know who – who to put the blame on?”",5.95,41.24,0.0,40.0,-5.95,-1.24
75,"An' he says, “I'm sure there was more than one person.”",0.0,31.96,0.0,40.0,0.0,8.04
76,"So my mother said, “Well I don't know what I'm going to do.”",0.0,17.53,0.0,60.0,0.0,42.47
77,"She says, “But one thing I know I'm not going to do is move. Because I have no money to move with.”",15.48,80.41,0.0,100.0,-15.48,19.59
78,"They took all we had to, to pay the rent.",0.0,69.07,0.0,70.0,0.0,0.93
79,In that house you had to pay in advance.,7.14,36.08,0.0,40.0,-7.14,3.92
80,"And she said, “If they didn't want me there they should not have rented the house to me.",3.57,47.42,0.0,90.0,-3.57,42.58
81,Now the real estate agent should be accountable.”,2.38,30.93,0.0,60.0,-2.38,29.07
82,"So anyhow, she said to him, “Well I know one thing you can do.”",0.0,23.71,0.0,80.0,0.0,56.29
83,"And he says, “What's that?”",0.0,13.4,0.0,40.0,0.0,26.6
84,"She says, “You can take me home.”",33.33,61.86,0.0,50.0,-33.33,-11.86
85,"He said, “Take you home?”",1.19,20.62,0.0,30.0,-1.19,9.38
86,"She said, “Yes in the police patrol.”",30.95,52.58,0.0,40.0,-30.95,-12.58
87,So – I guess they figured “Let's get this lady out of here because she's talking loud and long.”,3.57,26.8,0.0,50.0,-3.57,23.2
88,And they had never come up with anybody like that.,3.57,18.56,0.0,40.0,-3.57,21.44
89,So they put us in the police patrol,3.57,73.2,0.0,50.0,-3.57,-23.2
90,and they took us home.,23.81,71.13,0.0,60.0,-23.81,-11.13
91,We weren't far from – from where it was – maybe Fifth street – from where we had moved.,4.76,30.93,0.0,40.0,-4.76,9.07
92,"And – course with the horses and the police patrol, and the clang –",4.76,37.11,0.0,30.0,-4.76,-7.11
93,they had a bell that clanged. Clang clang clang –,20.24,43.3,0.0,30.0,-20.24,-13.3
94,you know they told you about the trolley that went “Clang.”,0.0,26.8,0.0,30.0,0.0,3.2
95,"Well this police patrol that bell they had, it went “Clang clang clang.”",5.95,22.68,0.0,30.0,-5.95,7.32
96,And um all the neighbors came running out to see what was happening.,26.19,52.58,0.0,30.0,-26.19,-22.58
97,And of course they saw the man came around the back –,2.38,19.59,0.0,30.0,-2.38,10.41
98,"I can see it right now – from where he was sitting up front there where the horses came around,",0.0,20.62,0.0,30.0,0.0,9.38
99,and opened the door in the back.,3.57,27.84,0.0,30.0,-3.57,2.16
100,And they had a long door in the back where you had to come down steps to get out the back of the – of this police patrol.,3.57,29.9,0.0,30.0,-3.57,0.1
101,Well we got out of that police patrol –,0.0,24.74,0.0,30.0,0.0,5.26
102,Before the patrol ever left my mother turned,0.0,59.79,0.0,60.0,0.0,0.21
103,"and faced all those people that were standing around,",2.38,57.73,0.0,50.0,-2.38,-7.73
104,"and she says, “Why you're doing this to me I don't know.”",13.1,51.55,0.0,60.0,-13.1,8.45
105,"She says, “I know that I am different from you, color wise,",16.67,61.86,0.0,60.0,-16.67,-1.86
106,"but in every other respect I'm just the same as you are,",4.76,62.89,0.0,70.0,-4.76,7.11
107,and all I'm trying to do is provide a home for my family.”,11.9,47.42,0.0,70.0,-11.9,22.58
108,"She told them that they had rented the house,",7.14,46.39,0.0,70.0,-7.14,23.61
109,"she told them how much money she had paid,",3.57,44.33,0.0,50.0,-3.57,5.67
110,she had told them that was all the money she had.,3.57,53.61,0.0,70.0,-3.57,16.39
111,And they had paid that rent for a month.,10.71,56.7,0.0,70.0,-10.71,13.3
112,She knew she was going to be there for the month.,3.57,53.61,0.0,50.0,-3.57,-3.61
113,She did not know beyond the month.,1.19,58.76,0.0,80.0,-1.19,21.24
114,Whether they'd have enough money to pay it for the next month.,3.57,55.67,0.0,90.0,-3.57,34.33
115,But she knew they were going to be there for the month.,8.33,57.73,0.0,60.0,-8.33,2.27
116,"She said, “It is winter time and it is cold.",5.95,46.39,0.0,60.0,-5.95,13.61
117,And I cannot afford to be buying windows.”,9.52,43.3,0.0,60.0,-9.52,16.7
118,"“Now” she said, “Whoever threw the stones I don't know.",0.0,35.05,0.0,60.0,0.0,24.95
119,But you can all see what has happened.,1.19,35.05,0.0,60.0,-1.19,24.95
120,And now I'm telling you that we're going to be here for a month.,7.14,40.21,0.0,90.0,-7.14,49.79
121,So you might just as well make up your mind to that.,16.67,50.52,0.0,70.0,-16.67,19.48
122,"If you don't want me here then you people get together and give me enough money to move somewhere else, because I do not have it.”",25.0,74.23,10.0,80.0,-15.0,5.77
123,Well of course you know they didn't do that.,2.38,26.8,0.0,40.0,-2.38,13.2
124,They probably didn't have any money either.,3.57,18.56,0.0,30.0,-3.57,11.44
125,"So in the meantime – not in the meantime but during, during the period of time that we were there, my father became sick.",50.0,63.92,50.0,100.0,0.0,36.08
126,And the neighbors were as nice as anybody could ever have been.,41.67,71.13,50.0,100.0,8.33,28.87
127,When there was trouble they responded just like anyone else.,8.33,58.76,40.0,100.0,31.67,41.24
128,But that was our welcoming to the neighborhood.,5.95,18.56,0.0,80.0,-5.95,61.44
129,And it was terrible,3.57,17.53,0.0,50.0,-3.57,32.47
130,and it certainly was frightening for me.,9.52,9.28,0.0,40.0,-9.52,30.72
