recall_id,clause_id,clause_text
5e1f321074dfbe028c2fbb18,16,but prayers without faith were useless.
5e1f321074dfbe028c2fbb18,17,The narrator had doubts as they were not particularly religious
5e1f321074dfbe028c2fbb18,18,and had done their fair share of misdeeds.
5e1f321074dfbe028c2fbb18,19,However they decided to go in to the church
5e1f321074dfbe028c2fbb18,20,and knelt down to pray for their grandpa to get better.
5e1f321074dfbe028c2fbb18,21,"After praying,"
5e1f321074dfbe028c2fbb18,22,the narrator returned to work.
5e1f321074dfbe028c2fbb18,23,"Back at the bookstore,"
5e1f321074dfbe028c2fbb18,24,they got a strong feeling pulling them to go home.
5e1f321074dfbe028c2fbb18,25,They left early
5e1f321074dfbe028c2fbb18,26,"and were astonished to see their grandpa sitting talking to their sister in the living room,"
5e1f321074dfbe028c2fbb18,27,despite the fact that their grandpa had been bedbound for several months.
5e1f321074dfbe028c2fbb18,28,Their grandpa lived for several more years
5e1f321074dfbe028c2fbb18,29,"and even got to celebrate his 90th birthday surrounded by loved ones,"
5e1f321074dfbe028c2fbb18,30,who were all more grateful for the time they had together having been through such a lifechanging experience.
5e1f321074dfbe028c2fbb18,31,The narrator was reflecting on this story 20 years later
5e1f321074dfbe028c2fbb18,32,and how it had been such a turning point for them.
60151380a2273d594f63aae3,1,I graduated at 22
60151380a2273d594f63aae3,2,and worked in a bookstore 5 miles away.
60151380a2273d594f63aae3,3,My sister was looking after my grandpa.
60151380a2273d594f63aae3,4,"One day while at work,"
60151380a2273d594f63aae3,5,I heard a voice asking me to go to the church nearby
60151380a2273d594f63aae3,6,and light a candle for my grandpa.
60151380a2273d594f63aae3,7,The voice said this twice.
60151380a2273d594f63aae3,8,I closed up the store
60151380a2273d594f63aae3,9,and walked to the church.
60151380a2273d594f63aae3,10,I said a clumsy prayer
60151380a2273d594f63aae3,11,as I am not religious.
60151380a2273d594f63aae3,12,"When I got home,"
60151380a2273d594f63aae3,13,my grandpa had gotten energy to get up from his months of being bedridden.
60151380a2273d594f63aae3,14,"He lived to his 90th birthday,"
60151380a2273d594f63aae3,15,when we had a party to celebrate him.
60151380a2273d594f63aae3,16,This has strengthened my faith
60151380a2273d594f63aae3,17,that you are never alone.
6447c2f4adb0bafcbae225bf,1,Let me tell you a story about a time when I was twenty two and had my first job in a book store.
6447c2f4adb0bafcbae225bf,2,My grandpa was staying with us and my sister was looking after him because he was unwell.
6447c2f4adb0bafcbae225bf,3,Our parents were out of town at the time.
6447c2f4adb0bafcbae225bf,4,There were only two of us siblings.
6447c2f4adb0bafcbae225bf,5,While I was working I heard a voice in my head telling me to go to the local church and light a candle and say a prayer for my grandpa's health.
6447c2f4adb0bafcbae225bf,6,I looked around but no one else had spoken.
6447c2f4adb0bafcbae225bf,7,I carried on working but heard the voice again.
6447c2f4adb0bafcbae225bf,8,I'm not particularly religious and I remember my grandma saying if you're sincere about saying a prayer it will be more effective.
6447c2f4adb0bafcbae225bf,9,If you're not then it wont.
6447c2f4adb0bafcbae225bf,10,I'm not a saint but I decided to go to the church.
6447c2f4adb0bafcbae225bf,11,"I locked up the shop, walked to the church and lit a candle and said a prayer."
6447c2f4adb0bafcbae225bf,12,I prayed for my grandpa's health and recovery.
6447c2f4adb0bafcbae225bf,13,I left the church and went back to the shop.
6447c2f4adb0bafcbae225bf,14,As I was stacking books I had a sudden urge to go home.
6447c2f4adb0bafcbae225bf,15,It was like something was pulling me to the house.
6447c2f4adb0bafcbae225bf,16,There was no voice this time.
6447c2f4adb0bafcbae225bf,17,I shut the shop and I went home.
6447c2f4adb0bafcbae225bf,18,To my surprise my grandpa was sat in a chair in the living room talking to my sister.
6447c2f4adb0bafcbae225bf,19,He hadn't been able to get out of bed for some time.
6447c2f4adb0bafcbae225bf,20,My sister told me earlier on he'd had a sudden surge of energy and had felt able to get out of bed and walk.
6447c2f4adb0bafcbae225bf,21,That was the start of my grandpa's recovery.
6447c2f4adb0bafcbae225bf,22,He slowly got better and was able to live independently again.
6447c2f4adb0bafcbae225bf,23,We treasured every moment with him.
6447c2f4adb0bafcbae225bf,24,He went on to live many more years and celebrated his ninetieth birthday surrounded by his family.
6447c2f4adb0bafcbae225bf,25,He passed away a few years after that but we were grateful for every moment we had with him.
6447c2f4adb0bafcbae225bf,26,I don't know if his recovery was influenced by my prayer but I often think about that moment.
6447c2f4adb0bafcbae225bf,27,It changed my perspective on faith and the power of it.
6447c2f4adb0bafcbae225bf,28,That incident was twenty years ago but I often think about it.
6447c2f4adb0bafcbae225bf,29,It's still a vivid memory for me.
6447c2f4adb0bafcbae225bf,30,It made me think about the power of faith and prayer and made think that we are never truly alone.
60f984adfea10999e9a39727,1,I was 22
60f984adfea10999e9a39727,2,and just out of college.
60f984adfea10999e9a39727,3,I was working in a bookstore.
60f984adfea10999e9a39727,4,My sister and I were caring for our Grandpa
60f984adfea10999e9a39727,5,while our parents were out of town.
60f984adfea10999e9a39727,6,While working I heard a voice in my head
60f984adfea10999e9a39727,7,saying to visit the church down the road
60f984adfea10999e9a39727,8,and say a prayer.
60f984adfea10999e9a39727,9,It repeated itself
60f984adfea10999e9a39727,10,and I walked to the church
60f984adfea10999e9a39727,11,after remembering my Grandma's words about prayers being answered if they were from a sincere heart.
60f984adfea10999e9a39727,12,I went to the church
60f984adfea10999e9a39727,13,and told God I didn't know how to pray
60f984adfea10999e9a39727,14,but asked for help for my Grandpa.
60f984adfea10999e9a39727,15,After work I went home
60f984adfea10999e9a39727,16,and found him out of bed
60f984adfea10999e9a39727,17,where he had been for months.
60f984adfea10999e9a39727,18,He gained more strength
60f984adfea10999e9a39727,19,and independence
60f984adfea10999e9a39727,20,and celebrated his 90th birthday with family.
60f984adfea10999e9a39727,21,He lived for many years after this.
60f984adfea10999e9a39727,22,This happened over 20 years ago
60f984adfea10999e9a39727,23,and I recall the feeling I had for faith
60f984adfea10999e9a39727,24,and prayer
60f984adfea10999e9a39727,25,and how it can bring about miracles.
5995b7bef9db7d0001895985,1,When working in a bookstore
5995b7bef9db7d0001895985,2,the writer heard a voice telling them to go to church
5995b7bef9db7d0001895985,3,and light a candle for his grandpa.
5995b7bef9db7d0001895985,4,They were staying in a quiet town
5995b7bef9db7d0001895985,5,with their sister
5995b7bef9db7d0001895985,6,and grandpa who was ill
5995b7bef9db7d0001895985,7,and had been bedridden for almost a year.
5995b7bef9db7d0001895985,8,When they were shelving books
5995b7bef9db7d0001895985,9,"they heard the voice,"
5995b7bef9db7d0001895985,10,they weren't sure what to do
5995b7bef9db7d0001895985,11,but heard the voice again
5995b7bef9db7d0001895985,12,so decided to walk down to the church.
5995b7bef9db7d0001895985,13,At the church
5995b7bef9db7d0001895985,14,they lit a candle for their grandpa.
5995b7bef9db7d0001895985,15,They weren't sure because they weren't particularly religious.
5995b7bef9db7d0001895985,16,After they had lit the candle
5995b7bef9db7d0001895985,17,they went back to work
5995b7bef9db7d0001895985,18,when they felt a pull to go home.
5995b7bef9db7d0001895985,19,Once they went home
5995b7bef9db7d0001895985,20,their grandpa was in the living room talking to their sister.
5995b7bef9db7d0001895985,21,The grandpa lived for a while after that
5995b7bef9db7d0001895985,22,and celebrated their 90th birthday with family and friends.
5756decbba27eb0006d5201e,1,It was a 22 year old fresh out of college
5756decbba27eb0006d5201e,2,who worked at a bookstore
5756decbba27eb0006d5201e,3,and lived with his sister and grandfather.
5756decbba27eb0006d5201e,4,His grandpa was unable to care for himself
5756decbba27eb0006d5201e,5,and was looked after his granddaughter.
5756decbba27eb0006d5201e,6,"While working at the bookstore,"
5756decbba27eb0006d5201e,7,our lead heard a voice
5756decbba27eb0006d5201e,8,that told him to go to church
5756decbba27eb0006d5201e,9,and light a candle.
5756decbba27eb0006d5201e,10,"Having heard the voice,"
5756decbba27eb0006d5201e,11,he decided to go there on his break.
5756decbba27eb0006d5201e,12,"While at the church,"
5756decbba27eb0006d5201e,13,he pondered and hesitated
5756decbba27eb0006d5201e,14,weighing up the push and pull of his decision;
5756decbba27eb0006d5201e,15,him not being religious
5756decbba27eb0006d5201e,16,"but also how his mom stated you if you don't believe in faith, it won't work."
5756decbba27eb0006d5201e,17,Our character tried it
5756decbba27eb0006d5201e,18,and prayed;
5756decbba27eb0006d5201e,19,"and miraculously, his grandpa could talk for the first time in years."
5756decbba27eb0006d5201e,20,It was the start of his recovery
5756decbba27eb0006d5201e,21,and led to many more years of his life before he passed.
5756decbba27eb0006d5201e,22,The 22 year old then had believed in faith more that day.
61376e55710e09d0b8f4dcb3,1,"Man worked in a bookstore,"
61376e55710e09d0b8f4dcb3,2,he was 22 with 1 sister
61376e55710e09d0b8f4dcb3,3,he heard a voice asking him to light a candle for his ill Grandpa
61376e55710e09d0b8f4dcb3,4,which he did
61376e55710e09d0b8f4dcb3,5,Miraculously his Grandpa healed
61376e55710e09d0b8f4dcb3,6,and made a full recovery
61376e55710e09d0b8f4dcb3,7,Sometimes you need faith
60b0cac3c6533bac7605471f,1,"A girl who worked at a book store after graduating year back and her sister were left to care for their grandpa who was very sick,"
60b0cac3c6533bac7605471f,2,and their parents had gone for a weekend.
60b0cac3c6533bac7605471f,3,"One time when she was book shelving she heard a voice telling her to go to church and light candle for her grandpa to get back,"
60b0cac3c6533bac7605471f,4,"she looked around to see who was telling her this but didn't see anyone,"
60b0cac3c6533bac7605471f,5,then she continued bookshelving and again hears the same voice.
60b0cac3c6533bac7605471f,6,She wasn't a religious person but her late grandma always told them prayer works
60b0cac3c6533bac7605471f,7,but inorder for it to manifest you need to have faith otherwise you just wasting time praying without faith.
60b0cac3c6533bac7605471f,8,"So she decided to go to the church found the candle and she prayed unto God whole heartedly to heal her grandpa,"
60b0cac3c6533bac7605471f,9,after that she went back to book store
60b0cac3c6533bac7605471f,10,"as she was working she suddenly felt the urge to go home like something was pulling her to go home so she did,"
60b0cac3c6533bac7605471f,11,and found her grandpa whom had not been able to get out of the bed because he was so weak found him seated on the couch
60b0cac3c6533bac7605471f,12,and after that he gradually healed.
60b0cac3c6533bac7605471f,13,He live long after that
60b0cac3c6533bac7605471f,14,and eventually passed away.
568db47ae3ef9e000ca0dcdd,1,"Guy works at bookstore,"
568db47ae3ef9e000ca0dcdd,2,hears voice telling him to light a candle to heal his ailing granddad.
568db47ae3ef9e000ca0dcdd,3,"He does,"
568db47ae3ef9e000ca0dcdd,4,"it works,"
568db47ae3ef9e000ca0dcdd,5,Granddad lives to be 90 something and dies.
6298d6f2015f1d50783c0ed9,1,I was 22
6298d6f2015f1d50783c0ed9,2,and I worked in the bookstore.
6298d6f2015f1d50783c0ed9,3,My grandpa was very sick
6298d6f2015f1d50783c0ed9,4,and needed assistance to walk around.
6298d6f2015f1d50783c0ed9,5,"One day, I heard a voice telling me to go to the old church"
6298d6f2015f1d50783c0ed9,6,and light up a candle to heal my grandpa.
6298d6f2015f1d50783c0ed9,7,"Initially, I didn't want to go"
6298d6f2015f1d50783c0ed9,8,because I was not religious
6298d6f2015f1d50783c0ed9,9,but then I remembered my grandma's words about prayer
6298d6f2015f1d50783c0ed9,10,and the importance of faith
6298d6f2015f1d50783c0ed9,11,and I decided to go.
6298d6f2015f1d50783c0ed9,12,"At the church, I prayed deep from my heart"
6298d6f2015f1d50783c0ed9,13,and asked God to return my grandpa's strength.
6298d6f2015f1d50783c0ed9,14,When I returned home from work due to a strong feeling
6298d6f2015f1d50783c0ed9,15,I saw my grandpa suddenly being able to talk to my sister at a good amount of strength
6298d6f2015f1d50783c0ed9,16,after months of staying in bed.
6298d6f2015f1d50783c0ed9,17,This began his recovery
6298d6f2015f1d50783c0ed9,18,and he went on to leave for 20 years afterwards
6298d6f2015f1d50783c0ed9,19,even celebrating his 90th once.
6298d6f2015f1d50783c0ed9,20,This experience has changed my life
6298d6f2015f1d50783c0ed9,21,and perspective on faith.
5acb92e9e1099600016ad073,1,The narrator is in their 40s
5acb92e9e1099600016ad073,2,and recalled when they were 22 years old
5acb92e9e1099600016ad073,3,a day when they were working 5 miles away at a local bookstore.
5acb92e9e1099600016ad073,4,They heard a voice twice in their head
5acb92e9e1099600016ad073,5,(no one was there)
5acb92e9e1099600016ad073,6,telling them to go to church
5acb92e9e1099600016ad073,7,and pray/light a candle for their sick Grandpa.
5acb92e9e1099600016ad073,8,They hesitated as they weren't religious
5acb92e9e1099600016ad073,9,but remembered their Grandma said a sincere prayer could help.
5acb92e9e1099600016ad073,10,Eventually they went in the church
5acb92e9e1099600016ad073,11,and prayed/lit a candle.
5acb92e9e1099600016ad073,12,When they went home their Grandpa was feeling better
5acb92e9e1099600016ad073,13,and it marked a turning point in his recovery.
5acb92e9e1099600016ad073,14,He has now died
5acb92e9e1099600016ad073,15,but celebrated his ninetieth birthday
5acb92e9e1099600016ad073,16,and was around for many months after the incident.
5acb92e9e1099600016ad073,17,The event gave the narrator more faith.
5ba7aa44dd5915000137e42f,1,Let me tell you a story
5ba7aa44dd5915000137e42f,2,from when I was 22 year old.
5ba7aa44dd5915000137e42f,3,I’d just finished college.
5ba7aa44dd5915000137e42f,4,I was working at a bookstore.
5ba7aa44dd5915000137e42f,5,"My parents were away for the weekend,"
5ba7aa44dd5915000137e42f,6,it was only my sister and I in town
5ba7aa44dd5915000137e42f,7,to look after my grandpa.
5ba7aa44dd5915000137e42f,8,He was poorly
5ba7aa44dd5915000137e42f,9,and couldn’t get out of bed.
5ba7aa44dd5915000137e42f,10,That was over 20 years ago
5ba7aa44dd5915000137e42f,11,and I can remember it to this day.
63d1494c8ed3bc3d40494d45,1,A boy
63d1494c8ed3bc3d40494d45,2,who worked at a bookstore
63d1494c8ed3bc3d40494d45,3,who's grandfather was ill.
63d1494c8ed3bc3d40494d45,4,But he heard a voice in his head
63d1494c8ed3bc3d40494d45,5,to light a candle at the church
63d1494c8ed3bc3d40494d45,6,for his grandfather to get better.
63d1494c8ed3bc3d40494d45,7,In which his grandfather did get better
63d1494c8ed3bc3d40494d45,8,"and lived for many years after,"
63d1494c8ed3bc3d40494d45,9,but it all came down to having faith
63d1494c8ed3bc3d40494d45,10,goes a long way.
5c93073250e4fb0001f7907b,1,"Let me tell you a story about a time when I was twenty two years old,"
5c93073250e4fb0001f7907b,2,fresh out of college.
5c93073250e4fb0001f7907b,3,I got a job at a bookstore.
5c93073250e4fb0001f7907b,4,My sister took care of my grandpa.
5c93073250e4fb0001f7907b,5,It was just us two siblings.
5c93073250e4fb0001f7907b,6,Our parents were away.
5c93073250e4fb0001f7907b,7,I was shelving books and heard a voice tell me to go to the church and light a candle for my grandpa and he would feel better.
5c93073250e4fb0001f7907b,8,I looked around the store and no one else was in there.
5c93073250e4fb0001f7907b,9,I heard the voice again.
5c93073250e4fb0001f7907b,10,I looked around again and still nobody was in the store.
5c93073250e4fb0001f7907b,11,I continued shelving books.
5c93073250e4fb0001f7907b,12,I am not particularly religious and have been told that a prayer will not mean anything if I don't believe.
5c93073250e4fb0001f7907b,13,I decided to walk to the church I was about a quarter mile close to it and light a candle for grandpa.
5c93073250e4fb0001f7907b,14,I was back at the bookstore when I had a strong feeling to go to the house.
5c93073250e4fb0001f7907b,15,"Not a voice this time, an overwhelming feeling."
5c93073250e4fb0001f7907b,16,I locked the bookstore and went home to find my grandpa sitting in a chair in the living room with my sister.
5c93073250e4fb0001f7907b,17,He had not been able to get out of bed for months.
5c93073250e4fb0001f7907b,18,My sister told me he suddenly had a surge of energy and was able to get out of bed and walk to the chair.
5c93073250e4fb0001f7907b,19,It was amazing to see.
5c93073250e4fb0001f7907b,20,That was the day he gradually began to get better.
5c93073250e4fb0001f7907b,21,He got more energy and lived a few more years.
5c93073250e4fb0001f7907b,22,We got to cherish our time with him.
5c93073250e4fb0001f7907b,23,You are never truly alone.
60d05712d155f607f2b7f664,1,I was 22 years old
60d05712d155f607f2b7f664,2,"and freshly graduated from college,"
60d05712d155f607f2b7f664,3,it was about 5 miles from here.
60d05712d155f607f2b7f664,4,I was working in a bookstore at the time.
60d05712d155f607f2b7f664,5,"My sister was looking after my bedridden grandpa,"
60d05712d155f607f2b7f664,6,my parents were out of town for the weekend.
60d05712d155f607f2b7f664,7,I was stocking the shelves one day
60d05712d155f607f2b7f664,8,and a voice told me that I should go to the church
60d05712d155f607f2b7f664,9,and light a candle
60d05712d155f607f2b7f664,10,and my grandpa would get better.
60d05712d155f607f2b7f664,11,I looked around
60d05712d155f607f2b7f664,12,but I was alone.
60d05712d155f607f2b7f664,13,The voice said it again.
60d05712d155f607f2b7f664,14,I took a break
60d05712d155f607f2b7f664,15,and walked to the church
60d05712d155f607f2b7f664,16,it was only about a quarter-mile away.
60d05712d155f607f2b7f664,17,I was never a religious person
60d05712d155f607f2b7f664,18,but I felt the need to confess that I was not a perfect person
60d05712d155f607f2b7f664,19,but I should have faith.
60d05712d155f607f2b7f664,20,I grabbed a candle
60d05712d155f607f2b7f664,21,and knelt at the alter
60d05712d155f607f2b7f664,22,and prayed about my grandpa getting better.
60d05712d155f607f2b7f664,23,I went back to the bookstore
60d05712d155f607f2b7f664,24,"and felt the urge to go home,"
60d05712d155f607f2b7f664,25,it was like a force was pulling me home
60d05712d155f607f2b7f664,26,but there was no voice this time.
60d05712d155f607f2b7f664,27,I went home
60d05712d155f607f2b7f664,28,"and found my grandpa sitting in the living room in a chair,"
60d05712d155f607f2b7f664,29,he hadn't been able to get out of bed for months.
60d05712d155f607f2b7f664,30,My sister said he had a sudden surge of energy.
60d05712d155f607f2b7f664,31,That was the start of my grandpas road to recovery.
60d05712d155f607f2b7f664,32,He lived for many years cherished by our family.
60d05712d155f607f2b7f664,33,"That was about 20 years ago,"
60d05712d155f607f2b7f664,34,he passed away a couple years ago.
60d05712d155f607f2b7f664,35,His spirit lives on in all of our hearts.
61fa9016d42cb19beec49061,1,The narrator recalled how twenty years ago he worked in a bookshop
61fa9016d42cb19beec49061,2,and his sister cared for their grandfather.
61fa9016d42cb19beec49061,3,There parents were out of town.
61fa9016d42cb19beec49061,4,His grandfather was unwell
61fa9016d42cb19beec49061,5,and had been bedridden for weeks.
61fa9016d42cb19beec49061,6,One day in the bookshop he was shelving books
61fa9016d42cb19beec49061,7,and heard a voice which told him to go to church
61fa9016d42cb19beec49061,8,and pray for his grandfather.
61fa9016d42cb19beec49061,9,He initially ignored it
61fa9016d42cb19beec49061,10,but then it came again.
61fa9016d42cb19beec49061,11,He decided to shut the bookshop
61fa9016d42cb19beec49061,12,and go to the church.
61fa9016d42cb19beec49061,13,"At the church he remembered his grandmother's words about prayer and faith,"
61fa9016d42cb19beec49061,14,"that faithful prayer could work,"
61fa9016d42cb19beec49061,15,but a prayer without faith would do nothing.
61fa9016d42cb19beec49061,16,He went to the altar
61fa9016d42cb19beec49061,17,and asked God for his grandfather's health
61fa9016d42cb19beec49061,18,and guidance on what they should do.
61fa9016d42cb19beec49061,19,He went back to the bookshop
61fa9016d42cb19beec49061,20,but felt a strong urge to go home.
61fa9016d42cb19beec49061,21,At home he found his grandfather was feeling much better
61fa9016d42cb19beec49061,22,and was out of bed and talking.
61fa9016d42cb19beec49061,23,After his recovery the family valued the remaining time they had with him
61fa9016d42cb19beec49061,24,and he lived many years after that.
5fd7c98ecffb0b080c0f1c84,1,"At 22 years old,"
5fd7c98ecffb0b080c0f1c84,2,the young adult began his first job at a local bookstore.
5fd7c98ecffb0b080c0f1c84,3,His parents were out of town
5fd7c98ecffb0b080c0f1c84,4,and lived with his bedridden grandpa.
5fd7c98ecffb0b080c0f1c84,5,"At work,"
5fd7c98ecffb0b080c0f1c84,6,"he heard a voice telling him to go to the local church,"
5fd7c98ecffb0b080c0f1c84,7,light a candle
5fd7c98ecffb0b080c0f1c84,8,and pray
5fd7c98ecffb0b080c0f1c84,9,and the grandpa will get better.
5fd7c98ecffb0b080c0f1c84,10,"The young adult was not at all religious,"
5fd7c98ecffb0b080c0f1c84,11,however recalled how his grandpa would pray.
5fd7c98ecffb0b080c0f1c84,12,The young adult lit the candle
5fd7c98ecffb0b080c0f1c84,13,"and spoke to God,"
5fd7c98ecffb0b080c0f1c84,14,without knowing what to say
5fd7c98ecffb0b080c0f1c84,15,asked for his grandpa's healing.
5fd7c98ecffb0b080c0f1c84,16,As he went back to work
5fd7c98ecffb0b080c0f1c84,17,he had a strong urge to go home.
5fd7c98ecffb0b080c0f1c84,18,"To his surprise,"
5fd7c98ecffb0b080c0f1c84,19,"he saw his grandpa in the living room,"
5fd7c98ecffb0b080c0f1c84,20,he slowly gained more strength
5fd7c98ecffb0b080c0f1c84,21,and lived a good few years
5fd7c98ecffb0b080c0f1c84,22,and died at 90 years.
5e377e7147f5527223aee301,1,Story teller was 22 when he started working at a bookstore.
5e377e7147f5527223aee301,2,His grandpa had been bedridden for a while
5e377e7147f5527223aee301,3,and was home with his sister
5e377e7147f5527223aee301,4,and she was taking care of him since he couldn't move alone.
5e377e7147f5527223aee301,5,"One day when his parents were gone for a weekend,"
5e377e7147f5527223aee301,6,he was at work
5e377e7147f5527223aee301,7,and heard a voice in his head continuously telling him that he should go to the church
5e377e7147f5527223aee301,8,and light a candle for his grandpa to get better.
5e377e7147f5527223aee301,9,He thought it was a prank
5e377e7147f5527223aee301,10,and looked around
5e377e7147f5527223aee301,11,"but didn't see anyone else there,"
5e377e7147f5527223aee301,12,but the voice kept repeating.
5e377e7147f5527223aee301,13,He left work to go to the church
5e377e7147f5527223aee301,14,and tried it.
5e377e7147f5527223aee301,15,"He remembered his grandma saying ""prayers from the heart can bring miracles""."
5e377e7147f5527223aee301,16,He lit a candle
5e377e7147f5527223aee301,17,and said a prayer that admitted he doesn't do it often
5e377e7147f5527223aee301,18,but he would like his grandpa to get better.
5e377e7147f5527223aee301,19,He went back to work
5e377e7147f5527223aee301,20,"and continued his job,"
5e377e7147f5527223aee301,21,but had a sudden urge to go home.
5e377e7147f5527223aee301,22,The storyteller went home to follow the urge
5e377e7147f5527223aee301,23,and when he got home his grandpa was sitting upright on the couch.
5e377e7147f5527223aee301,24,He was astonished as his grandpa had never been able to do so for around a year.
5e377e7147f5527223aee301,25,He thinks back to the day in the church
5e377e7147f5527223aee301,26,and if it played a role in his grandpa's recovery.
5e377e7147f5527223aee301,27,His grandpa had to be around 70 at the time
5e377e7147f5527223aee301,28,as they spent another 20 years together from that moment.
5e377e7147f5527223aee301,29,"Ever since that moment, the storyteller has believed in faith."
60db48619d10beb5c73430f5,1,The author was about 21
60db48619d10beb5c73430f5,2,and home from college.
60db48619d10beb5c73430f5,3,Her sister was looking after her grandpa
60db48619d10beb5c73430f5,4,who was bed bound.
60db48619d10beb5c73430f5,5,She heard a voice saying that she should light a candle at the church.
60db48619d10beb5c73430f5,6,She tried to ignore the feeling
60db48619d10beb5c73430f5,7,as she wasn't particularly religious
60db48619d10beb5c73430f5,8,and her grandma said praying without faith is useless.
60db48619d10beb5c73430f5,9,But she gave in
60db48619d10beb5c73430f5,10,and lit the candle
60db48619d10beb5c73430f5,11,and prayed.
60db48619d10beb5c73430f5,12,Then she felt a voice inside of herself saying she should go home.
60db48619d10beb5c73430f5,13,When she arrived home
60db48619d10beb5c73430f5,14,her grandpa was sitting upright
60db48619d10beb5c73430f5,15,"and talking to her sister,"
60db48619d10beb5c73430f5,16,he said he felt a sudden feeling/change.
60db48619d10beb5c73430f5,17,From that day on he was getting better and better
60db48619d10beb5c73430f5,18,and he celebrated his 90th birthday with his family.
60db48619d10beb5c73430f5,19,and a few years later he died.
60db48619d10beb5c73430f5,20,From that day the author started believing in the power of prayer.
5de16fd00e58661bb3519db8,1,Let me share a story.
5de16fd00e58661bb3519db8,2,"I was twenty-two years old, fresh out of college."
