recall_id,clause_id,clause_text
5a66568a63394a0001558e4d,4,"Suddenly, I heard a voice in my head that said ""light a candle for your grandpa at the church""."
5a66568a63394a0001558e4d,5,I was only a short distance from the church.
5a66568a63394a0001558e4d,6,A quarter mile.
5a66568a63394a0001558e4d,7,I had never been a religious man but my grandma had told me the power of faith.
5a66568a63394a0001558e4d,8,"As I entered the church, I knelt and said ""God, I don't know how to pray. but please restore my grandpa to his strength and guide us in looking after him""."
5a66568a63394a0001558e4d,9,I returned to the bookshop after.
5a66568a63394a0001558e4d,10,"Suddenly, I felt a strong urge to return home."
5a66568a63394a0001558e4d,11,I locked up the shop and went home.
5a66568a63394a0001558e4d,12,I was shocked to find my grandpa in the living room talking to my sister.
5a66568a63394a0001558e4d,13,He hadn't left his bed for months without assistance.
5a66568a63394a0001558e4d,14,He lived for many more years and celebrated his ninetieth birthday surrounded by his loved one.
5a66568a63394a0001558e4d,15,He died several years later but his spirit lives on in our hearts.
5ced0ccddfb2720019962226,1,The boy took a job in bookstore during his break from university
5ced0ccddfb2720019962226,2,and his sister was looking after their grandad
5ced0ccddfb2720019962226,3,as his parents were away for the weekend
5ced0ccddfb2720019962226,4,his grandad had been bedridden for some time
5ced0ccddfb2720019962226,5,while book stacking he heard a voice tell him to go light a candle
5ced0ccddfb2720019962226,6,and say a prayer for his grandad
5ced0ccddfb2720019962226,7,so he did
5ced0ccddfb2720019962226,8,"even though he wasn't a church goer,"
5ced0ccddfb2720019962226,9,when he got back to bookstore he felt a sudden urge to go home
5ced0ccddfb2720019962226,10,where he found his grandad sitting in the kitchen looking much better
5ced0ccddfb2720019962226,11,and some thing he hadn't done for some time
5ced0ccddfb2720019962226,12,he said he felt sudden surge of energy and strength
5ced0ccddfb2720019962226,13,maybe the prayer and lighting of the candle had worked
5ced0ccddfb2720019962226,14,his grandad got healthier and stronger
5ced0ccddfb2720019962226,15,and lived to ninety.
5f4cc45ee974b18dbf4a503d,1,A twenty two year old person had just finished college
5f4cc45ee974b18dbf4a503d,2,and was working in a book store.
5f4cc45ee974b18dbf4a503d,3,He had a sickly grandfather
5f4cc45ee974b18dbf4a503d,4,and a sister that looked after him.
5f4cc45ee974b18dbf4a503d,5,Whilst packing the shelves he heard a voice in his head
5f4cc45ee974b18dbf4a503d,6,that said he should go to the church
5f4cc45ee974b18dbf4a503d,7,and light a candle for his grandfather.
5f4cc45ee974b18dbf4a503d,8,He looked around the book store
5f4cc45ee974b18dbf4a503d,9,and didn't see anyone
5f4cc45ee974b18dbf4a503d,10,then heard the voice say the same thing again.
5f4cc45ee974b18dbf4a503d,11,"He decided to go down to the church,"
5f4cc45ee974b18dbf4a503d,12,"even though he isn't religious,"
5f4cc45ee974b18dbf4a503d,13,and light a candle
5f4cc45ee974b18dbf4a503d,14,and say a little prayer.
5f4cc45ee974b18dbf4a503d,15,Later he got home
5f4cc45ee974b18dbf4a503d,16,and his grandfather was feeling a little better.
5f4cc45ee974b18dbf4a503d,17,He lived for 20 more years
5f4cc45ee974b18dbf4a503d,18,and now the person seems more religious
5f4cc45ee974b18dbf4a503d,19,and takes comfort in his memories of his grandfather.
5c6c81cf1137e9000178795b,1,"When he was 22 years old,"
5c6c81cf1137e9000178795b,2,he worked in a book store
5c6c81cf1137e9000178795b,3,which was five miles from his house.
5c6c81cf1137e9000178795b,4,He lived with his sister
5c6c81cf1137e9000178795b,5,and grandpa
5c6c81cf1137e9000178795b,6,who was bedridden for many years.
5c6c81cf1137e9000178795b,7,"Whilst in the bookstore,"
5c6c81cf1137e9000178795b,8,he heard a voice telling him to pray
5c6c81cf1137e9000178795b,9,and he remembered his grandma told him pray brings miracles
5c6c81cf1137e9000178795b,10,so he went to church
5c6c81cf1137e9000178795b,11,and asked God to help his grandpa
5c6c81cf1137e9000178795b,12,even though he wasn't religious
5c6c81cf1137e9000178795b,13,he was asking for a miracle.
5c6c81cf1137e9000178795b,14,He was then told by his sister
5c6c81cf1137e9000178795b,15,that his grandpa suddenly left the bed
5c6c81cf1137e9000178795b,16,which he believed was a miracle.
5c6c81cf1137e9000178795b,17,His grandpa celebrated his 90th birthday
5c6c81cf1137e9000178795b,18,and passed away a few years later.
615e0a9b470e2794d8318046,1,A boy worked in a book shop.
615e0a9b470e2794d8318046,2,"He had one sister who looked after his grandfather,"
615e0a9b470e2794d8318046,3,who wasn’t able to look after himself.
615e0a9b470e2794d8318046,4,"One day while shelving books, the boy heard a voice"
615e0a9b470e2794d8318046,5,that told him to go to the church and light a candle for his grandfather.
615e0a9b470e2794d8318046,6,"If he did this, and prayed, his grandfather would regain his strength."
615e0a9b470e2794d8318046,7,His grandfather hadn’t been able to leave his bed for months.
615e0a9b470e2794d8318046,8,The church wasn’t far down the road so the boy went.
615e0a9b470e2794d8318046,9,He found a candle and kneeled down.
615e0a9b470e2794d8318046,10,He wasn’t a very religious person so he started his prayer by saying he wasn’t sure how to pray.
615e0a9b470e2794d8318046,11,He asked for his grandfather to regain his strength.
615e0a9b470e2794d8318046,12,When the boys was back at the book shop he had an overwhelming feeling to go home.
615e0a9b470e2794d8318046,13,So he closed the bookshop and went home.
615e0a9b470e2794d8318046,14,"When he arrived home his grandfather was sitting downstairs,"
615e0a9b470e2794d8318046,15,and he hadn’t been able to leave the bed in months.
615e0a9b470e2794d8318046,16,His grandfather lived for many more years
615e0a9b470e2794d8318046,17,and they all cherished the time they had with him.
615e0a9b470e2794d8318046,18,The boy looked back and wondered did his prayer have anything to do with his grandfather regaining his strength and recovering.
616d8ff5eeb9a8616afa647d,1,"The story takes place some years years ago,"
616d8ff5eeb9a8616afa647d,2,when the storyteller was young.
616d8ff5eeb9a8616afa647d,3,He had a sister.
616d8ff5eeb9a8616afa647d,4,His grandfather was very unwell and was bed ridden.
616d8ff5eeb9a8616afa647d,5,"One day he was working in a bookshop stacking shelves,"
616d8ff5eeb9a8616afa647d,6,when he heard a voice in his head.
616d8ff5eeb9a8616afa647d,7,The voice was telling him to go to the local church and light a candle for his grandfather.
616d8ff5eeb9a8616afa647d,8,"He looked around the store,"
616d8ff5eeb9a8616afa647d,9,but he was alone.
616d8ff5eeb9a8616afa647d,10,He went back to stacking books
616d8ff5eeb9a8616afa647d,11,but he kept on hearing the voice.
616d8ff5eeb9a8616afa647d,12,"Although he was not religious,"
616d8ff5eeb9a8616afa647d,13,he decided to go to the local church and do as the voice said.
616d8ff5eeb9a8616afa647d,14,When he got to the church he said a prayer for this grandfather.
616d8ff5eeb9a8616afa647d,15,He returned to the bookshop and continued to stack shelves.
616d8ff5eeb9a8616afa647d,16,"However, he soon had an overwhelming feeling to return home,"
616d8ff5eeb9a8616afa647d,17,so he locked up the bookshop and went home.
616d8ff5eeb9a8616afa647d,18,When he entered he heard his grandad talking to his sister in the living room.
616d8ff5eeb9a8616afa647d,19,His prayer seemed to have been answered and his grandad got better.
616d8ff5eeb9a8616afa647d,20,He celebrated his ninetieth birthday and died shortly afterwards.
616d8ff5eeb9a8616afa647d,21,The event had a big impact on the storytellers life
616d8ff5eeb9a8616afa647d,22,and from that dat forth he gained faith.
5772b5b39137f30001ebbbb7,1,"Let me tell you a story about when I was twenty two,"
5772b5b39137f30001ebbbb7,2,fresh out of college.
5772b5b39137f30001ebbbb7,3,I was working in a bookstore
5772b5b39137f30001ebbbb7,4,and living with my sister then.
5772b5b39137f30001ebbbb7,5,"My sister was taking care of my grandpa,"
5772b5b39137f30001ebbbb7,6,who was bedridden.
5772b5b39137f30001ebbbb7,7,One day as I was working
5772b5b39137f30001ebbbb7,8,I heard a voice in my head telling me to go to the church yard.
5772b5b39137f30001ebbbb7,9,I am not a particularly religious person.
5772b5b39137f30001ebbbb7,10,I heard the voice again
5772b5b39137f30001ebbbb7,11,and went looking for the church.
5772b5b39137f30001ebbbb7,12,I found the church
5772b5b39137f30001ebbbb7,13,and I prayed.
5772b5b39137f30001ebbbb7,14,After that I went home.
5772b5b39137f30001ebbbb7,15,My sister was there
5772b5b39137f30001ebbbb7,16,and she told me my grandfather had experienced a sudden surge of energy.
5772b5b39137f30001ebbbb7,17,That marked the beginning of his recovery.
5772b5b39137f30001ebbbb7,18,After that he steadily got better
5772b5b39137f30001ebbbb7,19,and made a full recovery.
5772b5b39137f30001ebbbb7,20,That was twenty years ago
5772b5b39137f30001ebbbb7,21,and he went on to live a full life till he passed at the age of ninety.
5772b5b39137f30001ebbbb7,22,That was the beginning of my faith.
5772b5b39137f30001ebbbb7,23,Sometimes when things get tough
5772b5b39137f30001ebbbb7,24,I still look back on that moment
5772b5b39137f30001ebbbb7,25,and remember the power of faith and prayer.
5b9110223366db0001157e7d,1,as a young man
5b9110223366db0001157e7d,2,he had just started his first job
5b9110223366db0001157e7d,3,and a voice inside his head urged him
5b9110223366db0001157e7d,4,to go to the church
5b9110223366db0001157e7d,5,"and light a candle,"
5b9110223366db0001157e7d,6,he did
5b9110223366db0001157e7d,7,and his grandpa recovered.
5b9110223366db0001157e7d,8,This incident made him believe
5b9110223366db0001157e7d,9,in faith
5b9110223366db0001157e7d,10,and prayer.
60199b0a7384e30ddf3a7c55,1,HE WAS 22
60199b0a7384e30ddf3a7c55,2,AND STARTED FIRST JOB IN BOOKSHOP.
60199b0a7384e30ddf3a7c55,3,HIS GRANDA WAS BEDRIDDEN
60199b0a7384e30ddf3a7c55,4,AND WAS BEING CARED FOR BY HIS SISTER.
60199b0a7384e30ddf3a7c55,5,HE HAD A LIGHT BULB MOMENT
60199b0a7384e30ddf3a7c55,6,WHERE HE WAS TOLD TO LIGHT A CANDLE IN THE LOCAL CHURCH
60199b0a7384e30ddf3a7c55,7,AND HIS GRANDPA MIGHT IMPROVE
60199b0a7384e30ddf3a7c55,8,BUT HE WAS ALONE.
60199b0a7384e30ddf3a7c55,9,HE KEPT HEARING THE VOICE.
60199b0a7384e30ddf3a7c55,10,HE TOOK A BREAK
60199b0a7384e30ddf3a7c55,11,AND WENT TO THE CHURCH NOT FAR.
60199b0a7384e30ddf3a7c55,12,AFTER SOME HESITATION
60199b0a7384e30ddf3a7c55,13,"HE ENTERED THE CHURCH,"
60199b0a7384e30ddf3a7c55,14,GOT A CANDLE
60199b0a7384e30ddf3a7c55,15,AND KNELT DOWN
60199b0a7384e30ddf3a7c55,16,AND ASKED FOR HIS GRANDPA TO BE HEALED.
60199b0a7384e30ddf3a7c55,17,HE RETURNED TO THE BOOKSHOP
60199b0a7384e30ddf3a7c55,18,BUT NEEDED TO GO HOME
60199b0a7384e30ddf3a7c55,19,AS HE WAS INSPIRED
60199b0a7384e30ddf3a7c55,20,AND WHEN HE GOT THERE HIS GRANDPA WAS ABLE TO LEAVE HIS BED UNASSISTED.
60199b0a7384e30ddf3a7c55,21,HE FINALLY REGAINED HIS INDEPENDENCE
60199b0a7384e30ddf3a7c55,22,AND CHANGED EVERYONES LIFE FOR THE BETTER
60199b0a7384e30ddf3a7c55,23,AND LIVED INTO HIS NINTIES
60199b0a7384e30ddf3a7c55,24,AND MAYBE PRAYER AND FAITH IS THE ANSWER.
5cfaf97eadb3da00013c1eaa,1,There was a boy who had a sister and a grandpa.
5cfaf97eadb3da00013c1eaa,2,His grandma had died.
5cfaf97eadb3da00013c1eaa,3,His grandpa was very weak.
5cfaf97eadb3da00013c1eaa,4,He could not care for himself.
5cfaf97eadb3da00013c1eaa,5,"Therefore, he worked in the bookstore."
5cfaf97eadb3da00013c1eaa,6,His sister took care of the grandpa.
5cfaf97eadb3da00013c1eaa,7,"One day while at the bookstore, he heard a voice twice."
5cfaf97eadb3da00013c1eaa,8,The voice told him to go to the church.
5cfaf97eadb3da00013c1eaa,9,He was to light a candle and pray for the grandpa.
5cfaf97eadb3da00013c1eaa,10,"On his way, he hesitated."
5cfaf97eadb3da00013c1eaa,11,"But still, he went ahead and prayed a simple prayer for his grandpa's healing."
5cfaf97eadb3da00013c1eaa,12,He was not a particularly religious person.
5cfaf97eadb3da00013c1eaa,13,His grandma always told him prayer should come from a sincere heart.
5cfaf97eadb3da00013c1eaa,14,These were the reasons for his resistance.
5cfaf97eadb3da00013c1eaa,15,"However, back at the bookstore, while resuming his tasks, he felt a strong urge to go home."
5cfaf97eadb3da00013c1eaa,16,"After obliging, he was surprised to find his grandpa sitting in a chair."
5cfaf97eadb3da00013c1eaa,17,His grandpa was chatting with his sister.
5cfaf97eadb3da00013c1eaa,18,This was not normal as he was unable to get up from bed.
5cfaf97eadb3da00013c1eaa,19,Grandpa explained that he felt a surge of energy a while ago.
5cfaf97eadb3da00013c1eaa,20,His sister was happy.
5cfaf97eadb3da00013c1eaa,21,The writer could not believe this had anything to do with his prayer.
5cfaf97eadb3da00013c1eaa,22,"Grandpa, however, made continuous recovery."
5cfaf97eadb3da00013c1eaa,23,He lived a long time after that.
5cfaf97eadb3da00013c1eaa,24,He died at about ninety years in the midst of family and friends.
5cfaf97eadb3da00013c1eaa,25,This taught the writer about faith.
5cfaf97eadb3da00013c1eaa,26,There is another presence with us even though we seem to be alone.
5cfaf97eadb3da00013c1eaa,27,There's always someone looking out for us.
62a1ef4b118ae7c6c666e130,1,The story is about a 22 year old
62a1ef4b118ae7c6c666e130,2,that was hearing voices in their head
62a1ef4b118ae7c6c666e130,3,& also had an ill grandpa.
62a1ef4b118ae7c6c666e130,4,They prayed for their grandpa to get better
62a1ef4b118ae7c6c666e130,5,which he did
62a1ef4b118ae7c6c666e130,6,but he eventually died.
62a1ef4b118ae7c6c666e130,7,The moral of the story was to always have faith
62a1ef4b118ae7c6c666e130,8,& that you’re never alone.
55ad3f2dfdf99b563a2471c8,1,When I was twenty two years old
55ad3f2dfdf99b563a2471c8,2,I was working in a book store.
55ad3f2dfdf99b563a2471c8,3,At the time my grandpa became unwell.
55ad3f2dfdf99b563a2471c8,4,Whilst stacking books in the store
55ad3f2dfdf99b563a2471c8,5,I heard a voice telling me to go to the alter and light a candle for him.
55ad3f2dfdf99b563a2471c8,6,I looked around
55ad3f2dfdf99b563a2471c8,7,but couldn't see anyone
55ad3f2dfdf99b563a2471c8,8,but the voice remained.
55ad3f2dfdf99b563a2471c8,9,"My grandma always told me a prayer from a sincere heart can have a meaningful impact,"
55ad3f2dfdf99b563a2471c8,10,but a prayer from someone with no faith is meaningless.
55ad3f2dfdf99b563a2471c8,11,I know I am not a saint
55ad3f2dfdf99b563a2471c8,12,as I have made many mistakes.
55ad3f2dfdf99b563a2471c8,13,But as I was leaving the store
55ad3f2dfdf99b563a2471c8,14,I felt compelled to turn around and go to pray.
55ad3f2dfdf99b563a2471c8,15,I said my prayer
55ad3f2dfdf99b563a2471c8,16,that I don't know how to pray
55ad3f2dfdf99b563a2471c8,17,but would like support for my grandpa.
55ad3f2dfdf99b563a2471c8,18,Once I returned home
55ad3f2dfdf99b563a2471c8,19,"I was surprised to see my grandpa in the living room,"
55ad3f2dfdf99b563a2471c8,20,my sister told me he had started to recover.
55ad3f2dfdf99b563a2471c8,21,This was the first time I had seen him
55ad3f2dfdf99b563a2471c8,22,as normally he was bedridden
55ad3f2dfdf99b563a2471c8,23,and it marked the start of his recovery.
55ad3f2dfdf99b563a2471c8,24,"I wasn't sure if my prayer had anything to do with his recovery,"
55ad3f2dfdf99b563a2471c8,25,but it did make me reconsider my views on faith.
55ad3f2dfdf99b563a2471c8,26,We then spent as much time as we could with my grandpa
55ad3f2dfdf99b563a2471c8,27,as he made his recovery
55ad3f2dfdf99b563a2471c8,28,and learnt to enjoy the time we had together.
55ad3f2dfdf99b563a2471c8,29,He continued to live on for many years
55ad3f2dfdf99b563a2471c8,30,seeing through his 90th birthday
55ad3f2dfdf99b563a2471c8,31,before passing away peacefully.
634e7e0695471fa84bfe5f2f,1,Started working at a bookstore straight out of college at 22 years old.
634e7e0695471fa84bfe5f2f,2,Grandpa was sick.
634e7e0695471fa84bfe5f2f,3,"Only two siblings, me and my sister to look after him."
634e7e0695471fa84bfe5f2f,4,"Heard a voice in my head to go to the church,"
634e7e0695471fa84bfe5f2f,5,Light a candle
634e7e0695471fa84bfe5f2f,6,And pray for his grandpa to get better and recover.
634e7e0695471fa84bfe5f2f,7,Not religious but went to church anyway
634e7e0695471fa84bfe5f2f,8,And lit and candle
634e7e0695471fa84bfe5f2f,9,And prayed.
634e7e0695471fa84bfe5f2f,10,Went back to the bookstore
634e7e0695471fa84bfe5f2f,11,And had overwhelming feeling that he needed to go home.
634e7e0695471fa84bfe5f2f,12,Went home
634e7e0695471fa84bfe5f2f,13,And grandpa was out of bed
634e7e0695471fa84bfe5f2f,14,And sitting in the living room with my sister.
634e7e0695471fa84bfe5f2f,15,He hadn't gotten out of bed for months without assistance.
634e7e0695471fa84bfe5f2f,16,This was the start of his recovery.
634e7e0695471fa84bfe5f2f,17,Got better
634e7e0695471fa84bfe5f2f,18,And lived until 90 before passing away recently.
634e7e0695471fa84bfe5f2f,19,Made me think of the power of faith.
60dcc945f7ee60621d36b715,1,The author is in his twenties
60dcc945f7ee60621d36b715,2,and was working in a bookstore.
60dcc945f7ee60621d36b715,3,His grandfather was poorly
60dcc945f7ee60621d36b715,4,and living with him
60dcc945f7ee60621d36b715,5,and his parents
60dcc945f7ee60621d36b715,6,and his parents are away for the weekend.
60dcc945f7ee60621d36b715,7,When he was at work
60dcc945f7ee60621d36b715,8,he had a voice say to his to go to the church
60dcc945f7ee60621d36b715,9,"and he felt compelled to go,"
60dcc945f7ee60621d36b715,10,even though he had no strong faith.
60dcc945f7ee60621d36b715,11,He tells how his grandmother used to say something about no prayer is wasted
60dcc945f7ee60621d36b715,12,but also that a prayer without conviction was worth less-
60dcc945f7ee60621d36b715,13,or words to that effect.
60dcc945f7ee60621d36b715,14,He went to the church
60dcc945f7ee60621d36b715,15,and said to God he didn't really know how to pray
60dcc945f7ee60621d36b715,16,but that he was praying for his grandfather's healing.
60dcc945f7ee60621d36b715,17,He returned to work
60dcc945f7ee60621d36b715,18,but when there felt a strong urge that he must return home.
60dcc945f7ee60621d36b715,19,So he closed up the bookstore
60dcc945f7ee60621d36b715,20,and went home.
60dcc945f7ee60621d36b715,21,"On getting home, he was surprised to find his grandfather sat up in the living room,"
60dcc945f7ee60621d36b715,22,"talking with his sister,"
60dcc945f7ee60621d36b715,23,as he had been bedridden for months prior to the.
60dcc945f7ee60621d36b715,24,His sister told him that he just suddenly had the energy to get up.
60dcc945f7ee60621d36b715,25,The author muses whether his visit to the church has anything to do with this.
60dcc945f7ee60621d36b715,26,"From then on, his grandfather continues to gain strength"
60dcc945f7ee60621d36b715,27,and return to his health
60dcc945f7ee60621d36b715,28,and lived for many years into his 90s.
60dcc945f7ee60621d36b715,29,This story became a something of a family legend
60dcc945f7ee60621d36b715,30,and lives strong in the authors memory.
5f7760d025023628ce3f4d05,1,"A man 22 years old, fresh out of college is looking after his ill grandpa with his sister at their family home"
5f7760d025023628ce3f4d05,2,while his parents are out of town.
5f7760d025023628ce3f4d05,3,He has a job at a bookstore
5f7760d025023628ce3f4d05,4,"and whilst working, hears an imaginary voice telling him to go to the church and light a candle."
5f7760d025023628ce3f4d05,5,"He does it, despite not really believing it,"
5f7760d025023628ce3f4d05,6,"but thinking about what his grandma used to say, he goes anyway."
5f7760d025023628ce3f4d05,7,Once back to the bookstore after lighting the candle
5f7760d025023628ce3f4d05,8,he gets a strong urge to go home.
5f7760d025023628ce3f4d05,9,When he gets home his grandpa is sitting in the lounge
5f7760d025023628ce3f4d05,10,despite not being able to get out of bed for months.
5f7760d025023628ce3f4d05,11,His grandpa lived a few more years after that.
5f7760d025023628ce3f4d05,12,The writer is recalling the story from 20 years ago.
64528c575f51539110be524a,1,Let me share a story when I was twenty years old.
64528c575f51539110be524a,2,I finished my school and started a job.
64528c575f51539110be524a,3,We are two siblings and a grandpa.
64528c575f51539110be524a,4,"Our grandpa was bedridden,"
64528c575f51539110be524a,5,He could not move on his own.
64528c575f51539110be524a,6,"One day, I felt someone saying to me go down to the church and pray."
64528c575f51539110be524a,7,I had ignored that many times
64528c575f51539110be524a,8,But one day I felt an urge to go there.
64528c575f51539110be524a,9,I was not a religious person.
64528c575f51539110be524a,10,"I went to the church,"
64528c575f51539110be524a,11,"Knelt down,"
64528c575f51539110be524a,12,And say a prayer to God to recover my grandpa and give him a healthy life so he could move.
64528c575f51539110be524a,13,I have heard that prayer from the heart with strong belief never goes unheard
64528c575f51539110be524a,14,And prayer without a belief is never heard.
64528c575f51539110be524a,15,"So, said a prayer and went home."
64528c575f51539110be524a,16,"When I went home, to my surprise my sister told me that Grandpa suddenly felt some unbelievable energy"
64528c575f51539110be524a,17,And he stood up without any support.
64528c575f51539110be524a,18,"That day, made my belief strong that no prayer goes wasted."
64528c575f51539110be524a,19,Grandpa lived so many years with spirit and health.
5d39a607190d3e000100e72a,1,"""When I was 22 years just after college I went to work in bookstore."""
5d39a607190d3e000100e72a,2,"""On the weekend in question my parents were out of town and my sister was minding my grandpa who was bedridden."""
5d39a607190d3e000100e72a,3,"""Suddenly I heard a voice in my head telling me to go to the church to light a candle for grandpa and he would get better."""
5d39a607190d3e000100e72a,4,"""I looked around the store and there definitely wasn't anyone else in there with me."""
5d39a607190d3e000100e72a,5,"""I wasn't a overtly religious person nor would I call myself a saint."""
5d39a607190d3e000100e72a,6,"""I decided that I would go to the church, I entered, lit a candle, and said a prayer."""
5d39a607190d3e000100e72a,7,"""I then went back to the store."""
5d39a607190d3e000100e72a,8,"""I had this overwhelmingly feeling that I needed to go home and I closed up shop."""
5d39a607190d3e000100e72a,9,"""When I got home I saw that my grandpa sitting in the living room."""
5d39a607190d3e000100e72a,10,"""My sister informed me that he had got there himself, he hadn't been able to get out of bed unassisted in months."""
5d39a607190d3e000100e72a,11,"""Up to this point I hadn't believe too strongly in faith and miracles but this felt like one."""
5d39a607190d3e000100e72a,12,"""My grandpa gradually made a recovery and recovered his strength and independence."""
5d39a607190d3e000100e72a,13,"""He went on to sleep long more years and celebrated his 90th birthday surrounded by family."""
5d39a607190d3e000100e72a,14,"""Whenever I feel lost I think back to this vivid memory to brighten my day."""
5e9883baf93c610a951f26e7,1,I am 22 years old
5e9883baf93c610a951f26e7,2,"and I was walking to the bookstore,"
5e9883baf93c610a951f26e7,3,where I work.
5e9883baf93c610a951f26e7,4,"At home, I have a grandpa"
5e9883baf93c610a951f26e7,5,and a sister.
5e9883baf93c610a951f26e7,6,My grandpa is bedbound
5e9883baf93c610a951f26e7,7,and is not in a good state.
5e9883baf93c610a951f26e7,8,My sister looks after him.
5e9883baf93c610a951f26e7,9,"While shelving, I heard a noise in my head"
5e9883baf93c610a951f26e7,10,"""Come to the church and pray for your grandpa"
5e9883baf93c610a951f26e7,11,"and he will get better""."
5e9883baf93c610a951f26e7,12,I looked around
5e9883baf93c610a951f26e7,13,and nobody was there.
5e9883baf93c610a951f26e7,14,I closed the bookstore
5e9883baf93c610a951f26e7,15,and walked to the church
5e9883baf93c610a951f26e7,16,which was a quarter of a mile away.
5e9883baf93c610a951f26e7,17,On the way I remembered my grandma's words.
5e9883baf93c610a951f26e7,18,I am not particularly religious
5e9883baf93c610a951f26e7,19,but she said that prayers with a sincere heart come true.
5e9883baf93c610a951f26e7,20,"On the other hand, she said prayers without faith were useless."
5e9883baf93c610a951f26e7,21,In the church I prayed for my grandpa to get better.
5e9883baf93c610a951f26e7,22,I left
5e9883baf93c610a951f26e7,23,and went back to shelving at the bookstore.
5e9883baf93c610a951f26e7,24,I then felt the sudden urge to leave
5e9883baf93c610a951f26e7,25,and go home
5e9883baf93c610a951f26e7,26,so I locked up
5e9883baf93c610a951f26e7,27,and went home.
5e9883baf93c610a951f26e7,28,"When I arrived, I found my grandpa sitting in the chair in the living room"
5e9883baf93c610a951f26e7,29,"talking to my sister,"
5e9883baf93c610a951f26e7,30,which was a surprise because he was bedbound for the last few years.
5e9883baf93c610a951f26e7,31,My sister said he felt a sudden urge of energy
5e9883baf93c610a951f26e7,32,and managed to get out of bed.
5e9883baf93c610a951f26e7,33,That marked the first day of his recovery.
5e9883baf93c610a951f26e7,34,He lived until his 90th birthday in good health.
5e9883baf93c610a951f26e7,35,That was 20 years ago
5e9883baf93c610a951f26e7,36,and he died several years later.
5e9883baf93c610a951f26e7,37,Sometimes now when I think about it
5e9883baf93c610a951f26e7,38,I am reminded that we are not alone
5e9883baf93c610a951f26e7,39,even when it may appear we are.
5e8e5058e690d70ebefeb033,1,"Man lives with his grandpa and his sister,"
5e8e5058e690d70ebefeb033,2,his grandpa is bed ridden
5e8e5058e690d70ebefeb033,3,and is recovering from illness.
5e8e5058e690d70ebefeb033,4,His parents are out for the weekend.
5e8e5058e690d70ebefeb033,5,"He works at a library 20 miles away from the town,"
