recall_id,clause_id,clause_text
5de16fd00e58661bb3519db8,3,I was staying in a small town about five miles from here.
5de16fd00e58661bb3519db8,4,I had just started my first job at a local bookstore.
5de16fd00e58661bb3519db8,5,"It was a quiet afternoon, and I was alone in the store."
5de16fd00e58661bb3519db8,6,"My grandpa, who had been bedridden for almost a year, was at home with my sister."
5de16fd00e58661bb3519db8,7,"She had to care for him daily, as he couldn't move around on his own."
5de16fd00e58661bb3519db8,8,"There were only two of us siblings, my sister and me."
5de16fd00e58661bb3519db8,9,My parents had gone out of town for the weekend.
5de16fd00e58661bb3519db8,10,"As I was shelving books, I suddenly heard a voice inside my head."
5de16fd00e58661bb3519db8,11,"It said, ""If you go to the old church down the street and light a candle for your grandpa, he will get better."""
5de16fd00e58661bb3519db8,12,"I looked around the bookstore, but no one was there."
5de16fd00e58661bb3519db8,13,"I continued with my work, trying to ignore the voice."
5de16fd00e58661bb3519db8,14,"It spoke to me again, repeating the same message."
5de16fd00e58661bb3519db8,15,"I looked around once more, but still found no one."
5de16fd00e58661bb3519db8,16,I decided to take a break and walk to the church.
5de16fd00e58661bb3519db8,17,"I was only a short distance away, maybe a quarter-mile."
5de16fd00e58661bb3519db8,18,"As I approached the church, I hesitated for a moment."
5de16fd00e58661bb3519db8,19,I was not a religious person.
5de16fd00e58661bb3519db8,20,I remembered my grandma always saying that prayers from a sincere heart could bring miracles.
5de16fd00e58661bb3519db8,21,"On the other hand, she also said that prayers without faith were useless."
5de16fd00e58661bb3519db8,22,I admitted to myself that I was far from being a saint.
5de16fd00e58661bb3519db8,23,I had my share of mistakes and misdeeds.
5de16fd00e58661bb3519db8,24,I thought about my grandpa and how much he meant to our family.
5de16fd00e58661bb3519db8,25,"Finally, I went inside the church and found a candle."
5de16fd00e58661bb3519db8,26,I knelt down in front of the altar.
5de16fd00e58661bb3519db8,27,"I said, ""God, I don't know how to pray properly. But I am asking you with all my heart to heal my grandpa. Please help him regain his strength and guide us in taking care of him."""
5de16fd00e58661bb3519db8,28,"After saying a prayer, I returned to the bookstore."
5de16fd00e58661bb3519db8,29,"I resumed my work, shelving books."
5de16fd00e58661bb3519db8,30,"Suddenly, I felt a strong urge to go home."
5de16fd00e58661bb3519db8,31,It was as if something was pulling me towards the house.
5de16fd00e58661bb3519db8,32,I didn't hear any voice this time.
5de16fd00e58661bb3519db8,33,It was just an overwhelming feeling that I needed to go home.
5de16fd00e58661bb3519db8,34,I locked up the store and rushed home.
5de16fd00e58661bb3519db8,35,"To my surprise, I found my grandpa sitting in the living room, talking to my sister."
5de16fd00e58661bb3519db8,36,He hadn't been able to leave his bed for months without assistance.
5de16fd00e58661bb3519db8,37,My sister told me that he had suddenly felt a surge of energy and was able to stand up and walk.
5de16fd00e58661bb3519db8,38,That day started the beginning of his recovery.
5de16fd00e58661bb3519db8,39,He gradually regained his strength and independence.
5de16fd00e58661bb3519db8,40,It was a turning point in our lives.
5de16fd00e58661bb3519db8,41,We became more grateful for the time we had together.
5de16fd00e58661bb3519db8,42,I often thought back to that day in the church.
5de16fd00e58661bb3519db8,43,I wondered if my prayer had anything to do with my grandpa's recovery.
5de16fd00e58661bb3519db8,44,"I couldn't be sure, but it definitely changed my perspective on faith and the power of prayer."
5de16fd00e58661bb3519db8,45,My grandpa lived for many more years after that incident.
5de16fd00e58661bb3519db8,46,He celebrated his ninetieth birthday surrounded by family and friends.
5de16fd00e58661bb3519db8,47,We cherished every moment we had with him.
5de16fd00e58661bb3519db8,48,That experience happened almost twenty years ago.
5de16fd00e58661bb3519db8,49,It remains a vivid memory in my mind.
5de16fd00e58661bb3519db8,50,"My grandpa passed away a few years later, but his spirit lives on in our hearts."
5de16fd00e58661bb3519db8,51,"Sometimes, when I'm feeling lost or uncertain, I think back to that day."
5de16fd00e58661bb3519db8,52,I remember the power of faith and the miracles it can bring.
5de16fd00e58661bb3519db8,53,"And I am reminded that we are never truly alone, even when it seems like we are."
57a7337e913c710001977341,1,Lady was working in her book store shelving books.
57a7337e913c710001977341,2,She is one of two siblings the other being her sister.
57a7337e913c710001977341,3,Her sister looked after their grandpa who had been bedridden for many months and had to be assisted with moving around and looking after him.
57a7337e913c710001977341,4,Whilst working the lady heard a voice in her head saying if she went now to her church and lit a candle her grandpa would get better.
57a7337e913c710001977341,5,She ignored the voice at first but the message was repeated many times.
57a7337e913c710001977341,6,After a while the lady went to the church despite her lack of faith and before she went in she remembered her grandma’s words that a sincere prayer can work miracles but prayers without faith were useless.
57a7337e913c710001977341,7,The lady whilst unsure lit a candle and knelt at the alter in prayer and asked god to help her grandpa recover and gain his strength and let him have a life again.
57a7337e913c710001977341,8,She went back to the bookstore and continued to shelve books until she felt an overwhelming urge to go home.
57a7337e913c710001977341,9,She locked up the bookstore and went home to find her grandpa in the living room having sat up in bed saying he had the urge to get up.
57a7337e913c710001977341,10,Grandpa recovered and lived for a number of years and then passed away but the extra time with him was fulfilling for the family.
57a7337e913c710001977341,11,The incident happened 20 years ago but has helped the lady in sad and troubled times to help her through.
605ba57d2842d8291b4afd24,1,"The story is about a 22-year-old,"
605ba57d2842d8291b4afd24,2,fresh from college
605ba57d2842d8291b4afd24,3,and was working in the local bookstore.
605ba57d2842d8291b4afd24,4,"She lived with her sister,"
605ba57d2842d8291b4afd24,5,parents
605ba57d2842d8291b4afd24,6,and sick grandfather.
605ba57d2842d8291b4afd24,7,"One day when she was at work,"
605ba57d2842d8291b4afd24,8,"busy shelving,"
605ba57d2842d8291b4afd24,9,"she heard a voice instructing her to go to a church,"
605ba57d2842d8291b4afd24,10,light a candle
605ba57d2842d8291b4afd24,11,and pray for her grandfather.
605ba57d2842d8291b4afd24,12,She looked around
605ba57d2842d8291b4afd24,13,and saw that she was alone in the store
605ba57d2842d8291b4afd24,14,and was shocked.
605ba57d2842d8291b4afd24,15,"She was not particularly a religious person,"
605ba57d2842d8291b4afd24,16,"so this was a bit strange for her,"
605ba57d2842d8291b4afd24,17,but she eventually went to the church
605ba57d2842d8291b4afd24,18,and prayed for her grandfather.
605ba57d2842d8291b4afd24,19,"After praying,"
605ba57d2842d8291b4afd24,20,she went back to the store
605ba57d2842d8291b4afd24,21,"and when she was there,"
605ba57d2842d8291b4afd24,22,had this overwhelming feeling that she needed to go home.
605ba57d2842d8291b4afd24,23,"When she got home,"
605ba57d2842d8291b4afd24,24,she found her grandfather sitting
605ba57d2842d8291b4afd24,25,"and her sister told her that he had gotten out of bed on his own,"
605ba57d2842d8291b4afd24,26,which had not happened in months.
605273bcd0b9b4510724f3d7,1,"Girl 22 years old,"
605273bcd0b9b4510724f3d7,2,sibling (one sister)
605273bcd0b9b4510724f3d7,3,"first job was at a bookstore shelving books,"
605273bcd0b9b4510724f3d7,4,the bookstore was close to a church.
605273bcd0b9b4510724f3d7,5,"Grandpa was poorly and had been bedridden for almost a year,"
605273bcd0b9b4510724f3d7,6,one day she heard a voice telling her to go and light a candle for her grandpa
605273bcd0b9b4510724f3d7,7,and this would make him better.
605273bcd0b9b4510724f3d7,8,She was hesitant as she wasn't really religious
605273bcd0b9b4510724f3d7,9,and remembered things her nan said such as prayers without faith are useless.
605273bcd0b9b4510724f3d7,10,"She ended up going to the church,"
605273bcd0b9b4510724f3d7,11,"finding a candle,"
605273bcd0b9b4510724f3d7,12,lighting it whilst kneeling at the alter.
605273bcd0b9b4510724f3d7,13,Afterwards she went back to work
605273bcd0b9b4510724f3d7,14,but felt a force but no voice telling her to go home.
605273bcd0b9b4510724f3d7,15,When she did go home her grandpa was at home with her sister
605273bcd0b9b4510724f3d7,16,but he was sat up not in bed.
605273bcd0b9b4510724f3d7,17,The sister said he had felt a rush of energy
605273bcd0b9b4510724f3d7,18,and was able to stand and walk.
605273bcd0b9b4510724f3d7,19,The grandpa got some of his independence back
605273bcd0b9b4510724f3d7,20,and she often wondered if her prayer at the church has helped.
605273bcd0b9b4510724f3d7,21,They got to enjoy many more years with him
605273bcd0b9b4510724f3d7,22,and he passed a few years later
605273bcd0b9b4510724f3d7,23,but they were all grateful for the extra time they had with him.
611fd5c03b9654834bd4af0e,1,The person is 22 years old
611fd5c03b9654834bd4af0e,2,and working at a bookstore in their quiet town.
611fd5c03b9654834bd4af0e,3,They are at work
611fd5c03b9654834bd4af0e,4,"while their sister is at home with their sick grandpa,"
611fd5c03b9654834bd4af0e,5,and their parents are out of town.
611fd5c03b9654834bd4af0e,6,"All of a sudden, the bookstore worker hears a voice saying to go down to the nearby church"
611fd5c03b9654834bd4af0e,7,and light a candle for their grandpa.
611fd5c03b9654834bd4af0e,8,"If they do this, it will heal him."
611fd5c03b9654834bd4af0e,9,"After some contemplation, the worker goes to the church,"
611fd5c03b9654834bd4af0e,10,"and although uncertain about their faith, thinks of something their grandma used to say"
611fd5c03b9654834bd4af0e,11,and goes in anyway.
611fd5c03b9654834bd4af0e,12,They make a prayer
611fd5c03b9654834bd4af0e,13,"and light the candle,"
611fd5c03b9654834bd4af0e,14,then return to work.
611fd5c03b9654834bd4af0e,15,"Once back in the shop, they feel a strong urge to go back home."
611fd5c03b9654834bd4af0e,16,"Once there, they see their grandpa is all better."
611fd5c03b9654834bd4af0e,17,"In fact, he lives on for many years"
611fd5c03b9654834bd4af0e,18,and they all get to celebrate his 90th birthday with him.
611fd5c03b9654834bd4af0e,19,"The bookstore worker is thinking about these events 20 years later,"
611fd5c03b9654834bd4af0e,20,and wonders to this day if that candle had anything to do with it.
6417413921c539fd7d59e6e6,1,22 year old girl worked in a bookstore.
6417413921c539fd7d59e6e6,2,Her grandpa was unwell
6417413921c539fd7d59e6e6,3,and she had voice that told her to go to church
6417413921c539fd7d59e6e6,4,and light a candle
6417413921c539fd7d59e6e6,5,and pray for him
6417413921c539fd7d59e6e6,6,to make him better.
6417413921c539fd7d59e6e6,7,She returned back to the bookstore
6417413921c539fd7d59e6e6,8,and later had the feeling to go home.
6417413921c539fd7d59e6e6,9,She went home
6417413921c539fd7d59e6e6,10,and found her grandpa sitting up
6417413921c539fd7d59e6e6,11,and recovering.
6417413921c539fd7d59e6e6,12,Her prays had been answered
6417413921c539fd7d59e6e6,13,and he continue to get better.
6417413921c539fd7d59e6e6,14,He lived for another 20 years.
5f4e826dade9a507a7c6c2d3,1,"In my twenties,"
5f4e826dade9a507a7c6c2d3,2,I worked in a bookstore.
5f4e826dade9a507a7c6c2d3,3,"My grandpa was really sick at this moment,"
5f4e826dade9a507a7c6c2d3,4,he couldn't get out of bed without help.
5f4e826dade9a507a7c6c2d3,5,My sister and I took care of him.
5f4e826dade9a507a7c6c2d3,6,"One day, while I was working,"
5f4e826dade9a507a7c6c2d3,7,"I heard a voice in my head saying that ""I need to go to the old church and light a candle for my grandpa""."
5f4e826dade9a507a7c6c2d3,8,"I ignored it,"
5f4e826dade9a507a7c6c2d3,9,"but then I heard this voice again, saying the exact same thing."
5f4e826dade9a507a7c6c2d3,10,I felt like i had to go to this church.
5f4e826dade9a507a7c6c2d3,11,I closed the bookstore
5f4e826dade9a507a7c6c2d3,12,and went to the church.
5f4e826dade9a507a7c6c2d3,13,"I wasn't sure if I should do this,"
5f4e826dade9a507a7c6c2d3,14,"because I wasn't a believing person,"
5f4e826dade9a507a7c6c2d3,15,but I did this anyway.
5f4e826dade9a507a7c6c2d3,16,"After that, I went back to work."
5f4e826dade9a507a7c6c2d3,17,"Then I felt this strong urge to go home,"
5f4e826dade9a507a7c6c2d3,18,as if something was pulling me there.
5f4e826dade9a507a7c6c2d3,19,I closed the store
5f4e826dade9a507a7c6c2d3,20,and went to home.
5f4e826dade9a507a7c6c2d3,21,"When I came in,"
5f4e826dade9a507a7c6c2d3,22,I saw my grandpa sitting in the living room with my sister.
5f4e826dade9a507a7c6c2d3,23,"She told me that he suddenly got so much energy,"
5f4e826dade9a507a7c6c2d3,24,that he could stand up by himself.
5f4e826dade9a507a7c6c2d3,25,He lived a long time after this event.
5f4e826dade9a507a7c6c2d3,26,"I still come back in my memories to this day,"
5f4e826dade9a507a7c6c2d3,27,"thinking if my prayers had something to do with ""healing"" my grandpa."
5f4e826dade9a507a7c6c2d3,28,This changed my thinking about faith and prayers.
5dcc6f91e5e18690a20e74d1,1,A man recalls a time in his young life at 22 years old.
5dcc6f91e5e18690a20e74d1,2,He was just out of college and working in a bookstore in his small town.
5dcc6f91e5e18690a20e74d1,3,His parents were out of town and his sister was at home with their grandfather who was bedridden.
5dcc6f91e5e18690a20e74d1,4,While working on a particular day he heard a voice in his head telling him to go to church and light a candle for his grandfather.
5dcc6f91e5e18690a20e74d1,5,No one was with him in the shop as he looked around then he heard the voice again.
5dcc6f91e5e18690a20e74d1,6,He took a break from work and walked to the church.
5dcc6f91e5e18690a20e74d1,7,He wasn't a religious person but he remembered his grandmother saying that a prayer could work miracles but a prayer with no faith was useless.
5dcc6f91e5e18690a20e74d1,8,He prayed to God to help his grandfather get better.
5dcc6f91e5e18690a20e74d1,9,He then returned to work.
5dcc6f91e5e18690a20e74d1,10,"A little later he felt a strong urge to go home, there was no voice this time just an urgent feeling to go home."
5dcc6f91e5e18690a20e74d1,11,He shut the shop and returned home.
5dcc6f91e5e18690a20e74d1,12,When he got there he found his grandfather in the living room chatting to his sister and this was the first time he had been able to leave his bed in a long time.
5dcc6f91e5e18690a20e74d1,13,It was the beginning of his grandfathers recovery.
5dcc6f91e5e18690a20e74d1,14,His grandfather lived to celebrate his 90th birthday and a few years more.
5dcc6f91e5e18690a20e74d1,15,The man writing the story gained a certain amount of faith from this episode in his life and always wondered if the prayer had indeed helped his grandfather get better.
5fb92475bca3903c9f3f7d45,1,The person was young and working in a bookstore
5fb92475bca3903c9f3f7d45,2,when one day he heard a voice telling him to go and light the candle at church for his grandpa
5fb92475bca3903c9f3f7d45,3,at first he tried to ignore it
5fb92475bca3903c9f3f7d45,4,but the voice repeated
5fb92475bca3903c9f3f7d45,5,and he decided to head to the church
5fb92475bca3903c9f3f7d45,6,before he entered the church he remembered the words from his grandma telling them about how powerful a prayer can be if you pray with a sincere heart
5fb92475bca3903c9f3f7d45,7,so he went ahead inside the church
5fb92475bca3903c9f3f7d45,8,where he found a candle
5fb92475bca3903c9f3f7d45,9,and started to pray for his grandpa
5fb92475bca3903c9f3f7d45,10,after that he went back to the bookstore
5fb92475bca3903c9f3f7d45,11,where he felt a sudden surge to go home
5fb92475bca3903c9f3f7d45,12,he got up and lock the store
5fb92475bca3903c9f3f7d45,13,and went straight home
5fb92475bca3903c9f3f7d45,14,when he got there he found his grandpa sitting in a stool
5fb92475bca3903c9f3f7d45,15,and looked better then when he left him that morning
5fb92475bca3903c9f3f7d45,16,and that was beginning of his recovery
5fb92475bca3903c9f3f7d45,17,The grandpa lived till he was ninety years old.
615776777c08445c8ffd8d1b,1,The writer was 22
615776777c08445c8ffd8d1b,2,and had just graduated college.
615776777c08445c8ffd8d1b,3,They were working in a bookstore near their hometown
615776777c08445c8ffd8d1b,4,when they heard a voice telling them that if they went to light a candle in the church down the street their grandfather would regain his strength.
615776777c08445c8ffd8d1b,5,"He was looked after by their sister,"
615776777c08445c8ffd8d1b,6,and was bedridden.
615776777c08445c8ffd8d1b,7,Their parents were away.
615776777c08445c8ffd8d1b,8,They heard the voice twice
615776777c08445c8ffd8d1b,9,and went to the church.
615776777c08445c8ffd8d1b,10,"Although not religious, they lit a candle"
615776777c08445c8ffd8d1b,11,"and said a prayer at the altar, asking god to give their grandfather his strength back."
615776777c08445c8ffd8d1b,12,They returned to the bookstore
615776777c08445c8ffd8d1b,13,"and continued shelving books,"
615776777c08445c8ffd8d1b,14,when they had a powerful urge to return home.
615776777c08445c8ffd8d1b,15,They locked up the bookstore
615776777c08445c8ffd8d1b,16,"and went home,"
615776777c08445c8ffd8d1b,17,"to find their grandfather sitting in a chair in the living room, something he had not done for a long time."
615776777c08445c8ffd8d1b,18,He said he had felt the strength returning to him.
615776777c08445c8ffd8d1b,19,He lived for many more years
615776777c08445c8ffd8d1b,20,and celebrated his 90th birthday surrounded by family.
615776777c08445c8ffd8d1b,21,The writer said although this all happened 20 years ago they remembered it well
615776777c08445c8ffd8d1b,22,and wondered if their prayer had been the reason for their grandfather getting better.
615776777c08445c8ffd8d1b,23,"They said their grandmother had told them that if a prayer was said sincerely it had power,"
615776777c08445c8ffd8d1b,24,but if it was said with no sincerity or meaning it was useless.
615776777c08445c8ffd8d1b,25,They were happy that they had many more happy years with their grandfather.
5ea00067d330db1ac58c6163,1,Twenty years ago
5ea00067d330db1ac58c6163,2,I left college
5ea00067d330db1ac58c6163,3,and went to work in a book store.
5ea00067d330db1ac58c6163,4,I had a vision
5ea00067d330db1ac58c6163,5,that I should go to church
5ea00067d330db1ac58c6163,6,and light a candle
5ea00067d330db1ac58c6163,7,to pray for my grandpa.
5ea00067d330db1ac58c6163,8,"I went to church,"
5ea00067d330db1ac58c6163,9,lit a candle
5ea00067d330db1ac58c6163,10,and prayed.
5ea00067d330db1ac58c6163,11,My sister told me to come home.
5ea00067d330db1ac58c6163,12,When I got there
5ea00067d330db1ac58c6163,13,my grandpa was out of bed.
5ea00067d330db1ac58c6163,14,It changed my attitude to prayer.
5ea00067d330db1ac58c6163,15,My grandpa lived for several more years.
5edfeb15743509317e9ec17c,1,A boy was at home
5edfeb15743509317e9ec17c,2,looking after his very ill grandpa.
5edfeb15743509317e9ec17c,3,He heard a voice say
5edfeb15743509317e9ec17c,4,if he went to the church
5edfeb15743509317e9ec17c,5,"and light a candle,"
5edfeb15743509317e9ec17c,6,his grandpa would get better.
5edfeb15743509317e9ec17c,7,He ignored it.
5edfeb15743509317e9ec17c,8,He then heard it again.
5edfeb15743509317e9ec17c,9,He decided to go
5edfeb15743509317e9ec17c,10,and light a candle.
5edfeb15743509317e9ec17c,11,"When he got home,"
5edfeb15743509317e9ec17c,12,his grandpa was much better.
5edfeb15743509317e9ec17c,13,He lived for 20 more years.
5c2bb03b9fb36d000198e2d7,1,A young man fresh out of college was working in a bookstore.
5c2bb03b9fb36d000198e2d7,2,His grandfather was bedridden at home with the young man's sister.
5c2bb03b9fb36d000198e2d7,3,The sister was taking care of the grandfather.
5c2bb03b9fb36d000198e2d7,4,The young man heard a voice telling him to go to the church nearby and light a candle for his grandfather and he would be healed.
5c2bb03b9fb36d000198e2d7,5,After some hesitation he went to the church and lit the candle and said a short prayer despite his hesitations.
5c2bb03b9fb36d000198e2d7,6,He went back to the bookstore and continued working.
5c2bb03b9fb36d000198e2d7,7,Shortly after he felt a strong urge to go home.
5c2bb03b9fb36d000198e2d7,8,He locked up the store and went home.
5c2bb03b9fb36d000198e2d7,9,His grandfather was sitting up in the living room after having been bedridden for months.
5c2bb03b9fb36d000198e2d7,10,In what seemed to be a miracle his grandfather lived on for years.
5c2bb03b9fb36d000198e2d7,11,This experience helped the young man appreciate more and value prayer and faith.
630492ce98f024b7188676df,1,The person was 22 years old working in a book store.
630492ce98f024b7188676df,2,Their grandpa was bedridden.
630492ce98f024b7188676df,3,The person thought they heard voices saying go to church but no one was in the store.
630492ce98f024b7188676df,4,They locked up and went to church to pray even though they weren't really religious.
630492ce98f024b7188676df,5,They prayed for their grandpa to get better.
630492ce98f024b7188676df,6,They went back to work then felt the urge to go home.
630492ce98f024b7188676df,7,"At home the grandpa had felt a surge of energy and got out of bed alone, the first time in months and said he felt better."
630492ce98f024b7188676df,8,He gradually recovered and lived to celebrate his 90th birthday.
630492ce98f024b7188676df,9,This happened 20 years ago and the narrator said they still think about it when they are losing faith.
647ba080cdf4db4ed1a2e695,1,Let me tell you a story.
647ba080cdf4db4ed1a2e695,2,I was in college and was working in a bookstore.
647ba080cdf4db4ed1a2e695,3,My grandfather was sick and I have a sister.
647ba080cdf4db4ed1a2e695,4,"While shelving book, I heard a voice telling me that if I want my grandfather to get well, then I have to go to church and pray."
647ba080cdf4db4ed1a2e695,5,"I was not religious, but I went anyway and prayed."
647ba080cdf4db4ed1a2e695,6,I went back to the bookstore and had a feeling to go home.
647ba080cdf4db4ed1a2e695,7,When I went home I saw my grandfather sitting on the couch.
647ba080cdf4db4ed1a2e695,8,"He had never left his bed before, so this surprised me."
647ba080cdf4db4ed1a2e695,9,He lived on for many more years to come.
647ba080cdf4db4ed1a2e695,10,I do not know if my prayer had anything to do with it.
647ba080cdf4db4ed1a2e695,11,"When I feel alone, I remind myself that prayer can work."
5c5ad828903c7700010a4635,1,My story begins when I was 22
5c5ad828903c7700010a4635,2,"and just fresh out of college,"
5c5ad828903c7700010a4635,3,I was working at a bookstore.
5c5ad828903c7700010a4635,4,One day I had an overwhelming urge to go to church
5c5ad828903c7700010a4635,5,and pray
5c5ad828903c7700010a4635,6,and light a candle for my grandpa.
5c5ad828903c7700010a4635,7,There was only 2 siblings myself and my sister
5c5ad828903c7700010a4635,8,who looked after my grandpa
5c5ad828903c7700010a4635,9,as he hadn't been able to do anything without assistance.
5c5ad828903c7700010a4635,10,My parents were out of town for the week.
5c5ad828903c7700010a4635,11,I went to church
5c5ad828903c7700010a4635,12,and prayed to give my grandpa strength.
5c5ad828903c7700010a4635,13,I returned to the bookstore
5c5ad828903c7700010a4635,14,"but had another urge to return to grandpa's house,"
5c5ad828903c7700010a4635,15,when I arrived grandpa was in the lounge talking to my sister
5c5ad828903c7700010a4635,16,she said that he had a sudden surge of energy
5c5ad828903c7700010a4635,17,and strength
5c5ad828903c7700010a4635,18,"and got up and walked to the lounge,"
5c5ad828903c7700010a4635,19,grandpa had been bedbound
5c5ad828903c7700010a4635,20,as he was unable to do anything without assistance.
5c5ad828903c7700010a4635,21,Grandpa lived a few more years until 90
5c5ad828903c7700010a4635,22,that was 20 years ago
5c5ad828903c7700010a4635,23,but I will always remember that praying gives us strength
5c5ad828903c7700010a4635,24,and hope.
5c5ad828903c7700010a4635,25,"Grandma says that prayers are useless if you don't believe,"
5c5ad828903c7700010a4635,26,but strong if you do.
5f3dbd5e99a9be1da93d9039,1,Guy was 22 years old
5f3dbd5e99a9be1da93d9039,2,working in a bookstore
5f3dbd5e99a9be1da93d9039,3,and himself and sister were minding their bedridden grandpa
5f3dbd5e99a9be1da93d9039,4,while their parents were away for the weekend.
5f3dbd5e99a9be1da93d9039,5,A voice told him to pray at the church
5f3dbd5e99a9be1da93d9039,6,and his grandpa would get better
5f3dbd5e99a9be1da93d9039,7,which he did.
5f3dbd5e99a9be1da93d9039,8,While back at the bookstore
5f3dbd5e99a9be1da93d9039,9,he got an urge to go home
5f3dbd5e99a9be1da93d9039,10,and found his grandpa sitting up for the first time in years.
5f3dbd5e99a9be1da93d9039,11,After this he kept recovering
5f3dbd5e99a9be1da93d9039,12,and had a 90th birthday party years later.
5f3dbd5e99a9be1da93d9039,13,He passed a few years after that
5f3dbd5e99a9be1da93d9039,14,and the guy always thought about whether the power of prayer truly helped his grandpa.
60858088111c462ba649ead5,1,A 22 year old woman lives 5 miles away from town.
60858088111c462ba649ead5,2,Her grandpa had been bedridden for awhile.
60858088111c462ba649ead5,3,"She works in a bookstore when one day she heard someone say 'go to the old church and pray',"
60858088111c462ba649ead5,4,She doesn't believe in religion or faith.
60858088111c462ba649ead5,5,She lives with her sister and grandpa and her parents were away for the weekend.
