recall_id,clause_id,clause_text,rephrased_text
5d3594902fd5a4001ae58fb9,3,They heard a voice,"A voice reached their ears,"
5d3594902fd5a4001ae58fb9,4,telling them to go to a church,"instructing them to visit a chapel,"
5d3594902fd5a4001ae58fb9,5,and light a candle,"to ignite a candle there,"
5d3594902fd5a4001ae58fb9,6,so that their grandfather would recover.,in hopes that their granddad would heal.
5d3594902fd5a4001ae58fb9,7,"The narrator did,","The narrator complied,"
5d3594902fd5a4001ae58fb9,8,and prayed.,offering prayers.
5d3594902fd5a4001ae58fb9,9,His grandfather recovered,"The grandfather's health improved,"
5d3594902fd5a4001ae58fb9,10,but died a few years later.,yet he passed away some years afterward.
5d39a607190d3e000100e72a,1,"""When I was 22 years just after college I went to work in bookstore.""","At the age of 22, shortly after finishing college, I started working at a bookstore."
5d39a607190d3e000100e72a,2,"""On the weekend in question my parents were out of town and my sister was minding my grandpa who was bedridden.""","During the particular weekend in question, my parents were away and my sister was taking care of our bedridden grandfather."
5d39a607190d3e000100e72a,3,"""Suddenly I heard a voice in my head telling me to go to the church to light a candle for grandpa and he would get better.""","Out of nowhere, a voice inside my head insisted that if I went to the church to light a candle for my grandfather, he would recover."
5d39a607190d3e000100e72a,4,"""I looked around the store and there definitely wasn't anyone else in there with me.""",I glanced around the shop and confirmed that I was indeed alone.
5d39a607190d3e000100e72a,5,"""I wasn't a overtly religious person nor would I call myself a saint.""",I wasn't particularly devout or considered myself a holy person.
5d39a607190d3e000100e72a,6,"""I decided that I would go to the church, I entered, lit a candle, and said a prayer.""","Nevertheless, I made up my mind to visit the church, where I lit a candle and offered a prayer."
5d39a607190d3e000100e72a,7,"""I then went back to the store.""","Afterward, I returned to the bookstore."
5d39a607190d3e000100e72a,8,"""I had this overwhelmingly feeling that I needed to go home and I closed up shop.""","An intense urge overcame me, compelling me to go home, so I shut down the bookstore early."
5d39a607190d3e000100e72a,9,"""When I got home I saw that my grandpa sitting in the living room.""","Upon arriving home, I was astonished to find my grandfather seated in the living room."
5d39a607190d3e000100e72a,10,"""My sister informed me that he had got there himself, he hadn't been able to get out of bed unassisted in months.""","My sister explained that he had made his way there on his own, something he hadn't managed to do without help for many months."
5d39a607190d3e000100e72a,11,"""Up to this point I hadn't believe too strongly in faith and miracles but this felt like one.""","Until that moment, my belief in faith and miracles hadn't been strong, yet this experience seemed like a true miracle."
5d39a607190d3e000100e72a,12,"""My grandpa gradually made a recovery and recovered his strength and independence.""","My grandfather slowly regained his health, along with his strength and autonomy."
5d39a607190d3e000100e72a,13,"""He went on to sleep long more years and celebrated his 90th birthday surrounded by family.""","He lived for many more years, eventually celebrating his 90th birthday with our family gathered around him."
5d39a607190d3e000100e72a,14,"""Whenever I feel lost I think back to this vivid memory to brighten my day.""","Now, whenever I'm feeling uncertain, I recall this powerful memory to lift my spirits."
5d9f4d5f3cac2b0016c79242,1,"A 22 year old in college started her first job at a bookstore,","At the age of 22, while attending college, she began working at a bookstore for the first time,"
5d9f4d5f3cac2b0016c79242,2,"she was one of two siblings,","being one half of a pair of siblings,"
5d9f4d5f3cac2b0016c79242,3,her other sibling was her sister.,with her only sibling being her sister.
5d9f4d5f3cac2b0016c79242,4,Their grandfather was sick and dying,"Their beloved grandfather was gravely ill,"
5d9f4d5f3cac2b0016c79242,5,but one day while she shelving books at the bookstore,"however, on a particular day as she was arranging books in the bookstore,"
5d9f4d5f3cac2b0016c79242,6,she heard a voice inside her head telling her to light a candle outside the church to save her grandfather.,"a mysterious voice whispered in her mind, urging her to light a candle at the church as a plea for her grandfather's health."
5d9f4d5f3cac2b0016c79242,7,"She went and did it,","She followed the instruction,"
5d9f4d5f3cac2b0016c79242,8,her grandfather miraculously recovered,"and, as if by a miracle, her grandfather's health was restored,"
5d9f4d5f3cac2b0016c79242,9,and lived for a few more years afterwards living past 90.,allowing him to enjoy life beyond his 90th year.
5d9f4d5f3cac2b0016c79242,10,This happened to her a few years ago,"This extraordinary event took place several years prior,"
5d9f4d5f3cac2b0016c79242,11,and she will never forget it.,and it remains an indelible memory for her.
5dcc6f91e5e18690a20e74d1,1,A man recalls a time in his young life at 22 years old.,A gentleman reflects on an episode from his early twenties.
5dcc6f91e5e18690a20e74d1,2,He was just out of college and working in a bookstore in his small town.,"Fresh out of university, he found employment at a local bookstore in his quaint hometown."
5dcc6f91e5e18690a20e74d1,3,His parents were out of town and his sister was at home with their grandfather who was bedridden.,"At that time, his parents were away and his sister stayed at home to care for their ailing grandfather."
5dcc6f91e5e18690a20e74d1,4,While working on a particular day he heard a voice in his head telling him to go to church and light a candle for his grandfather.,"One day at work, an inner voice urged him to visit the church and light a candle for his grandfather."
5dcc6f91e5e18690a20e74d1,5,No one was with him in the shop as he looked around then he heard the voice again.,"Alone in the store, he scanned the area before the voice spoke to him once more."
5dcc6f91e5e18690a20e74d1,6,He took a break from work and walked to the church.,He decided to take a pause from his duties and made his way to the church.
5dcc6f91e5e18690a20e74d1,7,He wasn't a religious person but he remembered his grandmother saying that a prayer could work miracles but a prayer with no faith was useless.,"Although not devout, he recalled his grandmother's words that a prayer could be miraculous, yet without belief, it was futile."
5dcc6f91e5e18690a20e74d1,8,He prayed to God to help his grandfather get better.,He offered a prayer to the Almighty for his grandfather's recovery.
5dcc6f91e5e18690a20e74d1,9,He then returned to work.,"After praying, he went back to his job."
5dcc6f91e5e18690a20e74d1,10,"A little later he felt a strong urge to go home, there was no voice this time just an urgent feeling to go home.","Sometime later, he was overcome with a compelling need to return home, this time without any auditory prompt, just a pressing need to go back."
5dcc6f91e5e18690a20e74d1,11,He shut the shop and returned home.,He closed the bookstore early and headed to his house.
5dcc6f91e5e18690a20e74d1,12,When he got there he found his grandfather in the living room chatting to his sister and this was the first time he had been able to leave his bed in a long time.,"Upon arrival, he was greeted by the sight of his grandfather conversing with his sister in the living room, an event that hadn't happened in a considerable time due to his confinement to bed."
5dcc6f91e5e18690a20e74d1,13,It was the beginning of his grandfathers recovery.,This marked the commencement of his grandfather's convalescence.
5dcc6f91e5e18690a20e74d1,14,His grandfather lived to celebrate his 90th birthday and a few years more.,The grandfather went on to celebrate his ninetieth birthday and lived for several more years.
5dcc6f91e5e18690a20e74d1,15,The man writing the story gained a certain amount of faith from this episode in his life and always wondered if the prayer had indeed helped his grandfather get better.,The author of the narrative acquired a newfound belief from this incident and often pondered whether his prayer had truly contributed to his grandfather's improvement.
5de16fd00e58661bb3519db8,1,Let me share a story.,Allow me to recount a tale.
5de16fd00e58661bb3519db8,2,"I was twenty-two years old, fresh out of college.","At the age of twenty-two, I had just graduated from university."
5de16fd00e58661bb3519db8,3,I was staying in a small town about five miles from here.,I resided in a quaint village roughly five miles from this location.
5de16fd00e58661bb3519db8,4,I had just started my first job at a local bookstore.,I had embarked on my inaugural employment at a nearby bookshop.
5de16fd00e58661bb3519db8,5,"It was a quiet afternoon, and I was alone in the store.","The store was peaceful that afternoon, with me as the sole attendant."
5de16fd00e58661bb3519db8,6,"My grandpa, who had been bedridden for almost a year, was at home with my sister.","My grandfather, confined to his bed for nearly twelve months, was at our residence with my sister."
5de16fd00e58661bb3519db8,7,"She had to care for him daily, as he couldn't move around on his own.",She was tasked with his daily care since he was unable to ambulate independently.
5de16fd00e58661bb3519db8,8,"There were only two of us siblings, my sister and me.","There were just the two of us, my sister and I."
5de16fd00e58661bb3519db8,9,My parents had gone out of town for the weekend.,Our parents had traveled out for the weekend.
5de16fd00e58661bb3519db8,10,"As I was shelving books, I suddenly heard a voice inside my head.","While organizing books, an unexpected voice echoed in my mind."
5de16fd00e58661bb3519db8,11,"It said, ""If you go to the old church down the street and light a candle for your grandpa, he will get better.""","It whispered, ""Venture to the ancient church down the road, light a candle for your grandfather, and he shall recover."""
5de16fd00e58661bb3519db8,12,"I looked around the bookstore, but no one was there.","I scanned the bookshop, yet it was devoid of any presence."
5de16fd00e58661bb3519db8,13,"I continued with my work, trying to ignore the voice.","I persisted in my duties, attempting to dismiss the voice."
5de16fd00e58661bb3519db8,14,"It spoke to me again, repeating the same message.","The voice addressed me once more, insisting on the identical instruction."
5de16fd00e58661bb3519db8,15,"I looked around once more, but still found no one.","I surveyed the area again, but it remained empty."
5de16fd00e58661bb3519db8,16,I decided to take a break and walk to the church.,I chose to pause for a break and stroll to the church.
5de16fd00e58661bb3519db8,17,"I was only a short distance away, maybe a quarter-mile.","It was a mere quarter-mile away, not far at all."
5de16fd00e58661bb3519db8,18,"As I approached the church, I hesitated for a moment.","Drawing near the church, I paused, filled with hesitation."
5de16fd00e58661bb3519db8,19,I was not a religious person.,I was not one to hold religious beliefs.
5de16fd00e58661bb3519db8,20,I remembered my grandma always saying that prayers from a sincere heart could bring miracles.,"Yet, I recalled my grandmother's belief that heartfelt prayers could work wonders."
5de16fd00e58661bb3519db8,21,"On the other hand, she also said that prayers without faith were useless.","Conversely, she believed that prayers lacking faith were futile."
5de16fd00e58661bb3519db8,22,I admitted to myself that I was far from being a saint.,I acknowledged to myself that I was hardly a paragon of virtue.
5de16fd00e58661bb3519db8,23,I had my share of mistakes and misdeeds.,I had committed my fair share of errors and wrongdoings.
5de16fd00e58661bb3519db8,24,I thought about my grandpa and how much he meant to our family.,I contemplated my grandfather's importance to our family.
5de16fd00e58661bb3519db8,25,"Finally, I went inside the church and found a candle.","Ultimately, I entered the church and located a candle."
5de16fd00e58661bb3519db8,26,I knelt down in front of the altar.,I genuflected before the altar.
5de16fd00e58661bb3519db8,27,"I said, ""God, I don't know how to pray properly. But I am asking you with all my heart to heal my grandpa. Please help him regain his strength and guide us in taking care of him.""","I uttered, ""Lord, I'm unsure of the correct way to pray, but with all my heart, I implore you to heal my grandfather. Aid him in regaining his vitality and guide us as we care for him."""
5de16fd00e58661bb3519db8,28,"After saying a prayer, I returned to the bookstore.","Having prayed, I made my way back to the bookshop."
5de16fd00e58661bb3519db8,29,"I resumed my work, shelving books.",I continued my task of arranging books.
5de16fd00e58661bb3519db8,30,"Suddenly, I felt a strong urge to go home.","Out of nowhere, I was seized by an intense compulsion to return home."
5de16fd00e58661bb3519db8,31,It was as if something was pulling me towards the house.,It felt as though an invisible force was drawing me towards my dwelling.
5de16fd00e58661bb3519db8,32,I didn't hear any voice this time.,"This time, no voice accompanied the sensation."
5de16fd00e58661bb3519db8,33,It was just an overwhelming feeling that I needed to go home.,It was purely a potent intuition that I must head home.
5de16fd00e58661bb3519db8,34,I locked up the store and rushed home.,I secured the store and hurried back to my house.
5de16fd00e58661bb3519db8,35,"To my surprise, I found my grandpa sitting in the living room, talking to my sister.","Astonishingly, I discovered my grandpa seated in the living room, conversing with my sister."
5de16fd00e58661bb3519db8,36,He hadn't been able to leave his bed for months without assistance.,He had been unable to exit his bed on his own for several months.
5de16fd00e58661bb3519db8,37,My sister told me that he had suddenly felt a surge of energy and was able to stand up and walk.,"My sister explained that he had experienced a sudden burst of vigor, enabling him to rise and walk."
5de16fd00e58661bb3519db8,38,That day started the beginning of his recovery.,That moment marked the commencement of his recuperation.
5de16fd00e58661bb3519db8,39,He gradually regained his strength and independence.,He slowly but surely reclaimed his strength and autonomy.
5de16fd00e58661bb3519db8,40,It was a turning point in our lives.,This event marked a pivotal change in our lives.
5de16fd00e58661bb3519db8,41,We became more grateful for the time we had together.,We grew to appreciate our shared moments more deeply.
5de16fd00e58661bb3519db8,42,I often thought back to that day in the church.,I frequently reflected on that particular day at the church.
5de16fd00e58661bb3519db8,43,I wondered if my prayer had anything to do with my grandpa's recovery.,I pondered whether my prayer had influenced my grandpa's improvement.
5de16fd00e58661bb3519db8,44,"I couldn't be sure, but it definitely changed my perspective on faith and the power of prayer.","While uncertain, the incident certainly altered my view on faith and the potency of prayer."
5de16fd00e58661bb3519db8,45,My grandpa lived for many more years after that incident.,"Following that event, my grandpa enjoyed many additional years of life."
5de16fd00e58661bb3519db8,46,He celebrated his ninetieth birthday surrounded by family and friends.,He observed his ninetieth birthday amidst family and friends.
5de16fd00e58661bb3519db8,47,We cherished every moment we had with him.,We treasured every second spent with him.
5de16fd00e58661bb3519db8,48,That experience happened almost twenty years ago.,That incident occurred nearly two decades ago.
5de16fd00e58661bb3519db8,49,It remains a vivid memory in my mind.,It continues to be a clear recollection in my thoughts.
5de16fd00e58661bb3519db8,50,"My grandpa passed away a few years later, but his spirit lives on in our hearts.","My grandpa departed a few years subsequent to that event, yet his essence endures in our memories."
5de16fd00e58661bb3519db8,51,"Sometimes, when I'm feeling lost or uncertain, I think back to that day.","Occasionally, in moments of doubt or confusion, I reflect on that day."
5de16fd00e58661bb3519db8,52,I remember the power of faith and the miracles it can bring.,I recall the strength of belief and the wonders it can manifest.
5de16fd00e58661bb3519db8,53,"And I am reminded that we are never truly alone, even when it seems like we are.","And it reassures me that we are never truly isolated, even when solitude appears to be our only companion."
5e0d531982a9554d3862a670,1,The story teller is telling a story from 20 years ago,The narrator recounts a tale from two decades past
5e0d531982a9554d3862a670,2,"when he was 22,","at the age of 22,"
5e0d531982a9554d3862a670,3,fresh out of college,right after graduating from university
5e0d531982a9554d3862a670,4,working in a bookstore.,employed at a local bookshop.
5e0d531982a9554d3862a670,5,He has one sister,He possesses a single sibling
5e0d531982a9554d3862a670,6,who was at home,who resided at their residence
5e0d531982a9554d3862a670,7,looking after his grandad,caring for their grandfather
5e0d531982a9554d3862a670,8,who was sick,who was unwell
5e0d531982a9554d3862a670,9,as their parents were away.,while their parents were out of town.
5e0d531982a9554d3862a670,10,He was working alone,He found himself working solo
5e0d531982a9554d3862a670,11,stacking shelves,organizing the bookshelves
5e0d531982a9554d3862a670,12,and heard a voice telling him that if he went to the church and prayed his grandad would get better.,and perceived a voice suggesting that a visit to the church to pray would heal his grandfather.
5e0d531982a9554d3862a670,13,He tried to ignore it,He attempted to dismiss the notion
5e0d531982a9554d3862a670,14,but kept thinking about it,yet it continued to occupy his thoughts
5e0d531982a9554d3862a670,15,"so he took a break,","leading him to take a pause,"
5e0d531982a9554d3862a670,16,locked the store,secure the bookstore
5e0d531982a9554d3862a670,17,and went to a close by church a quarter-mile away.,and proceed to a nearby church a quarter-mile distant.
5e0d531982a9554d3862a670,18,He was not a particularly religious person,He wasn't particularly devout
5e0d531982a9554d3862a670,19,but remembered his grandma saying that prayers from a sincere heart caused miracles,but recalled his grandmother's words about heartfelt prayers bringing forth wonders
5e0d531982a9554d3862a670,20,"so he went in,","prompting him to enter,"
5e0d531982a9554d3862a670,21,He said he had forgotten how to pray,Admitting he had lost touch with how to pray
5e0d531982a9554d3862a670,22,but prayed for his grandad to get better,he nonetheless offered prayers for his grandfather's recovery
5e0d531982a9554d3862a670,23,and went back to work.,before returning to his job.
5e0d531982a9554d3862a670,24,"After some time he felt a pull to go home,","Later, he experienced an urge to return home,"
5e0d531982a9554d3862a670,25,he didn't hear any voices,not due to any auditory hallucinations
5e0d531982a9554d3862a670,26,just an overwhelming pull to the house.,but due to an irresistible compulsion towards his home.
5e0d531982a9554d3862a670,27,He got home,Upon arriving
5e0d531982a9554d3862a670,28,"and found his grandad in the living room,","he discovered his grandfather in the sitting area,"
5e0d531982a9554d3862a670,29,he hadn't got up and walked in a long time.,who hadn't managed to walk for an extended period.
5e0d531982a9554d3862a670,30,His sister said the grandad had had a sudden burst of energy.,His sister mentioned their grandfather had experienced a sudden surge of vitality.
5e0d531982a9554d3862a670,31,That was a turning point in their lives,This moment marked a pivotal change in their existence
5e0d531982a9554d3862a670,32,and the grandad lived into his 90s.,with the grandfather surviving well into his nineties.
5e0d531982a9554d3862a670,33,They still think about that day,The incident remains in their memories
5e0d531982a9554d3862a670,34,and the story teller has changed his perspective on faith and miracles.,and has altered the narrator's views on spirituality and the miraculous.
5e1f321074dfbe028c2fbb18,1,"When the narrator was 22 (fresh out of college),","At the age of 22, just after graduating from college,"
5e1f321074dfbe028c2fbb18,2,they were working in a bookstore.,the storyteller was employed at a local bookshop.
5e1f321074dfbe028c2fbb18,3,"They lived with their sister (their only other sibling) and grandpa,","Their living situation included their sister (the only other sibling) and their grandfather,"
5e1f321074dfbe028c2fbb18,4,who was unwell and needed constant care.,who was ill and required ongoing attention.
5e1f321074dfbe028c2fbb18,5,"One day while shelving books,","On a particular day amidst organizing the bookshelves,"
5e1f321074dfbe028c2fbb18,6,"the narrator heard a voice tell them that if they went over to the old church and prayed,","a mysterious voice suggested that by visiting the ancient church to offer prayers,"
5e1f321074dfbe028c2fbb18,7,their grandpa would get better.,their grandfather's health would improve.
5e1f321074dfbe028c2fbb18,8,"Though they looked around the store,","Even though they scanned the bookstore,"
5e1f321074dfbe028c2fbb18,9,the narrator couldn't see anyone.,the storyteller could not spot anyone.
5e1f321074dfbe028c2fbb18,10,The voice repeated itself.,The voice echoed its message.
5e1f321074dfbe028c2fbb18,11,The narrator decided to take a break and head over to the church,"Resolved to act, the storyteller opted to pause their work and proceed to the church,"
5e1f321074dfbe028c2fbb18,12,which was only a quarter of a mile away.,which was a mere quarter-mile distant.
5e1f321074dfbe028c2fbb18,13,"At the church,","Inside the church,"
5e1f321074dfbe028c2fbb18,14,"the narrator thought about advice their grandma had given them,","the storyteller pondered over a piece of wisdom their grandmother had shared,"
5e1f321074dfbe028c2fbb18,15,"that prayers from a sincere heart could come true,","about the power of earnest prayers to manifest,"
5e1f321074dfbe028c2fbb18,16,but prayers without faith were useless.,while those lacking belief were of no consequence.
5e1f321074dfbe028c2fbb18,17,The narrator had doubts as they were not particularly religious,"Filled with skepticism due to a lack of strong religious convictions,"
5e1f321074dfbe028c2fbb18,18,and had done their fair share of misdeeds.,"and mindful of their past wrongdoings,"
5e1f321074dfbe028c2fbb18,19,However they decided to go in to the church,"they nonetheless chose to enter the church,"
5e1f321074dfbe028c2fbb18,20,and knelt down to pray for their grandpa to get better.,and humbly knelt to seek divine intervention for their grandfather's recovery.
5e1f321074dfbe028c2fbb18,21,"After praying,","Having offered their prayers,"
5e1f321074dfbe028c2fbb18,22,the narrator returned to work.,the storyteller made their way back to their job.
5e1f321074dfbe028c2fbb18,23,"Back at the bookstore,","Upon returning to the bookshop,"
5e1f321074dfbe028c2fbb18,24,they got a strong feeling pulling them to go home.,an overwhelming urge compelled them to return home.
5e1f321074dfbe028c2fbb18,25,They left early,"Departing ahead of schedule,"
5e1f321074dfbe028c2fbb18,26,"and were astonished to see their grandpa sitting talking to their sister in the living room,","they were greeted by the sight of their grandfather engaging in conversation with their sister in the lounge,"
5e1f321074dfbe028c2fbb18,27,despite the fact that their grandpa had been bedbound for several months.,an astonishing sight given his prolonged confinement to bed.
5e1f321074dfbe028c2fbb18,28,Their grandpa lived for several more years,"The grandfather went on to live for additional years,"
5e1f321074dfbe028c2fbb18,29,"and even got to celebrate his 90th birthday surrounded by loved ones,","celebrating his ninetieth birthday in the company of his family,"
5e1f321074dfbe028c2fbb18,30,who were all more grateful for the time they had together having been through such a lifechanging experience.,who all cherished the extended time together after such a transformative ordeal.
5e1f321074dfbe028c2fbb18,31,The narrator was reflecting on this story 20 years later,"Two decades later, the storyteller reminisced about the incident,"
5e1f321074dfbe028c2fbb18,32,and how it had been such a turning point for them.,recalling the profound impact it had on their life's journey.
5e349c07e2790c468d9775aa,1,One day I was a young boy,"Once upon a time, I was a little boy"
5e349c07e2790c468d9775aa,2,and my sister was caring for my grandpa,while my sister took care of our grandfather
5e349c07e2790c468d9775aa,3,who was bedridden.,who was confined to his bed.
5e349c07e2790c468d9775aa,4,I was working at a bookstore.,My job was at a local bookshop.
5e349c07e2790c468d9775aa,5,There was only two siblings me and my sister.,"There were just the two of us, my sister and I."
5e349c07e2790c468d9775aa,6,One day when I was shelving books,On a day as I was placing books on shelves
5e349c07e2790c468d9775aa,7,a voice said to me to light a candle at the church for my grandpa,a whisper urged me to light a candle in the church for my grandfather
5e349c07e2790c468d9775aa,8,and he would regain his strength.,promising that he would recover his vitality.
5e349c07e2790c468d9775aa,9,Although I wasn’t a strong believer,Even though I wasn't deeply religious
5e349c07e2790c468d9775aa,10,and my grandma said prayer without belief was pointless,and my grandmother had mentioned that prayer without faith was futile
5e349c07e2790c468d9775aa,11,I went and lit a candle.,I still went ahead and lit a candle.
5e349c07e2790c468d9775aa,12,I said despite my misdeeds I was looking for help and strength for my grandpa,"I prayed, admitting my faults, seeking aid and vigor for my grandfather"
