recall_id,clause_id,clause_text,rephrased_text
5f305d059a58b14b23eeccb8,12,He got better since that day & lived to an old age.,"From that day forward, he regained his health and lived to a ripe old age."
5f305d059a58b14b23eeccb8,13,When times are tough even though its been over 20yrs ago now the girl still thinks of that moment.,"In difficult times, even now after more than two decades, the woman often reflects on that extraordinary day."
5f3dbd5e99a9be1da93d9039,1,Guy was 22 years old,"At the age of 22, Guy"
5f3dbd5e99a9be1da93d9039,2,working in a bookstore,was employed at a local bookshop
5f3dbd5e99a9be1da93d9039,3,and himself and sister were minding their bedridden grandpa,while he and his sister took care of their immobilized grandfather
5f3dbd5e99a9be1da93d9039,4,while their parents were away for the weekend.,as their parents were gone for a weekend trip.
5f3dbd5e99a9be1da93d9039,5,A voice told him to pray at the church,An inner voice urged him to offer prayers at the church
5f3dbd5e99a9be1da93d9039,6,and his grandpa would get better,promising that his grandfather would recover
5f3dbd5e99a9be1da93d9039,7,which he did.,and so he followed the advice.
5f3dbd5e99a9be1da93d9039,8,While back at the bookstore,Upon returning to the bookshop
5f3dbd5e99a9be1da93d9039,9,he got an urge to go home,he felt a sudden compulsion to return home
5f3dbd5e99a9be1da93d9039,10,and found his grandpa sitting up for the first time in years.,where he discovered his grandfather upright for the first time in many years.
5f3dbd5e99a9be1da93d9039,11,After this he kept recovering,"From that point on, his grandfather gradually got better"
5f3dbd5e99a9be1da93d9039,12,and had a 90th birthday party years later.,eventually celebrating his 90th birthday years afterward.
5f3dbd5e99a9be1da93d9039,13,He passed a few years after that,The grandfather departed a few years subsequent to that
5f3dbd5e99a9be1da93d9039,14,and the guy always thought about whether the power of prayer truly helped his grandpa.,and Guy often pondered if the act of praying had indeed aided his grandfather's health.
5f4cc45ee974b18dbf4a503d,1,A twenty two year old person had just finished college,A 22-year-old individual had recently graduated from university
5f4cc45ee974b18dbf4a503d,2,and was working in a book store.,and was employed at a bookstore.
5f4cc45ee974b18dbf4a503d,3,He had a sickly grandfather,His grandfather was in poor health
5f4cc45ee974b18dbf4a503d,4,and a sister that looked after him.,with his sister taking care of him.
5f4cc45ee974b18dbf4a503d,5,Whilst packing the shelves he heard a voice in his head,"While stocking the shelves, he perceived a voice inside his mind"
5f4cc45ee974b18dbf4a503d,6,that said he should go to the church,urging him to visit the church
5f4cc45ee974b18dbf4a503d,7,and light a candle for his grandfather.,to light a candle in honor of his grandfather.
5f4cc45ee974b18dbf4a503d,8,He looked around the book store,He glanced around the bookstore
5f4cc45ee974b18dbf4a503d,9,and didn't see anyone,but saw no one
5f4cc45ee974b18dbf4a503d,10,then heard the voice say the same thing again.,when the voice repeated the instruction once more.
5f4cc45ee974b18dbf4a503d,11,"He decided to go down to the church,","He made up his mind to head to the church,"
5f4cc45ee974b18dbf4a503d,12,"even though he isn't religious,","despite not being a follower of any religion,"
5f4cc45ee974b18dbf4a503d,13,and light a candle,to ignite a candle
5f4cc45ee974b18dbf4a503d,14,and say a little prayer.,and offer a brief prayer.
5f4cc45ee974b18dbf4a503d,15,Later he got home,Upon returning home later
5f4cc45ee974b18dbf4a503d,16,and his grandfather was feeling a little better.,he found his grandfather's health had slightly improved.
5f4cc45ee974b18dbf4a503d,17,He lived for 20 more years,His grandfather survived another two decades
5f4cc45ee974b18dbf4a503d,18,and now the person seems more religious,and the individual now appears to be more spiritual
5f4cc45ee974b18dbf4a503d,19,and takes comfort in his memories of his grandfather.,finding solace in the recollections of his grandfather.
5f4e826dade9a507a7c6c2d3,1,"In my twenties,","During my twenties,"
5f4e826dade9a507a7c6c2d3,2,I worked in a bookstore.,I was employed at a bookshop.
5f4e826dade9a507a7c6c2d3,3,"My grandpa was really sick at this moment,","At that time, my grandfather was quite ill,"
5f4e826dade9a507a7c6c2d3,4,he couldn't get out of bed without help.,unable to rise from his bed unassisted.
5f4e826dade9a507a7c6c2d3,5,My sister and I took care of him.,My sibling and I were his caretakers.
5f4e826dade9a507a7c6c2d3,6,"One day, while I was working,","Once, as I manned the store,"
5f4e826dade9a507a7c6c2d3,7,"I heard a voice in my head saying that ""I need to go to the old church and light a candle for my grandpa"".","An inner voice insisted I ""visit the ancient church to light a candle for my granddad""."
5f4e826dade9a507a7c6c2d3,8,"I ignored it,","I dismissed the thought,"
5f4e826dade9a507a7c6c2d3,9,"but then I heard this voice again, saying the exact same thing.",yet the same message repeated itself in my mind.
5f4e826dade9a507a7c6c2d3,10,I felt like i had to go to this church.,I sensed an obligation to heed this call to the church.
5f4e826dade9a507a7c6c2d3,11,I closed the bookstore,I shut down the bookshop
5f4e826dade9a507a7c6c2d3,12,and went to the church.,and proceeded to the chapel.
5f4e826dade9a507a7c6c2d3,13,"I wasn't sure if I should do this,","I was uncertain about following through,"
5f4e826dade9a507a7c6c2d3,14,"because I wasn't a believing person,","given my lack of religious conviction,"
5f4e826dade9a507a7c6c2d3,15,but I did this anyway.,"nevertheless, I followed the impulse."
5f4e826dade9a507a7c6c2d3,16,"After that, I went back to work.","Subsequently, I returned to my job."
5f4e826dade9a507a7c6c2d3,17,"Then I felt this strong urge to go home,","Later, an overwhelming compulsion to return home overcame me,"
5f4e826dade9a507a7c6c2d3,18,as if something was pulling me there.,as though an invisible force was guiding me.
5f4e826dade9a507a7c6c2d3,19,I closed the store,I locked up the shop
5f4e826dade9a507a7c6c2d3,20,and went to home.,and made my way home.
5f4e826dade9a507a7c6c2d3,21,"When I came in,","Upon entering,"
5f4e826dade9a507a7c6c2d3,22,I saw my grandpa sitting in the living room with my sister.,I was greeted by the sight of my grandpa seated in the lounge with my sister.
5f4e826dade9a507a7c6c2d3,23,"She told me that he suddenly got so much energy,","She explained that he had found a sudden burst of vitality,"
5f4e826dade9a507a7c6c2d3,24,that he could stand up by himself.,enabling him to stand independently.
5f4e826dade9a507a7c6c2d3,25,He lived a long time after this event.,He continued to live for many years following that incident.
5f4e826dade9a507a7c6c2d3,26,"I still come back in my memories to this day,","To this day, I often reflect on that moment,"
5f4e826dade9a507a7c6c2d3,27,"thinking if my prayers had something to do with ""healing"" my grandpa.",pondering whether my act of faith contributed to my grandfather's recovery.
5f4e826dade9a507a7c6c2d3,28,This changed my thinking about faith and prayers.,It profoundly altered my perspective on spirituality and prayer.
5f5bdef433291039ca812397,1,"When I was 22,","At the age of 22,"
5f5bdef433291039ca812397,2,"fresh out of college,","just after graduating,"
5f5bdef433291039ca812397,3,I worked in a bookstore.,I was employed at a bookstore.
5f5bdef433291039ca812397,4,I have 1 sister,I possess one sibling
5f5bdef433291039ca812397,5,who looks after my grandad,who takes care of my grandfather
5f5bdef433291039ca812397,6,who is bed bound,who is confined to his bed
5f5bdef433291039ca812397,7,and parents are away.,while our parents are out.
5f5bdef433291039ca812397,8,"One day,","On a particular day,"
5f5bdef433291039ca812397,9,"when filling shelves,","as I was stocking the shelves,"
5f5bdef433291039ca812397,10,"I heard a voice say,"" Go to the church and light a candle'.","I perceived a voice instructing, 'Proceed to the church and ignite a candle.'"
5f5bdef433291039ca812397,11,"I looked around,","I scanned the area,"
5f5bdef433291039ca812397,12,"no one there,","but found it deserted,"
5f5bdef433291039ca812397,13,I ignored it,so I dismissed the occurrence
5f5bdef433291039ca812397,14,but heard the voice again a few times.,yet the voice repeated itself several times.
5f5bdef433291039ca812397,15,The shop wasn't busy,"With the store not bustling,"
5f5bdef433291039ca812397,16,so I walked towards the church,I made my way to the church
5f5bdef433291039ca812397,17,and about a ¼ of a mile away,and roughly a quarter mile from it
5f5bdef433291039ca812397,18,"I remembered my Grandma used to say that you had to have faith for a prayer to work,","I recalled my Grandmother's words that faith was necessary for prayers to be effective,"
5f5bdef433291039ca812397,19,"also that a prayer, without belief was no good.",and that a prayer without true belief was futile.
5f5bdef433291039ca812397,20,"I went to the church,","I proceeded to the church,"
5f5bdef433291039ca812397,21,lit a candle,ignited a candle
5f5bdef433291039ca812397,22,and told God I wasn't sure how to pray,and expressed to God my uncertainty on how to pray
5f5bdef433291039ca812397,23,but could my grandad possibly get better,but requested if my grandfather could somehow recover
5f5bdef433291039ca812397,24,and be part of the family again.,and rejoin our family circle.
5f5bdef433291039ca812397,25,On returning to the bookshop,Upon my return to the bookstore
5f5bdef433291039ca812397,26,a voice told me to go home,a voice urged me to return home
5f5bdef433291039ca812397,27,"and when I did,","which I did,"
5f5bdef433291039ca812397,28,grandad was sitting on a chair.,to find my grandfather seated in a chair.
5f5bdef433291039ca812397,29,He had reached the chair with help,He had managed to get to the chair with assistance
5f5bdef433291039ca812397,30,as he had felt a surge of energy.,having experienced a burst of vitality.
5f5bdef433291039ca812397,31,He continued to improve,His health progressively got better
5f5bdef433291039ca812397,32,and lived for a few years till his nineties.,and he went on to live into his nineties.
5f7760d025023628ce3f4d05,1,"A man 22 years old, fresh out of college is looking after his ill grandpa with his sister at their family home","At 22 years of age, a young man just graduated from university takes care of his sick grandfather with his sister in their ancestral house"
5f7760d025023628ce3f4d05,2,while his parents are out of town.,while his parents are away from the city.
5f7760d025023628ce3f4d05,3,He has a job at a bookstore,He's employed at a local bookshop
5f7760d025023628ce3f4d05,4,"and whilst working, hears an imaginary voice telling him to go to the church and light a candle.","and during his shift, he perceives a non-existent voice instructing him to visit the church to light a candle."
5f7760d025023628ce3f4d05,5,"He does it, despite not really believing it,","He follows the instruction, though he's not a firm believer,"
5f7760d025023628ce3f4d05,6,"but thinking about what his grandma used to say, he goes anyway.","yet, recalling his grandmother's words, he decides to proceed."
5f7760d025023628ce3f4d05,7,Once back to the bookstore after lighting the candle,After fulfilling the task of candle lighting and returning to the bookshop
5f7760d025023628ce3f4d05,8,he gets a strong urge to go home.,he feels a compelling need to return to his residence.
5f7760d025023628ce3f4d05,9,When he gets home his grandpa is sitting in the lounge,"Upon arriving, he finds his grandfather seated in the living room"
5f7760d025023628ce3f4d05,10,despite not being able to get out of bed for months.,even though his grandfather hadn't managed to leave his bed for several months.
5f7760d025023628ce3f4d05,11,His grandpa lived a few more years after that.,"Following this event, his grandfather continued to live for several more years."
5f7760d025023628ce3f4d05,12,The writer is recalling the story from 20 years ago.,The author is reminiscing about this incident from two decades prior.
5f7f239e9b204e05b6c36538,1,I want to share with a story of when I was twenty two back in college.,I'd like to recount a tale from my college days when I was twenty-two.
5f7f239e9b204e05b6c36538,2,At home we lived with my grandpa who was now bedridden for months.,"Back then, my grandfather, who had been confined to his bed for several months, lived with us."
5f7f239e9b204e05b6c36538,3,"There was just two siblings, me and my sister.",It was just my sister and me as the only two siblings.
5f7f239e9b204e05b6c36538,4,Our parents were away on weekend and my sister was the one taking care of him.,"Our parents had gone for the weekend, leaving my sister in charge of his care."
5f7f239e9b204e05b6c36538,5,"One day when I was at store packing book on shelves, I heard a voice saying "" if you go to the church and light a candle for your grandpa, he will get better"".","Once, while I was at the bookstore arranging books on the shelves, I heard someone whisper, ""Light a candle in the church for your grandpa, and he will recover""."
5f7f239e9b204e05b6c36538,6,I turned around to see who was there but there was no one.,"I spun around to identify the speaker, but there was nobody there."
5f7f239e9b204e05b6c36538,7,I continued packing the books on the shelves till I heard the voice again.,I resumed my task of shelving books until the voice spoke to me once more.
5f7f239e9b204e05b6c36538,8,I turned around again but still there was no one.,"Spinning around yet again, I found myself alone."
5f7f239e9b204e05b6c36538,9,I then left the store and made my way to the church.,"Subsequently, I departed from the bookstore and headed towards the church."
5f7f239e9b204e05b6c36538,10,"About a quarter mile away, I stopped and pondered.","Roughly a quarter mile from the church, I halted to reflect."
5f7f239e9b204e05b6c36538,11,"I was not a religious person but my grandmother used to say prayer from a sincere heart can bring miracles, but she said prayer without faith is useless.","Although I wasn't devout, my grandmother always mentioned that earnest prayers could work wonders, yet she also believed that prayer without faith was futile."
5f7f239e9b204e05b6c36538,12,Finally I went inside and lit the candle and prayed.,"In the end, I entered the church, lit the candle, and offered a prayer."
5f7f239e9b204e05b6c36538,13,I went back to the store and had a strong urge to go back home.,"After returning to the bookstore, I felt a compelling urge to return home."
5f7f239e9b204e05b6c36538,14,"There no voices this time, just an overwhelming feeling.","This time, there were no voices, just an overpowering sensation."
5f7f239e9b204e05b6c36538,15,I immediately locked up the store and went home.,"Without hesitation, I secured the bookstore and set off for home."
5f7f239e9b204e05b6c36538,16,I walked in to find my grandpa sitting in the dining room with my sister.,"Upon arrival, I was astonished to see my grandpa seated in the dining room with my sister."
5f7f239e9b204e05b6c36538,17,He had been bedding for months but he suddenly had a burst of energy and was able to get up without assistance.,"Despite being bedridden for months, he had suddenly gained enough energy to rise unaided."
5f7f239e9b204e05b6c36538,18,I wondered if my prayer had.,I pondered whether it was my prayer that had made the difference.
5f95f7f71193824c90e0b5ef,1,A 22 year old working in a bookshop,A 22-year-old employed at a bookstore
5f95f7f71193824c90e0b5ef,2,heard a voice,perceived a voice
5f95f7f71193824c90e0b5ef,3,telling him to light a candle at the church,instructing him to ignite a candle in the church
5f95f7f71193824c90e0b5ef,4,for his sick grandpa.,for his ailing grandfather.
5f95f7f71193824c90e0b5ef,5,After he had lit the candle,Once the candle was lit
5f95f7f71193824c90e0b5ef,6,he went home,he returned home
5f95f7f71193824c90e0b5ef,7,and found his grandpa,and discovered his grandfather
5f95f7f71193824c90e0b5ef,8,who had been unable to get out of bed,who had been bedridden
5f95f7f71193824c90e0b5ef,9,sitting out in a chair,seated comfortably in a chair
5f95f7f71193824c90e0b5ef,10,with renewed energy.,exhibiting a surge of vitality.
5f95f7f71193824c90e0b5ef,11,His grandpa made a full recovery,His grandfather eventually healed completely
5f95f7f71193824c90e0b5ef,12,and lived for many years.,and continued to live for numerous years.
5fb92475bca3903c9f3f7d45,1,The person was young and working in a bookstore,"The individual was youthful, employed at a bookshop"
5fb92475bca3903c9f3f7d45,2,when one day he heard a voice telling him to go and light the candle at church for his grandpa,when suddenly a voice instructed him to light a candle in the church for his grandfather
5fb92475bca3903c9f3f7d45,3,at first he tried to ignore it,initially he dismissed the notion
5fb92475bca3903c9f3f7d45,4,but the voice repeated,yet the voice persisted
5fb92475bca3903c9f3f7d45,5,and he decided to head to the church,leading him to make his way to the church
5fb92475bca3903c9f3f7d45,6,before he entered the church he remembered the words from his grandma telling them about how powerful a prayer can be if you pray with a sincere heart,"upon approaching the church, he recalled his grandmother's words about the strength of prayer when done with a true heart"
5fb92475bca3903c9f3f7d45,7,so he went ahead inside the church,"thus, he proceeded inside the sanctuary"
5fb92475bca3903c9f3f7d45,8,where he found a candle,there he discovered a candle
5fb92475bca3903c9f3f7d45,9,and started to pray for his grandpa,and began praying for his grandfather's well-being
5fb92475bca3903c9f3f7d45,10,after that he went back to the bookstore,"subsequently, he returned to the bookshop"
5fb92475bca3903c9f3f7d45,11,where he felt a sudden surge to go home,where he was overcome with an urge to return home
5fb92475bca3903c9f3f7d45,12,he got up and lock the store,"he rose, secured the store"
5fb92475bca3903c9f3f7d45,13,and went straight home,and headed directly to his residence
5fb92475bca3903c9f3f7d45,14,when he got there he found his grandpa sitting in a stool,"upon arrival, he saw his grandfather seated on a stool"
5fb92475bca3903c9f3f7d45,15,and looked better then when he left him that morning,appearing healthier than he had that morning
5fb92475bca3903c9f3f7d45,16,and that was beginning of his recovery,marking the start of his recuperation
5fb92475bca3903c9f3f7d45,17,The grandpa lived till he was ninety years old.,The grandfather continued to live until the age of ninety.
5fd7c98ecffb0b080c0f1c84,1,"At 22 years old,","At the age of 22,"
5fd7c98ecffb0b080c0f1c84,2,the young adult began his first job at a local bookstore.,the young man embarked on his inaugural employment at a neighborhood bookshop.
5fd7c98ecffb0b080c0f1c84,3,His parents were out of town,His parents were away from home
5fd7c98ecffb0b080c0f1c84,4,and lived with his bedridden grandpa.,and he resided with his ailing grandfather.
5fd7c98ecffb0b080c0f1c84,5,"At work,","During his shift,"
5fd7c98ecffb0b080c0f1c84,6,"he heard a voice telling him to go to the local church,","a mysterious voice instructed him to visit the nearby church,"
5fd7c98ecffb0b080c0f1c84,7,light a candle,ignite a candle
5fd7c98ecffb0b080c0f1c84,8,and pray,and offer a prayer
5fd7c98ecffb0b080c0f1c84,9,and the grandpa will get better.,so that his grandfather would recover.
5fd7c98ecffb0b080c0f1c84,10,"The young adult was not at all religious,","The young man was not particularly spiritual,"
5fd7c98ecffb0b080c0f1c84,11,however recalled how his grandpa would pray.,yet he remembered his grandfather's prayers.
5fd7c98ecffb0b080c0f1c84,12,The young adult lit the candle,The young man set the candle alight
5fd7c98ecffb0b080c0f1c84,13,"and spoke to God,","and communicated with the divine,"
5fd7c98ecffb0b080c0f1c84,14,without knowing what to say,unsure of what to articulate
5fd7c98ecffb0b080c0f1c84,15,asked for his grandpa's healing.,he implored for his grandfather's recuperation.
5fd7c98ecffb0b080c0f1c84,16,As he went back to work,"Upon returning to his job,"
5fd7c98ecffb0b080c0f1c84,17,he had a strong urge to go home.,he felt an overwhelming compulsion to return home.
5fd7c98ecffb0b080c0f1c84,18,"To his surprise,","Astonishingly,"
5fd7c98ecffb0b080c0f1c84,19,"he saw his grandpa in the living room,","he found his grandfather in the sitting area,"
5fd7c98ecffb0b080c0f1c84,20,he slowly gained more strength,who was gradually regaining vigor
5fd7c98ecffb0b080c0f1c84,21,and lived a good few years,and enjoyed several more years of life
5fd7c98ecffb0b080c0f1c84,22,and died at 90 years.,passing away at the age of 90.
5ff45beefdb6e6b063b4c520,1,I was fresh out of college,"Having just graduated from university,"
5ff45beefdb6e6b063b4c520,2,and working in a book store.,I secured a job at a bookstore.
5ff45beefdb6e6b063b4c520,3,I lived with my younger sister,My living situation included my younger sibling
5ff45beefdb6e6b063b4c520,4,"and my grandpa,","alongside our grandfather,"
5ff45beefdb6e6b063b4c520,5,and recently he'd became ill.,who had recently fallen sick.
5ff45beefdb6e6b063b4c520,6,Very ill.,"Extremely sick, in fact."
5ff45beefdb6e6b063b4c520,7,Eventually becoming bedridden,"He soon became confined to his bed,"
5ff45beefdb6e6b063b4c520,8,and continuing to decline.,his health progressively worsening.
5ff45beefdb6e6b063b4c520,9,One night while stacking shelves at work,"During an evening shift organizing books,"
5ff45beefdb6e6b063b4c520,10,I hear a voice in my mind -,a voice echoed within my thoughts -
5ff45beefdb6e6b063b4c520,11,"telling me to go to the Church nearby,",urging me to visit the nearby church
5ff45beefdb6e6b063b4c520,12,and light a candle:,to kindle a candle:
5ff45beefdb6e6b063b4c520,13,this would help my grandpa get better.,this act was supposed to aid in my grandfather's recovery.
5ff45beefdb6e6b063b4c520,14,I had reservations,I was skeptical
5ff45beefdb6e6b063b4c520,15,as I was far from religious,"since I wasn't particularly spiritual,"
5ff45beefdb6e6b063b4c520,16,"but I went to the Church about a quarter mile away,","yet I made my way to the church a short distance away,"
5ff45beefdb6e6b063b4c520,17,"found,","located it,"
5ff45beefdb6e6b063b4c520,18,and lit a candle.,and ignited a candle.
5ff45beefdb6e6b063b4c520,19,"I suddenly felt an inescapable urge to go home,","An overwhelming compulsion to return home washed over me,"
5ff45beefdb6e6b063b4c520,20,which I gave in to,"to which I surrendered,"
5ff45beefdb6e6b063b4c520,21,"only to see Grandpa,","and was greeted by my Grandpa,"
5ff45beefdb6e6b063b4c520,22,"who had been bedridden remember,","who, despite being confined to bed,"
5ff45beefdb6e6b063b4c520,23,up and walking.,was on his feet.
5ff45beefdb6e6b063b4c520,24,"He'd, that night, felt a rush of energy",He had experienced a surge of vitality that evening
5ff45beefdb6e6b063b4c520,25,"and every night after got better and better,","and continued to improve night after night,"
5ff45beefdb6e6b063b4c520,26,living for many many years afterwards.,ultimately living for many additional years.
5ff45beefdb6e6b063b4c520,27,He made it to ninety.,He reached the age of ninety.
5ff45beefdb6e6b063b4c520,28,"I still think back to that night very often,","That night remains frequently in my thoughts,"
5ff45beefdb6e6b063b4c520,29,and wonder whether my act of lighting that candle and giving a prayer really made a difference or not.,leaving me to ponder if my gesture of lighting the candle and offering a prayer truly had an impact.
5ff45beefdb6e6b063b4c520,30,Either way it changed my whole outlook on faith.,"Regardless, it profoundly altered my perspective on spirituality."
60148ce8ea15974d855c06d5,1,Guy was 22,"At the age of 22,"
60148ce8ea15974d855c06d5,2,and had a job in a bookstore.,Guy worked at a bookstore.
60148ce8ea15974d855c06d5,3,His sister was at home,"His sister stayed at home,"
60148ce8ea15974d855c06d5,4,looking after their grandpa.,caring for their grandfather.
60148ce8ea15974d855c06d5,5,There were only 2 siblings.,They were a duo of siblings.
60148ce8ea15974d855c06d5,6,Parents were out of town.,Their parents were away.
60148ce8ea15974d855c06d5,7,When he was putting books away,"While shelving books,"
60148ce8ea15974d855c06d5,8,he heard a voice,"a voice reached his ears,"
60148ce8ea15974d855c06d5,9,telling him to light a candle in church,urging him to light a candle at the church
60148ce8ea15974d855c06d5,10,and his grandpa would get better.,to aid in his grandfather's recovery.
60148ce8ea15974d855c06d5,11,He ignored it the first time,"He dismissed the notion initially,"
60148ce8ea15974d855c06d5,12,but after the second time,"yet upon hearing it a second time,"
60148ce8ea15974d855c06d5,13,closed the store,"he locked up the shop,"
60148ce8ea15974d855c06d5,14,and went to the church a short walk away.,and made his way to the nearby church.
60148ce8ea15974d855c06d5,15,His grandmother had told him,His grandmother had once advised him
60148ce8ea15974d855c06d5,16,sincere prayers would be answered,"that heartfelt prayers would find their answers,"
60148ce8ea15974d855c06d5,17,but insincere ones were pointless.,while hollow ones were in vain.
60148ce8ea15974d855c06d5,18,He went in,"He entered the church,"
60148ce8ea15974d855c06d5,19,and prayed,"offered a prayer,"
60148ce8ea15974d855c06d5,20,but confess he didn't know how to do it properly.,admitting he was unsure of the correct way to pray.
60148ce8ea15974d855c06d5,21,Then he went back to the bookstore.,"Afterward, he returned to the bookstore."
60148ce8ea15974d855c06d5,22,Then he had a feeling,"A sensation then overcame him,"
60148ce8ea15974d855c06d5,23,that he should go home.,compelling him to return home.
60148ce8ea15974d855c06d5,24,When he did,"Upon his arrival,"
60148ce8ea15974d855c06d5,25,his grandpa was feeling better,"he found his grandfather's health improved,"
60148ce8ea15974d855c06d5,26,and recovered to live a much longer life.,who then continued to live an extended life.
