recall_id,recall_text,len_original,recall rate,rephrased_text,len_rephrased,rate
5ced352a6b2b3d001a94c003,"wtf! Daughter, ill father, sister not visited in 8 months. voice in her head says go to the park and pray for his recovery. Park 10 minutes away. hears voice, no one there. prays under an oak tree. receives text on her way back to work from father, took a few steps with walker. goes to visit him, standing with walker, recovers most mobility with a yr that was 6-7 yrs ago. living life to fullest in his 70's.",410,0.22,"What the heck! My dear daughter, ailing dad, sibling not seen for over half a year. an inner voice urges her to head to the park to seek divine intervention for his well-being. The park is a brief 10-minute journey away. perceives a voice, yet finds herself alone. offers prayers beneath a sturdy oak. gets a message while returning to her job from her dad, who managed to walk a bit with his walker. decides to pay him a visit, finds him upright with the walker, and he regains much of his movement within a year which was about six to seven years prior. enjoys his life to the max in his seventies.",600,0.11750725735758337
60612b2762141813740d1074,"A guy was living with his dad who lost mobility. His neighbor usually stay at home with his dad during the day as his younger sister is away at college. One day, he heard something that told him to go to the park and pray for his dad's recovery. On his lunch break, he got up and went to the park. He sat on a bench and prayed for his dad's recovery. Soon, he got a text from his dad that he just took a few steps with his walker. He got home and saw his dad taking more steps in the living room. Within a year, his dad could work without assistance. Six years later, his dad is fully independent and doesn't need walking aid. He is living life to fullest in his seventies.",673,0.13,"A man resided with his father who had become immobile. During the day, his neighbor often remained at home with his father while his younger sibling was at university. One particular day, he overheard something urging him to visit the park and offer prayers for his father's healing. During his lunchtime, he rose and made his way to the park. He positioned himself on a bench and offered prayers for his father's health. Shortly after, he received a message from his father stating he had managed to walk a few paces with his walker. Upon returning home he witnessed his father walking further in the living room. In the span of a year, his father was able to move unaided. After six years, his father gained complete independence and no longer required any walking support. He now enjoys his life to the fullest in his seventies.",831,0.08842510494740675
64835a147dd0f17e8b18b196,"Age 21 lived with father Sister away at college, Father in wheelchair And was looked after by neighbour during the day. One day at work Got the overwhelming feeling to pray for fathers health to improve. Went to park in break About 10 min walk from work. Sat on bench under tree And closed eyes. Got the urge to pray again And did so. When back at work Father texted to say he had taken 2 steps with walker. Rushed home at end of working day To father standing in living room with walker. Now 7 years later Father is fully mobile And in his 70’s.",546,0.17,"At 21, resided with dad While sister was enrolled in university, Dad used a wheelchair And received daytime care from a local neighbor. During a workday Felt a compelling urge to pray for dad's health to get better. Took a break to the park Roughly a 10-minute stroll from the office. Chose a bench beneath a tree to sit And shut my eyes. Felt prompted to pray once more And so I prayed. Upon returning to the office Dad sent a message saying he'd managed two steps with his walker. Hurried back home after work To find dad upright in the living room, using his walker. Seven years have passed since then Dad walks unaided now And is in his seventies.",651,0.13502563089771122
608b445691f3225d81ca0f02,"I was living in an apartment in the near the city center and her twenties working as a graphic designer with a sister away at college. She has a sick father who is using a wheel chair and is taken care by the neighbor. One day while at the office she heard a voice that told her to go to the park and pray, she looked around and there was no one. She decided to go to the park which was a few minutes away from her office, while at the park she heard that voice again encouraging her to pray still there was no one. she found a spot to pray at which was under an oak tree she sat on the bench and prayed"" God please heal my father"", after she prayed she got a text from her father telling her, he was able to walk. After work she rushed home only to find her father standing up with that walker. It has been six to seven years now and her father is completely healed and living a full life.",890,0.1,"I resided in a flat close to the downtown area spending her twenties as a graphic artist with her sibling attending university elsewhere. Her father was ill reliant on a wheelchair for mobility and received care from a neighboring person. On a certain day at her workplace a mysterious voice instructed her to visit the park and offer prayers, she scanned the surroundings but there wasn't a soul in sight. She made up her mind to head to the park which was just a short stroll from her workplace, upon arriving at the park the same voice once more urged her to engage in prayer yet again, she was alone. she located a serene place for prayer nestled beneath a towering oak she took a seat on the bench and implored, ""God, please restore my father's health"", following her prayer she received a message from her father, announcing his newfound ability to ambulate. Post-work, she hurried to her abode to discover her father upright, aided by a walker. It's been approximately six to seven years since then and her father has fully recovered leading a completely fulfilling existence.",1083,0.08271300996522622
5d46e0febeeecd0001d01e79,"Age 21 living in an apartment and working as a graphic designer. Farther was recovering from surgery and a female neighbour was caring for him during the day. He was using a wheelchair to get around. The person got a strong urge to go to a local park and prey for his recovery, despite not being a religious person, they walked to the park, sat beneath an oak tree, looked up at the branches and said a prayer for their farther. On the way back to the office they received a text message from their farther telling them that they had taken some steps using their walker. On returning home, their farther stood to greet them. Their farther continued to improve and regained full mobility after 1 year. This took place 6-7 years ago and their farther is now in his 70s and doing well.",782,0.12,"At the age of 21, residing in a flat while employed as a graphic artist. Father was recuperating from an operation with a woman next door looking after him throughout the day. He relied on a wheelchair for mobility. The individual felt a compelling need to visit a nearby park to pray for his healing, even though they were not devout, they made their way to the park on foot, settled under a towering oak, gazed upon the treetop limbs and offered a prayer for their father's health. While heading back to work they got a text from their father informing them that he had managed to walk a few steps with his walker. Upon arriving back at their residence, their father stood up to welcome them. The father kept on getting better and achieved complete mobility within a year. These events occurred about six to seven years prior and now their father is in his seventies and remains in good health.",896,0.10010795935104913
5fa507fa0776431b370bc0c7,"In my twenties, I started a job near town, and following my dad's surgery he was alone at home with the help of a lady neighbor as my little sister was at college. One day while at the office, I got a strong feeling to go to the park and pray for my dad. As I wanted to help him get better, during my break, I took off to the park. I got the same strong feeling again and found a bench under a tree to sit on. I looked around and closed my eyes praying, please God, help my dad recover so he can have his life back. I then went back to the office and I received a message from my dad telling me that he started taking small steps. I rushed home to find my dad standing with the aid of his walking stick. It has been more than 10 years and he continues to recover and makes the most of his life.",794,0.12,"During my twenties, I secured employment close to the town center, and after my father underwent surgery he remained at home with assistance from a woman next door while my younger sister attended university. Once, while I was at work, an intense urge came over me to visit the park and offer prayers for my father's well-being. Desiring to contribute to his recovery, on my lunch break, I headed to the park. That powerful intuition struck me once more and I chose a bench beneath a tree to rest upon. I surveyed the surroundings and with my eyes shut, I offered a prayer, begging God to aid my father's healing so he might regain his normal life. Afterward, I returned to my workplace and got a text from my father informing me he had begun to walk a little. I hurried back home to see my father up on his feet, leaning on his cane. It's been over a decade since then and his recuperation continues as he enjoys his life to the fullest.",938,0.09441038584460557
63861a54c47e7f59fdb5a4c8,"When the story teller was 21 years old and had just started his first job as a graphic designer he lived in an apartment in the city. His father was recovering from an operation and had lost his independence and mobility. His only company was a neighbour in her sixties, who called on him every day. One day the story teller had a strong feeling that he should go to the park in his lunch break and pray for his father. He did this, even though he felt slightly uncomfortable and self conscious about doing it. He sat under an oak tree, closed his eyes and prayed to God that his father may recover his independence and start being able to enjoy life again. When he got back to the office, later that afternoon, he received a text from his father saying that he had managed to take a few steps without his walker. And later, when the story teller returned home, his father was standing waiting for him, having been able to walk a few more steps. From this point onwards his father continued to improve and is now, many years later, living a fulfilling life in his seventies.",1074,0.09,"At the age of 21, the narrator had recently embarked on his career as a graphic artist residing in a city apartment. His dad was recuperating from surgery and had become dependent and less mobile. His sole companion was a woman in her sixties from next door, who visited him daily. On a particular day, the narrator was struck by a compelling urge to spend his lunch break at the park and offer prayers for his dad. He followed through with this act, despite feeling a bit uneasy and conscious of others' perceptions. He positioned himself beneath an oak, shut his eyes and beseeched the divine for his father's regained autonomy and a renewed zest for life. Upon his return to work that afternoon, he got a message from his dad informing him that he had taken some steps unaided by his walking aid. And later, upon the narrator's arrival home, his dad was up waiting for him, having walked a bit further on his own. From then on, his dad's health steadily got better and now, years later, he enjoys a rewarding existence in his seventies.",1039,0.07591101978799808
60a6bc4f4cb533e7e0867aab,"I lived in a small department near the city when I got my first job, my father had been unable to move without assistance for about 8 months, he got assistance from a nice lady neighbor in her sixties. One day I got a feeling if I prayed for my father at park which was 10 minutes from my office, he would be better so I looked around the office and saw no one around so I went to the park and got that feeling again so I looked around and found a bench and set and closed my eyes and prayed under an oak tree that my father got better. When I came back to the office I received a call from my father saying he just took a few steps without any assistance and he hadn't been able to do that so I took it as a sign that my prayer was heard.",739,0.13,"I resided in a modest apartment close to the urban center upon securing my initial employment, my dad had been incapacitated, requiring help for roughly eight months, receiving aid from a kind elderly woman living nearby. Suddenly, an intuition struck me that if I offered prayers for my dad at a park a brief 10-minute journey from my workplace, he might experience improvement so I glanced around my workspace and noticed it was empty prompting me to head to the park where the sensation washed over me once more prompting me to survey the surroundings until I spotted a bench and settled down, shutting my eyes to offer prayers beneath the branches of an oak wishing for my father's recovery. Upon my return to the office a call from my dad greeted me informing me he had managed a few unassisted steps something he'd been unable to achieve before leading me to interpret this as a sign that my supplications had been acknowledged.",934,0.08259882099237686
60a3cb60b3e2bdb82a865197,A man is recalling an incident that happened maybe six or seven years back when he was at work in the city and he had a voice say to him to go and pray during his break for his father who was not able to walk independently that time. His father would be home alone with the assistance of a sixty year old neighbour at his mercy. The narrators younger sister was away at college. So he went out to the park to try help his father as he had been told that prayers can bring change. He had the same voice under an oak tree and he made a prayer for healing for his dad to regain his independence and start enjoying life again. After he got back to the office he received a message that his father had taken a few steps with walker. From then on he started improving and within a year he was walking independently again. Since then his father had been enjoying his good health well into his seventies.,896,0.11,"A gentleman is reminiscing about an event that occurred roughly six to seven years ago while he was employed in the urban area and he heard a voice instruct him to dedicate his break time to prayer for his father who was then unable to walk on his own. His father would be by himself at home relying on the help of a neighbor in their sixties. The narrator's younger sibling was at university at the time. Thus, he made his way to the park to seek assistance for his father as he had learned that prayer could lead to transformation. He heard the same voice beneath an oak tree and offered a supplication for recovery wishing for his father to reclaim his autonomy and to once again find joy in life. Upon returning to his workplace he was informed via a text that his father had managed a few steps with a walker. Subsequently, his father began to show progress and was able to walk by himself within a year's time. Ever since, his father has been relishing his robust health continuing well into his seventies.",1012,0.09956751503301381
5fae55f1c1b83f2c4d05540d,"Let me tell you a story about when I was twenty one. I was living in a small apartment outside of the city centre. My father lived nearby with a live in nurse. My younger sister was away in college so it was just the two of them. My father was in a wheelchair and couldn't do a lot by himself. One day I was at work in the office and I got this feeling that if I prayed for my father to get better then it would work. It was an overwhelming feeling so I looked around the office to see if I could leave to go to the local park. Nobody was around so I walked the ten minutes over and sat underneath the oak tree. I looked up at the branches swaying and I got that feeling to pray again. So I asked God to make my father better. That day I got a text from my father saying ""I just took three steps with my walker"". He had not been able to move without any assistance before then so I took it as a sign that my prayer worked. This was seven or eight years ago and now he can walk without any assistance at all and lives life to the fullest.",1037,0.1,"Allow me to share a tale from when I turned twenty-one. I resided in a modest flat on the outskirts of the downtown area. Close by, my dad lived with a caretaker who stayed with him. Since my younger sibling was at university, it was only them at home. Being wheelchair-bound, my father was quite limited in what he could do on his own. Once, while at my desk job, I was struck by the notion that praying for my dad's recovery might actually help. Consumed by this powerful urge, I glanced around my workplace to check if I could slip away to the nearby park. With no one in sight, I made the brief ten-minute journey there and settled beneath the large oak. Gazing at the gently moving branches above, the impulse to pray washed over me once more. Thus, I implored the divine to heal my father. On that very day, I received a message from my dad which read, ""I've managed to take three steps using my walker."" Previously, he had been completely reliant on others for movement, so I interpreted this as a confirmation that my prayer had been effective. That event took place about seven or eight years back, and today he walks unaided, embracing life to its fullest.",1166,0.08362612055269297
63f7a673985571acc7eeb29a,This is a story from when I was twenty one years old. I was living in an apartment near the city centre. I had just started my first job. My dad was recovering from surgery. He was alone in the days. It was just him and a kind neighbour in her sixties. My younger sister was away at college. One day at work I had an overwhelming feeling to pray for my dad's recovery at the nearby park. I looked around and no one was there. So I went to the park. I had the overwhelming feeling again. So I said a little prayer for my father. When I got back to my desk I had a text. The text said my father had taken a few steps with his walker. He hadn't been able to do that in months.,673,0.15,"This tale unfolds from my days as a twenty-one-year-old. My residence was an apartment close to the downtown area. I had recently embarked on my inaugural employment. My father was in the midst of recuperating from an operation. During the daytime, he was by himself. His only company was a considerate neighbor in her sixties. My younger sibling was studying at a university far away. Once, while at my job, I was struck by a compelling urge to offer prayers for my dad's healing in the adjacent park. Glancing around, I noticed the absence of anyone else. Thus, I made my way to the park. The compelling urge washed over me once more. Hence, I whispered a brief prayer for my dad. Upon returning to my workstation, I discovered a message waiting. The message revealed that my father had managed to take a few steps using his walker. Such an achievement had eluded him for several months.",889,0.11474579975766033
60d1a0e2551b5660575cdd64,"The person was 21 years old, living in an apartment close to the city, he had just started his first job as a graphic designer. His father was in a wheelchair recovering from surgery and had been mainly housebound for 8 months. The father was generally alone apart from the neighbour as the persons younger sister was away at college. One day whilst at work the person had a strange feeling telling him to go to a nearby park at lunch in order to pray for his father, it was quiet at work so he went to the park and found a quiet spot under a tree and whispered a short prayer for his father. Shortly after he received a message saying his father had managed to take a few steps without his walker, when he got home he found his father standing un-aided in the living room. Now 8 years later his father is still walking.",820,0.12,"At the age of 21, the individual resided in an apartment near the urban center, having recently embarked on his inaugural role as a graphic designer. His dad was utilizing a wheelchair while recuperating from an operation and had been confined to his home for the past eight months. Except for the neighbor's company, the father was usually by himself since the person's younger sibling was studying at a university. One particular day at his job, the individual experienced an unusual intuition urging him to visit a park close by during his lunch break to offer prayers for his dad's well-being, the workplace was serene at the time, prompting him to head to the park, where he located a secluded area beneath a tree, and quietly said a brief prayer for his dad's health. Not long after, he got a notification informing him that his dad had succeeded in walking a few paces without his walking aid, upon arriving home, he was greeted by the sight of his dad standing without assistance in the living room. Now, eight years on, his dad continues to walk.",1055,0.09639746489279623
60a7ac27f10784b94cec23df,"When She was 21 and lived in a small city and had just started working. Her father was in a wheel chair for about 8 months. She had hoped that he would recovery, there was no one to stay with him as her sister was in college and ther had a Neighbour she was a lady in her sixties. She went to work and she suddenly heard a voice telling her to pray for her fathers recovery but she ignored it she then went to a park and heard the same voice to pray for her fathers recovery but there was no one around. She had been raised to believe that prayers work so she decided to pray for her fathers recovery and a few minutes later her father called and told her that he was able to take a few steps with his walker. She went home immediately and she saw him walking with his walker. This was the start to his recovery. It now been six years and he is now able to walk in his seventies.",879,0.12,"At the age of 21, she resided in a quaint town, having recently embarked on her career. Her father had been confined to a wheelchair for eight months. She harbored hopes for his recuperation, with no one available to accompany him, since her sibling was attending university, and they had a neighbor, a woman in her sixtieth decade. She departed for her job, when suddenly a voice urged her to pray for her father's healing, yet she dismissed the thought, later she visited a local park, and the same voice implored her to pray for her father's health, even though she was alone. Raised with the belief in the power of prayer, she chose to offer prayers for her father's health, and shortly after, her father phoned her, informing her that he managed to walk a few paces with his walker. She returned home at once, and witnessed him ambulating with his walker. This marked the beginning of his recuperation. Six years have since passed, and he now walks independently in his seventies.",985,0.09666706213892383
5ea015577dd57200089eb811,"21 yr old male graphic designer, sister away at college, father recovering from surgery but only the father and a kind neighbour were together during the day at home. Son at work one day and he felt he was being told to pray for his father in his lunch break. He went to the park, there was no one else around and sat on a bench under a big oak tree and closed his eyes to ask God to help his father regain his independence. Shortly after his father rang him to say he had taken a few steps with his walker which he had not managed before. He rushed home after work to find his father standing with his walker. He continued to improve over the next 6 or 7 years and is now fully enjoying life again in his 60’s.",711,0.15,"A 21-year-old male employed in graphic design, with his sister attending university afar, has a father on the mend from an operation who spent his days in the company of only a considerate neighbor. The son was at his job one particular day when he sensed an urge to offer prayers for his dad during his lunchtime. He made his way to a nearby park, where he found himself alone, and chose a seat on a bench beneath a towering oak. There, he shut his eyes to beseech divine assistance for his father's recovery of autonomy. Not long after, his father called to share that he had successfully taken some steps using his walker, a feat he hadn't achieved previously. He hurried back to his house post-work only to discover his dad upright, aided by his walker. His father's health progressively got better over the ensuing six to seven years and he now fully savors life once more in his sixties.",893,0.10573630203202687
