recall_id,clause_id,clause_text,rephrased_text
60fd36bd3daa2d81249f11b2,11,"so on my break, i went to the park and found a quiet spot.",That same sensation washed over me once more.
60fd36bd3daa2d81249f11b2,12,I felt that feeling again.,"I settled down and softly uttered, ""God, kindly grant my father a swift recovery so he can enjoy life to its fullest."""
60fd36bd3daa2d81249f11b2,13,"I sat down and whispered, ""God, please help my dad make a speedy recovery so he may live a happy life to the fullest.""","Immediately upon returning to my workplace, that peculiar feeling surfaced again."
60fd36bd3daa2d81249f11b2,14,"As soon as i got back to work, i felt that strange feeling yet again.","Shortly after, a message from my father arrived, informing me he had managed a few steps unaided by his walker."
60fd36bd3daa2d81249f11b2,15,I then received a text from my dad saying that he took a few steps without his walker.,This was something he hadn't achieved for many years.
60fd36bd3daa2d81249f11b2,16,He hadn't been able to do that in years.,"Post work, I hurried back and witnessed him taking careful strides"
60fd36bd3daa2d81249f11b2,17,"After work, i rushed home and saw him taking slow steps",and I was astounded - my prayer had been effective.
60fd36bd3daa2d81249f11b2,18,and i couldn't believe it - my prayer worked.,"From that point on, his recuperation has only improved -"
60fd36bd3daa2d81249f11b2,19,"Since then, he's been recovering even better -","now, six or seven years later, he's nearly returned to his former health, even in his seventies."
60fea505c8796961a71b67d9,1,It was a story about someone recounting an event from when they were 21.,The narrative centered on an individual reflecting on a past experience at the age of 21.
60fea505c8796961a71b67d9,2,They lived in the city and had an apartment.,They resided in an urban area with their own flat.
60fea505c8796961a71b67d9,3,Their dad hadn't been well and hadn't left the house for eight months.,Their father had been unwell and confined to the home for eight months.
60fea505c8796961a71b67d9,4,The storyteller worried about their father when they were at work.,Concern for their dad's health occupied the narrator's thoughts during work hours.
60fea505c8796961a71b67d9,5,All he had for company was a kind neighbour.,His sole companion was a considerate neighbor.
60fea505c8796961a71b67d9,6,"One day, when at work she got a feeling.","One particular day at her job, she experienced a sudden intuition."
60fea505c8796961a71b67d9,7,The feeling seemed to suggest that if they went to the local park and prayed their father would be healed.,This intuition hinted that a visit to the nearby park for prayer might lead to her father's recovery.
60fea505c8796961a71b67d9,8,She looked around the office and saw no one else was there and walked to the park.,"Glancing around the empty office, she decided to make her way to the park."
60fea505c8796961a71b67d9,9,The park was about a 10 minute walk away.,The park was roughly a ten-minute stroll from her location.
60fea505c8796961a71b67d9,10,They looked around again to see if there was anyone watching.,"Looking around once more to ensure no one was observing, they proceeded."
60fea505c8796961a71b67d9,11,They sat under the oak tree and prayed to God.,They chose a spot beneath the oak tree and offered prayers to the divine.
60fea505c8796961a71b67d9,12,"'God if you are listening, please help my father to recover'.","'Dear God, if you can hear me, I ask for your aid in my father's healing,' they implored."
60fea505c8796961a71b67d9,13,They had always been told that prayers could come true so they saw no harm in trying.,"Having been raised with the belief in the power of prayer, they felt there was no downside to attempting."
60fea505c8796961a71b67d9,14,"When they returned to work, they got a message from their father which said he had just taken some steps.","Upon their return to the office, they received a note from their father stating he had managed to walk a little."
60fea505c8796961a71b67d9,15,"The storyteller went to be with him and found him standing up, able to take a few steps with his walker.","The narrator hurried to their father's side and discovered him on his feet, taking tentative steps with the aid of a walker."
60fea505c8796961a71b67d9,16,He improved and now 6 or 7 years later is fully recovered and lives life to the fullest in his seventies.,"His condition improved, and now, years later, he enjoys a full and active life in his seventies."
60febeea70275898e6272837,1,I was 21 years old,"At the age of 21,"
60febeea70275898e6272837,2,and living in an apartment near the city's center.,I resided in a flat close to the downtown area.
60febeea70275898e6272837,3,My Father was recovering from surgery.,My father was recuperating from an operation.
60febeea70275898e6272837,4,My sister and a neighbor lady were the only two supports he had.,He relied solely on my sister and a neighboring woman for support.
60febeea70275898e6272837,5,The lady was in her 60's.,This woman was in her sixties.
60febeea70275898e6272837,6,"One day while at work,","Once, while I was at my job,"
60febeea70275898e6272837,7,I had a feeling come over me,an intuition washed over me
60febeea70275898e6272837,8,"that if I went to the park and prayed,","suggesting that if I visited the park to offer prayers,"
60febeea70275898e6272837,9,my Father's health would start to improve.,my dad's condition would begin to get better.
60febeea70275898e6272837,10,I looked around my office,"Glancing around my workplace,"
60febeea70275898e6272837,11,"and nobody was there,","I noticed it was empty,"
60febeea70275898e6272837,12,so I went to the park,"which led me to head for the park,"
60febeea70275898e6272837,13,and sat near an oak tree.,settling myself beside a sturdy oak.
60febeea70275898e6272837,14,I looked around again,"Scanning the area once more,"
60febeea70275898e6272837,15,nobody was around,I saw no one in sight
60febeea70275898e6272837,16,so I prayed for my father.,and so I offered a prayer for my father's health.
60febeea70275898e6272837,17,I left,"After leaving the park,"
60febeea70275898e6272837,18,"and immediately afterward,","right away,"
60febeea70275898e6272837,19,I received a text from my father,"a message from my dad popped up on my phone,"
60febeea70275898e6272837,20,telling me he had just taken a few steps without assistance.,informing me he had managed to walk a few steps unaided.
60febeea70275898e6272837,21,He hadn't been able to do that in years.,Such an achievement had eluded him for many years.
60febeea70275898e6272837,22,It made me feel my prayers had been heard.,The experience gave me the sense that my prayers were acknowledged.
60febeea70275898e6272837,23,He continued to improve,"His health steadily got better,"
60febeea70275898e6272837,24,and he now lives a great life,"and he now enjoys a fulfilling life,"
60febeea70275898e6272837,25,"and has independence,","complete with autonomy,"
60febeea70275898e6272837,26,even into his seventies.,well into his 70s.
610816258dd273092f2dc450,1,"A man had recently moved to a new place,","Recently, a gentleman relocated to a different area,"
610816258dd273092f2dc450,2,starting a job as an architect.,embarking on a career as a building designer.
610816258dd273092f2dc450,3,"His father is someone who had been in a wheelchair for some time,","His dad had been confined to a wheelchair for quite some time,"
610816258dd273092f2dc450,4,unable to walk at all.,completely unable to stand or walk.
610816258dd273092f2dc450,5,"The man wanted to try and help his father,","The gentleman was determined to assist his father,"
610816258dd273092f2dc450,6,wanting him to be well more than anything.,desiring his father's recovery above all else.
610816258dd273092f2dc450,7,"He kept getting a message,","He consistently received a recurring message,"
610816258dd273092f2dc450,8,hearing a voice saying to him that he should pray for his father's wellness.,listening to a voice that urged him to seek his father's health through prayer.
610816258dd273092f2dc450,9,He went out walking and found quiet spots to be.,"He would go for walks, seeking out tranquil places to spend time."
610816258dd273092f2dc450,10,Three or four times he heard this calling to ask for help in making his dad well.,"On three or four occasions, he felt this summons to solicit divine aid for his father's health."
610816258dd273092f2dc450,11,"Understanding that prayer has been known to help,","Recognizing the potential power of prayer,"
610816258dd273092f2dc450,12,"he did,","he acted upon it,"
610816258dd273092f2dc450,13,he prayed for his father's wellness.,offering prayers for his father's return to health.
610816258dd273092f2dc450,14,His father called him at a later point and said that he had managed to walk a few steps with his walker.,"Later, his father phoned to tell him that he had succeeded in taking a few steps using his walker."
610816258dd273092f2dc450,15,The man was so happy that this seemed to be the confirmation that his prayer had been answered.,"The son was overjoyed, perceiving this as a sign that his prayers had been effective."
610816258dd273092f2dc450,16,"In time his father was able to walk more and more,","Gradually, his father began walking increasingly further,"
610816258dd273092f2dc450,17,and in the span of 7 years he was all the way better and healthy again.,"and after seven years, he had fully recovered and was healthy once more."
610eed701307b477c5f8771e,1,I am going to tell a story from when I was twenty one.,I'm about to recount a tale from my twenty-first year.
610eed701307b477c5f8771e,2,I moved out to start a new job.,I relocated to embark on a fresh career.
610eed701307b477c5f8771e,3,My father had surgery eight months ago and was using a wheelchair.,"Eight months prior, my dad underwent an operation and relied on a wheelchair for mobility."
610eed701307b477c5f8771e,4,My sister moved out to go to college so he was by himself apart from our kind neighbour who was in her sixties who came over.,"With my sister off to university, he found himself alone, save for a considerate neighbor in her sixties who would visit."
610eed701307b477c5f8771e,5,One day I was at work and got the sudden urge to pray for his recovery at the park during my lunch break.,"One afternoon at work, I felt a compelling need to offer prayers for his healing at the park on my lunch hour."
610eed701307b477c5f8771e,6,I looked around the office to see if anyone was there.,I scanned the office to check if it was empty.
610eed701307b477c5f8771e,7,I decided to go to the park.,I made up my mind to head to the park.
610eed701307b477c5f8771e,8,I looked around to see if anyone was there.,I surveyed the area to ensure no one was around.
610eed701307b477c5f8771e,9,It was about a ten minute walk from my office.,The park was roughly a ten-minute stroll from where I worked.
610eed701307b477c5f8771e,10,I looked around once more.,I glanced around yet again.
610eed701307b477c5f8771e,11,I sat on a bench and looked up at an oak tree.,I settled on a bench and gazed up at a towering oak.
610eed701307b477c5f8771e,12,"I whispered to myself ""dear god I don't know if you're listening but I am praying for my father's recovery.""","Murmuring to myself, I said, ""Oh God, I'm not sure if you hear me, but I'm earnestly praying for my dad's recuperation."""
610eed701307b477c5f8771e,13,When I got back to the office I received a text from my father saying he had just walked a few steps with his walker for the first time since the surgery.,"Upon returning to work, I got a message from my dad announcing he had taken a few steps with his walker for the first time post-operation."
610eed701307b477c5f8771e,14,I went home and saw him in the living room walking with the help of the walker.,"When I arrived home, I witnessed him in the living room, taking steps with the aid of his walker."
610eed701307b477c5f8771e,15,That was about 7 or 8 years ago and my father can now walk freely again and can live his life to the fullest once more.,"That incident took place 7 or 8 years ago, and today my father is able to walk unassisted once again, living his life fully."
610fddb9524e959f1965db31,1,I was 22 year old,"At the age of 22,"
610fddb9524e959f1965db31,2,and living in an apartment in the city center.,I resided in a downtown apartment.
610fddb9524e959f1965db31,3,I had just started my first job as a graphic designer.,I had recently embarked on my career as a graphic designer.
610fddb9524e959f1965db31,4,"Whilst I was out at work,","While I spent my days working,"
610fddb9524e959f1965db31,5,"my Dad, who had been recovering from a surgery, was at home.",my father was recuperating from an operation at home.
610fddb9524e959f1965db31,6,He hadn't been out in - uh- 6 or 7 months.,He had not ventured outside for roughly six or seven months.
610fddb9524e959f1965db31,7,My sister was away at college,My sister was attending university
610fddb9524e959f1965db31,8,"and so the only person who was at home was my Dad,","leaving my father as the sole family member at home,"
610fddb9524e959f1965db31,9,"and a kind neighbor, who was in her sixties.",alongside a considerate neighbor in her sixties.
610fddb9524e959f1965db31,10,"One day when I was at work,","On a particular workday,"
610fddb9524e959f1965db31,11,I had an overwhelming feeling.,"I was struck by a sudden, intense sensation."
610fddb9524e959f1965db31,12,I looked around and there was nobody there.,"Glancing around, I found myself alone."
610fddb9524e959f1965db31,13,"I felt I heard a voice say ""If you pray for your father, he will start to recover"".","It seemed as though a voice told me, ""Pray for your dad, and he will begin to heal""."
610fddb9524e959f1965db31,14,I looked around again and could see nobody.,A second look confirmed I was still by myself.
610fddb9524e959f1965db31,15,"I decided to go for a walk to the park,","I chose to stroll to the nearby park,"
610fddb9524e959f1965db31,16,which was around a ten minute walk from my office.,a brief ten-minute journey from where I worked.
610fddb9524e959f1965db31,17,I looked around the park and could see nobody.,"Surveying the park, I realized it was deserted."
610fddb9524e959f1965db31,18,I noticed the trees.,The trees caught my attention.
610fddb9524e959f1965db31,19,"I felt that feeling again,","That same feeling washed over me once more,"
610fddb9524e959f1965db31,20,and decided to get down to pray.,prompting me to kneel down and pray.
610fddb9524e959f1965db31,21,I prayed for my fathers recovery.,I offered prayers for my father's health.
610fddb9524e959f1965db31,22,Suddenly I received a text from Father saying that he had taken a few steps.,"Out of the blue, I got a message from my dad saying he had managed to walk a little."
610fddb9524e959f1965db31,23,Since then he has been recovering from strength to strength for the past few years.,"Ever since, he's been progressively regaining his strength over the years."
612fad8cc0210532817a60cb,1,I was living in an apartment near the city centre.,My residence was a flat close to the downtown area.
612fad8cc0210532817a60cb,2,I worked as a graphic designer.,My profession was in graphic design.
612fad8cc0210532817a60cb,3,My father hadn't been well and was living nearby.,My dad was in poor health and resided in the vicinity.
612fad8cc0210532817a60cb,4,His only company during the day was a friendly neighbour.,A congenial neighbor was his sole companion during daylight hours.
612fad8cc0210532817a60cb,5,He hadn't been out of the house in eight months.,He had not left his home in over half a year.
612fad8cc0210532817a60cb,6,"One day, i got a strong feeling that if i went out of the office at lunchtime and prayed then my father would get better.","One particular day, I was overcome by an intuition that praying during my midday break would lead to my dad's recovery."
612fad8cc0210532817a60cb,7,I checked around that no one was looking and went to the park for lunch.,I stealthily ensured no colleagues were watching and made my way to the park for my midday meal.
612fad8cc0210532817a60cb,8,I looked around again and still no one was looking.,"Once more, I surveyed my surroundings and confirmed I was still unobserved."
612fad8cc0210532817a60cb,9,i sat on a bench and looked up at the branches of an oak tree.,I settled on a park bench and gazed at the limbs of a towering oak.
612fad8cc0210532817a60cb,10,"Still no one was around so i closed my eyes, the feeling came back so I and prayed.","With no one in sight, I shut my eyes, embraced the sensation, and offered a prayer."
612fad8cc0210532817a60cb,11,I asked god if he was listening to help my father recover and live his life to the full.,I implored the divine presence to grant my father's health and a life lived to its fullest.
612fad8cc0210532817a60cb,12,When I got back to the office I got a text from my father saying he had taken a few steps with his walker without help.,"Upon returning to work, I received a message from my dad informing me he had managed a few steps using his walker solo."
612fad8cc0210532817a60cb,13,That was the first time in months.,This marked the first occurrence in a lengthy period.
612fad8cc0210532817a60cb,14,he gradually got better and within a year was walking without assistance.,"He progressively improved and by the year's end, he was ambulating independently."
612fad8cc0210532817a60cb,15,That was seven years ago and now my father can walk unaided and lives a full life.,"Now, seven years later, my father ambulates freely and enjoys a vibrant life."
613129fdf8f6b04c9a7a2429,1,I was twenty one,"At the age of twenty-one,"
613129fdf8f6b04c9a7a2429,2,and had just finished my first job.,I had just completed my initial employment.
613129fdf8f6b04c9a7a2429,3,My father had been ill,My dad was suffering from an illness
613129fdf8f6b04c9a7a2429,4,"and was recovering slowly,","and his recovery was a gradual process,"
613129fdf8f6b04c9a7a2429,5,he'd been at home for about eight months,"having spent roughly eight months confined to our home,"
613129fdf8f6b04c9a7a2429,6,"with only a lady neighbour for company,","with a woman from next door as his sole companion,"
613129fdf8f6b04c9a7a2429,7,"she was in her sixties,","who was in her sixtieth year,"
613129fdf8f6b04c9a7a2429,8,my sister was away at college,"while my sister pursued her studies at university,"
613129fdf8f6b04c9a7a2429,9,so it was just my father and the lady neighbour during the day.,leaving only my dad and the neighbor lady during daylight hours.
613129fdf8f6b04c9a7a2429,10,He couldn't walk,He was unable to walk
613129fdf8f6b04c9a7a2429,11,and relied on a wheelchair.,and depended on a wheelchair for mobility.
613129fdf8f6b04c9a7a2429,12,One day at work I had this feeling come over me,"One particular day at my workplace, I was struck by a sudden intuition"
613129fdf8f6b04c9a7a2429,13,"that I should pray for his recovery,","that I ought to pray for his healing,"
613129fdf8f6b04c9a7a2429,14,"no-one in the office saw my reaction to this feeling,","unnoticed by my colleagues, I experienced a profound emotional response to this intuition,"
613129fdf8f6b04c9a7a2429,15,"and it came over me again,","and the sensation overwhelmed me once more,"
613129fdf8f6b04c9a7a2429,16,"I'd always been taught that prayers could change things,","having been raised with the belief that prayer could bring about change,"
613129fdf8f6b04c9a7a2429,17,so I left the office during my break,"I decided to leave my desk during a break,"
613129fdf8f6b04c9a7a2429,18,and went to a park about ten minutes away,"and made my way to a nearby park that was a short ten-minute journey,"
613129fdf8f6b04c9a7a2429,19,"and I had the feeling again,","where the feeling enveloped me yet again,"
613129fdf8f6b04c9a7a2429,20,"so I found a bench which was under an oak tree,","so I chose a seat beneath the shelter of an oak,"
613129fdf8f6b04c9a7a2429,21,looked around,scanned the surroundings
613129fdf8f6b04c9a7a2429,22,and then looked up into the branches,and then gazed upward into the tree's limbs
613129fdf8f6b04c9a7a2429,23,and closed my eyes,"and with eyes shut,"
613129fdf8f6b04c9a7a2429,24,and prayed to God to help my father in his recovery.,I offered a prayer to the Almighty for my dad's recuperation.
613129fdf8f6b04c9a7a2429,25,When I got back to the office,"Upon my return to work,"
613129fdf8f6b04c9a7a2429,26,I took a call from my father,"I received a phone call from my dad,"
613129fdf8f6b04c9a7a2429,27,and he said he'd taken his first steps with his walker,who excitedly informed me that he had managed to take his initial steps with his walking aid
613129fdf8f6b04c9a7a2429,28,which he hadn't been able to do before.,something he had previously been unable to achieve.
613129fdf8f6b04c9a7a2429,29,I went home,"I headed back to my residence,"
613129fdf8f6b04c9a7a2429,30,"and he was standing using the walker,","to find him upright and using the walker for support,"
613129fdf8f6b04c9a7a2429,31,he improved from then on,"his health began to improve from that point forward,"
613129fdf8f6b04c9a7a2429,32,and within a year he could walk unaided,"and in the span of a year, he was walking independently"
613129fdf8f6b04c9a7a2429,33,and and was living a good life.,and leading a fulfilling life.
613129fdf8f6b04c9a7a2429,34,My prayers had been answered.,The prayers I offered had indeed been heard.
613b77da863afce13714e4c4,1,I was 21,"At the age of 21,"
613b77da863afce13714e4c4,2,and working in the city centre as a graphic designer.,I was employed downtown as a graphic artist.
613b77da863afce13714e4c4,3,Dad had recently had surgery,My father had undergone an operation recently
613b77da863afce13714e4c4,4,and after 8 months was in a wheelchair.,and was using a wheelchair after eight months.
613b77da863afce13714e4c4,5,He was alone during the day,"During the daytime, he was by himself"
613b77da863afce13714e4c4,6,except for a lady in her 60's who would look after him.,save for a woman in her sixties who cared for him.
613b77da863afce13714e4c4,7,I had a strong feeling whilst at work,"While at my job, I was overcome by a strong intuition"
613b77da863afce13714e4c4,8,that I should pray for dad's recovery.,that I needed to pray for my father's healing.
613b77da863afce13714e4c4,9,"In my lunchbreak I went to the local park,","During my lunch hour, I made my way to the nearby park,"
613b77da863afce13714e4c4,10,"a bit apprehensive,","feeling somewhat nervous,"
613b77da863afce13714e4c4,11,but the park was free of people.,yet I found the park deserted.
613b77da863afce13714e4c4,12,I sat down on a bench by a big oak tree,I chose a bench near a large oak to sit down
613b77da863afce13714e4c4,13,and although I knew how to pray felt quite unsure.,"and, despite knowing how to pray, I felt quite uncertain."
613b77da863afce13714e4c4,14,"I knew that sincere prayer had helped people in the past,","Aware that heartfelt prayers had aided others before,"
613b77da863afce13714e4c4,15,"so tentatively, I closed my eyes",I hesitantly shut my eyes
613b77da863afce13714e4c4,16,and said a prayer to ask for recovery for dad,and offered a prayer for my father's recuperation
613b77da863afce13714e4c4,17,and for him to be able to regain his independence.,wishing for him to reclaim his self-sufficiency.
613b77da863afce13714e4c4,18,I went back to work,"Returning to my job,"
613b77da863afce13714e4c4,19,and got a message from dad to say he was standing with the aid of his walker for the first time.,I received a message from my father announcing he had stood up using his walker for the first time.
613b77da863afce13714e4c4,20,"After work, I rushed home","I hurried to my house after my shift,"
613b77da863afce13714e4c4,21,to find dad standing without help.,only to see my father on his feet unassisted.
613b77da863afce13714e4c4,22,He continued to regain the use of his legs,He progressively regained leg function
613b77da863afce13714e4c4,23,and could walk.,and was able to ambulate.
613b77da863afce13714e4c4,24,He's now fully independent,He has since achieved full autonomy
613b77da863afce13714e4c4,25,and living his fullest life for the past 6 - 7 years.,and has been living life to the fullest for the last six to seven years.
614fcba0d71b7a527a512011,1,When I was 21,At the age of 21
614fcba0d71b7a527a512011,2,my father had surgery,my father underwent an operation
614fcba0d71b7a527a512011,3,and had to use a wheelchair.,and was required to utilize a wheelchair.
614fcba0d71b7a527a512011,4,He hadn’t been out in eight months.,He had not ventured outside in eight months.
614fcba0d71b7a527a512011,5,During the day,Throughout the daytime
614fcba0d71b7a527a512011,6,a nice neighbour lady in her sixties stayed with him.,a kind elderly neighbor woman in her sixties would look after him.
614fcba0d71b7a527a512011,7,While I was at work,As I worked
614fcba0d71b7a527a512011,8,I got a strong feeling,I experienced a powerful intuition
614fcba0d71b7a527a512011,9,that if I went to a nearby park,that by visiting a local park
614fcba0d71b7a527a512011,10,and prayed,and offering a prayer
614fcba0d71b7a527a512011,11,he would improve.,his condition would get better.
614fcba0d71b7a527a512011,12,I went to the park,I made my way to the park
614fcba0d71b7a527a512011,13,and got the feeling again.,and felt the intuition once more.
614fcba0d71b7a527a512011,14,I looked around.,I surveyed the surroundings.
614fcba0d71b7a527a512011,15,I closed my eyes,I shut my eyes
614fcba0d71b7a527a512011,16,and got the feeling for a third time.,and experienced the intuition a third instance.
614fcba0d71b7a527a512011,17,I said a quiet prayer.,I murmured a silent prayer.
614fcba0d71b7a527a512011,18,I whispered asking for God’s help,I softly implored for divine assistance
614fcba0d71b7a527a512011,19,to help my father recover.,to aid in my father's recuperation.
614fcba0d71b7a527a512011,20,When I got back to work,Upon returning to my job
614fcba0d71b7a527a512011,21,I suddenly got a text from my dad,I was suddenly greeted by a message from my father
