recall_id,recall_text,len_original,recall rate,rephrased_text,len_rephrased,rate
60bc8694c10f8519a26ec749,"This lady was 21 years old and her dad recently had surgery. During the day while she was working, her neighbor would help to look after her dad during the day. One day at work she had this strong urge to go to the park and pray for her dad's healing. So she went to the park, sat at a bench under an oak tree and prayed a little prayer asking God to heal her dad. When she got back to the office her dad sent her a message saying that he walked a few steps with the walker by himself. It took him a year to recover fully and 6/7 years later he is walking without any assistance, living his best life.",601,0.11,"The woman was twenty-one years of age and her father had undergone a recent operation. While she spent her time at work, a neighbor would assist in caring for her father throughout the day. On a particular day at her job she felt a compelling need to visit the park to offer prayers for her father's recovery. Thus, she made her way to the park, settled on a bench beneath a towering oak and offered a heartfelt plea to God for her father's health. Upon her return to the workplace she received a text from her dad stating he had managed to take a few steps using his walker on his own. His journey to full recovery spanned a year and now, six to seven years later, he ambulates independently, enjoying the pinnacle of his life.",728,0.09365377833877751
5beee551bae98700018aa45a,"Let me tell you a story, I moved to the city to work as a graphic designer. My father lived there, but he struggles as he cannot walk. He has the help of a nice old lady. One day I heard a voice that said if you give a prayer under a tree in the park then your father will get well. During my lunch I sat in the park and found myself under an oak tree, I decided to make a prayer as I was always taught that prayer is good. I prayed and went back to my work. I received a call later and it was my father saying he had just taken a few steps with his walking stick. This was 6-7 years ago and he is now walking.",610,0.11,"Allow me to share a tale, I relocated to the metropolis to pursue a career in graphic design. My dad resided there, yet he faces challenges because he's unable to walk. A kind elderly woman assists him. Once, I overheard a whisper suggesting that offering a prayer beneath a park tree would heal my father. On my lunch break, I ended up sitting beneath an oak in the park, I chose to say a prayer, having been taught the virtues of prayer. After praying, I returned to my job. Later, I got a call from my dad who excitedly reported he had managed to take a few steps using his cane. That was 6-7 years back, and he's been able to walk ever since.",646,0.08321726651252323
5fb2808bf1937b872c6ad534,The writer had just finished school and was working his first job. He had a small apartment by the city center. His father just had surgery and was on a wheelchair. A nice lady in her sixties who was his neighbor used to take care of his father when he was working. One day when the writer was at work he got this feeling or urge to pray for his father's recovery. He walked to the park which was about 10 minutes from his office and looked for a quiet place to sit. He sat there and started praying even though it had been a long time since he had prayed for anything. Soon after he received a call from his father telling him that he just took a few steps. Six seven years later his father is now able to walk without the help of a walker.,741,0.1,"The author had recently completed his education and had embarked on his inaugural job. He resided in a modest flat near the downtown area. His dad had undergone an operation and was utilizing a wheelchair. A kind woman in her sixties, who lived next door, would look after his dad while he was at work. On a particular day while the author was at his job he experienced a sudden compulsion to pray for his father’s healing. He made his way to the nearby park which was roughly a 10-minute walk from his workplace and searched for a secluded spot to sit down. He found a spot to sit and began to pray despite it being quite some time since his last prayer for anything. Shortly thereafter, he got a phone call from his dad informing him that he had managed to take a few steps on his own. Six to seven years on, his father can now walk without needing a walker's assistance.",873,0.07354962448106529
5a94779df05361000171b4fe,"When I was 21 and working as a graphic designer my father was recovering from surgery. A neighbor looked out for him. One day at work I got this feeling that I should go to a park, a quiet place and pray for my father's recovery. I had heard that prayer held and so I did this. I sat beneath an old oak tree and looked up at the sky and said a prayer for my father. As soon as I got back to the office I received a text from my father saying that he had managed to take a few steps with his walker, the first time he had been able to do this. I was amazed. He continued to improved and now in his seventies, years later he is able to live a fulfilling life.",657,0.11,"At the age of 21, while employed as a graphic artist, my dad was recuperating from an operation. A neighboring resident took care of him. During a day at the office, an urge came over me to visit a park, a serene spot, to offer prayers for my dad's healing. I had been informed about the power of prayer, thus I followed through with it. I positioned myself under a venerable oak, gazed skyward, and voiced a prayer for my dad. Right after returning to work, I got a message from my dad expressing that he had succeeded in walking a bit with his walker, marking the first occasion he had managed that. I was astonished. His health steadily got better, and presently in his seventies, many years on, he manages to lead a rewarding life.",735,0.09102980421488441
59e721e0ac0af70001b36a13,"The story I was 21 living in the city with my dad who had major surgery. My sister was at college. In the daytime, a neighbour and my dad was home. I got this feeling one day that I should go and pray at the park for my dad. No one was watching at work. So I went to the park and sat under the tree. And prayed for my dad's recovery. After I prayed, I got a text saying my dad had taken some steps on his own with a walker. He is now recovered and can live his life to full in his seventies.",491,0.15,"At 21, I resided in the urban area alongside my father, who had undergone significant surgery. My sibling was attending university. During the day, a neighbor would be with my father at home. One particular day, I was struck by the urge to visit the park and offer prayers for my father's well-being. Nobody at my workplace was paying attention. Thus, I made my way to the park and chose a tree to sit beneath. There, I earnestly prayed for my father's health to improve. Following my prayer, I received a message informing me that my father had managed to walk a few steps by himself using a walker. He has since recuperated and is now able to fully enjoy his life in his seventies.",683,0.11312715963193268
64a5d369158a0321ae5e50e1,"21 years old graduate was living near city centre. His father had just had surgery. His father needed assistance. While at work, he got a strong feeling to go to a park. He wanted to pray for his father. He looked around his office. His office was pretty empty. He decided to go near his lunch time. He went to the park. He felt the urge again. He looked around. He moved to a tree nearby. He got the feeling again. He then prayed for his father to recovery. He went back to work. He got a text message from his father. His father said he had walked for the first time without assistance. This was the turning point in his recovery. It has been months since then. His father is now living life to the fullest in his 70's.",721,0.1,"A 21-year-old graduate resided close to the downtown area. Recently, his father underwent an operation. His father required help. At his job, a compelling urge to visit a park came over him. He desired to offer prayers for his father's well-being. He surveyed his workplace. His workplace was quite deserted. He chose to head out around the time of his lunch break. He proceeded to the park. Once again, he felt a strong impulse. He scanned the surroundings. He walked over to a nearby tree. The sensation struck him once more. He then offered a prayer for his father's swift recovery. He returned to his job. He received a text from his father. His father mentioned that he had managed to walk unaided for the first time. That moment marked a significant shift in his recuperation. Several months have passed since that event. His father is now enjoying his 70s to the fullest.",878,0.06675130195328016
60a8b2592eb0a75a134b89f3,"I was twenty-one years old and living in an apartment. I was working in an office nearby as a graphic designer. My father was bound to a wheelchair because of an accident and only had a next door neighbor, a lady in her sixties to help and keep him company during the day. My younger sister was away for college so there was no one else. One day at work during lunch, I had a feeling where someone told me I should go to a nearby park to pray for my father's recovery as it would help him actually recover. No one was around so I had been confused.",548,0.14,"At the age of twenty-one, I resided in a flat. My job was close by in an office building, working as a visual communicator. My dad used a wheelchair for mobility due to a mishap, with only the woman next door, who was in her sixties, for assistance and to provide him with companionship throughout the day. My sister, younger than me, was at university leaving no one else behind. Once, while on a lunch break at my job, I experienced a sensation as if someone was instructing me to visit a park close by to offer prayers for my dad's health improvement believing it would truly aid his healing. With no one in sight, the feeling left me puzzled.",646,0.12181845379377709
60041b89f0b70121fb013c80,I was 21 years old and living in a small apartment in the city working as a graphic designer. My father gets sick and has a problem with his leg. He cannot stand up and is in the hospital. A neighbor in her 60s is the only one going there to visit him. I do have a sister but she isn't nearby. I am at work and hear a voice say that I should pray for my dad that he would get better. I look around but there is no one there. The voice says that I should go to the park nearby the office and pray for my dad. I got to the park and figure I should give praying for my dad a chance. I was brought up to believe that prayer works. I say to God that if it is at all possible please heal my dad. Later I see my dad standing up next to his walker. I take this as a sign that something has happened. In a few days my dad is walking. He gets better and is now living a normal life. He is in his 70's.,891,0.08,"At the age of 21, I resided in a tiny flat within the urban area, employed as a graphic artist. My father fell ill, experiencing an issue with his leg. Standing was impossible for him, and he was admitted to a hospital. An elderly neighbor in her sixties was the sole visitor at his bedside. I do possess a sister, yet she lives far away. While at my job, a voice suggests I should offer prayers for my father, hoping for his recovery. I glance around, but no one is present. The voice advises me to head to the nearby park from my workplace and to pray for my father there. I proceed to the park, and decide to try praying for my father's health. I grew up with the belief in the power of prayer. I appeal to God, asking if it's within the realm of possibility, to please restore my father's health. Subsequently, I witness my father on his feet beside his walking aid. I interpret this as an indication that an event has transpired. Within several days, my father is ambulatory. His condition improves, and he resumes a regular lifestyle. Now, he's in his seventies.",1068,0.07340431567672287
6165c4bf0d20a0e2c1cc5047,"Dad recently has surgery and lost a lot of mobility. Child lived near the city centre. Neighbor visited dad frequently. Person was at work then heard a voice saying that if they went to the park nearby work at lunch and prayed for their fathers recovery then it would be heard. The person went to the park at lunch, was sitting under an oak tree and prayed for their father's recovery. Once back at work the father called and said that they were able to take step with the help of their walker - this was the first time that he was able to do that in months. The prayer worked, after work the person got home and saw their father standing with the aid of his walker. This was the beginning of his recovery - father regained the majority of his mobility back within the year.",774,0.1,"Father underwent a recent operation and experienced significant loss of movement. Offspring resided close to the urban core. The neighbor made regular visits to see the father. Individual was occupied with their job when they overheard someone mention that if they took a break at the park near their workplace during lunchtime and offered prayers for their dad's health then their supplications would be acknowledged. The individual made their way to the park during their lunch break, settled beneath a sturdy oak and sought divine intervention for their dad's well-being. Upon returning to their job, the father made a phone call and mentioned that he managed to take a step with his walker's assistance - marking the first occasion in several months he had achieved this. The devotions proved effective, after completing their workday, the individual arrived home and witnessed their dad upright, supported by his walker. It marked the commencement of his convalescence - the father substantially regained his mobility over the course of the year.",1051,0.047588332015861094
5d593bb9035b8900189e4a42,"A guy in his twenty went out to work all day. During the day his father, that was recovering from an operation at home, was looked after by a neighbour. He saw no one else during the day, couldn't walk and hadn't been out of the house in about 7 months. The guy at work had an urge to pray for his dad's recovery, so during his lunch break he went to a local park, sat under an oak tree on a bench and said a short prayer, that God would help his father recover more quickly from the surgery. When our praying guy got back to the office he got a text from his father saying that he had taken a few steps with his walker. When the guy got home his father was standing with the aid of his walker. Now his father is almost entirely recovered and walks unaided, and is well in his 70s. The praying thing happened about 7 years ago.",827,0.1,"A young man in his twenties set off for a day's work. Meanwhile, his father, recuperating from surgery at home, received care from a neighboring friend. Throughout the day, he encountered no one else, was unable to ambulate and had not left his residence for approximately seven months. The young worker felt a compulsion to seek divine intervention for his father's healing, so he took advantage of his lunch hour to visit a nearby park, chose a bench beneath an oak to sit on and offered a brief supplication, asking for divine assistance in accelerating his father's post-operative recovery. Upon returning to his workplace, the son received a message from his dad indicating that he had managed to walk a bit using his walker. When the son arrived home, he found his father standing with the support of his walker. Presently, his father has nearly fully recuperated and moves about without assistance, now well into his seventies. This incident of prayer occurred roughly seven years prior.",994,0.07903438115822939
5c105e2757fd11000127e60f,"Let me tell you a story about when I was 21. I lived in the city center and worked a job as a graphic designer. I lived with my dad and my younger sister. There was also an old lady in her 60s that lived nearby. One day while at work i had a feeling that i should go pray in the nearby park and my dad would recover. When i went to go pray i kept having this reoccurring feeling, and as I tried it despite being skeptical i kept having that feeling. As soon as i finished praying a got a message from my dad saying that he was able to take a few steps. this was surprising, when i got home i saw him standing with his walker. now 6 years later, he is able to walk again unassisted and is living life to the fullest.",715,0.11,"Allow me to share a tale from when I turned 21. My residence was in the heart of the city where I served as a graphic designer. My living companions were my father along with my little sister. Additionally, there was an elderly woman in her sixties residing close by. On a certain day at my job, I was struck by an intuition suggesting I ought to offer prayers in the park nearby believing that it would aid in my father's recovery. Upon deciding to pray this persistent intuition continued to nag at me, and even though I was doubtful, I decided to follow through the intuition persisted. Right after I concluded my prayers I received a text from my father informing me that he had managed to walk a little. This news was astonishing; when I arrived back home I witnessed him upright, using his walker for support. Now, six years on, he can walk by himself without help and is embracing life to its fullest extent.",915,0.08576111914140985
62c08c865b36cf4fbabf34d2,"The author's father was recovering from surgery. He was being looked after by a neighbour, a woman in her sixties. The author's sister was away at college. One day at work the author had a premonition that if she went to the park and prayed, her father's health would improve. As there was no-one else in the office, at lunchtime she went to the park, a ten minute walk away, and found a bench in a quiet corner. She asked God to help. When she got back to the office, she received a text from her father stating that he had a taken a few steps with the help of the neighbour. When she got home, her father was standing with the aid of a walker. Seven years later the father, then in his seventies, was back on his feet properly.",729,0.12,"The writer's dad was recuperating from an operation. A neighboring lady in her sixties was taking care of him. The writer's sibling was enrolled in university. While at her job, the writer felt an intuition that her dad's condition would get better if she visited the park to pray. Since the office was empty, she took a stroll to the park during her lunch break, locating a secluded bench. She implored the Almighty for assistance. Upon her return to work, she got a message from her dad mentioning he managed to walk a bit with the neighbor's support. Arriving home, she saw her dad upright, using a walker for support. After seven years, her father, then in his seventies, was walking unassisted again.",705,0.10624239758353198
61532673649c83e233f62033,"He was a 21-year old graphic designer, living in a small flat near the city centre. His dad had been unwell for 8 months and wasn't fully independent. An nice neighbour was helping them. Then one day the graphic designer got a feeling that he should pray. So he went to a park 10 minutes from his work. He closed his eyes and prayed to God asking to help his dad recover. Shortly after, he received a text from his dad saying he just took a few steps for the first time in months. After worked he rushed home to see his dad standing up with the help of a walker. 6 or 7 years later the dad is living life to his fullest even in his seventies.",642,0.13,"At 21 years of age, he worked as a graphic designer, residing in a compact apartment close to the downtown area. His father had been suffering from illness for eight months, lacking complete independence. A kind neighbor lent their support to them. Suddenly, the designer felt an urge to offer prayers. Therefore, he made his way to a nearby park just a short walk from his job. He shut his eyes and earnestly sought divine intervention for his father's healing. Not long after, he got a message from his father announcing that he had managed to walk a little for the first time in many months. Post work, he hurried back to his residence to witness his father on his feet, utilizing a walker for support. Years later, about six or seven, his father enjoys his life to the fullest, even in his 70s.",798,0.09416519480512531
6395bdcb4cd55ceb7287d30a,Living in a small apartment. Close to the city centre. Father unwell had surgery. Eight minutes later the better and in a wheelchair. Neighbour looking after him. He was in the 60s. Sister would call saying father not the best. Had a feeling could help someone. I went to the park for lunchtime. Wasn’t very far away. It was only 10 minutes walk. Willing to try anything to get the father to improve. Found a quiet spot near note tree. When there was no one around trying some prayers. Will try anything to help. Close dollars please help my father. The moment I said this in my father texted that he just walked for the first time. I believe this was a sign of my prayers. It been taking small steps. This was a turning point in his recovery. He had full mobility within a year with no issues. And there was living in the 70s.,827,0.11,"Residing in a compact living space. Situated near the heart of the city. My father, being ill, underwent an operation. Shortly after, eight minutes to be precise, he felt better and used a wheelchair. A neighbor took on the role of caregiver. His age was in the sixties. My sister often phoned to report that our father wasn't doing well. I sensed an opportunity to be of assistance to someone. During lunch, I made my way to the park. The distance was not significant. Indeed, it was a mere ten-minute stroll. I was prepared to do whatever it took to see my father's health improve. I discovered a secluded area by a notable tree. In solitude, I attempted to offer some prayers. I was determined to do whatever could aid him. I pleaded earnestly, 'Please, I implore you, aid my father.' Right after uttering these words, I received a text from my father announcing his first steps. I took this as a divine response to my prayers. He began to take incremental steps forward. This marked a significant change in his path to recovery. Within the span of a year, he regained complete mobility without complications. And thus he continued living into his seventies.",1161,0.053730842181989674
5ef367aa3b28ea0a3aad67ba,"This morning I left for work in an office. My dad has not been well for 6 or 7 year now and uses a wheelchair. He was at home and a 60 year old neighbour was with him. I suddenly got a strange feeling at work that I should pray to help my dad's recovery. I looked around the office and there was no one there. I got the feeling that if I went into a nearby park during my break and prayed it might help. I took a break and went to the local park. I sat on a bench and looked up into the branches of a tree. I looked around and there was no one else there. I had been told that if you pray it can help make thing better. I was not sure if this was the case, but decided to try. I took another look around, still no one there. I closed my eyes and said ""God if you can hear me, please make my dad better"". I returned to the office. That afternoon I received a text from my dad. It said, ""I am feeling better and have just stood up"". I could hardly believe it. When I got home, my dad was standing there and, with the aid of his walker, took a few steps.",1051,0.08,"Today, I departed for my job at the office. For the past six or seven years, my father's health has been declining, and he relies on a wheelchair. While he remained at our residence, a neighbor in their sixties kept him company. At my workplace, an unusual urge overcame me to offer prayers for my father's healing. Glancing around the workspace, I realized it was empty. An intuition struck me that praying in a park close by during my break might be beneficial. So, I took my break and made my way to the nearby green space. Settling on a park bench, I gazed into the treetop branches. Surveying the area, I noticed it was devoid of other people. I had heard that prayer could contribute to improving situations. Although uncertain, I chose to give it a chance. Casting another glance around and finding myself still alone, I shut my eyes and implored, ""God, if you're listening, please heal my father"". Afterward, I made my way back to the office. Later that day, a message from my father arrived on my phone. The message read, ""I've started to feel better and managed to stand up on my own"". I was astounded by the news. Upon my return home, there stood my father, who, with the support of his walker, managed to take several steps.",1236,0.06156980176517799
