recall_id,recall_text,recall_len,max_clause_id,mbits_original_narrative,mbits_rephrased_narrative
563a76bfbe9cac0005aab326,"The story is set in 1949 the narrator met his friends at the same school but they were from different backgrounds as he grew up on a farm and they didn't. They would come to the farm to hunt rabbits and squirrels but the narrator wasn't so keen on this but just went along with it. Time went by and the friends came up with the idea of going to Canada to hunt a bear. Again the narrator wasn't keen but was persuaded to go. They flew to Canada, took kayaks across the lake and got to a cabin. They felt the place they were in was too spooky, none of them wanted to go out hunting in the end. They stayed in for 3-4 days. In the end they discussed how they would be mocked for not bringing a bear back so split cards to see who should go hunting for one. The narrator was chosen. He went out, saw a huge bear but had forgotten to load his gun so he ran away towards the cabin. He yelled for the friends to open the door because he had a bear and they did but instead of going in he dashed to one side and the bear went in the cabin. They never forgot he had delivered a bear as agreed.",1084,30,112.34,107.06468073061339
5660c8ff9df648001102f010,"He met a group of friends initially in school in 1949. He was a farm boy, they were city boys. The friends liked to come out to the farm and do country related chores, hunting and such. He never enjoyed it as it wasn't a new experience for him as it was for the city friends. One day they decided to go to Canada and got a flight there to hunt for bears. They hiked for a long time and arrived at a cabin in the north woods. They decided they didn't want to go bear hunting but had to do something because they told everyone they'd go near hunting so thought they had to go back with a bear. They cut the cards to decide who would hunt for the bear and the rest would skin and prepare the bear for taking home. He went to find a bear but the gun didn't work, so he ran but the bear chased him back to the cabin.",811,23,78.69,95.47149887707243
573c6b96b3a71f00146df8c4,"They all met in 1949 and went to the same school and became friends. He lived on a farm and they lived in the city - they used to visit him on the farm and they liked to hunt but he didn't. They had an idea to go on a trip to Canada to hunt bears so they went there. They had to go across a lake to get to the woods and had to walk what felt like five hundred miles to get to their cabin. The walk was scary so it put them off wanting to go hunting for bears as they were all spooked out. So for a few days they just stayed in the cabin together and played cards. Then they realised that if they didn't bring back a bear people wouldn't believe them and would probably make fun of them. So they played the high cards game and who ever picked the highest card had to go and hunt the bear alone and bring it back to the cabin dead. The others would skin the bear and prepare it to take back as a trophy. The story teller got the high card so had to go out and hunt. He went out and took a gun, found a bear bigger than he'd even seen on pictures. He went to shoot it and realised that he hadn't loaded the gun so ran instead. He got back to the cabin just in time and slammed the door. They didn't go bear hunting again.",1218,34,79.0,104.21467461334842
576020968ddaf40006ce9746,"There were 4 friends that met at school. The narrator was a farm boy and the other 3 from the city. They admire the farm life especially hunting and used to hang out on the farm. The narrator would take them out hunting, even though he himself wasn't that interested. They eventually decided they wanted to go bear hunting in Canada. They hired a remote cabin that required them to travel (by canoe and hiking) for several days. On arrival they got nervous as it all seemed very spooky. They spent several days in the cabin playing cards. Eventually one of them thought they would be made fun of if they returned without a bear. So they cut the cards to decide who would go out and hunt. It was the narrator. He went hunting and on eventually finding a bear discovered that the gun wasn't loaded. The bear chased him all the way back to the cabin. He screamed at his colleagues to open the door. They opened it and the bear ran in. He shouted that they could skin the bear. They agreed he'd lived up to his part of the bargain. But they never invited him hunting again.",1069,18,104.71,116.99433117707542
58945874b5496d00018cfe1c,Four friends from their childhood used to go hunting on a farm (three guys from the city). They decided to go bear hunting in Canada and hired a cabin in the wood which were spooky. Once of them who didn't even want to go hunting was chosen to hunt a bear for the others to skin. He found a big old bear but couldn't shoot it because he forgot to load the rifle. The bear chased him back to the cabin. He shouted to open the door and then swerved and the bear went inside!,472,15,40.88,52.33569771403638
5a0c4184fe645f0001e9f5dd,"A story about a man and three friends in 1949. The man knew the other three men from high school. They each went to different schools. Then they went to the same college. The man lived on a farm. His 3 friends were from the city. The friends liked to go hunting. Even though he did not like hunting, they persuaded him to go bear hunting. They arranged to go up to a cabin in the woods. They planned to hunt for bears. They got to the cabin. They found it to be very creepy. None of the men wanted to go hunting in the end. They stayed in the cabin for 3 days without leaving. Then the three friends decided that they must go hunting. People back home knew they had come to hunt a bear. So they had to take a bear home. They decided to draw cards. The one who got the highest card would go out and kill the bear. The rest would skin and chop up the bear to take home. The man drew the highest card. So he had to take a gun and hunt a bear. He struggled at first to find any bear. But after several hours he spotted a bear. When he went to fire the gun, there were no bullets in it. The bear chased him back to the cabin. And the friends never asked him to go hunting again.",1173,27,82.31,94.1114453731154
5a63713163394a00015555aa,In 1949 I was at high school and I met some friends. Then we went hunting for some bears in the woods. It is who you know and not what you know. The big bears came and they did scare me a little bit.,199,11,-14.000000000000002,-4.906032325949589
5a9d223b89de8200013f1893,"I met three friends in 1949 at college. We had been to the same primary school but went to different high schools. We had all been athletes, so bonded at college over this. I had grown up on a farm but the other three guys were city folk. They loved to come out to the farm and help with chores and to go hunting rabbits and squirrels and be in nature. I wasn't keen on hunting but wanted to be part of group and it made the guys happy. After several years, the guys said they would love to go on a bear hunt and told everyone we were going. I didn't want to but went along with it. We took a plane from Fort Wayne up to Canada and then canoes in to the North Woods, we had to back pack for 500 miles. Finally we got to a cabin where we had had groceries and stuff delivered. It was really spooky in the cabin and we were all spooked about going out day or night. So we sat around playing cards and not being able to sleep. The others felt we would lose face if we didn't come back with a bear so we drew cards and the person with the high card had to go hunt a bear. Wouldn't you know it! I got the high card and had to go out with the shotgun. I was in the woods for hours but there was no sign of a bear. I heard a noise and turned around and saw a big old bear. I had never seen one so big. I pulled the trigger on the gun, but I had forgotten to load it! The bear started to run at me so I ran as fast as I could, with the bear on my tail all the way back to the cabin. I shouted ""Open the door, open the door!"" and the guys opened the door and as I reached it I turned right and the bear ran in the cabin and I shouted you guys can skin him! The guys never asked me to go hunting again.",1692,22,181.39000000000001,169.5648637598425
5b119f161e55760001b9daac,"A group of college friends that met prior to 1949, originally acquainted through high school sports and ended up going to the same college. 1 farm boy and 3 city boys. They all used to go out and hang out together on the farm, help with chores and then go out hunting for rabbits and squirrels. They got onto talking and planning a visit to Canada to go and hunt bears. Farm boy didnt want to go as he had no interest but he did go as not to let the group down. They stayed in an old cabin in the woods and all of them were quite unnerved by the general spookiness of the area, so they didnt go hunting at all. They stayed in and played cards, eating and drinking the days away. They got to the last day and had to pick cards as to who was actually going to go out and find a bear for them to take back with them. Farm boy got the highest card so had to go out looking for a bear, even though he hadnt wanted to go on the trip at all in the first place! He had an old gun from the cabin with him, and eventually came across a bear. He turned to shoot the bear and had actually forgotten to load the gun! He started running as the bear chased him down, as fast as he could run to try and get back to the cabin. He shouted out for the other guys to open the door, and as he got to the door he stepped aside and the bear ran into the cabin where the guys were. He closed the door on them! He said he has not been asked on a hunting trip ever since, and this was 30+ years ago now.",1477,37,116.36,124.25584780028446
5ba3dde51ce477000117a55e,"There were 4 friends who all met at school in 1949, but all went to different schools growing up. 1 grew up on a farm and 3 lived in the city. The 3 from the city used to like to go to the other friend's farm to hunt squirrels and rabbits, but the friend from the farm didn't care much for hunting. The 3 friends from the city suggested going hiking in the mountains to hunt bears. The friend from the farm did not want to go but agreed to go anyway to be part of the group. They travelled by canoe for about a day and a half and then hiked what appeared to be another 500 miles, according to the friend from the farm and stayed in a cabin. After 3 or 4 days they had not ventured out to hunt a bear as none of them really wanted to. One of the friends said they needed to go home with a bear as a lot of people knew they were coming to hunt bears and would give them a hard time about it if they came home empty handed, so they agreed to get a bear. They cut cards to decide which of them would go and get the bear and the remaining 3 friends would skin it. The friend from the farm, who did not even want to go hunting, drew the card which meant he had to go and get the bear. He found a bear, the biggest he'd ever seen, and went to shoot it with his gun but had forgotten to load it, so started running away from the bear. The bear chased him back to the cabin, and they ended up trapping the bear inside the cabin. The friend who went to get the bear told the others to get on with their part of the deal and he would go and get another one. The friends from the city never invited the friend from the farm hunting again.",1626,31,124.03,140.696698134982
5bc879d3836d560001fc421a,A boy met three other boys slightly before they all attended college together in 1949. The boy telling the story grew up on a farm. The other three grew up in the city. For this reason the city boys were quite keen on the idea of hunting. The farm boy was not so thrilled as this was quite normal to his general way of life. They would hunt together on his property. Even though the boy wasn't keen he did it to fit in with the group. One day they all decided to take a trip to northern Canada to try to hunt a bear. The boy was still not keen but was pressured to go with his group. They flew out of Fort Wayne and headed to northern Canada together. They went to some woods where they had rented a spooky looking cabin. For days the boys could not bring themselves to go and look for the bear as they were scared by their surrounding. So they played cards and drank and slept. Before they were due to come home they were worried that people would make fun of them if they came back and had not brought a bear. So they drew cards and the boy telling the story unfortunately drew the short straw (so to speak). He went out into the woods and found a bear. The bear chased him all the way back to the cabin. He let the bear into the cabin and said there you go boys there a bear to skin ill go and get another one. Surprisingly none of his friends ever invited him hunting again.,1378,19,125.43,134.41732811213933
5bf1c9d332cb3b0001f6f1c3,I knew some acquaintances and then when I went to a new school they were then also there and we got to being good friends. We were all on the same athletics team. The other 3 lived in the city however I was brought up on a farm and they liked to come up to the farm to help with chores and hunt. As we grew up we were talking one day and someone mentioned about going bear hunting however I really didn’t want to go. I also didn’t want to disappoint the group so I agreed to go even through I didn’t want to. So we took a flight to the canal where we then had to use canoes to get to the bottom of the mountain which seemed to take forever. Once we got to the mountain we then had to walk what felt like 5 days to get to the cabin. Once we got to the cabin we realised how scary the place was so we decided to stay inside and not go out so we stayed in the cabin playing cards. Towards the end of the break we realised if we didn’t take a bear home with us we would be talked about unkindly so we decided that we would cut cards and whoever got the highest would be the one to go get a bear and the remaining 3 would be the ones to skin the bear ready to take home. Unluckily it was me who got the highest card so I went out in the scary woods looking for a bear. I finally found the biggest bear I had ever seen ( even in a photo!) I shot the gun but it didn’t go off as it hadn’t been loaded. So I ran and ran back towards the cabin. When the cabin was in sight I shouted “open the door” when the door opened I moved to the left and the bear ran in! I told the rest id done my bit! Looking back now the group all agree that I did infact do my bit!,1649,42,161.44,158.19475547583448
5c2ebf3e626018000134986f,"This is a story about me and three of my friends. We knew each other back in 1949. At one point we all attended the same high school. We were athletes on the school team. All the guys were the macho type. They used to love to go hunting. Reluctantly I would go with them. They liked hunting squirrel and other small animals. I didn't have much interest in hunting. I grew up on a farm. I was used to these activities. I was no longer excited by them. After a number of hunting trips the other guys suggested we all fly to Canada. They wanted to try to hunt a bear. Again I wasn't particularly keen to do this. I agreed to go anyway. We flew over to Canada out of Fort Wayne. When we landed we had to paddle in canoes for what seemed like two days. Once back on land we had to trek for a further 500 miles. The guys had rented a cabin in the woods. We had supplies for a few nights. The strange thing is, we didn't go hunting. We just stayed in the cabin, eating, sleeping and playing cards. The woods were really spooky up there. It seemed that the guys had lost all interest in hunting a bear. So we just stayed in the cabin. Towards to the end of our stay one of the guys said we're going to look stupid if we don't come back with a bear. So we decided to draw cards to see who would venture into the woods to kill the bear. The other guys would have the job of skinning and cutting the meat. We drew our cards. Can you believe it? The guy who didn't want to go in the first place drew the bear card. So out I went into the spooky woods. I looked for a bear. Suddenly I looked up and saw a bear. It was huge. I've never even seen a picture of a bear so big. Here was one starring right at me. I whipped up the shotgun. I pulled the trigger. But nothing happened. Like a complete turkey I had only forgot to load the damn thing. That bear was furious. He did not want me on his turf. So I turned and ran like hell. I saw the cabin up ahead. I screamed at the guys to open the door. I jumped into the cabin. I ran to the left. Then shouted, here's the bear I promised. That was over thirty years ago. Do you know what? Those guys have never asked me to come hunting since!",2172,53,185.48,194.3979543758214
5c3130a10091e40001cc1794,"Three friends met at school and then ended up going to the same college in 1949. The narrator of the story grew up on a farm and was used to the outdoor life. His friends did not so enjoyed staying with him and as they were pretty macho, they enjoyed going out hunting. The narrator didn't like hunting but just went along with it. They hunted rabbits and squirrels. One of them came up with the idea to go and hunt a bear. The narrator really didn't want to go and hunt a bear but just went along with it. They took an airplane from Fort Wayne to some place in Canada. They had to canoe a distance using paddles and then had to backpack on foot to get to a remote cabin in the woods they had rented. The location was quite spooky and remote and when they were there none of them fancied actually going outside and hunting, the narrator was very apprehensive! They stayed for 3 or 4 days playing cards and chatting but then one of them said we do actually need to go and hunt a bear as everyone knows that's why we have come so we either need to hunt one or find a bear to take back with us. They drew cards and the narrator got the short straw and was the one who had to go out. He took his gun and walked around for a few hours. Eventually he heard a noise and saw the biggest bear he had ever seen, he had never seen a picture of a bear so big. He took a shot and nothing happened, he realised he had forgotten to load it. So he ran and ran as fast as he could and the bear followed, he got to the cabin and yelled to open the door, and he got right up to the cabin door, the door opened and the bear ran straight in and he said there you go a bear to skin, I'll go find another. His friends agreed he had lived up to his part of the task and they never asked him to go hunting again.",1787,39,196.9,196.1058519850654
5c6c08c5d9c1580001ce9aab,"A group of guys were athletes at different school so knew of each other, but didn't come friends until further education. The story-teller was a farmer and his 3 city friends would come out to the farm to help him, esp hunting (which he didn't like doing). One year they decided to go to Canada to hunt bears (even though the story teller didn't want to, he allowed himself to be persuaded). They took a long journey into the wilderness and at the cabin decided it was too scary out there to hunt, so they chilled for a few days. They realised they'd be mocked if they didn't bring back a bear so drew cards for who would hunt alone. The story-teller got the high card so had to hunt. They found a huge bear but forgot the bullets, so tried to fire then had to run away. It chased him back to the cabin and ended up in the cabin with the friends, so he did keep his side of the deal, that he'd catch it and the others had to process it. They never invited him again but agreed he'd done his part of the deal.",1008,24,120.11,131.75003508309638
5c93b062c9d93b0015fcbc02,"A guy made 3 friends during high school and they all decided to go hunting bear one day, as they were avid hunters at his farm for several years. He didnt really want to go but felt that he had to. When they got there nobody wanted to hunt but decided they must to bring back for show. They drew stakes and he got the high card and ended up hunting bear alone. He came across one that chased him back to the cabin and he tricked them into letting it in the cabin to deal with. He wasnt invited hunting again.",508,14,33.83,67.61628278561142
5ca8eaf9bd0f9e0001c7d7fa,"The story was about someone and his three friends, who he became friends with in high school. Prior to that high school he knew them as acquaintances as they were in different high schools before that and were all involved with athletics. They met or became friends in 1949. He lived on a farm and his friends lived in the city. His friends would help him sometimes on the farm, including with chores. His friends liked to hunt, including squirrel hunting, however he was not that interested in hunting. One of his friends suggested bear hunting in Canada. He went along with his friends for the experience. They got an aeroplane to Fort Wayne then another aeroplane to Canada, did some backpacking, used a canoe and they stayed in a cabin. They played card games etc. in that cabin. He and his friends changed their minds about bear hunting however one of his friends mentioned that if they did not hunt a bear then it would let down the expectations of other people. It was decided that whoever out of them got the highest card would be the one to bear hunt and the others would skin etc. the bear. He, the one out of them who did not want to bear hunt in the first place, got the highest card. He went with a gun to go bear hunting and after a while spotted a bear which was bigger than any he had seen in photos. He tried using that gun to shoot the bear however realised that the gun was not loaded. The bear was not happy that he was on their territory and quickly chased him. He got to the cabin and shouted at his friends to let him in. He eventually got away from the bear.",1582,35,109.0,110.17939189081841
5cebd58ade266200191eaf7d,It’s about someone who is recalling his three college students. They actually met a few years before that because his buddies used to like to visit him in the country. They were in the city and he was in the country they like to go hunting. He felt that this was pretty boring because he hunted all the time. But then they decided to go up into Canada via canoes and tracking to a place way out in the woods and hunt bear. He got the job of finding a bear because they couldn’t go home without one because that would look bad. In the end an old bear run into the place they were staying. He told his colleagues to it while he went and found another one.,653,8,40.3,51.806057805732436
5cfc19ae3ce1c80001ddd88d,a guy went to college in 1949 and made some friends,51,2,8.1,9.617496223730434
5d8154a847a45600189e8f35,"This person talked about their group of friends that they met in 1949 or possibly before that. They went to high school together and college. The other 3 were city boys but the narrator was grew up on a farm. So the city boys would go to the farm to hunt, especially rabbits, etc. After some time the friends suggested going bear hunting in Canada. Despite the narrator being reluctant, they still went along with it. The place they ended up going to was so spooky that they decided to stay in the cabin and not to go looking for a bear. They played cards and passed the time. After a a few days they decided to find a bear so they wouldn't lose face when they returned. They decided to draw straws and the narrator was picked to find a bear but the friends would need to skin the bear. The narrator went out and found a bear but had forgotten to load the gun so didn't shoot the bear but was chased by the bear all the way back to cabin. So, despite not killing the bear the narrator fulfilled their promise of 'getting a bear'. Since that time, the narrator hasn't been asked to go hunting ever again!",1103,30,116.91,115.02585346255646
5de83e5748241d7af1b6c348,"The main character of the story had a group of friends whom he knew from he was very young. They went to the same school and same college and he's from a farm, where they were from the city. The city boys loved visiting the farm and him to go hunt and play there The farm boy wasn't that keen on hunting at all as he's from the farm and he's good at outdoors. One day, they went to the North Woods in Canada to hunt bear. No one wanted to hunt bear when they've reached the cabin in the woods in a very remote territory They decided to pick the high card and whoever got the high card will have to go bear hunting. The main character was the unfortunate one. He went to try to hunt the bear but the gun wasn't loaded.",717,19,8.12,35.931328461090416
