recall_id,recall_text,recall_len,max_clause_id,mbits_original_narrative,mbits_rephrased_narrative
5deba29b787ce529a9725c54,"The narrator of the story tells how he knew 3 good friends whom met years before going to college. They became close buddies at College. The main character lived on a farm and the other 3 were city boys. The city boys liked to spend time on the farm and enjoyed helping with chores and particularly hunting. The main character did not enjoy hunting at all. However later on his 3 friends wanted to go and hunt Bears, so they took off to Canada with the idea to catch and kill a bear and take home. When they arrived in Canada their lodgings were deep in the woods which they found quite scary. None of the men wanted to go out at all and stayed inside for days. Then they decided that they could not go home without taking a bear to show people the results of the Bear hunt and they decided to draw cards as to which one of them would go out and hunt the Bear. The main character happened to draw the highest card even thought this was his worst case scenario, he did go out and eventually found a bear. He became so frightened he could not kill it, instead he turned and ran back to the cabin. As he got close he shouted to his friends to open the door, the Bear was right on his heels. They opened the door he ran in and turned to the left, with the Bear following him into the cabin. 'There' he said to his friends I did what you asked me!",1342,14,86.47,103.39086806695437
5def503a8ccc565e6e7dfeb6,"4 people became friends in 1949, they had met before whilst in different schools as athletes. They became friends when they started going to the same school. The narrator friend grew up in a farm and the other 3 grew up in the city. The city friends were go to the farm and help out at times with the chores and they'd all go rabbit and squirrel hunting. One friend suggested bear hunting, which the narrator friend was not interested in. However, not wanting to be the only one out, he agreed. They went to the spot where they played cards, ate and slept. They questioned bear hunting, but one friend pointed out that they needed proof to show people back home. After what seems to be peer pressure, the group agreed on a game where the loser would go and hunt the bear and bring it back. Once back, the remaining friends would skin it and pack the bear to take home. The narrator friend lost the game and went out, he saw the bear and realised that the gun he had taken to shoot the bear wasn't loaded. He realised this, when he pointed the gun and tried to shoot. He ran back to the cabin with the bear closing in. Once he reached the cabin, he began screaming for the friends to open the door, he went in and turned left and the bear followed. He told his friends that his task was complete, he had brought the bear to them as agreed and now they had to skin and pack it. He was never asked to bear hunt again.",1414,23,99.86,94.21521315318142
5e12603776c03b8d43b40747,"The narrator was acquaintances with 3 other people he knew in high school athletics, and became much friendlier and closer to them when they went to the same college beginning in 1949. The narrator was from a farm and the other 3 were from the city and were interested in farm life. They would visit the narrator's farm and help with farm work and then hunt rabbits and squirrels. The narrator wasn't interested in hunting but went along with it as the rest of the group were interested. Eventually one of the group decided they should go bear hunting. They got a plane to Fort Wayne and then another plane into Canada where they landed on a lake, canoed for a day and a half and hiked what the narrator believed to be 500 miles to the cabin they had rented. When they got there, it was so remote and spooky that none of them wanted to go hunting. They stayed in the cabin, ate, slept and played cards until one of the group decided they had to go home with proof they had hunted a bear or else they would be teased for not going through with it. They decided to play a game and whoever got the high card from the deck would go out and hunt the bear while the others would skin it and prepare it for being brought home. The narrator drew the high card and went out to hunt a bear. After walking through the woods he came upon a huge old bear. This bear was bigger than even any picture of a bear the narrator had ever seen. He took aim with his gun, pulled the trigger but nothing happened. He had forgotten to load the gun. So he started running back towards the cabin and as he neared it he started shouting to his friends to open the door which they did. The narrator ran inside and told his friends that he got the bear and now it was their turn to skin him! They've never gone hunting since in the intervening 30 years.",1824,38,188.78,208.984290236755
5e15d85bd62abeba42692ed3,"The story was about a person and his three friends. They had gone to school in the same place. Then they met at college in 1949. Their paths had crossed in the past. Despite attending different schools, they had all been athletic. So they had become acquainted. They became good friends after graduation. When they then attended the same school. The author had lived on a farm. But the other three were from the city. The friends used to meet up on the farm to hunt for rabbits and squirrels. The city boys used to enjoy it more than the author. He'd been brought up on the farm. So it was the norm for him. And he didn't get excited by it. This went on for quite a few years. Until one day the young men decided that they would like to go bear hunting in Canada. Whilst the idea didn't really appeal to the author. He was part of the group. And got talked into going along with them. He was concerned that he may be hunted by the bear rather than the other way round. They took an aeroplane. And landed on a lake. It was still a long way to their destination. And they had to hike and use canoes to get there. They reached their cabin. But the author was still apprehensive about the expedition. And described it as spooky. In fact, none of the men wanted to go out into the woods. So they stayed in the cabin for several days. They had taken groceries with them. And played cards. They then discussed the shame of returning home having not hunted a bear. As they had told too many people about it. And knew that there was an expectation. They used the cards to determine who was going to go out to hunt the bear. The person who drew the high card would be the one to go. Unfortunately for the author, it was him. Typical as he was the one that didn't want to be there in the first place. He grabbed his and went into the woods. There was a noise. And he turned around to face the biggest bear ever. He aimed at it with his gun. Then realised he had forgotten to load it. The bear was angry. And started to chase him. Luckily, despite the bear being on his heels, he reached the cabin. And shouted for the others to open the door. He then made a quick left turn. But the bear turned right. Once safely inside the cabin, the author then said to his friends ""There he is. You skin him and I'll go and get another one!"" Thirty years had elapsed. And the friends had had not desire to go hunting ever again.",2404,54,225.89,218.4990416806234
5e3e964a5ed1320e1757da5a,A group of 3 male friends in 1946 who used to go hunting together The main protagonist wasn't really into it all He just went hunting with them to fit in One day they travel to Canada on a flight They canoe and backpack to go hunt a bear They started slacking off They then decided they needed to bring a bear back with them or be made fun of They decided who went to get the bear with a card game of who got the highest card The main protagonist did So he went outside to go hunt a bear He encountered the biggest old bear ever He forgot to load his gun So he ran back to the cabin Eventually they kill the bear The other 2 guys butcher and skin it They haven't gone hunting since.,682,16,47.19,57.303781859357464
5e7c8696aaaa890009345427,"This is a story about a man and his friends from college. They actually met before college playing on a sports team. They were all from the city but the man telling the story was from a farm. They used to meet at the farm all the time to hunt squirrels and rabbits. The man wasn't into hunting much but was part of the group. One day they decided to go to Canada on a bear hunting trip. They flew there and then got canoes across a lake. They then had 500 miles to hike to a cabin they had rented. The man didn't really have any interest in hunting but he went anyway. Once they got to the cabin in the north woods they decided none of them really wanted to hunt, so they stayed in the cabin and played cards and things. After 3 or 4 days they realised they needed to get a bear to take back home, as they'd told everyone they were going bear hunting. They cut the cards to decide who would go into the woods to hunt. The man had to do it. He came across an old large bear, of the like he'd never seen before, even in a photograph. He tried to shoot him but realised he'd forgotten to load the old gun. The bear ran at the man, so he turned and ran fast back to the cabin. As he approached he yelled 'open the door' and the bear went into the cabin. They never went hunting again.",1280,18,121.05,119.2721075125394
5ea040075511b505cf6ec1eb,"There were 4 boys who started and finished schooling together. One lived on a farm and 3 were city boys. During their younger years the city boys spent a lot of time visiting the farm and hunting for rabbits and squirrels. They all enjoyed the outdoor life. Long after they left school the city boys decided it would be a good idea to go to Canada to hunt bear. The farm boy wasn't at all keen, but was persuaded to go. The travelling took a long time by plane, canoe and a 500 mile walk to the north woods. They stayed in a cabin but decided they really didn't want to shoot a bear, so they spent time eating, sleeping and playing cards. However it was decided that one of them should shoot a bear because everyone back home would expect them to come back with a trophy. They drew cards and the farm boy got the highest card and went out with his gun. A very large brown bear rose up in front of him but although he took a shot, his gun wasn't loaded, so he ran back to the hut and yelled at his friend to open the door as he got there, he swerved to the right and the bear ran into the cabin. Funnily enough his friends haven't invited to go shooting with them since!!!",1171,26,80.26,88.98002800405943
5ea07f2c55a2bd050fd8f70b,"We were all friends the four of us from school. I lived on the farm and my buddies were from the city. They liked to come to the farm after we went to college and they wanted to do some hunting. Even though I was from a farm, I was not a fan of hunting but I went along when we went hunting for squirrels etc. As we grew older, someone suggested that we go bear hunting in Canada. The other three were mad keen but I was not but allowed them to talk me into it. We took a plane way up north then had to travel a further 500 miles to our hut in the woods. By this time my 3 friends were not as mad keen as they were about hunting bear. We sat around eating and playing cards however we knew that because we had talked about bear hunting so much before we came we knew we had to take one back or we would be totally ridiculed on our return. We decided whoever had the highest card number was the one to hunt the bear needless to say I was the guy who ended up with the job. When I eventually came across a bear, I could not believe how big it was when I fired my gun I had forgot to load it so had to make a run for it chased by the bear. I eventually got back to the cabin, opened the door and left my friends to deal with the bear. Needless to say my friends have never asked to go hunting again.",1296,13,63.29,93.95582406463444
5ea2d9b1159f0e2092bc0210,"Four friends, all met in school. One from the farm, three from the city. They enjoyed hunting at the one friend's farm, all except the farm boy. They decided to go bear hunting in Canada, all wanted to go except the farm boy. They took a plane to Canada, went on a canoe then backpacked to their rented cabin. Once they got there, they realised they didn't really want to go hunting at all. So they sat in the cabin, playing cards and having a nice time. They then thought, we need to shoot a bear otherwise the people back home will think they failed. So they decide to draw cards to see who will go. The farm boy pulls the high card, so he must go to the woods to shoot a bear. While the others will skin and prepare it to take it home. Off the boy goes into the woods, and he comes across an enormous bear. He pulls the trigger on his gun, but has forgotten to load it. The bear then chases the boy all the way back to the cabin. He manages to get in the cabin and lock the bear outside. And says to his friends ""I brought you the bear, now its your turn to skin it!"" This story took place 30 years ago. And they have not been on a hunting trip again since.",1160,18,86.82000000000001,101.57541368349746
5eb12f8510e0ce205e7b25c7,"The narrator made some friends during his high school years when they were in the athletics clubs, and they ended up attending the same college, together. The friends would often visit the narrator, who lived on a farm. They'd go hunting during those trips. Many years later, one of them suggested they fly to Canada and hunt down a bear. So, they make the trip, which includes a flight a long hike to their cabin in the woods, but by the time they get there, nobody is really in the mood to hunt bears (especially the narrator, who wasn't interested in hunting, anyway). However, after a few days of just staying in the cabin, they realise that they'd need some kind of evidence that they'd been hunting bears to bring back home, as they'd been bragging to all their other friends and families about it. So, they decide to draw cards in order to determine which one of the group had to go out and hunt the bear, alone; the narrator ends up having to do it. So, he takes his gun and makes his way out into the woods, where he eventually finds an enormous bear. Unfortunately, he had forgotten to load the gun before going out, and ends up running for his life as the bear chases him all the way back to the cabin. He gets his friends to open the door and, if I recall correctly, he seems to instead lure the bear inside while he stays outside, leaving his friends to kill and skin it. It's implied that everyone survived the ordeal.",1432,23,81.46000000000001,78.65868716478039
5efa3b73f0ef1585a149d72b,"This is a story of four guys who met when they were young. As youngsters they were in different schools but competed against each other as athletes. They later ended up being in school together and became friends. The narrator was from a farm and the other three from the city. They all spent a lot of time on the farm helping out as the city guys enjoyed hunting. The narrator did not enjoy hunting, but went along with it for the sake of his friends. One day they decided to set off on a trip to Canada bear hunting. They took a plane and then canoed and hiked for many many miles until they reached the cabin in the depth of the woods. Finally realised that they did not want to go out in the night hunting as it was very dark and deserted. They played cards and ate and slept. However, they realised that they would need to take a bear home to prove to people that they had been hunting. They drew cards to see who would go out for the bear and the other three would then skin the bear and pack it to take it home. The narrator drew the short straw so took the gun and head into the woods. He eventually found a bear, the biggest he had ever seen. he raised his gun to shoot but realised that it was not loaded. he ran for his life back to the cabin with the bear in pursuit. The bear followed him into the cabin. He trapped the bear and shouted to his friends that he had called the bear and it was now their turn. After that, he was never invited on hunting trips again.",1476,36,121.51,131.8014495753664
5f61371454efa10bdcfc588d,"I have3 friends that I have know since school days, although we didn't go to the same schools we would meet at events because we were all athletes. We did all meet up as we attended the same college. The other 3 guys we all from the city, but I was from a rural farm. They all used to enjoy visiting the farm to help out as they were all quite physical. They also like to go hunting for rabbits and the like. Although, even growing up on a farm I did not like hunting. We would often meet up. But after several years one of the guys said about going bear hunting. Even thought this was not something I liked, I agreed to go as we are all part of the group and I didn't have a good excuse. So they planned a trip to the north woods in Canada, we flew up from Fort Wayne and landed on a lake. We hired some canoes to paddle as far as wee could, seemed like over a day. We then left the canoes and had a long hike to an old cabin they had rented. It seems like we must have hiked hundreds of miles. We settled into the cabin but didn't like the look of the woods, we all found it a bit spooky. So much that we would not go outside at night. We just chatted and played cards for several days. When it got near to the time of leaving, one of the guys thought we would be embarrassed not returning with a bear. As a group we decided to cut a deck of cards to decide who would hunt for a bear before I return. As you might guess I was the one who drew the high card, the one who didn't like hunting. I had to follow through, so it was agreed I would hunt the bear and the rest would skin and butcher the bear. I wen out with the old rifle to hunt a bear, it seemed like I wasn't going to find one. But I heard a noise and turned around to see a huge bear, the biggest bear I had seen even in pictures. I raised the rifle , aimed at the bear and pulled the trigger. Nothing, I had forgotten to load the rifle. The bear decided it was going to defend its territory and started towards me, I just turned and ran as fast as I could towards the cabin. Even though in good shape the bear was gaining. Finally the cabin was inside, I shouted for help, called for them to open the door. The bear was almost on me as a reached the door. But rather than go in i swerved to the left of the door, the bear couldn't stop and ran straight into the cabin. I quickly closed the door and called to the guys, over to you, I have hunted the bear, now it is your turn to process the bear. This is what happened over 30 years ago. They have never asked me to go hunting with them since.",2558,33,226.94,255.93585241009743
5f7f18137488a50407d729e6,"I had three friends from school at the same place. During high school, we were all high school athletes at different schools. We became acquainted. After graduation, we all enrolled in school. Four of us were attending the same school. We became good friends. I was a child from a farm. The other guys all lived in the city. They used to come to the farm and hunt. They even helped me with house chores. Then we would go for rabbit hunting and squirrel hunting. I didn't like hunting. But being born in the farm, I was used to the outdoors. I will go along with the guys, just to be one of the group. We hunted for several years. They always came to me and hunt. After being together for years, one came with the idea of bear hunting in Canada. I didn't like the idea. But I would always been one of the group. I didn't have a reason to stay behind. We took an airplane and flew to Canada. We landed on the lake and rented canoes. We got groceries. No one was in the mood to go out for hunting. So we played cards, ate and slept. We sat indoors for three to four days. One day I took the old gun and go out bear hunting.",1120,27,178.57,144.5577267672733
5fb2727f2942a58418fd0d2b,"It happened in 1959 when they became friends. They all lived in the city and the one guy lived on the farm. Initially they all went to different schools and were good in athletics. Then they all united in the same school. The three guys were fascinated about farm life and would always visit the farm. The guy that lived on the farm was not keen on hunting bunnies and deer. They decided to go bear hunting but the guy on the farm was not interested in any bear hunting but agreed to go. They went on a canoe for several hours until they reached Noor wood Canada as far as they could go. They then hiked to the cabin. For several days they ate, sang and slept and no one wanted to go bear hunting. Then they decided that people will be expecting a bear so they cut the cards and the one with the highest card would go out and find a bear. The guy on the farm had to go bear hunting. He went out into the woods and couldn't see a bear but then heard a noise and he turned around to find the oldest bear. He pointed his rifle and took a shot but that turkey gun was not loaded. The bear started running after him. He ran to the cabin. He took a left and the bear took a right. He shut the door and told the boys, here is the bear. They need to cut and skin the bear. This happened thirty years ago. No one went bear hunting again.",1328,37,83.34,102.18416714831135
6022dfbafb748f0ca0385db9,"The story is about 4 friends who became close in college but knew each other before that because they were acquaintances. They later became best friends in college. The one telling the story is a farm boy while the others do not so much, they used to come and help him with his farm chores and seemed to enjoy the farm life. One day they decided they wanted to go hunting not just hunting but bear hunting, the farm boy was not so fond of hunting but because he is a people pleaser agreed to go with the team. They packed their bags and headed over to a cabin that seemed a couple of days away, they had to canoe up there eventually they arrived. Luckily for Farm Boy the other guys also did not feel like bear hunting when they got to the cabin, all they did was eat and sleep. Until one day they decided they had to take home a bear to show the other people that they went hunting to save their reputation. It was decided to make a draw and farm boy was the one who won the card to go hunting. He went hunting with his gun and sat out for almost an entire day without seeing a bear when eventually the biggest bear he ever saw appeared behind him. He tried to draw his gun but he had not loaded it, the bear started chasing him and it was swift. He eventually saw the cabin and started shouting they must open. Which they did, however instead of going in he swung to the right and the bear went right inside. He closed the door and said the guys got their bear and they must deal with it. This was 30yrs ago and the guys never asked him to go hunting again.",1559,39,75.77,109.52027943736746
60250e892b5c5727eeeef076,A group of four friends who had met long before college had a planned a bear hunt. Three were from the city and one was from a farm background. All of them were of strong build and liked to help out on the farm and hunt squirrels and other small creatures. In 1949 they planned a bear hunt despite the boy from the farming background being indifferent to the trip. They flew up from Fort Worth into Canada with a view to canoeing up to the Great North Woods. They canoed some great distance and then backpacked up to a cabin that they had rented. The bulk of the time they played cards and did not go out at night. They felt that they had to have some thing to bring back and drew cards to decide who would go out and get the bear. The farm boy went out but had not loaded his rifle. He found a bear that chased him all the way back to the cabin. He yelled to them to open the cabin door and the bear rushed into the cabin. He announced that he had delivered the bear and joked that he was going back for another one. Years later they laughed but he remarked that he was never asked to go on another bear hunt.,1110,13,86.49,104.56578695006439
