recall_id,recall_text,recall_len,max_clause_id,mbits_original_narrative,mbits_rephrased_narrative
66504b23d4203a2c5cf1252d,"The story was about a man and his three friends that started college in 1949. They had known each other before college even thought they had gone to different schools as they had often met at athletic meets. The narrator of the story had grown up on a farm, The other three friends came from city areas. They would often meet and go to the farm to hunt small animals, Even though the narrator did not enjoy hunting - he went along with it to please his macho city mates. One time they decided to go on a hunting trip to Canada to hunt bears. So after a plane flight and a hike for what seemed like hundreds of miles over many days, they arrived at their cabin, Set it up with groceries etc and settled in for a few days. Eventually they decided they would have to go out to hunt for a bear, Although by now they did not want to. Realising they would have to go out hunting after telling so many people they were on a bear hunting trip, They decided to draw cards to choose who would go out to hunt and kill the bear. The remaining three would skin and cut up the bear. The narrator drew the hunting card and was forced to head out with an old gun to find a bear. Eventually after hours of looking he spotted a very large bear - He drew the gun and tried to shoot it- but the gun was not loaded. Startled, the bear charged at him... The narrator started sprinting back towards the cabin, with the bear closing in. As he neared the cabin, he called out 'open the door' And as he was about to run into the cabin, he ran past the door - The bear then ran in the door. ""I found the bear for you' he called out... He was never invited on a bear hunt again!!",1651,24,115.94,149.79151925678846
6658c7edb546329c14e47569,"It was 1949 and he lived on a farm. His friends liked to come to the farm and hunt for rabbits. They decided to go on holiday to Canada to try and hunt bears. The narrator didn't like hunting but went on the holiday anyway. They got a plane to Fort Wayne and then had to canoe for a long time to get to the cabin. The cabin was very spooky in the forest and nobody wanted to go hunting anymore. They sorted out all their groceries when they arrived. They stayed in the cabin for 3 to 4 days playing cards, and never ventured out at night. On the last day, they realised that they would have to hunt for a bear because otherwise people back home would tease them. So they decided to play a card game to decide who would go out hunting. The narrator drew the highest card, so he had to go hunting. He took his gun and searched for a long time without seeing a bear. Then he saw the biggest bear he'd ever seen. He'd never seen a bear that big in pictures. He went to shoot the bear but realised his gun didn't have any bullets in it. His only choice was to run away from the bear, but the bear was very fast. He used to be fast at running but now he couldn't run faster than the bear. He got near the cabin and shouted ""Open the door"". His friends opened the door and he managed to get into the house. The bear was killed and all his friends celebrated him. They never went hunting together again.",1395,37,105.85000000000001,119.02710520933535
665adfe2f8a77b62563b293e,Three friends then another person met at school they became friend which they used to come his farm for hunting squirrel and three of them live in well place as town and he used to live village area by good bonding they decided to hunting bear in Canada he cant say no to them because he dont have good knowledge about that and so on they gone and landed in a courtage and they gave up for the hunting bear of fear and they used to enjoy a lot their playing cards and they deceived to cut the bear by buying it continuing the scenario they gave up. happily living there.,570,15,24.65,43.48229741104793
665ae45b40ab88f807fbb981,"Four friends from school (the narrator from the farm and 3 from the city), who were athletes, decided to go to Canada to hunt bear but they didn't actually hunt bear at first for reasons I forget, spooky cabin or something. Just played cards instead. Because they fear others they decided they should return with a dead bear so using a high card decider the narrator who didn't want to do any of this got the metaphorical short straw. He found an old bear, took a shot with an unloaded gun and they did the thing you must never ever do and that is run away from a bear. He ran to the cabin and I can't remember how it ends.",623,11,34.6,46.02718461782042
665c7ba6b596a3558adbf2ec,"A story about a man and his three friends who he first met in 1949. He recalls how they ended up going to the same college and their hunting trip. He grew up on a farm but he never really liked the outdoors. His friends liked hunting for squirrels, which he never liked but he just went with them cause he didn't want to be left out. They came up with the idea to go and hunt for bears in Canada, which he also went along with. They stayed in the cabin for three or four days cause they were too scared to go outside of the cabin. One of his friends spoke up and said, 'they couldn't go back empty-handed because the locals would talk about them not bringing back a bear'. They decided to play a game of cards to decide who would go out and hunt the bear. The man picked the hunt card and he ventured out to hunt down a bear. When he came across a bear, he realised that his gun was unloaded so he ran towards the cabin and shouted for his friends to open the door to the cabin. He ran inside and told them that he did his part and his friends should do theirs. It has been 50 years since the incident and none of his friends have ever talked about hunting again.",1163,12,65.89,85.08422454847937
6662cbaedf0c993cd37ffb83,"A guy is retelling a story of him and three friends back in 1949. They had all met before this, they were athletes that became acquainted. After they graduated they ended up at the same school and became good friends. The protagonist lived on a farm, and the friends used to come up to the farm to hunt. The protagonist didn't like hunting much, but the other three did, so he indulged them. One day, the three friends said they would like to go hunting bears in Canada. The protagonist couldn't think of a good excuse not to go so they agreed. They flew out of Fort Wayne and landed up in Canada on the water. They holed up in a cabin in the north woods, where they discussed the idea of hunting bears. They all decided that it was not something they actually wanted to do any more because of fear, but they were worried if they returned without a trophy bear, people would think less of them. They decided to split a deck of cards and whoever drew the high card would hunt the bear and the others would butcher and skin it. The protagonist drew the high card, and ended up going out on the hunt. When he encountered the bear it took him by surprise, as it was much larger than expected. He had not even seen a picture of a bear that size. He aimed the gun, but it didn't fire, because he forgot to load it. At this time, he decided to make a run for it back to the cabin. Once he got back he closed the door behind him. He reminisced that since this encounter, he had not been invited back on any more hunting trips. The story was being remembered 30 years after it happened.",1577,34,145.12,154.35057264085944
66634d3d893aa52a324be299,"This is a story about me and some friends. We met back in 1949. We were in school together. When we graduated, we all went off to school. We found out that we were in the same school. The four of us became good friends. Now I’m a farm boy. I grew up on a farm. The other three were city guys. They’d come over to help out at the farm. Although I didn’t enjoy it much, I went along with them to be with the group. They loved hunting rabbits. I’d join them. One day they mentioned that they wanted to hunt a bear up in Canada. I wasn’t really thrilled at the idea. I had no real reason as to why we couldn’t go. So we packed up and make our way to Canada. We landed in the water. We then canoed as far as we could go. When we got to land, we had to walk 500 miles it seemed like. When we got to the cabin, the forest was spooky. None of the guys wanted to venture outside. We stayed there for three or four days. We played cards. We ate. We slept. One of the guys mentioned that we needed to bring a bear back since a lot of people knew we were coming to hunt bears. Now no one was looking to be the guy that went out in the spooky woods trying to hunt a bear. So me being the farmer went out into the woods. The others were going to skin the bear and prep it to take back with us. When I went outside, I saw the biggest bear anyone’s ever seen. I turned around and started back towards the cabin. I thought I was fast. The bear was gaining. As I got close to the cabin I started yelling OPEN THE DOOR, OPEN THE DOOR. When the guys opened the door, I took a quick left. I quickly shut the door behind the bear. I shouted out, SKIN THE BEAR, I’LL GO FIND US ANOTHER ONE. Now this was 30 years ago. Can you imagine that not one of the guys asked me to go hunting with them since then?",1780,40,201.37,201.99542697466572
666861d3a592871c05b6fa7f,"Someone lived on a farm and went hunting there with their three friends who they met during school. Their friends convinced them to go on a hunting trip, even though they did not want to, and they ended up getting attacked, but coming out of it alive.",251,8,-2.9199999999999995,3.995815745171388
666aee2c8bf4c2b358481ce9,"1929, 4 students, athletic students all decide to go to a cabin in the woods to hunt some bears. I'm not very keen but I go anyway. When they get there the cabin is spooky so none of them want to hunt bears. In the end they decide that they have to bring a bear home as everyone at home is expecting a bear, so they all draw cards to find out who should do it. It ended up being me, who didnt even want to be there. So off I went to hunt a bear - the agreement was that I would hunt the bear and the others would skin and prepare the meat. I went out to find a bear but couldnt find any for a very long time, then suddenly, there was one GIANT bear right behind me. I lifted the shotgun and tried to fire it at the bear but I had forgotten to load it. So I turned around and ran back to the cabin as fast as I could with the bear following close behind me. When I got to the cabin I yelled OPEN THE DOOR, which they did, but then the bear ran past me and into the cabin. I took the opportunity to shut the door, trapping the bear inside, and then I yelled: NOW GET TO SKINNING, I'M OFF TO GET ANOTHER ONE. My friends all agreed that I had held up my end of the bargain.",1169,18,90.91,113.82264599615338
666f1aec64844fbd48cd89b8,"In 1949 I had 3 friends in college, we met in school as we were all athletes and then we all enrolled in the same school. I was from a farm and they were all from the city. They used to love to come down to the farm and hunt and help me with chores. I wasn't into hunting all that much but I would join in to be a part of the group. One day they decided they wanted to hunt bear in Canada, I didn't want to do this but I was a part of the group. So we went deep into Canada and had to trek another 500 miles to get to the cabin. This place was spooky, we didn't want to hunt the bear once we got there, so for about 3 or 4 days we just sat around the cabin playing cards and stuff. We said we had to hunt the bear though as the people at home would give us a hard time if we didn't come home with a bear as many people knew we went out hunting for a bear. So we agreed that whoever got a high card would have to go out and find the bear. Of course it was me who had to go and hunt the bear while the fellas would skin and pack the bear. For hours I was searching in the forest for the bear, then I heard a noise and it was behind me. The biggest bear I have ever seen, not even the pictures had them this big. So I pointed my gun at him and pulled the trigger. Nothing happened, I forgot the load this turkey. So I ran, I thought I was fast but this bear was gaining on me. When he was on my heels I could see the cabin and I shouted ""open the door!"". That was 30 years ago and those fellas have never asked me to come hunting.",1527,41,172.43,191.1202449562024
6671897ccb0249a1474a5656,"I met my friends in 1949, before that at school actually. I grew up on a farm and the other 3 were city boys. We were all macho and the other 3 liked coming over to the farm and go hunting. I didn’t like hunting but I went with them because I was part of the group. One of them suggested going north and bear hunting, I really didn’t want to but I left them talk me into it. We all went up and ended up changing our minds because it was spooky up there. Eventually we decided we couldn’t go home without a bear. I got the high card and had to go bear hunting. I found one but forgot to load the gun so I started running and it chased me to the cabin! I shouted ‘OPEN THE DOOR’ and they did, I ran as fast as I could and they opened the door, the bear ran in and I went left. I shouted ‘there you go boys, he’s in there, you skin it and I’ll go get another one’ they never asked me to go hunting again.",901,30,136.60999999999999,165.58285987534933
6676d189dcbd4eca274768b2,"Me and my friends met at school in 1949. My friends were athletes and liked to hunt for squirrels and rabbits. My friends suggested that we go out to Canada to go bear hunting, but I wasn’t so sure. When we got there, nobody wanted to go and we stayed in the cabin for three of four days. We wanted to bring something back though so it didn’t look like we skunked out. Guess who it was that ended up going hunting, it was me. My friends said that they would skin tans pack the bear when I brought it back. I went out to find one and saw it. It was THE BIGGEST bear I had ever seen, even bigger than ones I had seen in photos. I took a shot with my gun but the gun was not loaded. I ran towards the cabin but the bear did not want me in his territory. He ran also. When I got back, I slammed the door and told my friends that the bear is ‘RIGHT OUTSIDE’. I told them that ‘THEY CAN SKIN IT AND PACK IT’. Despite what happened, my friends thought I did a pretty good job at my task. That was thirty years ago and I haven’t been asked to go bear hunting again since.",1063,26,79.69,79.34073520012701
66783c88377bdf2f569885f9,"A group of guys who grew up together in the same neighborhood and have been friends since childhood reunited in school and decided to go on an adventure. Bear hunting! The story teller lived in the rural and his three other friends who have grown to become macho men lived in the city. The story teller had a family farm and the three other friends were always happy to help out in taking looking after the farm. They decided recently to go bear hunting which the story teller was not really interesting in. But he was talked into it and he agreed to go. They flew to some lake in Canada for the bear hunting. After arrival, they spent about four days playing cards and just having fun. They had told a lot of people that they were going bear hunting and thought it would be embarrassing to return without any bear. So they decided whoever wins the card game goes for the hunt and the rest of the would skin the bear. The story teller won the game and he had to go. He simply went out, saw a very big bear and tried to shoot, only to realize that his gun was not loaded. So things took a turn, the story teller ended up being hunted by the huge huge bear. He was running and screaming until he got to the door and started shouting...Open the doorrr.",1249,14,33.85,69.4769357230414
667889a03a2f652ce630b4bd,"The story is about a man and three friends who met before 1949. They were high school athletes that were in different high schools but became friends in college. The main character was from a farm but the other three were from the city so they all used to go to the farm and hunt rabbits and squirrels. The main character was not too fussed with hunting as he grew up on a farm. They did this for several years. The three friends talked about how they wanted to go bear hunting. The main character was not keen but wanted to be a apart of the group so agreed. They then flew from Fort Wayne to Canada and went to a big lake where they rented canoes. They then went to the North woods and in what seemed like 500 miles, got to an old cabin they rented. For 3-4 days they did not want to go bear hunting as they found the woods spooky and did not go out at night. One member of the group stated how they could not come back empty handed as they had told many people of their plans so they drew cards and agreed whoever got the high card would hunt the bear and the other three would skin it. The main character drew the high card and went out to find a bear. He saw an old giant bear and tried to shoot it but realised he did not load his gun. He ran away but the bear was gaining on him. He screamed to his friends to open the cabin door and the bear went into the cabin. The main character told them that he fulfilled his promise and they have to skin him now. They still talk about this 30 years later.",1503,17,185.63,214.47482902717036
668796f32bb0599e8ff9bfef,"I have 3 friends that I met in college, actually I met them before, in high school in 1949, because we were high schools athletes so we were acquainted before college, then we met each other at college, so we became good friends. I grew up in a farm but they were from the city, so us being big macho guys we'd go hunting where I used to live, I never really liked it, but I wanted to be part of the group so I went a long. We used to go squirrel hunting, rabbet hunting... they used to really get a kick out of it, but I didn't. One time one of my friends said that we should go bear hunting up in Canada. I really didn't want to go, but they talked me into it. I didn't really have a reason to not go and I let them talk me into it, so we went. We flew to Canada through New Fryer, we got there, from there we went with canons up a lake, where we rented an old cabin, we got there, stored away our groceries, and settled down, no one was really in the mood to go out hunting, neither was I. So we played card games, ate. We stayed like that for 3 or 4 days. At day 3, someone said that we have to go hunting, because so many people know we're here, we can't come back without a bear. So we made a deal that who ever will get the upper card, in the card games we we're playing will need to go hunt the bear alone, and the others will skim him, butcher, pack him home. Guess who got the upper card? me! So I had to go because I agreed to play the game. Here I went to go hunting for a bear, I looked for hours and didn't find anything, till I heard I noise behind me, I turn around and there is the biggest bear I ever saw in my  life, bigger than any bear I ever saw in a photo. I whipped out my gun to shoot the bear, but nothing happed, I FORGIT TO LOAD MY GUN!!! I turned around and started running, I thought I was fast, but the bear was on my heels the whole time, till I got close to the cabin, I whipped as loud as I can :""THE BEAR IS HERE!!!"" they opened the door and I turned to the right, and got into the cabin. They took the bear and skimmed it and wrapped it and brought it home, this happed 30 years ago, but till this day mu friends don't mention hunting to me, they know better. That is my story.",2213,54,184.14,230.4086124121414
6688000c0fc9f75d8caefc4f,"It is a story about three friends that I met in 1949 when I started college. Actually I met them before that, we became friends after we all... went to school at the same place. Previous to that during high school we'd all been school athletes at different schools, and so we were acquainted. But then after graduation after we all enrolled in school, we found that the four of us were all now attending the same school, and became quite good friends. I was the kid from the farm, the other three guys all lived in the city. So being big macho men that we all were, they used to come out to the farm and hunt, and they'd come out, and help me do chores and things like that. Then we'd go rabbit hunting and squirrel hunting and things of that nature. I never really enjoyed hunting. Uh... being born and raised.",811,22,329.2,216.35238926985647
66880d5992fc91de8ff934bc,"There were a group of 4 friends that become close and one of them lived in a farm while others lived in the city. So the other city friends loved to come hunting in the farm with their friend who lives there. And although he hates hunting he always accompanies his friends while they hunt. And years passed then one day they suggested they go Bear hunting in Canada and even though he hates the idea he still allowed his friends to talk him into doing it. They travelled and lodged in a spooky old cabin for days as they did not feel the need to go bear hunting anymore and one day while they were playing cards, they decided to play a game to choose who will go bear hunting and deliver the bear to the others to skin and take back to the city. Unluckily he was picked and he went out looking for a bear, he spotted one big old Bear and just when he wanted to shoot he realised he did not load his gun and so the Bear chased him all the way to the cabin and when he was near he screamed to be let in. The story ended with them agreeing that he did part of his bargain by bringing the Bear to them and they had the choice to skin the bear.",1139,26,66.48,89.88158500425139
66884e1b52a01d16fe557350,"A boy met his group of friends in 1949. They grew up on a farm. His friends were interested in hunting. He was not. They invited him on a trip to Canada to go hunting bears. He reluctantly agreed. He went with them. They hired canoes. They spent days in an old cabin. They were scared to hunt for bears. They did not want to go home empty-handed. After a few days, they went out to hunt them. The boy found a bear. He tried to shoot it. His gun wouldn't fire. The bear chased him. After this adventure, his friends never invited him to hunt again.",547,17,39.75,34.587585905291455
668936b212cea5becb2cf810,"It was a story in the year 1949 about a guy who made friends in school. These friends all loved hunting but him being someone raised to farm he didn't much love hunting and all. So after school his friends decided to travel to Canada to go bear hunting. He didn't really like that idea but since he has been part of that group, they talked him into it. They got to Canada, landed on a lake took canoes and paddled about a day and half and backpacked for about five hundred miles too til they got to their cabin they had rented. The place was way spooky that they forgot they had come to hunt bears rather they played cards and this went on for about 3 days where one of them came up with the idea they really had to go hunt a bear because they couldn't go home empty handed. A decision was made about the person with the highest number of card going to hunt the bear and the remaining will butcher skin and pack him up. Obviously he was the guy who ended up with the highest number. He took an old turkey gun and set of the woods to hunt. He came across a big old looking bear and when he was ready to fire, the gun didn't because he had failed to load it back then. He had no other choice than to run, and by doing so the bear chased him all the way to the cabin where he screamed and shouted for them to let him in. Alas he got in and closed the door where he told his friends, there is your bear, you asked for it and i have done my part, now you guys go do your part. All this happened thirty years ago and since then he hasn't been asked by his friends to go hunting again with them.",1588,13,118.93,154.39095078152957
66921dd9f8e4de298758c407,"god that was really hard It started to make me dizzy haha the story is about 4 friends that meet in high school and they like to hunt Sorry, that's all iv got",158,9,-11.98,3.1355952182654416
