recall_id,clause_id,clause_text
5ea07f2c55a2bd050fd8f70b,5,"As we grew older, someone suggested that we go bear hunting in Canada."
5ea07f2c55a2bd050fd8f70b,6,The other three were mad keen but I was not but allowed them to talk me into it.
5ea07f2c55a2bd050fd8f70b,7,We took a plane way up north then had to travel a further 500 miles to our hut in the woods.
5ea07f2c55a2bd050fd8f70b,8,By this time my 3 friends were not as mad keen as they were about hunting bear.
5ea07f2c55a2bd050fd8f70b,9,We sat around eating and playing cards however we knew that because we had talked about bear hunting so much before we came we knew we had to take one back or we would be totally ridiculed on our return.
5ea07f2c55a2bd050fd8f70b,10,We decided whoever had the highest card number was the one to hunt the bear needless to say I was the guy who ended up with the job.
5ea07f2c55a2bd050fd8f70b,11,"When I eventually came across a bear, I could not believe how big it was when I fired my gun I had forgot to load it so had to make a run for it chased by the bear."
5ea07f2c55a2bd050fd8f70b,12,"I eventually got back to the cabin, opened the door and left my friends to deal with the bear."
5ea07f2c55a2bd050fd8f70b,13,Needless to say my friends have never asked to go hunting again.
6554cfc335ac9ff968a5f162,1,"Three friends who met in 1949,"
6554cfc335ac9ff968a5f162,2,"who used to be athletes,"
6554cfc335ac9ff968a5f162,3,decided to bear hunting.
6554cfc335ac9ff968a5f162,4,One friend was reluctantly persuaded to join in.
6554cfc335ac9ff968a5f162,5,"For a while they used to hunt rabbits and squirrels,"
6554cfc335ac9ff968a5f162,6,but then decided to take a holiday to a cabin in the woods to hunt a bear.
6554cfc335ac9ff968a5f162,7,Nobody could be bothered to go out in the spooky woods to find a bear for three or four days
6554cfc335ac9ff968a5f162,8,so they just say around the campfire playing cards and talking.
6554cfc335ac9ff968a5f162,9,Eventually they decided that they have to find a bear
6554cfc335ac9ff968a5f162,10,otherwise they'd be given a hard time if they returned empty-handed.
6554cfc335ac9ff968a5f162,11,"The three friends decided to cut the deck,"
6554cfc335ac9ff968a5f162,12,and the person who drew the highest card had to go and find a bear.
6554cfc335ac9ff968a5f162,13,The friend that didn't really enjoy hunting drew the highest card.
6554cfc335ac9ff968a5f162,14,"Off he went to find a bear,"
6554cfc335ac9ff968a5f162,15,"Eventually, he turned around to see the biggest bear of his life standing in front of him."
6554cfc335ac9ff968a5f162,16,"He pulled the trigger of the gun he was carrying,"
6554cfc335ac9ff968a5f162,17,but he'd forgotten to load the turkey.
6554cfc335ac9ff968a5f162,18,"So he ran all the way back to the cabin with the bear chasing him,"
6554cfc335ac9ff968a5f162,19,yelling at his friends as he approached to open the door.
6554cfc335ac9ff968a5f162,20,At the last minute he dodged the doorway and the bear ran straight into the cabin.
6554cfc335ac9ff968a5f162,21,He told his friends that they could skin the bear.
6554cfc335ac9ff968a5f162,22,His friends never invited him hunting again.
5cebd58ade266200191eaf7d,1,It’s about someone who is recalling his three college students.
5cebd58ade266200191eaf7d,2,They actually met a few years before that because his buddies used to like to visit him in the country.
5cebd58ade266200191eaf7d,3,They were in the city and he was in the country they like to go hunting.
5cebd58ade266200191eaf7d,4,He felt that this was pretty boring because he hunted all the time.
5cebd58ade266200191eaf7d,5,But then they decided to go up into Canada via canoes and tracking to a place way out in the woods and hunt bear.
5cebd58ade266200191eaf7d,6,He got the job of finding a bear because they couldn’t go home without one because that would look bad.
5cebd58ade266200191eaf7d,7,In the end an old bear run into the place they were staying.
5cebd58ade266200191eaf7d,8,He told his colleagues to it while he went and found another one.
66a6ed1943bf2623c0a91c1a,1,There were three friends
66a6ed1943bf2623c0a91c1a,2,that met in college
66a6ed1943bf2623c0a91c1a,3,and they became friends.
66a6ed1943bf2623c0a91c1a,4,After graduation they enrolled in school
66a6ed1943bf2623c0a91c1a,5,and then found out
66a6ed1943bf2623c0a91c1a,6,that the four of them were all now attending the same school
66a6ed1943bf2623c0a91c1a,7,and they became quite good friends.
66a6ed1943bf2623c0a91c1a,8,"He was a kid from the farm,"
66a6ed1943bf2623c0a91c1a,9,the other three guys all lived in the city.
66a6ed1943bf2623c0a91c1a,10,"Being the macho men they were,"
66a6ed1943bf2623c0a91c1a,11,they used to hunt rabbits and squirrels
66a6ed1943bf2623c0a91c1a,12,and also help in the chores.
66a6ed1943bf2623c0a91c1a,13,He never really enjoyed hunting.
66a6ed1943bf2623c0a91c1a,14,"Being born and raised in the farm,"
66a6ed1943bf2623c0a91c1a,15,the outdoors was not really exciting for him.
66a6ed1943bf2623c0a91c1a,16,"This was going on for several years,"
66a6ed1943bf2623c0a91c1a,17,they'll always come around to his farm for hunting.
66a6ed1943bf2623c0a91c1a,18,"After they've been acquainted for years,"
66a6ed1943bf2623c0a91c1a,19,one of them got the idea
66a6ed1943bf2623c0a91c1a,20,that they'd like to go bear hunting up in Canada.
66a6ed1943bf2623c0a91c1a,21,This wasn’t appealing to him
66a6ed1943bf2623c0a91c1a,22,and unfortunately did not find any good reason not to go.
66a6ed1943bf2623c0a91c1a,23,so they took an airplane from Fort Wayne
66a6ed1943bf2623c0a91c1a,24,"all the way up into Canada,"
66a6ed1943bf2623c0a91c1a,25,and then landed on a lake.
66a6ed1943bf2623c0a91c1a,26,"They got up in the cabin,"
66a6ed1943bf2623c0a91c1a,27,got and stored all their groceries.
66a6ed1943bf2623c0a91c1a,28,They has a discussion on playing a game
66a6ed1943bf2623c0a91c1a,29,that whosoever has the highest cards will go to hunt the bear.
66a6ed1943bf2623c0a91c1a,30,"Unfortunately, it had to be him,"
66a6ed1943bf2623c0a91c1a,31,who did not buy the idea of bear hunt in the first place.
66a6ed1943bf2623c0a91c1a,32,He took his gun
66a6ed1943bf2623c0a91c1a,33,went out for hunting.
66a6ed1943bf2623c0a91c1a,34,"The bear was coming close to him,"
66a6ed1943bf2623c0a91c1a,35,so he tried to shoot
66a6ed1943bf2623c0a91c1a,36,and then found out
66a6ed1943bf2623c0a91c1a,37,that the gun was not loaded
66a6ed1943bf2623c0a91c1a,38,and began to run back.
60b7e1bcfe148de04d17624b,1,This is a story about a farm boy and three other guys from the city.
60b7e1bcfe148de04d17624b,2,They went to the same school.
60b7e1bcfe148de04d17624b,3,The farm boy's friends went to his farm to help him with the farm chores.
60b7e1bcfe148de04d17624b,4,They loved hunting on the farm.
60b7e1bcfe148de04d17624b,5,"Since he was an outdoor person, he was not that excited about what his friends enjoyed doing at the farm with him."
60b7e1bcfe148de04d17624b,6,One day they went out bear hunting.
60b7e1bcfe148de04d17624b,7,All they could do was play cards and stay indoors.
60b7e1bcfe148de04d17624b,8,Until one of them said that they told everyone that they went bear hunting.
60b7e1bcfe148de04d17624b,9,It looked somewhat like they go home hunting.
60b7e1bcfe148de04d17624b,10,So they played until the farm guy got the high.
60b7e1bcfe148de04d17624b,11,He did not want to go hunting.
60b7e1bcfe148de04d17624b,12,But he let them talk him into it.
60b7e1bcfe148de04d17624b,13,"Now that he got a high card, he had to live up to it."
60b7e1bcfe148de04d17624b,14,He took his gun and went hunting.
60b7e1bcfe148de04d17624b,15,"As he walked up into the spooky place, he saw one big old bear that he had never seen before."
60b7e1bcfe148de04d17624b,16,He fired at it.
60b7e1bcfe148de04d17624b,17,Nothing happened.
60b7e1bcfe148de04d17624b,18,He saw he did not load it.
60b7e1bcfe148de04d17624b,19,So he ran back to the cabin as fast as he could.
60b7e1bcfe148de04d17624b,20,The bear was running very fast.
60b7e1bcfe148de04d17624b,21,"He thought he used to be fast, but this time."
60b7e1bcfe148de04d17624b,22,"As he was approaching the cabin, he shouted at his friend to open the door."
60b7e1bcfe148de04d17624b,23,They opened and he got in.
60b7e1bcfe148de04d17624b,24,The bear got so close.
60b7e1bcfe148de04d17624b,25,That happened 30 years ago.
60b7e1bcfe148de04d17624b,26,Since then his friends never asked him to go hunting again.
66504b23d4203a2c5cf1252d,1,The story was about a man and his three friends that started college in 1949.
66504b23d4203a2c5cf1252d,2,They had known each other before college even thought they had gone to different schools as they had often met at athletic meets.
66504b23d4203a2c5cf1252d,3,"The narrator of the story had grown up on a farm,"
66504b23d4203a2c5cf1252d,4,The other three friends came from city areas.
66504b23d4203a2c5cf1252d,5,"They would often meet and go to the farm to hunt small animals,"
66504b23d4203a2c5cf1252d,6,Even though the narrator did not enjoy hunting - he went along with it to please his macho city mates.
66504b23d4203a2c5cf1252d,7,One time they decided to go on a hunting trip to Canada to hunt bears.
66504b23d4203a2c5cf1252d,8,"So after a plane flight and a hike for what seemed like hundreds of miles over many days, they arrived at their cabin,"
66504b23d4203a2c5cf1252d,9,Set it up with groceries etc and settled in for a few days.
66504b23d4203a2c5cf1252d,10,"Eventually they decided they would have to go out to hunt for a bear,"
66504b23d4203a2c5cf1252d,11,Although by now they did not want to.
66504b23d4203a2c5cf1252d,12,"Realising they would have to go out hunting after telling so many people they were on a bear hunting trip,"
66504b23d4203a2c5cf1252d,13,They decided to draw cards to choose who would go out to hunt and kill the bear.
66504b23d4203a2c5cf1252d,14,The remaining three would skin and cut up the bear.
66504b23d4203a2c5cf1252d,15,The narrator drew the hunting card and was forced to head out with an old gun to find a bear.
66504b23d4203a2c5cf1252d,16,Eventually after hours of looking he spotted a very large bear -
66504b23d4203a2c5cf1252d,17,He drew the gun and tried to shoot it- but the gun was not loaded.
66504b23d4203a2c5cf1252d,18,"Startled, the bear charged at him..."
66504b23d4203a2c5cf1252d,19,"The narrator started sprinting back towards the cabin, with the bear closing in."
66504b23d4203a2c5cf1252d,20,"As he neared the cabin, he called out 'open the door'"
66504b23d4203a2c5cf1252d,21,"And as he was about to run into the cabin, he ran past the door -"
66504b23d4203a2c5cf1252d,22,The bear then ran in the door.
66504b23d4203a2c5cf1252d,23,"""I found the bear for you' he called out..."
66504b23d4203a2c5cf1252d,24,He was never invited on a bear hunt again!!
5c2ebf3e626018000134986f,1,This is a story about me and three of my friends.
5c2ebf3e626018000134986f,2,We knew each other back in 1949.
5c2ebf3e626018000134986f,3,At one point we all attended the same high school.
5c2ebf3e626018000134986f,4,We were athletes on the school team.
5c2ebf3e626018000134986f,5,All the guys were the macho type.
5c2ebf3e626018000134986f,6,They used to love to go hunting.
5c2ebf3e626018000134986f,7,Reluctantly I would go with them.
5c2ebf3e626018000134986f,8,They liked hunting squirrel and other small animals.
5c2ebf3e626018000134986f,9,I didn't have much interest in hunting.
5c2ebf3e626018000134986f,10,I grew up on a farm.
5c2ebf3e626018000134986f,11,I was used to these activities.
5c2ebf3e626018000134986f,12,I was no longer excited by them.
5c2ebf3e626018000134986f,13,After a number of hunting trips the other guys suggested we all fly to Canada.
5c2ebf3e626018000134986f,14,They wanted to try to hunt a bear.
5c2ebf3e626018000134986f,15,Again I wasn't particularly keen to do this.
5c2ebf3e626018000134986f,16,I agreed to go anyway.
5c2ebf3e626018000134986f,17,We flew over to Canada out of Fort Wayne.
5c2ebf3e626018000134986f,18,When we landed we had to paddle in canoes for what seemed like two days.
5c2ebf3e626018000134986f,19,Once back on land we had to trek for a further 500 miles.
5c2ebf3e626018000134986f,20,The guys had rented a cabin in the woods.
5c2ebf3e626018000134986f,21,We had supplies for a few nights.
5c2ebf3e626018000134986f,22,"The strange thing is, we didn't go hunting."
5c2ebf3e626018000134986f,23,"We just stayed in the cabin, eating, sleeping and playing cards."
5c2ebf3e626018000134986f,24,The woods were really spooky up there.
5c2ebf3e626018000134986f,25,It seemed that the guys had lost all interest in hunting a bear.
5c2ebf3e626018000134986f,26,So we just stayed in the cabin.
5c2ebf3e626018000134986f,27,Towards to the end of our stay one of the guys said we're going to look stupid if we don't come back with a bear.
5c2ebf3e626018000134986f,28,So we decided to draw cards to see who would venture into the woods to kill the bear.
5c2ebf3e626018000134986f,29,The other guys would have the job of skinning and cutting the meat.
5c2ebf3e626018000134986f,30,We drew our cards.
5c2ebf3e626018000134986f,31,Can you believe it?
5c2ebf3e626018000134986f,32,The guy who didn't want to go in the first place drew the bear card.
5c2ebf3e626018000134986f,33,So out I went into the spooky woods.
5c2ebf3e626018000134986f,34,I looked for a bear.
5c2ebf3e626018000134986f,35,Suddenly I looked up and saw a bear.
5c2ebf3e626018000134986f,36,It was huge.
5c2ebf3e626018000134986f,37,I've never even seen a picture of a bear so big.
5c2ebf3e626018000134986f,38,Here was one starring right at me.
5c2ebf3e626018000134986f,39,I whipped up the shotgun.
5c2ebf3e626018000134986f,40,I pulled the trigger.
5c2ebf3e626018000134986f,41,But nothing happened.
5c2ebf3e626018000134986f,42,Like a complete turkey I had only forgot to load the damn thing.
5c2ebf3e626018000134986f,43,That bear was furious.
5c2ebf3e626018000134986f,44,He did not want me on his turf.
5c2ebf3e626018000134986f,45,So I turned and ran like hell.
5c2ebf3e626018000134986f,46,I saw the cabin up ahead.
5c2ebf3e626018000134986f,47,I screamed at the guys to open the door.
5c2ebf3e626018000134986f,48,I jumped into the cabin.
5c2ebf3e626018000134986f,49,I ran to the left.
5c2ebf3e626018000134986f,50,"Then shouted, here's the bear I promised."
5c2ebf3e626018000134986f,51,That was over thirty years ago.
5c2ebf3e626018000134986f,52,Do you know what?
5c2ebf3e626018000134986f,53,Those guys have never asked me to come hunting since!
5ba3dde51ce477000117a55e,1,"There were 4 friends who all met at school in 1949,"
5ba3dde51ce477000117a55e,2,but all went to different schools growing up.
5ba3dde51ce477000117a55e,3,1 grew up on a farm
5ba3dde51ce477000117a55e,4,and 3 lived in the city.
5ba3dde51ce477000117a55e,5,"The 3 from the city used to like to go to the other friend's farm to hunt squirrels and rabbits,"
5ba3dde51ce477000117a55e,6,but the friend from the farm didn't care much for hunting.
5ba3dde51ce477000117a55e,7,The 3 friends from the city suggested going hiking in the mountains to hunt bears.
5ba3dde51ce477000117a55e,8,The friend from the farm did not want to go
5ba3dde51ce477000117a55e,9,but agreed to go anyway to be part of the group.
5ba3dde51ce477000117a55e,10,They travelled by canoe for about a day and a half
5ba3dde51ce477000117a55e,11,"and then hiked what appeared to be another 500 miles, according to the friend from the farm"
5ba3dde51ce477000117a55e,12,and stayed in a cabin.
5ba3dde51ce477000117a55e,13,After 3 or 4 days they had not ventured out to hunt a bear
5ba3dde51ce477000117a55e,14,as none of them really wanted to.
5ba3dde51ce477000117a55e,15,One of the friends said they needed to go home with a bear
5ba3dde51ce477000117a55e,16,as a lot of people knew they were coming to hunt bears
5ba3dde51ce477000117a55e,17,"and would give them a hard time about it if they came home empty handed,"
5ba3dde51ce477000117a55e,18,so they agreed to get a bear.
5ba3dde51ce477000117a55e,19,They cut cards to decide which of them would go and get the bear
5ba3dde51ce477000117a55e,20,and the remaining 3 friends would skin it.
5ba3dde51ce477000117a55e,21,"The friend from the farm, who did not even want to go hunting, drew the card"
5ba3dde51ce477000117a55e,22,which meant he had to go and get the bear.
5ba3dde51ce477000117a55e,23,"He found a bear, the biggest he'd ever seen,"
5ba3dde51ce477000117a55e,24,and went to shoot it with his gun
5ba3dde51ce477000117a55e,25,"but had forgotten to load it,"
5ba3dde51ce477000117a55e,26,so started running away from the bear.
5ba3dde51ce477000117a55e,27,"The bear chased him back to the cabin,"
5ba3dde51ce477000117a55e,28,and they ended up trapping the bear inside the cabin.
5ba3dde51ce477000117a55e,29,The friend who went to get the bear told the others to get on with their part of the deal
5ba3dde51ce477000117a55e,30,and he would go and get another one.
5ba3dde51ce477000117a55e,31,The friends from the city never invited the friend from the farm hunting again.
5b119f161e55760001b9daac,1,"A group of college friends that met prior to 1949,"
5b119f161e55760001b9daac,2,originally acquainted through high school sports
5b119f161e55760001b9daac,3,and ended up going to the same college.
5b119f161e55760001b9daac,4,1 farm boy and 3 city boys.
5b119f161e55760001b9daac,5,They all used to go out
5b119f161e55760001b9daac,6,"and hang out together on the farm,"
5b119f161e55760001b9daac,7,help with chores
5b119f161e55760001b9daac,8,and then go out hunting for rabbits and squirrels.
5b119f161e55760001b9daac,9,They got onto talking
5b119f161e55760001b9daac,10,and planning a visit to Canada
5b119f161e55760001b9daac,11,to go and hunt bears.
5b119f161e55760001b9daac,12,Farm boy didnt want to go
5b119f161e55760001b9daac,13,as he had no interest
5b119f161e55760001b9daac,14,but he did go as not to let the group down.
5b119f161e55760001b9daac,15,They stayed in an old cabin in the woods
5b119f161e55760001b9daac,16,"and all of them were quite unnerved by the general spookiness of the area,"
5b119f161e55760001b9daac,17,so they didnt go hunting at all.
5b119f161e55760001b9daac,18,"They stayed in and played cards,"
5b119f161e55760001b9daac,19,eating and drinking the days away.
5b119f161e55760001b9daac,20,They got to the last day
5b119f161e55760001b9daac,21,and had to pick cards as to who was actually going to go out
5b119f161e55760001b9daac,22,and find a bear for them to take back with them.
5b119f161e55760001b9daac,23,Farm boy got the highest card
5b119f161e55760001b9daac,24,"so had to go out looking for a bear,"
5b119f161e55760001b9daac,25,even though he hadnt wanted to go on the trip at all in the first place!
5b119f161e55760001b9daac,26,"He had an old gun from the cabin with him,"
5b119f161e55760001b9daac,27,and eventually came across a bear.
5b119f161e55760001b9daac,28,He turned to shoot the bear
5b119f161e55760001b9daac,29,and had actually forgotten to load the gun!
5b119f161e55760001b9daac,30,"He started running as the bear chased him down,"
5b119f161e55760001b9daac,31,as fast as he could run to try and get back to the cabin.
5b119f161e55760001b9daac,32,"He shouted out for the other guys to open the door,"
5b119f161e55760001b9daac,33,and as he got to the door he stepped aside
5b119f161e55760001b9daac,34,and the bear ran into the cabin where the guys were.
5b119f161e55760001b9daac,35,He closed the door on them!
5b119f161e55760001b9daac,36,"He said he has not been asked on a hunting trip ever since,"
5b119f161e55760001b9daac,37,and this was 30+ years ago now.
6671897ccb0249a1474a5656,1,"I met my friends in 1949,"
6671897ccb0249a1474a5656,2,before that at school actually.
6671897ccb0249a1474a5656,3,I grew up on a farm
6671897ccb0249a1474a5656,4,and the other 3 were city boys.
6671897ccb0249a1474a5656,5,We were all macho
6671897ccb0249a1474a5656,6,and the other 3 liked coming over to the farm
6671897ccb0249a1474a5656,7,and go hunting.
6671897ccb0249a1474a5656,8,I didn’t like hunting
6671897ccb0249a1474a5656,9,but I went with them because I was part of the group.
6671897ccb0249a1474a5656,10,One of them suggested going north
6671897ccb0249a1474a5656,11,"and bear hunting,"
6671897ccb0249a1474a5656,12,I really didn’t want to
6671897ccb0249a1474a5656,13,but I left them talk me into it.
6671897ccb0249a1474a5656,14,We all went up
6671897ccb0249a1474a5656,15,and ended up changing our minds because it was spooky up there.
6671897ccb0249a1474a5656,16,Eventually we decided we couldn’t go home without a bear.
6671897ccb0249a1474a5656,17,I got the high card
6671897ccb0249a1474a5656,18,and had to go bear hunting.
6671897ccb0249a1474a5656,19,I found one
6671897ccb0249a1474a5656,20,but forgot to load the gun
6671897ccb0249a1474a5656,21,so I started running
6671897ccb0249a1474a5656,22,and it chased me to the cabin!
6671897ccb0249a1474a5656,23,I shouted ‘OPEN THE DOOR’
6671897ccb0249a1474a5656,24,"and they did,"
6671897ccb0249a1474a5656,25,I ran as fast as I could
6671897ccb0249a1474a5656,26,"and they opened the door,"
6671897ccb0249a1474a5656,27,the bear ran in
6671897ccb0249a1474a5656,28,and I went left.
6671897ccb0249a1474a5656,29,"I shouted ‘there you go boys, he’s in there, you skin it and I’ll go get another one’"
6671897ccb0249a1474a5656,30,they never asked me to go hunting again.
665c7ba6b596a3558adbf2ec,1,A story about a man and his three friends who he first met in 1949.
665c7ba6b596a3558adbf2ec,2,He recalls how they ended up going to the same college and their hunting trip.
665c7ba6b596a3558adbf2ec,3,He grew up on a farm but he never really liked the outdoors.
665c7ba6b596a3558adbf2ec,4,"His friends liked hunting for squirrels, which he never liked but he just went with them cause he didn't want to be left out."
665c7ba6b596a3558adbf2ec,5,"They came up with the idea to go and hunt for bears in Canada, which he also went along with."
665c7ba6b596a3558adbf2ec,6,They stayed in the cabin for three or four days cause they were too scared to go outside of the cabin.
665c7ba6b596a3558adbf2ec,7,"One of his friends spoke up and said, 'they couldn't go back empty-handed because the locals would talk about them not bringing back a bear'."
665c7ba6b596a3558adbf2ec,8,They decided to play a game of cards to decide who would go out and hunt the bear.
665c7ba6b596a3558adbf2ec,9,The man picked the hunt card and he ventured out to hunt down a bear.
665c7ba6b596a3558adbf2ec,10,"When he came across a bear, he realised that his gun was unloaded so he ran towards the cabin and shouted for his friends to open the door to the cabin."
665c7ba6b596a3558adbf2ec,11,He ran inside and told them that he did his part and his friends should do theirs.
665c7ba6b596a3558adbf2ec,12,It has been 50 years since the incident and none of his friends have ever talked about hunting again.
563a76bfbe9cac0005aab326,1,The story is set in 1949
563a76bfbe9cac0005aab326,2,the narrator met his friends at the same school
563a76bfbe9cac0005aab326,3,but they were from different backgrounds
563a76bfbe9cac0005aab326,4,as he grew up on a farm
563a76bfbe9cac0005aab326,5,and they didn't.
563a76bfbe9cac0005aab326,6,They would come to the farm to hunt rabbits and squirrels
563a76bfbe9cac0005aab326,7,but the narrator wasn't so keen on this
563a76bfbe9cac0005aab326,8,but just went along with it.
563a76bfbe9cac0005aab326,9,Time went by
563a76bfbe9cac0005aab326,10,and the friends came up with the idea of going to Canada to hunt a bear.
563a76bfbe9cac0005aab326,11,Again the narrator wasn't keen
563a76bfbe9cac0005aab326,12,but was persuaded to go.
563a76bfbe9cac0005aab326,13,"They flew to Canada,"
563a76bfbe9cac0005aab326,14,took kayaks across the lake
563a76bfbe9cac0005aab326,15,and got to a cabin.
563a76bfbe9cac0005aab326,16,"They felt the place they were in was too spooky,"
563a76bfbe9cac0005aab326,17,none of them wanted to go out hunting in the end.
563a76bfbe9cac0005aab326,18,They stayed in for 3-4 days.
563a76bfbe9cac0005aab326,19,In the end they discussed how they would be mocked for not bringing a bear back
563a76bfbe9cac0005aab326,20,so split cards to see who should go hunting for one.
563a76bfbe9cac0005aab326,21,The narrator was chosen.
563a76bfbe9cac0005aab326,22,"He went out,"
563a76bfbe9cac0005aab326,23,saw a huge bear
563a76bfbe9cac0005aab326,24,but had forgotten to load his gun
563a76bfbe9cac0005aab326,25,so he ran away towards the cabin.
563a76bfbe9cac0005aab326,26,He yelled for the friends to open the door because he had a bear
563a76bfbe9cac0005aab326,27,and they did
563a76bfbe9cac0005aab326,28,but instead of going in he dashed to one side
563a76bfbe9cac0005aab326,29,and the bear went in the cabin.
563a76bfbe9cac0005aab326,30,They never forgot he had delivered a bear as agreed.
668936b212cea5becb2cf810,1,It was a story in the year 1949 about a guy who made friends in school.
668936b212cea5becb2cf810,2,These friends all loved hunting but him being someone raised to farm he didn't much love hunting and all.
668936b212cea5becb2cf810,3,So after school his friends decided to travel to Canada to go bear hunting.
668936b212cea5becb2cf810,4,"He didn't really like that idea but since he has been part of that group, they talked him into it."
668936b212cea5becb2cf810,5,"They got to Canada, landed on a lake took canoes and paddled about a day and half and backpacked for about five hundred miles too til they got to their cabin they had rented."
668936b212cea5becb2cf810,6,The place was way spooky that they forgot they had come to hunt bears rather they played cards and this went on for about 3 days where one of them came up with the idea they really had to go hunt a bear because they couldn't go home empty handed.
668936b212cea5becb2cf810,7,A decision was made about the person with the highest number of card going to hunt the bear and the remaining will butcher skin and pack him up.
668936b212cea5becb2cf810,8,Obviously he was the guy who ended up with the highest number.
668936b212cea5becb2cf810,9,He took an old turkey gun and set of the woods to hunt.
668936b212cea5becb2cf810,10,"He came across a big old looking bear and when he was ready to fire, the gun didn't because he had failed to load it back then."
